[
    {
        "accountno": "1",
        "amount": "-51.88",
        "bic_receiver": "NDEAFIHH",
        "bookdate": "10/01/2019",
        "category": "Asuminen",
        "counterparty_account_id": "199",
        "iban_receiver": "0",
        "paymentdate": "10/01/2019",
        "reference": "0",
        "saldo": "156.56",
        "taplajikd": "129",
        "tstamp": "2019-01-10 2:41:30",
        "valuedate": "10/01/2019",
        "vientiselitekd": "706"
    },
    {
        "accountno": "1",
        "amount": "-15.9",
        "bic_receiver": "",
        "bookdate": "11/03/2019",
        "category": "Asuminen",
        "counterparty_account_id": "114",
        "iban_receiver": "1",
        "paymentdate": "11/03/2019",
        "reference": "1",
        "saldo": "39.34",
        "taplajikd": "162",
        "tstamp": "2019-03-11 21:03:09",
        "valuedate": "11/03/2019",
        "vientiselitekd": "0"
    },
    {
        "accountno": "1",
        "amount": "-5.24",
        "bic_receiver": "DABAFIHH",
        "bookdate": "22/04/2019",
        "category": "Asuminen",
        "counterparty_account_id": "195",
        "iban_receiver": "0",
        "paymentdate": "22/04/2019",
        "reference": "0",
        "saldo": "-160.09",
        "taplajikd": "106",
        "tstamp": "2019-04-22 9:19:13",
        "valuedate": "22/04/2019",
        "vientiselitekd": "706"
    },
    {
        "accountno": "1",
        "amount": "-43.16",
        "bic_receiver": "OKOYFIHH",
        "bookdate": "09/05/2019",
        "category": "Asuminen",
        "counterparty_account_id": "196",
        "iban_receiver": "0",
        "paymentdate": "09/05/2019",
        "reference": "0",
        "saldo": "-135.37",
        "taplajikd": "106",
        "tstamp": "2019-05-09 20:21:16",
        "valuedate": "09/05/2019",
        "vientiselitekd": "706"
    },
    {
        "accountno": "1",
        "amount": "-36.78",
        "bic_receiver": "OKOYFIHH",
        "bookdate": "15/05/2019",
        "category": "Asuminen",
        "counterparty_account_id": "193",
        "iban_receiver": "0",
        "paymentdate": "15/05/2019",
        "reference": "0",
        "saldo": "-189.68",
        "taplajikd": "106",
        "tstamp": "2019-05-15 3:02:17",
        "valuedate": "15/05/2019",
        "vientiselitekd": "706"
    },
    {
        "accountno": "1",
        "amount": "-3.12",
        "bic_receiver": "",
        "bookdate": "31/05/2019",
        "category": "Asuminen",
        "counterparty_account_id": "93",
        "iban_receiver": "1",
        "paymentdate": "30/05/2019",
        "reference": "1",
        "saldo": "-471.97",
        "taplajikd": "162",
        "tstamp": "2019-05-31 14:34:56",
        "valuedate": "31/05/2019",
        "vientiselitekd": "0"
    },
    {
        "accountno": "1",
        "amount": "-40.23",
        "bic_receiver": "DABAFIHH",
        "bookdate": "06/06/2019",
        "category": "Asuminen",
        "counterparty_account_id": "189",
        "iban_receiver": "0",
        "paymentdate": "05/06/2019",
        "reference": "0",
        "saldo": "-297.47",
        "taplajikd": "106",
        "tstamp": "2019-06-05 16:56:28",
        "valuedate": "05/06/2019",
        "vientiselitekd": "706"
    },
    {
        "accountno": "1",
        "amount": "-16.23",
        "bic_receiver": "",
        "bookdate": "19/08/2019",
        "category": "Asuminen",
        "counterparty_account_id": "39",
        "iban_receiver": "1",
        "paymentdate": "19/08/2019",
        "reference": "1",
        "saldo": "318.05",
        "taplajikd": "162",
        "tstamp": "2019-08-19 16:00:00",
        "valuedate": "19/08/2019",
        "vientiselitekd": "0"
    },
    {
        "accountno": "1",
        "amount": "-16.2",
        "bic_receiver": "OKOYFIHH",
        "bookdate": "30/08/2019",
        "category": "Asuminen",
        "counterparty_account_id": "199",
        "iban_receiver": "0",
        "paymentdate": "30/08/2019",
        "reference": "0",
        "saldo": "-7.95",
        "taplajikd": "129",
        "tstamp": "2019-08-30 8:50:32",
        "valuedate": "30/08/2019",
        "vientiselitekd": "706"
    },
    {
        "accountno": "1",
        "amount": "-30.69",
        "bic_receiver": "NDEAFIHH",
        "bookdate": "04/10/2019",
        "category": "Asuminen",
        "counterparty_account_id": "28",
        "iban_receiver": "0",
        "paymentdate": "04/10/2019",
        "reference": "0",
        "saldo": "-33.72",
        "taplajikd": "106",
        "tstamp": "2019-10-04 19:34:09",
        "valuedate": "04/10/2019",
        "vientiselitekd": "0"
    },
    {
        "accountno": "1",
        "amount": "-37.85",
        "bic_receiver": "OKOYFIHH",
        "bookdate": "14/10/2019",
        "category": "Asuminen",
        "counterparty_account_id": "202",
        "iban_receiver": "0",
        "paymentdate": "14/10/2019",
        "reference": "0",
        "saldo": "-161.24",
        "taplajikd": "129",
        "tstamp": "2019-10-14 9:36:00",
        "valuedate": "14/10/2019",
        "vientiselitekd": "706"
    },
    {
        "accountno": "1",
        "amount": "-51.85",
        "bic_receiver": "NDEAFIHH",
        "bookdate": "24/10/2019",
        "category": "Asuminen",
        "counterparty_account_id": "198",
        "iban_receiver": "0",
        "paymentdate": "24/10/2019",
        "reference": "0",
        "saldo": "-267.78",
        "taplajikd": "129",
        "tstamp": "2019-10-24 19:12:00",
        "valuedate": "24/10/2019",
        "vientiselitekd": "706"
    },
    {
        "accountno": "1",
        "amount": "-39.89",
        "bic_receiver": "OKOYFIHH",
        "bookdate": "04/11/2019",
        "category": "Asuminen",
        "counterparty_account_id": "198",
        "iban_receiver": "0",
        "paymentdate": "04/11/2019",
        "reference": "0",
        "saldo": "-424.18",
        "taplajikd": "129",
        "tstamp": "2019-11-04 7:15:58",
        "valuedate": "04/11/2019",
        "vientiselitekd": "706"
    },
    {
        "accountno": "1",
        "amount": "-3.65",
        "bic_receiver": "NDEAFIHH",
        "bookdate": "22/11/2019",
        "category": "Asuminen",
        "counterparty_account_id": "200",
        "iban_receiver": "0",
        "paymentdate": "22/11/2019",
        "reference": "0",
        "saldo": "-259.51",
        "taplajikd": "129",
        "tstamp": "2019-11-22 13:39:05",
        "valuedate": "22/11/2019",
        "vientiselitekd": "706"
    },
    {
        "accountno": "1",
        "amount": "-59.17",
        "bic_receiver": "NDEAFIHH",
        "bookdate": "25/11/2019",
        "category": "Asuminen",
        "counterparty_account_id": "203",
        "iban_receiver": "0",
        "paymentdate": "25/11/2019",
        "reference": "0",
        "saldo": "-343.86",
        "taplajikd": "129",
        "tstamp": "2019-11-25 2:51:45",
        "valuedate": "25/11/2019",
        "vientiselitekd": "706"
    },
    {
        "accountno": "1",
        "amount": "-19.01",
        "bic_receiver": "OKOYFIHH",
        "bookdate": "02/12/2019",
        "category": "Asuminen",
        "counterparty_account_id": "198",
        "iban_receiver": "0",
        "paymentdate": "02/12/2019",
        "reference": "0",
        "saldo": "-433.84",
        "taplajikd": "129",
        "tstamp": "2019-12-02 18:22:13",
        "valuedate": "02/12/2019",
        "vientiselitekd": "706"
    },
    {
        "accountno": "1",
        "amount": "-23.56",
        "bic_receiver": "DABAFIHH",
        "bookdate": "09/12/2019",
        "category": "Asuminen",
        "counterparty_account_id": "18",
        "iban_receiver": "0",
        "paymentdate": "09/12/2019",
        "reference": "0",
        "saldo": "-790.27",
        "taplajikd": "106",
        "tstamp": "2019-12-09 10:04:27",
        "valuedate": "09/12/2019",
        "vientiselitekd": "0"
    },
    {
        "accountno": "1",
        "amount": "-15.01",
        "bic_receiver": "DABAFIHH",
        "bookdate": "16/12/2019",
        "category": "Asuminen",
        "counterparty_account_id": "198",
        "iban_receiver": "0",
        "paymentdate": "16/12/2019",
        "reference": "0",
        "saldo": "-79.89",
        "taplajikd": "129",
        "tstamp": "2019-12-16 20:08:53",
        "valuedate": "16/12/2019",
        "vientiselitekd": "706"
    },
    {
        "accountno": "1",
        "amount": "-12.81",
        "bic_receiver": "OKOYFIHH",
        "bookdate": "30/12/2019",
        "category": "Asuminen",
        "counterparty_account_id": "26",
        "iban_receiver": "0",
        "paymentdate": "30/12/2019",
        "reference": "0",
        "saldo": "-252.43",
        "taplajikd": "106",
        "tstamp": "2019-12-30 7:42:13",
        "valuedate": "30/12/2019",
        "vientiselitekd": "0"
    },
    {
        "accountno": "1",
        "amount": "-4.1",
        "bic_receiver": "",
        "bookdate": "17/01/2020",
        "category": "Asuminen",
        "counterparty_account_id": "42",
        "iban_receiver": "1",
        "paymentdate": "17/01/2020",
        "reference": "1",
        "saldo": "-84.93",
        "taplajikd": "162",
        "tstamp": "2020-01-17 6:22:47",
        "valuedate": "17/01/2020",
        "vientiselitekd": "0"
    },
    {
        "accountno": "1",
        "amount": "-59.39",
        "bic_receiver": "",
        "bookdate": "03/02/2020",
        "category": "Asuminen",
        "counterparty_account_id": "95",
        "iban_receiver": "1",
        "paymentdate": "03/02/2020",
        "reference": "1",
        "saldo": "-331.57",
        "taplajikd": "162",
        "tstamp": "2020-02-03 4:31:42",
        "valuedate": "03/02/2020",
        "vientiselitekd": "0"
    },
    {
        "accountno": "1",
        "amount": "-1.96",
        "bic_receiver": "",
        "bookdate": "07/02/2020",
        "category": "Asuminen",
        "counterparty_account_id": "87",
        "iban_receiver": "1",
        "paymentdate": "07/02/2020",
        "reference": "1",
        "saldo": "-396.73",
        "taplajikd": "162",
        "tstamp": "2020-02-07 13:35:06",
        "valuedate": "07/02/2020",
        "vientiselitekd": "0"
    },
    {
        "accountno": "1",
        "amount": "-19.14",
        "bic_receiver": "OKOYFIHH",
        "bookdate": "06/03/2020",
        "category": "Asuminen",
        "counterparty_account_id": "208",
        "iban_receiver": "0",
        "paymentdate": "06/03/2020",
        "reference": "0",
        "saldo": "299.29",
        "taplajikd": "147",
        "tstamp": "2020-03-06 21:42:51",
        "valuedate": "06/03/2020",
        "vientiselitekd": "706"
    },
    {
        "accountno": "1",
        "amount": "-1.48",
        "bic_receiver": "",
        "bookdate": "09/06/2020",
        "category": "Asuminen",
        "counterparty_account_id": "100",
        "iban_receiver": "1",
        "paymentdate": "09/06/2020",
        "reference": "1",
        "saldo": "-246.02",
        "taplajikd": "162",
        "tstamp": "2020-06-09 3:15:15",
        "valuedate": "09/06/2020",
        "vientiselitekd": "0"
    },
    {
        "accountno": "1",
        "amount": "-97.59",
        "bic_receiver": "NDEAFIHH",
        "bookdate": "27/07/2020",
        "category": "Asuminen",
        "counterparty_account_id": "207",
        "iban_receiver": "0",
        "paymentdate": "27/07/2020",
        "reference": "0",
        "saldo": "-306.29",
        "taplajikd": "147",
        "tstamp": "2020-07-27 22:53:01",
        "valuedate": "23/07/2020",
        "vientiselitekd": "706"
    },
    {
        "accountno": "1",
        "amount": "-19.19",
        "bic_receiver": "",
        "bookdate": "27/08/2020",
        "category": "Asuminen",
        "counterparty_account_id": "144",
        "iban_receiver": "1",
        "paymentdate": "27/08/2020",
        "reference": "1",
        "saldo": "26.77",
        "taplajikd": "162",
        "tstamp": "2020-08-27 16:24:18",
        "valuedate": "27/08/2020",
        "vientiselitekd": "0"
    },
    {
        "accountno": "1",
        "amount": "-25.42",
        "bic_receiver": "OKOYFIHH",
        "bookdate": "02/10/2020",
        "category": "Asuminen",
        "counterparty_account_id": "199",
        "iban_receiver": "0",
        "paymentdate": "02/10/2020",
        "reference": "0",
        "saldo": "-206.93",
        "taplajikd": "129",
        "tstamp": "2020-10-02 17:33:02",
        "valuedate": "02/10/2020",
        "vientiselitekd": "706"
    },
    {
        "accountno": "1",
        "amount": "-28.28",
        "bic_receiver": "OKOYFIHH",
        "bookdate": "05/10/2020",
        "category": "Asuminen",
        "counterparty_account_id": "198",
        "iban_receiver": "0",
        "paymentdate": "05/10/2020",
        "reference": "0",
        "saldo": "-353.26",
        "taplajikd": "129",
        "tstamp": "2020-10-05 19:46:15",
        "valuedate": "05/10/2020",
        "vientiselitekd": "706"
    },
    {
        "accountno": "1",
        "amount": "-2.88",
        "bic_receiver": "",
        "bookdate": "09/11/2020",
        "category": "Asuminen",
        "counterparty_account_id": "100",
        "iban_receiver": "1",
        "paymentdate": "09/11/2020",
        "reference": "1",
        "saldo": "-149.2",
        "taplajikd": "162",
        "tstamp": "2020-11-09 10:18:51",
        "valuedate": "09/11/2020",
        "vientiselitekd": "0"
    },
    {
        "accountno": "1",
        "amount": "-14.71",
        "bic_receiver": "NDEAFIHH",
        "bookdate": "27/11/2020",
        "category": "Asuminen",
        "counterparty_account_id": "199",
        "iban_receiver": "0",
        "paymentdate": "27/11/2020",
        "reference": "0",
        "saldo": "-251.15",
        "taplajikd": "129",
        "tstamp": "2020-11-27 18:38:41",
        "valuedate": "27/11/2020",
        "vientiselitekd": "706"
    },
    {
        "accountno": "1",
        "amount": "-46.1",
        "bic_receiver": "OKOYFIHH",
        "bookdate": "07/12/2020",
        "category": "Asuminen",
        "counterparty_account_id": "201",
        "iban_receiver": "0",
        "paymentdate": "07/12/2020",
        "reference": "0",
        "saldo": "-96.39",
        "taplajikd": "129",
        "tstamp": "2020-12-07 20:37:11",
        "valuedate": "07/12/2020",
        "vientiselitekd": "706"
    },
    {
        "accountno": "1",
        "amount": "-29.27",
        "bic_receiver": "DABAFIHH",
        "bookdate": "08/12/2020",
        "category": "Asuminen",
        "counterparty_account_id": "201",
        "iban_receiver": "0",
        "paymentdate": "08/12/2020",
        "reference": "0",
        "saldo": "17.83",
        "taplajikd": "129",
        "tstamp": "2020-12-08 17:34:39",
        "valuedate": "08/12/2020",
        "vientiselitekd": "706"
    },
    {
        "accountno": "1",
        "amount": "-38.29",
        "bic_receiver": "DABAFIHH",
        "bookdate": "26/12/2020",
        "category": "Asuminen",
        "counterparty_account_id": "11",
        "iban_receiver": "0",
        "paymentdate": "26/12/2020",
        "reference": "0",
        "saldo": "192.1",
        "taplajikd": "106",
        "tstamp": "2020-12-26 4:43:57",
        "valuedate": "26/12/2020",
        "vientiselitekd": "0"
    },
    {
        "accountno": "2",
        "amount": "-20.52",
        "bic_receiver": "",
        "bookdate": "07/03/2019",
        "category": "Asuminen",
        "counterparty_account_id": "86",
        "iban_receiver": "1",
        "paymentdate": "07/03/2019",
        "reference": "1",
        "saldo": "1700.36",
        "taplajikd": "162",
        "tstamp": "2019-03-07 7:50:12",
        "valuedate": "07/03/2019",
        "vientiselitekd": "0"
    },
    {
        "accountno": "2",
        "amount": "-75.13",
        "bic_receiver": "NDEAFIHH",
        "bookdate": "10/05/2019",
        "category": "Asuminen",
        "counterparty_account_id": "187",
        "iban_receiver": "0",
        "paymentdate": "10/05/2019",
        "reference": "0",
        "saldo": "1453.48",
        "taplajikd": "106",
        "tstamp": "2019-05-10 9:18:22",
        "valuedate": "10/05/2019",
        "vientiselitekd": "706"
    },
    {
        "accountno": "2",
        "amount": "-13.96",
        "bic_receiver": "OKOYFIHH",
        "bookdate": "06/06/2019",
        "category": "Asuminen",
        "counterparty_account_id": "186",
        "iban_receiver": "0",
        "paymentdate": "06/06/2019",
        "reference": "0",
        "saldo": "1583.33",
        "taplajikd": "106",
        "tstamp": "2019-06-06 10:54:33",
        "valuedate": "06/06/2019",
        "vientiselitekd": "706"
    },
    {
        "accountno": "2",
        "amount": "-136",
        "bic_receiver": "OKOYFIHH",
        "bookdate": "10/06/2019",
        "category": "Asuminen",
        "counterparty_account_id": "195",
        "iban_receiver": "0",
        "paymentdate": "10/06/2019",
        "reference": "0",
        "saldo": "270.98",
        "taplajikd": "106",
        "tstamp": "2019-06-10 19:38:11",
        "valuedate": "10/06/2019",
        "vientiselitekd": "706"
    },
    {
        "accountno": "2",
        "amount": "-11.89",
        "bic_receiver": "OKOYFIHH",
        "bookdate": "19/06/2019",
        "category": "Asuminen",
        "counterparty_account_id": "186",
        "iban_receiver": "0",
        "paymentdate": "18/06/2019",
        "reference": "0",
        "saldo": "679.77",
        "taplajikd": "106",
        "tstamp": "2019-06-18 13:05:27",
        "valuedate": "18/06/2019",
        "vientiselitekd": "706"
    },
    {
        "accountno": "2",
        "amount": "-15.91",
        "bic_receiver": "NDEAFIHH",
        "bookdate": "27/06/2019",
        "category": "Asuminen",
        "counterparty_account_id": "186",
        "iban_receiver": "0",
        "paymentdate": "27/06/2019",
        "reference": "0",
        "saldo": "661.78",
        "taplajikd": "106",
        "tstamp": "2019-06-27 4:21:49",
        "valuedate": "27/06/2019",
        "vientiselitekd": "706"
    },
    {
        "accountno": "2",
        "amount": "-37.31",
        "bic_receiver": "OKOYFIHH",
        "bookdate": "02/07/2019",
        "category": "Asuminen",
        "counterparty_account_id": "188",
        "iban_receiver": "0",
        "paymentdate": "02/07/2019",
        "reference": "0",
        "saldo": "474.98",
        "taplajikd": "106",
        "tstamp": "2019-07-02 9:26:18",
        "valuedate": "02/07/2019",
        "vientiselitekd": "706"
    },
    {
        "accountno": "2",
        "amount": "-20.78",
        "bic_receiver": "NDEAFIHH",
        "bookdate": "05/07/2019",
        "category": "Asuminen",
        "counterparty_account_id": "190",
        "iban_receiver": "0",
        "paymentdate": "05/07/2019",
        "reference": "0",
        "saldo": "1844.12",
        "taplajikd": "106",
        "tstamp": "2019-07-05 4:18:53",
        "valuedate": "05/07/2019",
        "vientiselitekd": "706"
    },
    {
        "accountno": "2",
        "amount": "-366.16",
        "bic_receiver": "OKOYFIHH",
        "bookdate": "12/07/2019",
        "category": "Asuminen",
        "counterparty_account_id": "188",
        "iban_receiver": "0",
        "paymentdate": "12/07/2019",
        "reference": "0",
        "saldo": "3351.05",
        "taplajikd": "106",
        "tstamp": "2019-07-12 3:30:20",
        "valuedate": "12/07/2019",
        "vientiselitekd": "706"
    },
    {
        "accountno": "2",
        "amount": "-48.44",
        "bic_receiver": "OKOYFIHH",
        "bookdate": "16/07/2019",
        "category": "Asuminen",
        "counterparty_account_id": "188",
        "iban_receiver": "0",
        "paymentdate": "16/07/2019",
        "reference": "0",
        "saldo": "3126.68",
        "taplajikd": "106",
        "tstamp": "2019-07-16 7:49:13",
        "valuedate": "16/07/2019",
        "vientiselitekd": "706"
    },
    {
        "accountno": "2",
        "amount": "-78.04",
        "bic_receiver": "",
        "bookdate": "23/08/2019",
        "category": "Asuminen",
        "counterparty_account_id": "94",
        "iban_receiver": "1",
        "paymentdate": "23/08/2019",
        "reference": "1",
        "saldo": "3768.7",
        "taplajikd": "162",
        "tstamp": "2019-08-23 8:12:58",
        "valuedate": "23/08/2019",
        "vientiselitekd": "0"
    },
    {
        "accountno": "2",
        "amount": "-320.54",
        "bic_receiver": "NDEAFIHH",
        "bookdate": "01/10/2019",
        "category": "Asuminen",
        "counterparty_account_id": "201",
        "iban_receiver": "0",
        "paymentdate": "30/09/2019",
        "reference": "0",
        "saldo": "4047.24",
        "taplajikd": "129",
        "tstamp": "2019-10-01 22:53:32",
        "valuedate": "01/10/2019",
        "vientiselitekd": "706"
    },
    {
        "accountno": "2",
        "amount": "-36.11",
        "bic_receiver": "OKOYFIHH",
        "bookdate": "03/11/2019",
        "category": "Asuminen",
        "counterparty_account_id": "24",
        "iban_receiver": "0",
        "paymentdate": "03/11/2019",
        "reference": "0",
        "saldo": "3859.94",
        "taplajikd": "129",
        "tstamp": "2019-11-03 20:34:17",
        "valuedate": "03/11/2019",
        "vientiselitekd": "0"
    },
    {
        "accountno": "2",
        "amount": "-23.49",
        "bic_receiver": "",
        "bookdate": "11/11/2019",
        "category": "Asuminen",
        "counterparty_account_id": "116",
        "iban_receiver": "1",
        "paymentdate": "11/11/2019",
        "reference": "1",
        "saldo": "3708.03",
        "taplajikd": "162",
        "tstamp": "2019-11-11 17:08:34",
        "valuedate": "11/11/2019",
        "vientiselitekd": "0"
    },
    {
        "accountno": "2",
        "amount": "-87.72",
        "bic_receiver": "OKOYFIHH",
        "bookdate": "20/11/2019",
        "category": "Asuminen",
        "counterparty_account_id": "196",
        "iban_receiver": "0",
        "paymentdate": "20/11/2019",
        "reference": "0",
        "saldo": "51.32",
        "taplajikd": "129",
        "tstamp": "2019-11-21 0:00:00",
        "valuedate": "20/11/2019",
        "vientiselitekd": "706"
    },
    {
        "accountno": "2",
        "amount": "-42.93",
        "bic_receiver": "",
        "bookdate": "26/11/2019",
        "category": "Asuminen",
        "counterparty_account_id": "143",
        "iban_receiver": "1",
        "paymentdate": "26/11/2019",
        "reference": "1",
        "saldo": "332.29",
        "taplajikd": "162",
        "tstamp": "2019-11-26 10:17:09",
        "valuedate": "26/11/2019",
        "vientiselitekd": "0"
    },
    {
        "accountno": "2",
        "amount": "-17.11",
        "bic_receiver": "OKOYFIHH",
        "bookdate": "02/12/2019",
        "category": "Asuminen",
        "counterparty_account_id": "199",
        "iban_receiver": "0",
        "paymentdate": "02/12/2019",
        "reference": "0",
        "saldo": "3508.46",
        "taplajikd": "129",
        "tstamp": "2019-12-02 17:06:12",
        "valuedate": "02/12/2019",
        "vientiselitekd": "706"
    },
    {
        "accountno": "2",
        "amount": "-43.64",
        "bic_receiver": "OKOYFIHH",
        "bookdate": "16/12/2019",
        "category": "Asuminen",
        "counterparty_account_id": "9",
        "iban_receiver": "0",
        "paymentdate": "16/12/2019",
        "reference": "0",
        "saldo": "8101.39",
        "taplajikd": "106",
        "tstamp": "2019-12-16 6:04:08",
        "valuedate": "16/12/2019",
        "vientiselitekd": "0"
    },
    {
        "accountno": "2",
        "amount": "-291.88",
        "bic_receiver": "NDEAFIHH",
        "bookdate": "20/12/2019",
        "category": "Asuminen",
        "counterparty_account_id": "22",
        "iban_receiver": "0",
        "paymentdate": "20/12/2019",
        "reference": "0",
        "saldo": "2498.98",
        "taplajikd": "106",
        "tstamp": "2019-12-20 12:41:23",
        "valuedate": "20/12/2019",
        "vientiselitekd": "0"
    },
    {
        "accountno": "2",
        "amount": "-55.2",
        "bic_receiver": "OKOYFIHH",
        "bookdate": "10/01/2020",
        "category": "Asuminen",
        "counterparty_account_id": "197",
        "iban_receiver": "0",
        "paymentdate": "10/01/2020",
        "reference": "0",
        "saldo": "-69.21",
        "taplajikd": "129",
        "tstamp": "2020-01-10 17:39:10",
        "valuedate": "10/01/2020",
        "vientiselitekd": "706"
    },
    {
        "accountno": "2",
        "amount": "-16.32",
        "bic_receiver": "DABAFIHH",
        "bookdate": "22/01/2020",
        "category": "Asuminen",
        "counterparty_account_id": "202",
        "iban_receiver": "0",
        "paymentdate": "22/01/2020",
        "reference": "0",
        "saldo": "40.75",
        "taplajikd": "129",
        "tstamp": "2020-01-22 13:05:27",
        "valuedate": "22/01/2020",
        "vientiselitekd": "706"
    },
    {
        "accountno": "2",
        "amount": "-24.96",
        "bic_receiver": "OKOYFIHH",
        "bookdate": "31/01/2020",
        "category": "Asuminen",
        "counterparty_account_id": "199",
        "iban_receiver": "0",
        "paymentdate": "31/01/2020",
        "reference": "0",
        "saldo": "4.81",
        "taplajikd": "129",
        "tstamp": "2020-01-31 17:51:04",
        "valuedate": "31/01/2020",
        "vientiselitekd": "706"
    },
    {
        "accountno": "2",
        "amount": "-8.71",
        "bic_receiver": "",
        "bookdate": "04/02/2020",
        "category": "Asuminen",
        "counterparty_account_id": "97",
        "iban_receiver": "1",
        "paymentdate": "04/02/2020",
        "reference": "1",
        "saldo": "121.3",
        "taplajikd": "162",
        "tstamp": "2020-02-04 2:06:19",
        "valuedate": "04/02/2020",
        "vientiselitekd": "0"
    },
    {
        "accountno": "2",
        "amount": "-20.25",
        "bic_receiver": "OKOYFIHH",
        "bookdate": "09/02/2020",
        "category": "Asuminen",
        "counterparty_account_id": "17",
        "iban_receiver": "0",
        "paymentdate": "09/02/2020",
        "reference": "0",
        "saldo": "131.08",
        "taplajikd": "106",
        "tstamp": "2020-02-09 3:22:06",
        "valuedate": "09/02/2020",
        "vientiselitekd": "0"
    },
    {
        "accountno": "2",
        "amount": "-68.6",
        "bic_receiver": "OKOYFIHH",
        "bookdate": "17/02/2020",
        "category": "Asuminen",
        "counterparty_account_id": "199",
        "iban_receiver": "0",
        "paymentdate": "17/02/2020",
        "reference": "0",
        "saldo": "-264.53",
        "taplajikd": "129",
        "tstamp": "2020-02-17 6:44:13",
        "valuedate": "17/02/2020",
        "vientiselitekd": "706"
    },
    {
        "accountno": "2",
        "amount": "-16.07",
        "bic_receiver": "DABAFIHH",
        "bookdate": "20/02/2020",
        "category": "Asuminen",
        "counterparty_account_id": "204",
        "iban_receiver": "0",
        "paymentdate": "20/02/2020",
        "reference": "0",
        "saldo": "-376.17",
        "taplajikd": "129",
        "tstamp": "2020-02-20 8:25:16",
        "valuedate": "20/02/2020",
        "vientiselitekd": "706"
    },
    {
        "accountno": "2",
        "amount": "-52.96",
        "bic_receiver": "OKOYFIHH",
        "bookdate": "31/03/2020",
        "category": "Asuminen",
        "counterparty_account_id": "196",
        "iban_receiver": "0",
        "paymentdate": "30/03/2020",
        "reference": "0",
        "saldo": "-86.18",
        "taplajikd": "129",
        "tstamp": "2020-03-31 9:24:42",
        "valuedate": "31/03/2020",
        "vientiselitekd": "706"
    },
    {
        "accountno": "2",
        "amount": "-40.57",
        "bic_receiver": "OKOYFIHH",
        "bookdate": "24/04/2020",
        "category": "Asuminen",
        "counterparty_account_id": "200",
        "iban_receiver": "0",
        "paymentdate": "24/04/2020",
        "reference": "0",
        "saldo": "-218.4",
        "taplajikd": "129",
        "tstamp": "2020-04-24 7:17:28",
        "valuedate": "24/04/2020",
        "vientiselitekd": "706"
    },
    {
        "accountno": "2",
        "amount": "-11.23",
        "bic_receiver": "OKOYFIHH",
        "bookdate": "24/04/2020",
        "category": "Asuminen",
        "counterparty_account_id": "196",
        "iban_receiver": "0",
        "paymentdate": "21/04/2020",
        "reference": "0",
        "saldo": "-229.63",
        "taplajikd": "129",
        "tstamp": "2020-04-24 13:03:48",
        "valuedate": "24/04/2020",
        "vientiselitekd": "706"
    },
    {
        "accountno": "2",
        "amount": "-10.85",
        "bic_receiver": "DABAFIHH",
        "bookdate": "29/04/2020",
        "category": "Asuminen",
        "counterparty_account_id": "196",
        "iban_receiver": "0",
        "paymentdate": "29/04/2020",
        "reference": "0",
        "saldo": "-292.39",
        "taplajikd": "129",
        "tstamp": "2020-04-29 2:25:49",
        "valuedate": "29/04/2020",
        "vientiselitekd": "706"
    },
    {
        "accountno": "2",
        "amount": "-9.84",
        "bic_receiver": "NDEAFIHH",
        "bookdate": "11/05/2020",
        "category": "Asuminen",
        "counterparty_account_id": "197",
        "iban_receiver": "0",
        "paymentdate": "11/05/2020",
        "reference": "0",
        "saldo": "-281.18",
        "taplajikd": "129",
        "tstamp": "2020-05-11 11:29:35",
        "valuedate": "11/05/2020",
        "vientiselitekd": "706"
    },
    {
        "accountno": "2",
        "amount": "-20.24",
        "bic_receiver": "NDEAFIHH",
        "bookdate": "12/05/2020",
        "category": "Asuminen",
        "counterparty_account_id": "200",
        "iban_receiver": "0",
        "paymentdate": "12/05/2020",
        "reference": "0",
        "saldo": "-314.43",
        "taplajikd": "129",
        "tstamp": "2020-05-12 8:27:03",
        "valuedate": "12/05/2020",
        "vientiselitekd": "706"
    },
    {
        "accountno": "2",
        "amount": "-19.24",
        "bic_receiver": "NDEAFIHH",
        "bookdate": "18/05/2020",
        "category": "Asuminen",
        "counterparty_account_id": "196",
        "iban_receiver": "0",
        "paymentdate": "18/05/2020",
        "reference": "0",
        "saldo": "-397.92",
        "taplajikd": "129",
        "tstamp": "2020-05-18 14:11:50",
        "valuedate": "18/05/2020",
        "vientiselitekd": "706"
    },
    {
        "accountno": "2",
        "amount": "-52.15",
        "bic_receiver": "OKOYFIHH",
        "bookdate": "28/05/2020",
        "category": "Asuminen",
        "counterparty_account_id": "196",
        "iban_receiver": "0",
        "paymentdate": "28/05/2020",
        "reference": "0",
        "saldo": "-1430.29",
        "taplajikd": "129",
        "tstamp": "2020-05-28 16:33:48",
        "valuedate": "28/05/2020",
        "vientiselitekd": "706"
    },
    {
        "accountno": "2",
        "amount": "-6.62",
        "bic_receiver": "DABAFIHH",
        "bookdate": "04/06/2020",
        "category": "Asuminen",
        "counterparty_account_id": "203",
        "iban_receiver": "0",
        "paymentdate": "04/06/2020",
        "reference": "0",
        "saldo": "1387.06",
        "taplajikd": "129",
        "tstamp": "2020-06-04 14:44:49",
        "valuedate": "04/06/2020",
        "vientiselitekd": "706"
    },
    {
        "accountno": "2",
        "amount": "-27.36",
        "bic_receiver": "DABAFIHH",
        "bookdate": "05/06/2020",
        "category": "Asuminen",
        "counterparty_account_id": "199",
        "iban_receiver": "0",
        "paymentdate": "05/06/2020",
        "reference": "0",
        "saldo": "1355.48",
        "taplajikd": "129",
        "tstamp": "2020-06-05 8:05:47",
        "valuedate": "05/06/2020",
        "vientiselitekd": "706"
    },
    {
        "accountno": "2",
        "amount": "-16.46",
        "bic_receiver": "OKOYFIHH",
        "bookdate": "26/06/2020",
        "category": "Asuminen",
        "counterparty_account_id": "21",
        "iban_receiver": "0",
        "paymentdate": "26/06/2020",
        "reference": "0",
        "saldo": "1163.92",
        "taplajikd": "106",
        "tstamp": "2020-06-26 0:34:42",
        "valuedate": "26/06/2020",
        "vientiselitekd": "0"
    },
    {
        "accountno": "2",
        "amount": "-99.33",
        "bic_receiver": "OKOYFIHH",
        "bookdate": "13/07/2020",
        "category": "Asuminen",
        "counterparty_account_id": "196",
        "iban_receiver": "0",
        "paymentdate": "13/07/2020",
        "reference": "0",
        "saldo": "331.09",
        "taplajikd": "129",
        "tstamp": "2020-07-13 9:36:00",
        "valuedate": "13/07/2020",
        "vientiselitekd": "706"
    },
    {
        "accountno": "2",
        "amount": "-7.43",
        "bic_receiver": "OKOYFIHH",
        "bookdate": "15/07/2020",
        "category": "Asuminen",
        "counterparty_account_id": "196",
        "iban_receiver": "0",
        "paymentdate": "13/07/2020",
        "reference": "0",
        "saldo": "288.93",
        "taplajikd": "129",
        "tstamp": "2020-07-13 20:37:20",
        "valuedate": "13/07/2020",
        "vientiselitekd": "706"
    },
    {
        "accountno": "2",
        "amount": "-13.11",
        "bic_receiver": "OKOYFIHH",
        "bookdate": "29/07/2020",
        "category": "Asuminen",
        "counterparty_account_id": "197",
        "iban_receiver": "0",
        "paymentdate": "29/07/2020",
        "reference": "0",
        "saldo": "-22.68",
        "taplajikd": "129",
        "tstamp": "2020-07-29 11:22:40",
        "valuedate": "29/07/2020",
        "vientiselitekd": "706"
    },
    {
        "accountno": "2",
        "amount": "-1010.53",
        "bic_receiver": "",
        "bookdate": "07/08/2020",
        "category": "Asuminen",
        "counterparty_account_id": "121",
        "iban_receiver": "1",
        "paymentdate": "07/08/2020",
        "reference": "1",
        "saldo": "910.87",
        "taplajikd": "162",
        "tstamp": "2020-08-07 21:20:00",
        "valuedate": "07/08/2020",
        "vientiselitekd": "0"
    },
    {
        "accountno": "2",
        "amount": "-189.54",
        "bic_receiver": "OKOYFIHH",
        "bookdate": "10/08/2020",
        "category": "Asuminen",
        "counterparty_account_id": "206",
        "iban_receiver": "0",
        "paymentdate": "10/08/2020",
        "reference": "0",
        "saldo": "701.02",
        "taplajikd": "147",
        "tstamp": "2020-08-10 0:12:18",
        "valuedate": "10/08/2020",
        "vientiselitekd": "706"
    },
    {
        "accountno": "2",
        "amount": "-5.15",
        "bic_receiver": "",
        "bookdate": "13/08/2020",
        "category": "Asuminen",
        "counterparty_account_id": "57",
        "iban_receiver": "1",
        "paymentdate": "13/08/2020",
        "reference": "1",
        "saldo": "447.29",
        "taplajikd": "162",
        "tstamp": "2020-08-13 5:56:55",
        "valuedate": "13/08/2020",
        "vientiselitekd": "0"
    },
    {
        "accountno": "2",
        "amount": "-1179.65",
        "bic_receiver": "",
        "bookdate": "21/09/2020",
        "category": "Asuminen",
        "counterparty_account_id": "44",
        "iban_receiver": "1",
        "paymentdate": "21/09/2020",
        "reference": "1",
        "saldo": "2885.23",
        "taplajikd": "162",
        "tstamp": "2020-09-21 17:46:40",
        "valuedate": "21/09/2020",
        "vientiselitekd": "0"
    },
    {
        "accountno": "2",
        "amount": "-400.81",
        "bic_receiver": "",
        "bookdate": "04/11/2020",
        "category": "Asuminen",
        "counterparty_account_id": "28",
        "iban_receiver": "1",
        "paymentdate": "04/11/2020",
        "reference": "1",
        "saldo": "4031.05",
        "taplajikd": "162",
        "tstamp": "2020-11-04 6:32:44",
        "valuedate": "04/11/2020",
        "vientiselitekd": "0"
    },
    {
        "accountno": "2",
        "amount": "-18.91",
        "bic_receiver": "OKOYFIHH",
        "bookdate": "04/12/2020",
        "category": "Asuminen",
        "counterparty_account_id": "6",
        "iban_receiver": "0",
        "paymentdate": "04/12/2020",
        "reference": "0",
        "saldo": "7400.92",
        "taplajikd": "106",
        "tstamp": "2020-12-04 8:15:17",
        "valuedate": "04/12/2020",
        "vientiselitekd": "0"
    },
    {
        "accountno": "2",
        "amount": "-3.27",
        "bic_receiver": "",
        "bookdate": "14/12/2020",
        "category": "Asuminen",
        "counterparty_account_id": "57",
        "iban_receiver": "1",
        "paymentdate": "14/12/2020",
        "reference": "1",
        "saldo": "6553.3",
        "taplajikd": "162",
        "tstamp": "2020-12-14 10:51:13",
        "valuedate": "14/12/2020",
        "vientiselitekd": "0"
    },
    {
        "accountno": "2",
        "amount": "-1881.98",
        "bic_receiver": "DABAFIHH",
        "bookdate": "15/12/2020",
        "category": "Asuminen",
        "counterparty_account_id": "21",
        "iban_receiver": "0",
        "paymentdate": "15/12/2020",
        "reference": "0",
        "saldo": "4620.9",
        "taplajikd": "106",
        "tstamp": "2020-12-15 5:11:51",
        "valuedate": "15/12/2020",
        "vientiselitekd": "0"
    },
    {
        "accountno": "3",
        "amount": "-6.46",
        "bic_receiver": "OKOYFIHH",
        "bookdate": "20/02/2019",
        "category": "Asuminen",
        "counterparty_account_id": "215",
        "iban_receiver": "0",
        "paymentdate": "20/02/2019",
        "reference": "0",
        "saldo": "53090.91",
        "taplajikd": "129",
        "tstamp": "2019-02-20 7:26:54",
        "valuedate": "20/02/2019",
        "vientiselitekd": "706"
    },
    {
        "accountno": "3",
        "amount": "-122.41",
        "bic_receiver": "",
        "bookdate": "18/03/2019",
        "category": "Asuminen",
        "counterparty_account_id": "64",
        "iban_receiver": "1",
        "paymentdate": "18/03/2019",
        "reference": "1",
        "saldo": "57103.3",
        "taplajikd": "162",
        "tstamp": "2019-03-18 21:49:05",
        "valuedate": "18/03/2019",
        "vientiselitekd": "0"
    },
    {
        "accountno": "3",
        "amount": "-191.15",
        "bic_receiver": "NDEAFIHH",
        "bookdate": "29/03/2019",
        "category": "Asuminen",
        "counterparty_account_id": "219",
        "iban_receiver": "0",
        "paymentdate": "29/03/2019",
        "reference": "0",
        "saldo": "57279.92",
        "taplajikd": "129",
        "tstamp": "2019-03-29 4:21:49",
        "valuedate": "29/03/2019",
        "vientiselitekd": "706"
    },
    {
        "accountno": "3",
        "amount": "-33.93",
        "bic_receiver": "OKOYFIHH",
        "bookdate": "16/04/2019",
        "category": "Asuminen",
        "counterparty_account_id": "221",
        "iban_receiver": "0",
        "paymentdate": "16/04/2019",
        "reference": "0",
        "saldo": "61016.95",
        "taplajikd": "147",
        "tstamp": "2019-04-16 10:31:14",
        "valuedate": "16/04/2019",
        "vientiselitekd": "706"
    },
    {
        "accountno": "3",
        "amount": "-9.13",
        "bic_receiver": "DABAFIHH",
        "bookdate": "19/04/2019",
        "category": "Asuminen",
        "counterparty_account_id": "217",
        "iban_receiver": "0",
        "paymentdate": "19/04/2019",
        "reference": "0",
        "saldo": "61055.27",
        "taplajikd": "129",
        "tstamp": "2019-04-19 21:41:55",
        "valuedate": "19/04/2019",
        "vientiselitekd": "706"
    },
    {
        "accountno": "3",
        "amount": "-104.49",
        "bic_receiver": "DABAFIHH",
        "bookdate": "22/04/2019",
        "category": "Asuminen",
        "counterparty_account_id": "215",
        "iban_receiver": "0",
        "paymentdate": "22/04/2019",
        "reference": "0",
        "saldo": "61209.16",
        "taplajikd": "129",
        "tstamp": "2019-04-22 17:25:29",
        "valuedate": "22/04/2019",
        "vientiselitekd": "706"
    },
    {
        "accountno": "3",
        "amount": "-25.17",
        "bic_receiver": "OKOYFIHH",
        "bookdate": "24/04/2019",
        "category": "Asuminen",
        "counterparty_account_id": "211",
        "iban_receiver": "0",
        "paymentdate": "24/04/2019",
        "reference": "0",
        "saldo": "64255.59",
        "taplajikd": "129",
        "tstamp": "2019-04-24 0:19:44",
        "valuedate": "24/04/2019",
        "vientiselitekd": "706"
    },
    {
        "accountno": "3",
        "amount": "-40.8",
        "bic_receiver": "",
        "bookdate": "29/04/2019",
        "category": "Asuminen",
        "counterparty_account_id": "148",
        "iban_receiver": "1",
        "paymentdate": "29/04/2019",
        "reference": "1",
        "saldo": "65552.83",
        "taplajikd": "162",
        "tstamp": "2019-04-29 2:57:32",
        "valuedate": "29/04/2019",
        "vientiselitekd": "0"
    },
    {
        "accountno": "3",
        "amount": "-155.62",
        "bic_receiver": "OKOYFIHH",
        "bookdate": "01/05/2019",
        "category": "Asuminen",
        "counterparty_account_id": "222",
        "iban_receiver": "0",
        "paymentdate": "01/05/2019",
        "reference": "0",
        "saldo": "66352.03",
        "taplajikd": "147",
        "tstamp": "2019-05-01 19:50:24",
        "valuedate": "01/05/2019",
        "vientiselitekd": "706"
    },
    {
        "accountno": "3",
        "amount": "-141.3",
        "bic_receiver": "OKOYFIHH",
        "bookdate": "06/05/2019",
        "category": "Asuminen",
        "counterparty_account_id": "211",
        "iban_receiver": "0",
        "paymentdate": "06/05/2019",
        "reference": "0",
        "saldo": "66420.47",
        "taplajikd": "129",
        "tstamp": "2019-05-06 18:52:48",
        "valuedate": "06/05/2019",
        "vientiselitekd": "706"
    },
    {
        "accountno": "3",
        "amount": "-47.34",
        "bic_receiver": "OKOYFIHH",
        "bookdate": "08/05/2019",
        "category": "Asuminen",
        "counterparty_account_id": "211",
        "iban_receiver": "0",
        "paymentdate": "08/05/2019",
        "reference": "0",
        "saldo": "66557.27",
        "taplajikd": "129",
        "tstamp": "2019-05-08 10:33:36",
        "valuedate": "08/05/2019",
        "vientiselitekd": "706"
    },
    {
        "accountno": "3",
        "amount": "-36.08",
        "bic_receiver": "DABAFIHH",
        "bookdate": "10/05/2019",
        "category": "Asuminen",
        "counterparty_account_id": "212",
        "iban_receiver": "0",
        "paymentdate": "10/05/2019",
        "reference": "0",
        "saldo": "66446.16",
        "taplajikd": "129",
        "tstamp": "2019-05-10 2:14:24",
        "valuedate": "10/05/2019",
        "vientiselitekd": "706"
    },
    {
        "accountno": "3",
        "amount": "-25.31",
        "bic_receiver": "OKOYFIHH",
        "bookdate": "16/05/2019",
        "category": "Asuminen",
        "counterparty_account_id": "211",
        "iban_receiver": "0",
        "paymentdate": "16/05/2019",
        "reference": "0",
        "saldo": "66261.58",
        "taplajikd": "129",
        "tstamp": "2019-05-16 8:38:24",
        "valuedate": "16/05/2019",
        "vientiselitekd": "706"
    },
    {
        "accountno": "3",
        "amount": "-35.81",
        "bic_receiver": "OKOYFIHH",
        "bookdate": "20/05/2019",
        "category": "Asuminen",
        "counterparty_account_id": "212",
        "iban_receiver": "0",
        "paymentdate": "20/05/2019",
        "reference": "0",
        "saldo": "66654.43",
        "taplajikd": "129",
        "tstamp": "2019-05-20 4:28:48",
        "valuedate": "20/05/2019",
        "vientiselitekd": "706"
    },
    {
        "accountno": "3",
        "amount": "-119.38",
        "bic_receiver": "",
        "bookdate": "23/05/2019",
        "category": "Asuminen",
        "counterparty_account_id": "127",
        "iban_receiver": "1",
        "paymentdate": "23/05/2019",
        "reference": "1",
        "saldo": "66435.66",
        "taplajikd": "162",
        "tstamp": "2019-05-23 19:12:00",
        "valuedate": "23/05/2019",
        "vientiselitekd": "0"
    },
    {
        "accountno": "3",
        "amount": "-11.03",
        "bic_receiver": "OKOYFIHH",
        "bookdate": "27/05/2019",
        "category": "Asuminen",
        "counterparty_account_id": "214",
        "iban_receiver": "0",
        "paymentdate": "27/05/2019",
        "reference": "0",
        "saldo": "66059.7",
        "taplajikd": "129",
        "tstamp": "2019-05-27 10:52:48",
        "valuedate": "27/05/2019",
        "vientiselitekd": "706"
    },
    {
        "accountno": "3",
        "amount": "-78.21",
        "bic_receiver": "OKOYFIHH",
        "bookdate": "29/05/2019",
        "category": "Asuminen",
        "counterparty_account_id": "220",
        "iban_receiver": "0",
        "paymentdate": "29/05/2019",
        "reference": "0",
        "saldo": "66041.29",
        "taplajikd": "129",
        "tstamp": "2019-05-29 2:33:36",
        "valuedate": "29/05/2019",
        "vientiselitekd": "706"
    },
    {
        "accountno": "3",
        "amount": "-66.87",
        "bic_receiver": "DABAFIHH",
        "bookdate": "30/05/2019",
        "category": "Asuminen",
        "counterparty_account_id": "212",
        "iban_receiver": "0",
        "paymentdate": "30/05/2019",
        "reference": "0",
        "saldo": "63830.83",
        "taplajikd": "129",
        "tstamp": "2019-05-30 18:14:24",
        "valuedate": "30/05/2019",
        "vientiselitekd": "706"
    },
    {
        "accountno": "3",
        "amount": "-718.26",
        "bic_receiver": "NDEAFIHH",
        "bookdate": "03/06/2019",
        "category": "Asuminen",
        "counterparty_account_id": "214",
        "iban_receiver": "0",
        "paymentdate": "03/06/2019",
        "reference": "0",
        "saldo": "63183.52",
        "taplajikd": "129",
        "tstamp": "2019-06-03 5:47:35",
        "valuedate": "03/06/2019",
        "vientiselitekd": "706"
    },
    {
        "accountno": "3",
        "amount": "-53.61",
        "bic_receiver": "NDEAFIHH",
        "bookdate": "03/06/2019",
        "category": "Asuminen",
        "counterparty_account_id": "211",
        "iban_receiver": "0",
        "paymentdate": "03/06/2019",
        "reference": "0",
        "saldo": "63069.37",
        "taplajikd": "129",
        "tstamp": "2019-06-03 11:35:10",
        "valuedate": "03/06/2019",
        "vientiselitekd": "706"
    },
    {
        "accountno": "3",
        "amount": "-136.56",
        "bic_receiver": "NDEAFIHH",
        "bookdate": "05/06/2019",
        "category": "Asuminen",
        "counterparty_account_id": "211",
        "iban_receiver": "0",
        "paymentdate": "05/06/2019",
        "reference": "0",
        "saldo": "63317.8",
        "taplajikd": "129",
        "tstamp": "2019-06-05 3:18:37",
        "valuedate": "05/06/2019",
        "vientiselitekd": "706"
    },
    {
        "accountno": "3",
        "amount": "-35.87",
        "bic_receiver": "",
        "bookdate": "12/06/2019",
        "category": "Asuminen",
        "counterparty_account_id": "102",
        "iban_receiver": "1",
        "paymentdate": "12/06/2019",
        "reference": "1",
        "saldo": "70465.55",
        "taplajikd": "162",
        "tstamp": "2019-06-12 1:39:19",
        "valuedate": "12/06/2019",
        "vientiselitekd": "0"
    },
    {
        "accountno": "3",
        "amount": "-223.73",
        "bic_receiver": "DABAFIHH",
        "bookdate": "17/06/2019",
        "category": "Asuminen",
        "counterparty_account_id": "205",
        "iban_receiver": "0",
        "paymentdate": "17/06/2019",
        "reference": "0",
        "saldo": "69210.94",
        "taplajikd": "106",
        "tstamp": "2019-06-17 3:18:37",
        "valuedate": "17/06/2019",
        "vientiselitekd": "706"
    },
    {
        "accountno": "3",
        "amount": "-44.94",
        "bic_receiver": "",
        "bookdate": "25/06/2019",
        "category": "Asuminen",
        "counterparty_account_id": "113",
        "iban_receiver": "1",
        "paymentdate": "25/06/2019",
        "reference": "1",
        "saldo": "69210.93",
        "taplajikd": "162",
        "tstamp": "2019-06-25 19:51:43",
        "valuedate": "25/06/2019",
        "vientiselitekd": "0"
    },
    {
        "accountno": "3",
        "amount": "-110.08",
        "bic_receiver": "OKOYFIHH",
        "bookdate": "02/07/2019",
        "category": "Asuminen",
        "counterparty_account_id": "211",
        "iban_receiver": "0",
        "paymentdate": "02/07/2019",
        "reference": "0",
        "saldo": "69176.4",
        "taplajikd": "129",
        "tstamp": "2019-07-02 10:12:25",
        "valuedate": "02/07/2019",
        "vientiselitekd": "706"
    },
    {
        "accountno": "3",
        "amount": "-34.27",
        "bic_receiver": "OKOYFIHH",
        "bookdate": "05/07/2019",
        "category": "Asuminen",
        "counterparty_account_id": "27",
        "iban_receiver": "0",
        "paymentdate": "05/07/2019",
        "reference": "0",
        "saldo": "68375.24",
        "taplajikd": "106",
        "tstamp": "2019-07-05 6:37:14",
        "valuedate": "05/07/2019",
        "vientiselitekd": "0"
    },
    {
        "accountno": "3",
        "amount": "-52.14",
        "bic_receiver": "OKOYFIHH",
        "bookdate": "19/07/2019",
        "category": "Asuminen",
        "counterparty_account_id": "22",
        "iban_receiver": "0",
        "paymentdate": "19/07/2019",
        "reference": "0",
        "saldo": "69249.24",
        "taplajikd": "106",
        "tstamp": "2019-07-19 19:35:10",
        "valuedate": "19/07/2019",
        "vientiselitekd": "0"
    },
    {
        "accountno": "3",
        "amount": "-194.65",
        "bic_receiver": "",
        "bookdate": "31/07/2019",
        "category": "Asuminen",
        "counterparty_account_id": "59",
        "iban_receiver": "1",
        "paymentdate": "29/07/2019",
        "reference": "1",
        "saldo": "72693.73",
        "taplajikd": "162",
        "tstamp": "2019-07-29 22:20:41",
        "valuedate": "29/07/2019",
        "vientiselitekd": "0"
    },
    {
        "accountno": "3",
        "amount": "-64.27",
        "bic_receiver": "",
        "bookdate": "28/08/2019",
        "category": "Asuminen",
        "counterparty_account_id": "109",
        "iban_receiver": "1",
        "paymentdate": "28/08/2019",
        "reference": "1",
        "saldo": "71016.7",
        "taplajikd": "162",
        "tstamp": "2019-08-28 23:03:32",
        "valuedate": "28/08/2019",
        "vientiselitekd": "0"
    },
    {
        "accountno": "3",
        "amount": "-16.37",
        "bic_receiver": "OKOYFIHH",
        "bookdate": "30/08/2019",
        "category": "Asuminen",
        "counterparty_account_id": "213",
        "iban_receiver": "0",
        "paymentdate": "30/08/2019",
        "reference": "0",
        "saldo": "71044.4",
        "taplajikd": "129",
        "tstamp": "2019-08-30 9:24:42",
        "valuedate": "30/08/2019",
        "vientiselitekd": "706"
    },
    {
        "accountno": "3",
        "amount": "-29.5",
        "bic_receiver": "DABAFIHH",
        "bookdate": "13/09/2019",
        "category": "Asuminen",
        "counterparty_account_id": "223",
        "iban_receiver": "0",
        "paymentdate": "13/09/2019",
        "reference": "0",
        "saldo": "70933.39",
        "taplajikd": "147",
        "tstamp": "2019-09-13 18:29:30",
        "valuedate": "13/09/2019",
        "vientiselitekd": "706"
    },
    {
        "accountno": "3",
        "amount": "-13.67",
        "bic_receiver": "OKOYFIHH",
        "bookdate": "13/09/2019",
        "category": "Asuminen",
        "counterparty_account_id": "212",
        "iban_receiver": "0",
        "paymentdate": "13/09/2019",
        "reference": "0",
        "saldo": "70919.72",
        "taplajikd": "129",
        "tstamp": "2019-09-13 18:53:07",
        "valuedate": "13/09/2019",
        "vientiselitekd": "706"
    },
    {
        "accountno": "3",
        "amount": "-18.92",
        "bic_receiver": "OKOYFIHH",
        "bookdate": "17/09/2019",
        "category": "Asuminen",
        "counterparty_account_id": "212",
        "iban_receiver": "0",
        "paymentdate": "17/09/2019",
        "reference": "0",
        "saldo": "71034.56",
        "taplajikd": "129",
        "tstamp": "2019-09-17 16:55:05",
        "valuedate": "17/09/2019",
        "vientiselitekd": "706"
    },
    {
        "accountno": "3",
        "amount": "-17.16",
        "bic_receiver": "NDEAFIHH",
        "bookdate": "02/10/2019",
        "category": "Asuminen",
        "counterparty_account_id": "212",
        "iban_receiver": "0",
        "paymentdate": "02/10/2019",
        "reference": "0",
        "saldo": "72445.74",
        "taplajikd": "129",
        "tstamp": "2019-10-02 15:40:48",
        "valuedate": "02/10/2019",
        "vientiselitekd": "706"
    },
    {
        "accountno": "3",
        "amount": "-162.19",
        "bic_receiver": "OKOYFIHH",
        "bookdate": "10/10/2019",
        "category": "Asuminen",
        "counterparty_account_id": "211",
        "iban_receiver": "0",
        "paymentdate": "10/10/2019",
        "reference": "0",
        "saldo": "73122.98",
        "taplajikd": "129",
        "tstamp": "2019-10-10 17:55:12",
        "valuedate": "10/10/2019",
        "vientiselitekd": "706"
    },
    {
        "accountno": "3",
        "amount": "-7.85",
        "bic_receiver": "OKOYFIHH",
        "bookdate": "11/10/2019",
        "category": "Asuminen",
        "counterparty_account_id": "219",
        "iban_receiver": "0",
        "paymentdate": "11/10/2019",
        "reference": "0",
        "saldo": "73115.13",
        "taplajikd": "129",
        "tstamp": "2019-10-11 22:04:48",
        "valuedate": "11/10/2019",
        "vientiselitekd": "706"
    },
    {
        "accountno": "3",
        "amount": "-23.91",
        "bic_receiver": "OKOYFIHH",
        "bookdate": "12/10/2019",
        "category": "Asuminen",
        "counterparty_account_id": "7",
        "iban_receiver": "0",
        "paymentdate": "12/10/2019",
        "reference": "0",
        "saldo": "73091.22",
        "taplajikd": "106",
        "tstamp": "2019-10-12 9:36:00",
        "valuedate": "12/10/2019",
        "vientiselitekd": "0"
    },
    {
        "accountno": "3",
        "amount": "-63.69",
        "bic_receiver": "",
        "bookdate": "22/10/2019",
        "category": "Asuminen",
        "counterparty_account_id": "68",
        "iban_receiver": "1",
        "paymentdate": "21/10/2019",
        "reference": "1",
        "saldo": "72846.93",
        "taplajikd": "162",
        "tstamp": "2019-10-21 7:40:48",
        "valuedate": "21/10/2019",
        "vientiselitekd": "0"
    },
    {
        "accountno": "3",
        "amount": "-219.14",
        "bic_receiver": "OKOYFIHH",
        "bookdate": "29/10/2019",
        "category": "Asuminen",
        "counterparty_account_id": "215",
        "iban_receiver": "0",
        "paymentdate": "29/10/2019",
        "reference": "0",
        "saldo": "76466.69",
        "taplajikd": "129",
        "tstamp": "2019-10-29 2:33:36",
        "valuedate": "29/10/2019",
        "vientiselitekd": "706"
    },
    {
        "accountno": "3",
        "amount": "-23.07",
        "bic_receiver": "OKOYFIHH",
        "bookdate": "31/10/2019",
        "category": "Asuminen",
        "counterparty_account_id": "219",
        "iban_receiver": "0",
        "paymentdate": "31/10/2019",
        "reference": "0",
        "saldo": "76363.14",
        "taplajikd": "129",
        "tstamp": "2019-10-31 14:04:48",
        "valuedate": "31/10/2019",
        "vientiselitekd": "706"
    },
    {
        "accountno": "3",
        "amount": "-43.38",
        "bic_receiver": "",
        "bookdate": "04/11/2019",
        "category": "Asuminen",
        "counterparty_account_id": "87",
        "iban_receiver": "1",
        "paymentdate": "04/11/2019",
        "reference": "1",
        "saldo": "76319.31",
        "taplajikd": "162",
        "tstamp": "2019-11-04 22:27:06",
        "valuedate": "04/11/2019",
        "vientiselitekd": "0"
    },
    {
        "accountno": "3",
        "amount": "-19.57",
        "bic_receiver": "OKOYFIHH",
        "bookdate": "07/11/2019",
        "category": "Asuminen",
        "counterparty_account_id": "212",
        "iban_receiver": "0",
        "paymentdate": "07/11/2019",
        "reference": "0",
        "saldo": "76103.48",
        "taplajikd": "129",
        "tstamp": "2019-11-07 2:19:21",
        "valuedate": "07/11/2019",
        "vientiselitekd": "706"
    },
    {
        "accountno": "3",
        "amount": "-23271.42",
        "bic_receiver": "",
        "bookdate": "11/11/2019",
        "category": "Asuminen",
        "counterparty_account_id": "46",
        "iban_receiver": "1",
        "paymentdate": "11/11/2019",
        "reference": "1",
        "saldo": "52540.88",
        "taplajikd": "162",
        "tstamp": "2019-11-11 7:44:31",
        "valuedate": "11/11/2019",
        "vientiselitekd": "0"
    },
    {
        "accountno": "3",
        "amount": "-28.49",
        "bic_receiver": "OKOYFIHH",
        "bookdate": "13/11/2019",
        "category": "Asuminen",
        "counterparty_account_id": "213",
        "iban_receiver": "0",
        "paymentdate": "13/11/2019",
        "reference": "0",
        "saldo": "52421.51",
        "taplajikd": "129",
        "tstamp": "2019-11-13 21:40:39",
        "valuedate": "13/11/2019",
        "vientiselitekd": "706"
    },
    {
        "accountno": "3",
        "amount": "-35.03",
        "bic_receiver": "NDEAFIHH",
        "bookdate": "15/11/2019",
        "category": "Asuminen",
        "counterparty_account_id": "217",
        "iban_receiver": "0",
        "paymentdate": "15/11/2019",
        "reference": "0",
        "saldo": "52371.73",
        "taplajikd": "129",
        "tstamp": "2019-11-15 4:38:43",
        "valuedate": "15/11/2019",
        "vientiselitekd": "706"
    },
    {
        "accountno": "3",
        "amount": "-64.58",
        "bic_receiver": "",
        "bookdate": "22/11/2019",
        "category": "Asuminen",
        "counterparty_account_id": "64",
        "iban_receiver": "1",
        "paymentdate": "22/11/2019",
        "reference": "1",
        "saldo": "25217.77",
        "taplajikd": "162",
        "tstamp": "2019-11-22 22:27:06",
        "valuedate": "22/11/2019",
        "vientiselitekd": "0"
    },
    {
        "accountno": "3",
        "amount": "-35.64",
        "bic_receiver": "",
        "bookdate": "27/11/2019",
        "category": "Asuminen",
        "counterparty_account_id": "44",
        "iban_receiver": "1",
        "paymentdate": "27/11/2019",
        "reference": "1",
        "saldo": "24458.6",
        "taplajikd": "162",
        "tstamp": "2019-11-27 17:48:23",
        "valuedate": "27/11/2019",
        "vientiselitekd": "0"
    },
    {
        "accountno": "3",
        "amount": "-21.88",
        "bic_receiver": "OKOYFIHH",
        "bookdate": "11/12/2019",
        "category": "Asuminen",
        "counterparty_account_id": "211",
        "iban_receiver": "0",
        "paymentdate": "09/12/2019",
        "reference": "0",
        "saldo": "26826.99",
        "taplajikd": "129",
        "tstamp": "2019-12-09 4:31:18",
        "valuedate": "09/12/2019",
        "vientiselitekd": "706"
    },
    {
        "accountno": "3",
        "amount": "-7.99",
        "bic_receiver": "OKOYFIHH",
        "bookdate": "16/12/2019",
        "category": "Asuminen",
        "counterparty_account_id": "204",
        "iban_receiver": "0",
        "paymentdate": "16/12/2019",
        "reference": "0",
        "saldo": "29663.61",
        "taplajikd": "106",
        "tstamp": "2019-12-16 6:36:31",
        "valuedate": "16/12/2019",
        "vientiselitekd": "706"
    },
    {
        "accountno": "3",
        "amount": "-17.09",
        "bic_receiver": "OKOYFIHH",
        "bookdate": "17/12/2019",
        "category": "Asuminen",
        "counterparty_account_id": "212",
        "iban_receiver": "0",
        "paymentdate": "17/12/2019",
        "reference": "0",
        "saldo": "29566.34",
        "taplajikd": "129",
        "tstamp": "2019-12-17 23:18:16",
        "valuedate": "17/12/2019",
        "vientiselitekd": "706"
    },
    {
        "accountno": "3",
        "amount": "-60.92",
        "bic_receiver": "OKOYFIHH",
        "bookdate": "30/12/2019",
        "category": "Asuminen",
        "counterparty_account_id": "212",
        "iban_receiver": "0",
        "paymentdate": "30/12/2019",
        "reference": "0",
        "saldo": "27403.42",
        "taplajikd": "129",
        "tstamp": "2019-12-30 15:39:08",
        "valuedate": "30/12/2019",
        "vientiselitekd": "706"
    },
    {
        "accountno": "3",
        "amount": "-160.85",
        "bic_receiver": "OKOYFIHH",
        "bookdate": "21/01/2020",
        "category": "Asuminen",
        "counterparty_account_id": "10",
        "iban_receiver": "0",
        "paymentdate": "21/01/2020",
        "reference": "0",
        "saldo": "28029.79",
        "taplajikd": "106",
        "tstamp": "2020-01-21 16:00:00",
        "valuedate": "21/01/2020",
        "vientiselitekd": "0"
    },
    {
        "accountno": "3",
        "amount": "-30.46",
        "bic_receiver": "OKOYFIHH",
        "bookdate": "24/01/2020",
        "category": "Asuminen",
        "counterparty_account_id": "214",
        "iban_receiver": "0",
        "paymentdate": "24/01/2020",
        "reference": "0",
        "saldo": "27999.33",
        "taplajikd": "129",
        "tstamp": "2020-01-24 2:21:11",
        "valuedate": "24/01/2020",
        "vientiselitekd": "706"
    },
    {
        "accountno": "3",
        "amount": "-236.25",
        "bic_receiver": "OKOYFIHH",
        "bookdate": "14/02/2020",
        "category": "Asuminen",
        "counterparty_account_id": "16",
        "iban_receiver": "0",
        "paymentdate": "14/02/2020",
        "reference": "0",
        "saldo": "27504.13",
        "taplajikd": "106",
        "tstamp": "2020-02-14 6:10:17",
        "valuedate": "14/02/2020",
        "vientiselitekd": "0"
    },
    {
        "accountno": "3",
        "amount": "-30.42",
        "bic_receiver": "DABAFIHH",
        "bookdate": "24/02/2020",
        "category": "Asuminen",
        "counterparty_account_id": "212",
        "iban_receiver": "0",
        "paymentdate": "24/02/2020",
        "reference": "0",
        "saldo": "27299.49",
        "taplajikd": "129",
        "tstamp": "2020-02-24 4:48:00",
        "valuedate": "24/02/2020",
        "vientiselitekd": "706"
    },
    {
        "accountno": "3",
        "amount": "-61.11",
        "bic_receiver": "OKOYFIHH",
        "bookdate": "16/03/2020",
        "category": "Asuminen",
        "counterparty_account_id": "211",
        "iban_receiver": "0",
        "paymentdate": "16/03/2020",
        "reference": "0",
        "saldo": "30237.89",
        "taplajikd": "129",
        "tstamp": "2020-03-16 12:48:00",
        "valuedate": "16/03/2020",
        "vientiselitekd": "706"
    },
    {
        "accountno": "3",
        "amount": "-134.61",
        "bic_receiver": "",
        "bookdate": "29/05/2020",
        "category": "Asuminen",
        "counterparty_account_id": "133",
        "iban_receiver": "1",
        "paymentdate": "29/05/2020",
        "reference": "1",
        "saldo": "26720.23",
        "taplajikd": "162",
        "tstamp": "2020-05-29 2:26:56",
        "valuedate": "29/05/2020",
        "vientiselitekd": "0"
    },
    {
        "accountno": "3",
        "amount": "-23.75",
        "bic_receiver": "OKOYFIHH",
        "bookdate": "02/06/2020",
        "category": "Asuminen",
        "counterparty_account_id": "26",
        "iban_receiver": "0",
        "paymentdate": "02/06/2020",
        "reference": "0",
        "saldo": "26108.82",
        "taplajikd": "106",
        "tstamp": "2020-06-02 13:41:47",
        "valuedate": "02/06/2020",
        "vientiselitekd": "0"
    },
    {
        "accountno": "3",
        "amount": "-23.55",
        "bic_receiver": "",
        "bookdate": "09/06/2020",
        "category": "Asuminen",
        "counterparty_account_id": "85",
        "iban_receiver": "1",
        "paymentdate": "09/06/2020",
        "reference": "1",
        "saldo": "25034.16",
        "taplajikd": "162",
        "tstamp": "2020-06-09 11:33:37",
        "valuedate": "09/06/2020",
        "vientiselitekd": "0"
    },
    {
        "accountno": "3",
        "amount": "-88.46",
        "bic_receiver": "",
        "bookdate": "18/06/2020",
        "category": "Asuminen",
        "counterparty_account_id": "120",
        "iban_receiver": "1",
        "paymentdate": "18/06/2020",
        "reference": "1",
        "saldo": "23672.04",
        "taplajikd": "162",
        "tstamp": "2020-06-18 6:39:35",
        "valuedate": "18/06/2020",
        "vientiselitekd": "0"
    },
    {
        "accountno": "3",
        "amount": "-24.06",
        "bic_receiver": "",
        "bookdate": "19/06/2020",
        "category": "Asuminen",
        "counterparty_account_id": "161",
        "iban_receiver": "1",
        "paymentdate": "19/06/2020",
        "reference": "1",
        "saldo": "23476.69",
        "taplajikd": "162",
        "tstamp": "2020-06-19 5:16:39",
        "valuedate": "19/06/2020",
        "vientiselitekd": "0"
    },
    {
        "accountno": "3",
        "amount": "-45.18",
        "bic_receiver": "",
        "bookdate": "23/06/2020",
        "category": "Asuminen",
        "counterparty_account_id": "68",
        "iban_receiver": "1",
        "paymentdate": "23/06/2020",
        "reference": "1",
        "saldo": "22444.65",
        "taplajikd": "162",
        "tstamp": "2020-06-23 14:49:38",
        "valuedate": "23/06/2020",
        "vientiselitekd": "0"
    },
    {
        "accountno": "3",
        "amount": "-185.11",
        "bic_receiver": "",
        "bookdate": "26/06/2020",
        "category": "Asuminen",
        "counterparty_account_id": "124",
        "iban_receiver": "1",
        "paymentdate": "26/06/2020",
        "reference": "1",
        "saldo": "21722.44",
        "taplajikd": "162",
        "tstamp": "2020-06-26 9:17:54",
        "valuedate": "26/06/2020",
        "vientiselitekd": "0"
    },
    {
        "accountno": "3",
        "amount": "-7.96",
        "bic_receiver": "",
        "bookdate": "01/07/2020",
        "category": "Asuminen",
        "counterparty_account_id": "82",
        "iban_receiver": "1",
        "paymentdate": "01/07/2020",
        "reference": "1",
        "saldo": "21231.02",
        "taplajikd": "162",
        "tstamp": "2020-07-01 23:52:18",
        "valuedate": "01/07/2020",
        "vientiselitekd": "0"
    },
    {
        "accountno": "3",
        "amount": "-35.93",
        "bic_receiver": "",
        "bookdate": "17/07/2020",
        "category": "Asuminen",
        "counterparty_account_id": "142",
        "iban_receiver": "1",
        "paymentdate": "17/07/2020",
        "reference": "1",
        "saldo": "20497.47",
        "taplajikd": "162",
        "tstamp": "2020-07-17 13:59:21",
        "valuedate": "13/07/2020",
        "vientiselitekd": "0"
    },
    {
        "accountno": "3",
        "amount": "-63.11",
        "bic_receiver": "OKOYFIHH",
        "bookdate": "23/08/2020",
        "category": "Asuminen",
        "counterparty_account_id": "40",
        "iban_receiver": "0",
        "paymentdate": "23/08/2020",
        "reference": "0",
        "saldo": "35834.5",
        "taplajikd": "129",
        "tstamp": "2020-08-23 15:04:11",
        "valuedate": "23/08/2020",
        "vientiselitekd": "0"
    },
    {
        "accountno": "3",
        "amount": "-240.58",
        "bic_receiver": "OKOYFIHH",
        "bookdate": "08/09/2020",
        "category": "Asuminen",
        "counterparty_account_id": "216",
        "iban_receiver": "0",
        "paymentdate": "08/09/2020",
        "reference": "0",
        "saldo": "44490.91",
        "taplajikd": "129",
        "tstamp": "2020-09-08 18:13:08",
        "valuedate": "08/09/2020",
        "vientiselitekd": "706"
    },
    {
        "accountno": "3",
        "amount": "-19.61",
        "bic_receiver": "DABAFIHH",
        "bookdate": "10/09/2020",
        "category": "Asuminen",
        "counterparty_account_id": "214",
        "iban_receiver": "0",
        "paymentdate": "10/09/2020",
        "reference": "0",
        "saldo": "45828.96",
        "taplajikd": "129",
        "tstamp": "2020-09-10 22:46:25",
        "valuedate": "10/09/2020",
        "vientiselitekd": "706"
    },
    {
        "accountno": "3",
        "amount": "-62.81",
        "bic_receiver": "",
        "bookdate": "18/09/2020",
        "category": "Asuminen",
        "counterparty_account_id": "165",
        "iban_receiver": "1",
        "paymentdate": "18/09/2020",
        "reference": "1",
        "saldo": "43993.4",
        "taplajikd": "162",
        "tstamp": "2020-09-18 12:26:17",
        "valuedate": "18/09/2020",
        "vientiselitekd": "0"
    },
    {
        "accountno": "3",
        "amount": "-25.02",
        "bic_receiver": "",
        "bookdate": "05/10/2020",
        "category": "Asuminen",
        "counterparty_account_id": "44",
        "iban_receiver": "1",
        "paymentdate": "05/10/2020",
        "reference": "1",
        "saldo": "12916.69",
        "taplajikd": "162",
        "tstamp": "2020-10-05 15:31:46",
        "valuedate": "05/10/2020",
        "vientiselitekd": "0"
    },
    {
        "accountno": "3",
        "amount": "-49.22",
        "bic_receiver": "OKOYFIHH",
        "bookdate": "08/10/2020",
        "category": "Asuminen",
        "counterparty_account_id": "213",
        "iban_receiver": "0",
        "paymentdate": "08/10/2020",
        "reference": "0",
        "saldo": "12689.92",
        "taplajikd": "129",
        "tstamp": "2020-10-08 7:41:11",
        "valuedate": "08/10/2020",
        "vientiselitekd": "706"
    },
    {
        "accountno": "3",
        "amount": "-135.17",
        "bic_receiver": "",
        "bookdate": "09/10/2020",
        "category": "Asuminen",
        "counterparty_account_id": "145",
        "iban_receiver": "1",
        "paymentdate": "09/10/2020",
        "reference": "1",
        "saldo": "12554.75",
        "taplajikd": "162",
        "tstamp": "2020-10-09 2:30:35",
        "valuedate": "09/10/2020",
        "vientiselitekd": "0"
    },
    {
        "accountno": "3",
        "amount": "-21.72",
        "bic_receiver": "",
        "bookdate": "23/10/2020",
        "category": "Asuminen",
        "counterparty_account_id": "111",
        "iban_receiver": "1",
        "paymentdate": "23/10/2020",
        "reference": "1",
        "saldo": "17135.47",
        "taplajikd": "162",
        "tstamp": "2020-10-23 6:54:07",
        "valuedate": "23/10/2020",
        "vientiselitekd": "0"
    },
    {
        "accountno": "3",
        "amount": "-17.35",
        "bic_receiver": "OKOYFIHH",
        "bookdate": "28/10/2020",
        "category": "Asuminen",
        "counterparty_account_id": "212",
        "iban_receiver": "0",
        "paymentdate": "28/10/2020",
        "reference": "0",
        "saldo": "16103.62",
        "taplajikd": "129",
        "tstamp": "2020-10-28 3:36:28",
        "valuedate": "28/10/2020",
        "vientiselitekd": "706"
    },
    {
        "accountno": "3",
        "amount": "-716.94",
        "bic_receiver": "",
        "bookdate": "03/11/2020",
        "category": "Asuminen",
        "counterparty_account_id": "121",
        "iban_receiver": "1",
        "paymentdate": "03/11/2020",
        "reference": "1",
        "saldo": "21169.6",
        "taplajikd": "162",
        "tstamp": "2020-11-03 14:57:03",
        "valuedate": "03/11/2020",
        "vientiselitekd": "0"
    },
    {
        "accountno": "3",
        "amount": "-64.87",
        "bic_receiver": "",
        "bookdate": "03/11/2020",
        "category": "Asuminen",
        "counterparty_account_id": "94",
        "iban_receiver": "1",
        "paymentdate": "03/11/2020",
        "reference": "1",
        "saldo": "21104.73",
        "taplajikd": "162",
        "tstamp": "2020-11-03 22:49:11",
        "valuedate": "03/11/2020",
        "vientiselitekd": "0"
    },
    {
        "accountno": "3",
        "amount": "-52.65",
        "bic_receiver": "",
        "bookdate": "12/11/2020",
        "category": "Asuminen",
        "counterparty_account_id": "101",
        "iban_receiver": "1",
        "paymentdate": "12/11/2020",
        "reference": "1",
        "saldo": "22054.98",
        "taplajikd": "162",
        "tstamp": "2020-11-12 19:16:43",
        "valuedate": "12/11/2020",
        "vientiselitekd": "0"
    },
    {
        "accountno": "3",
        "amount": "-72.71",
        "bic_receiver": "",
        "bookdate": "13/11/2020",
        "category": "Asuminen",
        "counterparty_account_id": "44",
        "iban_receiver": "1",
        "paymentdate": "13/11/2020",
        "reference": "1",
        "saldo": "21982.27",
        "taplajikd": "162",
        "tstamp": "2020-11-13 2:45:15",
        "valuedate": "13/11/2020",
        "vientiselitekd": "0"
    },
    {
        "accountno": "3",
        "amount": "-170.57",
        "bic_receiver": "",
        "bookdate": "16/11/2020",
        "category": "Asuminen",
        "counterparty_account_id": "124",
        "iban_receiver": "1",
        "paymentdate": "16/11/2020",
        "reference": "1",
        "saldo": "25448.31",
        "taplajikd": "162",
        "tstamp": "2020-11-16 9:26:33",
        "valuedate": "16/11/2020",
        "vientiselitekd": "0"
    },
    {
        "accountno": "3",
        "amount": "-33.33",
        "bic_receiver": "",
        "bookdate": "20/11/2020",
        "category": "Asuminen",
        "counterparty_account_id": "100",
        "iban_receiver": "1",
        "paymentdate": "20/11/2020",
        "reference": "1",
        "saldo": "25029.01",
        "taplajikd": "162",
        "tstamp": "2020-11-21 0:00:00",
        "valuedate": "20/11/2020",
        "vientiselitekd": "0"
    },
    {
        "accountno": "3",
        "amount": "-29.85",
        "bic_receiver": "",
        "bookdate": "26/11/2020",
        "category": "Asuminen",
        "counterparty_account_id": "124",
        "iban_receiver": "1",
        "paymentdate": "26/11/2020",
        "reference": "1",
        "saldo": "23801.08",
        "taplajikd": "162",
        "tstamp": "2020-11-26 20:51:09",
        "valuedate": "26/11/2020",
        "vientiselitekd": "0"
    },
    {
        "accountno": "3",
        "amount": "-157.77",
        "bic_receiver": "",
        "bookdate": "27/11/2020",
        "category": "Asuminen",
        "counterparty_account_id": "43",
        "iban_receiver": "1",
        "paymentdate": "27/11/2020",
        "reference": "1",
        "saldo": "23629.84",
        "taplajikd": "162",
        "tstamp": "2020-11-27 5:06:53",
        "valuedate": "27/11/2020",
        "vientiselitekd": "0"
    },
    {
        "accountno": "3",
        "amount": "-34.43",
        "bic_receiver": "OKOYFIHH",
        "bookdate": "01/12/2020",
        "category": "Asuminen",
        "counterparty_account_id": "211",
        "iban_receiver": "0",
        "paymentdate": "01/12/2020",
        "reference": "0",
        "saldo": "22367.36",
        "taplajikd": "129",
        "tstamp": "2020-12-01 9:14:32",
        "valuedate": "01/12/2020",
        "vientiselitekd": "706"
    },
    {
        "accountno": "3",
        "amount": "-79.01",
        "bic_receiver": "NDEAFIHH",
        "bookdate": "15/12/2020",
        "category": "Asuminen",
        "counterparty_account_id": "211",
        "iban_receiver": "0",
        "paymentdate": "15/12/2020",
        "reference": "0",
        "saldo": "23943.2",
        "taplajikd": "129",
        "tstamp": "2020-12-15 5:57:46",
        "valuedate": "15/12/2020",
        "vientiselitekd": "706"
    },
    {
        "accountno": "3",
        "amount": "-10.59",
        "bic_receiver": "OKOYFIHH",
        "bookdate": "17/12/2020",
        "category": "Asuminen",
        "counterparty_account_id": "215",
        "iban_receiver": "0",
        "paymentdate": "17/12/2020",
        "reference": "0",
        "saldo": "23770.47",
        "taplajikd": "129",
        "tstamp": "2020-12-17 22:39:30",
        "valuedate": "17/12/2020",
        "vientiselitekd": "706"
    },
    {
        "accountno": "3",
        "amount": "-192.57",
        "bic_receiver": "",
        "bookdate": "28/12/2020",
        "category": "Asuminen",
        "counterparty_account_id": "132",
        "iban_receiver": "1",
        "paymentdate": "28/12/2020",
        "reference": "1",
        "saldo": "22812.98",
        "taplajikd": "162",
        "tstamp": "2020-12-28 13:42:51",
        "valuedate": "28/12/2020",
        "vientiselitekd": "0"
    },
    {
        "accountno": "3",
        "amount": "-37.92",
        "bic_receiver": "OKOYFIHH",
        "bookdate": "28/12/2020",
        "category": "Asuminen",
        "counterparty_account_id": "211",
        "iban_receiver": "0",
        "paymentdate": "28/12/2020",
        "reference": "0",
        "saldo": "22753.43",
        "taplajikd": "129",
        "tstamp": "2020-12-28 19:13:47",
        "valuedate": "28/12/2020",
        "vientiselitekd": "706"
    },
    {
        "accountno": "accountno",
        "amount": "amount",
        "bic_receiver": "bic_receiver",
        "bookdate": "bookdate",
        "category": "category",
        "counterparty_account_id": "counterparty_account_id",
        "iban_receiver": "iban_receiver",
        "paymentdate": "paymentdate",
        "reference": "reference",
        "saldo": "saldo",
        "taplajikd": "taplajikd",
        "tstamp": "tstamp",
        "valuedate": "valuedate",
        "vientiselitekd": "vientiselitekd"
    },
    {
        "accountno": "1",
        "amount": "-16.86",
        "bic_receiver": "OKOYFIHH",
        "bookdate": "24/01/2019",
        "category": "Harrastukset",
        "counterparty_account_id": "19",
        "iban_receiver": "0",
        "paymentdate": "24/01/2019",
        "reference": "0",
        "saldo": "-294.64",
        "taplajikd": "106",
        "tstamp": "2019-01-24 4:15:42",
        "valuedate": "24/01/2019",
        "vientiselitekd": "0"
    },
    {
        "accountno": "1",
        "amount": "-5.18",
        "bic_receiver": "",
        "bookdate": "29/04/2019",
        "category": "Harrastukset",
        "counterparty_account_id": "166",
        "iban_receiver": "1",
        "paymentdate": "29/04/2019",
        "reference": "1",
        "saldo": "321.56",
        "taplajikd": "162",
        "tstamp": "2019-04-29 9:05:15",
        "valuedate": "29/04/2019",
        "vientiselitekd": "0"
    },
    {
        "accountno": "1",
        "amount": "-2.62",
        "bic_receiver": "",
        "bookdate": "08/08/2019",
        "category": "Harrastukset",
        "counterparty_account_id": "34",
        "iban_receiver": "1",
        "paymentdate": "06/08/2019",
        "reference": "1",
        "saldo": "394.08",
        "taplajikd": "162",
        "tstamp": "2019-08-08 18:56:51",
        "valuedate": "08/08/2019",
        "vientiselitekd": "0"
    },
    {
        "accountno": "1",
        "amount": "-3.17",
        "bic_receiver": "",
        "bookdate": "07/10/2019",
        "category": "Harrastukset",
        "counterparty_account_id": "56",
        "iban_receiver": "1",
        "paymentdate": "07/10/2019",
        "reference": "1",
        "saldo": "-48.49",
        "taplajikd": "162",
        "tstamp": "2019-10-07 16:14:46",
        "valuedate": "07/10/2019",
        "vientiselitekd": "0"
    },
    {
        "accountno": "1",
        "amount": "-44.26",
        "bic_receiver": "DABAFIHH",
        "bookdate": "07/11/2019",
        "category": "Harrastukset",
        "counterparty_account_id": "9",
        "iban_receiver": "0",
        "paymentdate": "07/11/2019",
        "reference": "0",
        "saldo": "-598.97",
        "taplajikd": "106",
        "tstamp": "2019-11-07 6:09:54",
        "valuedate": "07/11/2019",
        "vientiselitekd": "0"
    },
    {
        "accountno": "1",
        "amount": "-17.02",
        "bic_receiver": "",
        "bookdate": "27/03/2020",
        "category": "Harrastukset",
        "counterparty_account_id": "100",
        "iban_receiver": "1",
        "paymentdate": "27/03/2020",
        "reference": "1",
        "saldo": "105.6",
        "taplajikd": "162",
        "tstamp": "2020-03-27 13:42:51",
        "valuedate": "27/03/2020",
        "vientiselitekd": "0"
    },
    {
        "accountno": "1",
        "amount": "-16.54",
        "bic_receiver": "NDEAFIHH",
        "bookdate": "25/09/2020",
        "category": "Harrastukset",
        "counterparty_account_id": "199",
        "iban_receiver": "0",
        "paymentdate": "25/09/2020",
        "reference": "0",
        "saldo": "-87.86",
        "taplajikd": "129",
        "tstamp": "2020-09-25 18:27:42",
        "valuedate": "25/09/2020",
        "vientiselitekd": "706"
    },
    {
        "accountno": "1",
        "amount": "-5.81",
        "bic_receiver": "",
        "bookdate": "09/11/2020",
        "category": "Harrastukset",
        "counterparty_account_id": "159",
        "iban_receiver": "1",
        "paymentdate": "09/11/2020",
        "reference": "1",
        "saldo": "-176.58",
        "taplajikd": "162",
        "tstamp": "2020-11-09 10:42:39",
        "valuedate": "09/11/2020",
        "vientiselitekd": "0"
    },
    {
        "accountno": "2",
        "amount": "-58.89",
        "bic_receiver": "OKOYFIHH",
        "bookdate": "20/05/2019",
        "category": "Harrastukset",
        "counterparty_account_id": "186",
        "iban_receiver": "0",
        "paymentdate": "20/05/2019",
        "reference": "0",
        "saldo": "1308.93",
        "taplajikd": "106",
        "tstamp": "2019-05-20 5:52:39",
        "valuedate": "20/05/2019",
        "vientiselitekd": "706"
    },
    {
        "accountno": "2",
        "amount": "-14.51",
        "bic_receiver": "",
        "bookdate": "27/05/2019",
        "category": "Harrastukset",
        "counterparty_account_id": "87",
        "iban_receiver": "1",
        "paymentdate": "27/05/2019",
        "reference": "1",
        "saldo": "1147.35",
        "taplajikd": "162",
        "tstamp": "2019-05-27 13:42:51",
        "valuedate": "27/05/2019",
        "vientiselitekd": "0"
    },
    {
        "accountno": "2",
        "amount": "-39.46",
        "bic_receiver": "",
        "bookdate": "29/08/2019",
        "category": "Harrastukset",
        "counterparty_account_id": "47",
        "iban_receiver": "1",
        "paymentdate": "29/08/2019",
        "reference": "1",
        "saldo": "3745.51",
        "taplajikd": "162",
        "tstamp": "2019-08-29 1:04:52",
        "valuedate": "29/08/2019",
        "vientiselitekd": "0"
    },
    {
        "accountno": "2",
        "amount": "-3.37",
        "bic_receiver": "",
        "bookdate": "27/11/2019",
        "category": "Harrastukset",
        "counterparty_account_id": "105",
        "iban_receiver": "1",
        "paymentdate": "27/11/2019",
        "reference": "1",
        "saldo": "264.49",
        "taplajikd": "162",
        "tstamp": "2019-11-27 20:34:17",
        "valuedate": "27/11/2019",
        "vientiselitekd": "0"
    },
    {
        "accountno": "2",
        "amount": "-53.15",
        "bic_receiver": "OKOYFIHH",
        "bookdate": "02/01/2020",
        "category": "Harrastukset",
        "counterparty_account_id": "199",
        "iban_receiver": "0",
        "paymentdate": "02/01/2020",
        "reference": "0",
        "saldo": "1507.65",
        "taplajikd": "129",
        "tstamp": "2020-01-02 0:35:42",
        "valuedate": "02/01/2020",
        "vientiselitekd": "706"
    },
    {
        "accountno": "2",
        "amount": "-93.14",
        "bic_receiver": "OKOYFIHH",
        "bookdate": "15/01/2020",
        "category": "Harrastukset",
        "counterparty_account_id": "200",
        "iban_receiver": "0",
        "paymentdate": "15/01/2020",
        "reference": "0",
        "saldo": "-257.06",
        "taplajikd": "129",
        "tstamp": "2020-01-15 7:44:08",
        "valuedate": "15/01/2020",
        "vientiselitekd": "706"
    },
    {
        "accountno": "2",
        "amount": "-116.26",
        "bic_receiver": "OKOYFIHH",
        "bookdate": "19/01/2020",
        "category": "Harrastukset",
        "counterparty_account_id": "20",
        "iban_receiver": "0",
        "paymentdate": "19/01/2020",
        "reference": "0",
        "saldo": "158.62",
        "taplajikd": "106",
        "tstamp": "2020-01-19 22:24:48",
        "valuedate": "19/01/2020",
        "vientiselitekd": "0"
    },
    {
        "accountno": "2",
        "amount": "-21.22",
        "bic_receiver": "",
        "bookdate": "23/03/2020",
        "category": "Harrastukset",
        "counterparty_account_id": "45",
        "iban_receiver": "1",
        "paymentdate": "23/03/2020",
        "reference": "1",
        "saldo": "-10.32",
        "taplajikd": "162",
        "tstamp": "2020-03-23 21:10:35",
        "valuedate": "23/03/2020",
        "vientiselitekd": "0"
    },
    {
        "accountno": "2",
        "amount": "-6.97",
        "bic_receiver": "DABAFIHH",
        "bookdate": "15/04/2020",
        "category": "Harrastukset",
        "counterparty_account_id": "194",
        "iban_receiver": "0",
        "paymentdate": "14/04/2020",
        "reference": "0",
        "saldo": "-73.16",
        "taplajikd": "106",
        "tstamp": "2020-04-14 16:06:05",
        "valuedate": "14/04/2020",
        "vientiselitekd": "706"
    },
    {
        "accountno": "2",
        "amount": "-87.82",
        "bic_receiver": "OKOYFIHH",
        "bookdate": "25/05/2020",
        "category": "Harrastukset",
        "counterparty_account_id": "203",
        "iban_receiver": "0",
        "paymentdate": "25/05/2020",
        "reference": "0",
        "saldo": "-1355.46",
        "taplajikd": "129",
        "tstamp": "2020-05-25 13:51:33",
        "valuedate": "25/05/2020",
        "vientiselitekd": "706"
    },
    {
        "accountno": "2",
        "amount": "-16.46",
        "bic_receiver": "",
        "bookdate": "08/06/2020",
        "category": "Harrastukset",
        "counterparty_account_id": "78",
        "iban_receiver": "1",
        "paymentdate": "08/06/2020",
        "reference": "1",
        "saldo": "1333.59",
        "taplajikd": "162",
        "tstamp": "2020-06-08 12:08:40",
        "valuedate": "08/06/2020",
        "vientiselitekd": "0"
    },
    {
        "accountno": "2",
        "amount": "-143.48",
        "bic_receiver": "ESSEFIHX",
        "bookdate": "29/06/2020",
        "category": "Harrastukset",
        "counterparty_account_id": "196",
        "iban_receiver": "0",
        "paymentdate": "29/06/2020",
        "reference": "0",
        "saldo": "419.89",
        "taplajikd": "129",
        "tstamp": "2020-06-29 21:58:33",
        "valuedate": "29/06/2020",
        "vientiselitekd": "706"
    },
    {
        "accountno": "2",
        "amount": "-34.73",
        "bic_receiver": "",
        "bookdate": "13/07/2020",
        "category": "Harrastukset",
        "counterparty_account_id": "57",
        "iban_receiver": "1",
        "paymentdate": "13/07/2020",
        "reference": "1",
        "saldo": "296.36",
        "taplajikd": "162",
        "tstamp": "2020-07-13 11:33:20",
        "valuedate": "13/07/2020",
        "vientiselitekd": "0"
    },
    {
        "accountno": "2",
        "amount": "-16.53",
        "bic_receiver": "OKOYFIHH",
        "bookdate": "24/07/2020",
        "category": "Harrastukset",
        "counterparty_account_id": "23",
        "iban_receiver": "0",
        "paymentdate": "24/07/2020",
        "reference": "0",
        "saldo": "46.22",
        "taplajikd": "129",
        "tstamp": "2020-07-24 21:09:20",
        "valuedate": "24/07/2020",
        "vientiselitekd": "0"
    },
    {
        "accountno": "2",
        "amount": "-124.83",
        "bic_receiver": "",
        "bookdate": "15/12/2020",
        "category": "Harrastukset",
        "counterparty_account_id": "98",
        "iban_receiver": "1",
        "paymentdate": "14/12/2020",
        "reference": "1",
        "saldo": "6428.47",
        "taplajikd": "162",
        "tstamp": "2020-12-14 15:17:12",
        "valuedate": "14/12/2020",
        "vientiselitekd": "0"
    },
    {
        "accountno": "2",
        "amount": "-126.34",
        "bic_receiver": "OKOYFIHH",
        "bookdate": "18/12/2020",
        "category": "Harrastukset",
        "counterparty_account_id": "196",
        "iban_receiver": "0",
        "paymentdate": "18/12/2020",
        "reference": "0",
        "saldo": "4353.87",
        "taplajikd": "129",
        "tstamp": "2020-12-18 23:32:29",
        "valuedate": "18/12/2020",
        "vientiselitekd": "706"
    },
    {
        "accountno": "3",
        "amount": "-17.44",
        "bic_receiver": "DABAFIHH",
        "bookdate": "10/02/2020",
        "category": "Harrastukset",
        "counterparty_account_id": "212",
        "iban_receiver": "0",
        "paymentdate": "10/02/2020",
        "reference": "0",
        "saldo": "28252.3",
        "taplajikd": "129",
        "tstamp": "2020-02-10 6:51:26",
        "valuedate": "10/02/2020",
        "vientiselitekd": "706"
    },
    {
        "accountno": "3",
        "amount": "-344.9",
        "bic_receiver": "OKOYFIHH",
        "bookdate": "10/02/2020",
        "category": "Harrastukset",
        "counterparty_account_id": "205",
        "iban_receiver": "0",
        "paymentdate": "10/02/2020",
        "reference": "0",
        "saldo": "27907.4",
        "taplajikd": "106",
        "tstamp": "2020-02-10 22:37:43",
        "valuedate": "10/02/2020",
        "vientiselitekd": "706"
    },
    {
        "accountno": "3",
        "amount": "-31.24",
        "bic_receiver": "",
        "bookdate": "15/06/2020",
        "category": "Harrastukset",
        "counterparty_account_id": "86",
        "iban_receiver": "1",
        "paymentdate": "15/06/2020",
        "reference": "1",
        "saldo": "24154.26",
        "taplajikd": "162",
        "tstamp": "2020-06-15 6:01:53",
        "valuedate": "15/06/2020",
        "vientiselitekd": "0"
    },
    {
        "accountno": "3",
        "amount": "-103.9",
        "bic_receiver": "",
        "bookdate": "18/06/2020",
        "category": "Harrastukset",
        "counterparty_account_id": "158",
        "iban_receiver": "1",
        "paymentdate": "18/06/2020",
        "reference": "1",
        "saldo": "23566.33",
        "taplajikd": "162",
        "tstamp": "2020-06-18 21:44:18",
        "valuedate": "18/06/2020",
        "vientiselitekd": "0"
    },
    {
        "accountno": "3",
        "amount": "-151.31",
        "bic_receiver": "OKOYFIHH",
        "bookdate": "12/08/2020",
        "category": "Harrastukset",
        "counterparty_account_id": "31",
        "iban_receiver": "0",
        "paymentdate": "12/08/2020",
        "reference": "0",
        "saldo": "24333.79",
        "taplajikd": "106",
        "tstamp": "2020-08-12 13:46:03",
        "valuedate": "12/08/2020",
        "vientiselitekd": "0"
    },
    {
        "accountno": "3",
        "amount": "-9.63",
        "bic_receiver": "",
        "bookdate": "29/09/2020",
        "category": "Harrastukset",
        "counterparty_account_id": "127",
        "iban_receiver": "1",
        "paymentdate": "29/09/2020",
        "reference": "1",
        "saldo": "43161.33",
        "taplajikd": "162",
        "tstamp": "2020-09-29 8:14:01",
        "valuedate": "29/09/2020",
        "vientiselitekd": "0"
    },
    {
        "accountno": "3",
        "amount": "-11.01",
        "bic_receiver": "",
        "bookdate": "23/10/2020",
        "category": "Harrastukset",
        "counterparty_account_id": "105",
        "iban_receiver": "1",
        "paymentdate": "23/10/2020",
        "reference": "1",
        "saldo": "17157.19",
        "taplajikd": "162",
        "tstamp": "2020-10-23 2:21:11",
        "valuedate": "23/10/2020",
        "vientiselitekd": "0"
    },
    {
        "accountno": "3",
        "amount": "-11.11",
        "bic_receiver": "",
        "bookdate": "09/11/2020",
        "category": "Harrastukset",
        "counterparty_account_id": "64",
        "iban_receiver": "1",
        "paymentdate": "09/11/2020",
        "reference": "1",
        "saldo": "21507.1",
        "taplajikd": "162",
        "tstamp": "2020-11-09 12:35:25",
        "valuedate": "09/11/2020",
        "vientiselitekd": "0"
    },
    {
        "accountno": "3",
        "amount": "-31.81",
        "bic_receiver": "OKOYFIHH",
        "bookdate": "10/12/2020",
        "category": "Harrastukset",
        "counterparty_account_id": "214",
        "iban_receiver": "0",
        "paymentdate": "10/12/2020",
        "reference": "0",
        "saldo": "24354.93",
        "taplajikd": "129",
        "tstamp": "2020-12-10 18:46:57",
        "valuedate": "10/12/2020",
        "vientiselitekd": "706"
    },
    {
        "accountno": "3",
        "amount": "-12.28",
        "bic_receiver": "OKOYFIHH",
        "bookdate": "29/12/2020",
        "category": "Harrastukset",
        "counterparty_account_id": "214",
        "iban_receiver": "0",
        "paymentdate": "29/12/2020",
        "reference": "0",
        "saldo": "22722.45",
        "taplajikd": "129",
        "tstamp": "2020-12-29 2:41:00",
        "valuedate": "29/12/2020",
        "vientiselitekd": "706"
    },
    {
        "accountno": "1",
        "amount": "-7.7",
        "bic_receiver": "NDEAFIHH",
        "bookdate": "05/04/2019",
        "category": "Hyvinvointi",
        "counterparty_account_id": "190",
        "iban_receiver": "0",
        "paymentdate": "05/04/2019",
        "reference": "0",
        "saldo": "-24.51",
        "taplajikd": "106",
        "tstamp": "2019-04-05 19:48:21",
        "valuedate": "05/04/2019",
        "vientiselitekd": "706"
    },
    {
        "accountno": "1",
        "amount": "-9.95",
        "bic_receiver": "",
        "bookdate": "15/04/2019",
        "category": "Hyvinvointi",
        "counterparty_account_id": "94",
        "iban_receiver": "1",
        "paymentdate": "15/04/2019",
        "reference": "1",
        "saldo": "-112.22",
        "taplajikd": "162",
        "tstamp": "2019-04-15 23:32:02",
        "valuedate": "15/04/2019",
        "vientiselitekd": "0"
    },
    {
        "accountno": "1",
        "amount": "-14.21",
        "bic_receiver": "",
        "bookdate": "11/06/2019",
        "category": "Hyvinvointi",
        "counterparty_account_id": "35",
        "iban_receiver": "1",
        "paymentdate": "11/06/2019",
        "reference": "1",
        "saldo": "-357.86",
        "taplajikd": "162",
        "tstamp": "2019-06-11 18:21:11",
        "valuedate": "11/06/2019",
        "vientiselitekd": "0"
    },
    {
        "accountno": "1",
        "amount": "-3.57",
        "bic_receiver": "",
        "bookdate": "18/06/2019",
        "category": "Hyvinvointi",
        "counterparty_account_id": "148",
        "iban_receiver": "1",
        "paymentdate": "18/06/2019",
        "reference": "1",
        "saldo": "-386.6",
        "taplajikd": "162",
        "tstamp": "2019-06-18 15:31:46",
        "valuedate": "18/06/2019",
        "vientiselitekd": "0"
    },
    {
        "accountno": "1",
        "amount": "-67.68",
        "bic_receiver": "OKOYFIHH",
        "bookdate": "15/07/2019",
        "category": "Hyvinvointi",
        "counterparty_account_id": "27",
        "iban_receiver": "0",
        "paymentdate": "15/07/2019",
        "reference": "0",
        "saldo": "-86.36",
        "taplajikd": "106",
        "tstamp": "2019-07-15 3:22:06",
        "valuedate": "15/07/2019",
        "vientiselitekd": "0"
    },
    {
        "accountno": "1",
        "amount": "-22.18",
        "bic_receiver": "",
        "bookdate": "04/11/2019",
        "category": "Hyvinvointi",
        "counterparty_account_id": "84",
        "iban_receiver": "1",
        "paymentdate": "04/11/2019",
        "reference": "1",
        "saldo": "-380.46",
        "taplajikd": "162",
        "tstamp": "2019-11-04 2:25:19",
        "valuedate": "04/11/2019",
        "vientiselitekd": "0"
    },
    {
        "accountno": "1",
        "amount": "-14.33",
        "bic_receiver": "DABAFIHH",
        "bookdate": "30/12/2019",
        "category": "Hyvinvointi",
        "counterparty_account_id": "32",
        "iban_receiver": "0",
        "paymentdate": "30/12/2019",
        "reference": "0",
        "saldo": "-239.62",
        "taplajikd": "106",
        "tstamp": "2019-12-30 2:04:27",
        "valuedate": "30/12/2019",
        "vientiselitekd": "0"
    },
    {
        "accountno": "1",
        "amount": "-16.86",
        "bic_receiver": "",
        "bookdate": "13/04/2020",
        "category": "Hyvinvointi",
        "counterparty_account_id": "101",
        "iban_receiver": "1",
        "paymentdate": "13/04/2020",
        "reference": "1",
        "saldo": "83.51",
        "taplajikd": "162",
        "tstamp": "2020-04-13 14:42:35",
        "valuedate": "13/04/2020",
        "vientiselitekd": "0"
    },
    {
        "accountno": "1",
        "amount": "-11.08",
        "bic_receiver": "",
        "bookdate": "11/05/2020",
        "category": "Hyvinvointi",
        "counterparty_account_id": "103",
        "iban_receiver": "1",
        "paymentdate": "11/05/2020",
        "reference": "1",
        "saldo": "-60.54",
        "taplajikd": "162",
        "tstamp": "2020-05-11 15:28:00",
        "valuedate": "11/05/2020",
        "vientiselitekd": "0"
    },
    {
        "accountno": "2",
        "amount": "-10.93",
        "bic_receiver": "",
        "bookdate": "28/05/2019",
        "category": "Hyvinvointi",
        "counterparty_account_id": "71",
        "iban_receiver": "1",
        "paymentdate": "28/05/2019",
        "reference": "1",
        "saldo": "1136.42",
        "taplajikd": "162",
        "tstamp": "2019-05-28 20:04:54",
        "valuedate": "28/05/2019",
        "vientiselitekd": "0"
    },
    {
        "accountno": "2",
        "amount": "-14.26",
        "bic_receiver": "",
        "bookdate": "17/07/2019",
        "category": "Hyvinvointi",
        "counterparty_account_id": "61",
        "iban_receiver": "1",
        "paymentdate": "17/07/2019",
        "reference": "1",
        "saldo": "3112.42",
        "taplajikd": "162",
        "tstamp": "2019-07-17 17:15:30",
        "valuedate": "17/07/2019",
        "vientiselitekd": "0"
    },
    {
        "accountno": "2",
        "amount": "-15.88",
        "bic_receiver": "",
        "bookdate": "24/10/2019",
        "category": "Hyvinvointi",
        "counterparty_account_id": "139",
        "iban_receiver": "1",
        "paymentdate": "24/10/2019",
        "reference": "1",
        "saldo": "3411.24",
        "taplajikd": "162",
        "tstamp": "2019-10-24 20:18:28",
        "valuedate": "24/10/2019",
        "vientiselitekd": "0"
    },
    {
        "accountno": "2",
        "amount": "-11.61",
        "bic_receiver": "OKOYFIHH",
        "bookdate": "22/11/2019",
        "category": "Hyvinvointi",
        "counterparty_account_id": "196",
        "iban_receiver": "0",
        "paymentdate": "22/11/2019",
        "reference": "0",
        "saldo": "39.71",
        "taplajikd": "129",
        "tstamp": "2019-11-22 6:51:26",
        "valuedate": "22/11/2019",
        "vientiselitekd": "706"
    },
    {
        "accountno": "2",
        "amount": "-3.08",
        "bic_receiver": "",
        "bookdate": "18/12/2019",
        "category": "Hyvinvointi",
        "counterparty_account_id": "54",
        "iban_receiver": "1",
        "paymentdate": "18/12/2019",
        "reference": "1",
        "saldo": "7915.04",
        "taplajikd": "162",
        "tstamp": "2019-12-18 9:22:46",
        "valuedate": "18/12/2019",
        "vientiselitekd": "0"
    },
    {
        "accountno": "2",
        "amount": "-70.6",
        "bic_receiver": "",
        "bookdate": "10/04/2020",
        "category": "Hyvinvointi",
        "counterparty_account_id": "73",
        "iban_receiver": "1",
        "paymentdate": "10/04/2020",
        "reference": "1",
        "saldo": "303.51",
        "taplajikd": "162",
        "tstamp": "2020-04-10 2:44:03",
        "valuedate": "10/04/2020",
        "vientiselitekd": "0"
    },
    {
        "accountno": "2",
        "amount": "-96.35",
        "bic_receiver": "DABAFIHH",
        "bookdate": "05/11/2020",
        "category": "Hyvinvointi",
        "counterparty_account_id": "2",
        "iban_receiver": "0",
        "paymentdate": "05/11/2020",
        "reference": "0",
        "saldo": "3934.7",
        "taplajikd": "106",
        "tstamp": "2020-11-05 8:43:38",
        "valuedate": "05/11/2020",
        "vientiselitekd": "0"
    },
    {
        "accountno": "2",
        "amount": "-50.5",
        "bic_receiver": "OKOYFIHH",
        "bookdate": "29/12/2020",
        "category": "Hyvinvointi",
        "counterparty_account_id": "1",
        "iban_receiver": "0",
        "paymentdate": "26/12/2020",
        "reference": "0",
        "saldo": "3514.66",
        "taplajikd": "106",
        "tstamp": "2020-12-26 2:08:24",
        "valuedate": "26/12/2020",
        "vientiselitekd": "0"
    },
    {
        "accountno": "3",
        "amount": "-46.31",
        "bic_receiver": "",
        "bookdate": "21/06/2019",
        "category": "Hyvinvointi",
        "counterparty_account_id": "45",
        "iban_receiver": "1",
        "paymentdate": "21/06/2019",
        "reference": "1",
        "saldo": "68680",
        "taplajikd": "162",
        "tstamp": "2019-06-21 12:24:50",
        "valuedate": "21/06/2019",
        "vientiselitekd": "0"
    },
    {
        "accountno": "3",
        "amount": "-20.8",
        "bic_receiver": "",
        "bookdate": "14/10/2019",
        "category": "Hyvinvointi",
        "counterparty_account_id": "157",
        "iban_receiver": "1",
        "paymentdate": "14/10/2019",
        "reference": "1",
        "saldo": "73018.71",
        "taplajikd": "162",
        "tstamp": "2019-10-14 21:07:12",
        "valuedate": "14/10/2019",
        "vientiselitekd": "0"
    },
    {
        "accountno": "3",
        "amount": "-128.01",
        "bic_receiver": "OKOYFIHH",
        "bookdate": "04/12/2019",
        "category": "Hyvinvointi",
        "counterparty_account_id": "208",
        "iban_receiver": "0",
        "paymentdate": "04/12/2019",
        "reference": "0",
        "saldo": "27425.96",
        "taplajikd": "106",
        "tstamp": "2019-12-04 14:15:39",
        "valuedate": "04/12/2019",
        "vientiselitekd": "706"
    },
    {
        "accountno": "3",
        "amount": "-150.74",
        "bic_receiver": "",
        "bookdate": "20/04/2020",
        "category": "Hyvinvointi",
        "counterparty_account_id": "77",
        "iban_receiver": "1",
        "paymentdate": "20/04/2020",
        "reference": "1",
        "saldo": "32541.78",
        "taplajikd": "162",
        "tstamp": "2020-04-20 3:20:56",
        "valuedate": "20/04/2020",
        "vientiselitekd": "0"
    },
    {
        "accountno": "3",
        "amount": "-6.25",
        "bic_receiver": "",
        "bookdate": "04/05/2020",
        "category": "Hyvinvointi",
        "counterparty_account_id": "152",
        "iban_receiver": "1",
        "paymentdate": "04/05/2020",
        "reference": "1",
        "saldo": "32516.31",
        "taplajikd": "162",
        "tstamp": "2020-05-04 19:06:07",
        "valuedate": "04/05/2020",
        "vientiselitekd": "0"
    },
    {
        "accountno": "3",
        "amount": "-21.72",
        "bic_receiver": "",
        "bookdate": "25/06/2020",
        "category": "Hyvinvointi",
        "counterparty_account_id": "45",
        "iban_receiver": "1",
        "paymentdate": "25/06/2020",
        "reference": "1",
        "saldo": "22173.19",
        "taplajikd": "162",
        "tstamp": "2020-06-25 12:03:46",
        "valuedate": "25/06/2020",
        "vientiselitekd": "0"
    },
    {
        "accountno": "3",
        "amount": "-14.31",
        "bic_receiver": "",
        "bookdate": "16/07/2020",
        "category": "Hyvinvointi",
        "counterparty_account_id": "86",
        "iban_receiver": "1",
        "paymentdate": "16/07/2020",
        "reference": "1",
        "saldo": "21889.92",
        "taplajikd": "162",
        "tstamp": "2020-07-16 5:54:13",
        "valuedate": "16/07/2020",
        "vientiselitekd": "0"
    },
    {
        "accountno": "1",
        "amount": "-21.03",
        "bic_receiver": "NDEAFIHH",
        "bookdate": "30/01/2019",
        "category": "Hyvinvointijakauneus",
        "counterparty_account_id": "189",
        "iban_receiver": "0",
        "paymentdate": "30/01/2019",
        "reference": "0",
        "saldo": "-529.87",
        "taplajikd": "106",
        "tstamp": "2019-01-30 9:25:14",
        "valuedate": "30/01/2019",
        "vientiselitekd": "706"
    },
    {
        "accountno": "1",
        "amount": "-18.73",
        "bic_receiver": "",
        "bookdate": "21/02/2019",
        "category": "Hyvinvointijakauneus",
        "counterparty_account_id": "124",
        "iban_receiver": "1",
        "paymentdate": "21/02/2019",
        "reference": "1",
        "saldo": "-409.16",
        "taplajikd": "162",
        "tstamp": "2019-02-21 10:17:09",
        "valuedate": "21/02/2019",
        "vientiselitekd": "0"
    },
    {
        "accountno": "1",
        "amount": "-9.21",
        "bic_receiver": "",
        "bookdate": "27/02/2019",
        "category": "Hyvinvointijakauneus",
        "counterparty_account_id": "80",
        "iban_receiver": "1",
        "paymentdate": "27/02/2019",
        "reference": "1",
        "saldo": "-459.62",
        "taplajikd": "162",
        "tstamp": "2019-02-27 6:51:26",
        "valuedate": "27/02/2019",
        "vientiselitekd": "0"
    },
    {
        "accountno": "1",
        "amount": "-4.02",
        "bic_receiver": "",
        "bookdate": "21/03/2019",
        "category": "Hyvinvointijakauneus",
        "counterparty_account_id": "41",
        "iban_receiver": "1",
        "paymentdate": "21/03/2019",
        "reference": "1",
        "saldo": "-61.97",
        "taplajikd": "162",
        "tstamp": "2019-03-21 16:00:00",
        "valuedate": "21/03/2019",
        "vientiselitekd": "0"
    },
    {
        "accountno": "1",
        "amount": "-9.33",
        "bic_receiver": "OKOYFIHH",
        "bookdate": "07/05/2019",
        "category": "Hyvinvointijakauneus",
        "counterparty_account_id": "189",
        "iban_receiver": "0",
        "paymentdate": "07/05/2019",
        "reference": "0",
        "saldo": "-78.64",
        "taplajikd": "106",
        "tstamp": "2019-05-07 1:31:08",
        "valuedate": "07/05/2019",
        "vientiselitekd": "706"
    },
    {
        "accountno": "1",
        "amount": "-16.21",
        "bic_receiver": "DABAFIHH",
        "bookdate": "14/06/2019",
        "category": "Hyvinvointijakauneus",
        "counterparty_account_id": "191",
        "iban_receiver": "0",
        "paymentdate": "14/06/2019",
        "reference": "0",
        "saldo": "-374.07",
        "taplajikd": "106",
        "tstamp": "2019-06-14 2:49:25",
        "valuedate": "14/06/2019",
        "vientiselitekd": "706"
    },
    {
        "accountno": "1",
        "amount": "-26.36",
        "bic_receiver": "",
        "bookdate": "09/09/2019",
        "category": "Hyvinvointijakauneus",
        "counterparty_account_id": "111",
        "iban_receiver": "1",
        "paymentdate": "09/09/2019",
        "reference": "1",
        "saldo": "198.29",
        "taplajikd": "162",
        "tstamp": "2019-09-09 7:36:35",
        "valuedate": "09/09/2019",
        "vientiselitekd": "0"
    },
    {
        "accountno": "1",
        "amount": "-15.94",
        "bic_receiver": "OKOYFIHH",
        "bookdate": "22/11/2019",
        "category": "Hyvinvointijakauneus",
        "counterparty_account_id": "25",
        "iban_receiver": "0",
        "paymentdate": "22/11/2019",
        "reference": "0",
        "saldo": "-238.7",
        "taplajikd": "106",
        "tstamp": "2019-11-22 0:26:25",
        "valuedate": "22/11/2019",
        "vientiselitekd": "0"
    },
    {
        "accountno": "1",
        "amount": "-5.76",
        "bic_receiver": "",
        "bookdate": "25/11/2019",
        "category": "Hyvinvointijakauneus",
        "counterparty_account_id": "143",
        "iban_receiver": "1",
        "paymentdate": "21/11/2019",
        "reference": "1",
        "saldo": "-349.62",
        "taplajikd": "162",
        "tstamp": "2019-11-25 5:17:04",
        "valuedate": "25/11/2019",
        "vientiselitekd": "0"
    },
    {
        "accountno": "1",
        "amount": "-5.12",
        "bic_receiver": "OKOYFIHH",
        "bookdate": "15/12/2019",
        "category": "Hyvinvointijakauneus",
        "counterparty_account_id": "31",
        "iban_receiver": "0",
        "paymentdate": "15/12/2019",
        "reference": "0",
        "saldo": "-906.19",
        "taplajikd": "106",
        "tstamp": "2019-12-15 18:40:00",
        "valuedate": "15/12/2019",
        "vientiselitekd": "0"
    },
    {
        "accountno": "1",
        "amount": "-15.87",
        "bic_receiver": "OKOYFIHH",
        "bookdate": "30/12/2019",
        "category": "Hyvinvointijakauneus",
        "counterparty_account_id": "31",
        "iban_receiver": "0",
        "paymentdate": "30/12/2019",
        "reference": "0",
        "saldo": "118.78",
        "taplajikd": "106",
        "tstamp": "2019-12-30 20:26:40",
        "valuedate": "30/12/2019",
        "vientiselitekd": "0"
    },
    {
        "accountno": "1",
        "amount": "-5.63",
        "bic_receiver": "",
        "bookdate": "20/01/2020",
        "category": "Hyvinvointijakauneus",
        "counterparty_account_id": "137",
        "iban_receiver": "1",
        "paymentdate": "20/01/2020",
        "reference": "1",
        "saldo": "-103.71",
        "taplajikd": "162",
        "tstamp": "2020-01-20 20:03:02",
        "valuedate": "20/01/2020",
        "vientiselitekd": "0"
    },
    {
        "accountno": "1",
        "amount": "-5.76",
        "bic_receiver": "",
        "bookdate": "06/05/2020",
        "category": "Hyvinvointijakauneus",
        "counterparty_account_id": "121",
        "iban_receiver": "1",
        "paymentdate": "06/05/2020",
        "reference": "1",
        "saldo": "-39.81",
        "taplajikd": "162",
        "tstamp": "2020-05-06 12:16:00",
        "valuedate": "06/05/2020",
        "vientiselitekd": "0"
    },
    {
        "accountno": "1",
        "amount": "-9.85",
        "bic_receiver": "",
        "bookdate": "31/07/2020",
        "category": "Hyvinvointijakauneus",
        "counterparty_account_id": "106",
        "iban_receiver": "1",
        "paymentdate": "30/07/2020",
        "reference": "1",
        "saldo": "-29.59",
        "taplajikd": "162",
        "tstamp": "2020-07-30 6:41:52",
        "valuedate": "30/07/2020",
        "vientiselitekd": "0"
    },
    {
        "accountno": "1",
        "amount": "-3.51",
        "bic_receiver": "",
        "bookdate": "07/09/2020",
        "category": "Hyvinvointijakauneus",
        "counterparty_account_id": "133",
        "iban_receiver": "1",
        "paymentdate": "07/09/2020",
        "reference": "1",
        "saldo": "-60.44",
        "taplajikd": "162",
        "tstamp": "2020-09-07 11:04:37",
        "valuedate": "07/09/2020",
        "vientiselitekd": "0"
    },
    {
        "accountno": "1",
        "amount": "-3.28",
        "bic_receiver": "",
        "bookdate": "02/10/2020",
        "category": "Hyvinvointijakauneus",
        "counterparty_account_id": "127",
        "iban_receiver": "1",
        "paymentdate": "02/10/2020",
        "reference": "1",
        "saldo": "-170.3",
        "taplajikd": "162",
        "tstamp": "2020-10-02 13:06:36",
        "valuedate": "02/10/2020",
        "vientiselitekd": "0"
    },
    {
        "accountno": "1",
        "amount": "-2.61",
        "bic_receiver": "",
        "bookdate": "05/10/2020",
        "category": "Hyvinvointijakauneus",
        "counterparty_account_id": "148",
        "iban_receiver": "1",
        "paymentdate": "05/10/2020",
        "reference": "1",
        "saldo": "-282.5",
        "taplajikd": "162",
        "tstamp": "2020-10-05 6:39:39",
        "valuedate": "05/10/2020",
        "vientiselitekd": "0"
    },
    {
        "accountno": "1",
        "amount": "-12.77",
        "bic_receiver": "",
        "bookdate": "19/10/2020",
        "category": "Hyvinvointijakauneus",
        "counterparty_account_id": "50",
        "iban_receiver": "1",
        "paymentdate": "19/10/2020",
        "reference": "1",
        "saldo": "-818.63",
        "taplajikd": "162",
        "tstamp": "2020-10-19 18:04:45",
        "valuedate": "19/10/2020",
        "vientiselitekd": "0"
    },
    {
        "accountno": "1",
        "amount": "-3.24",
        "bic_receiver": "",
        "bookdate": "27/10/2020",
        "category": "Hyvinvointijakauneus",
        "counterparty_account_id": "55",
        "iban_receiver": "1",
        "paymentdate": "27/10/2020",
        "reference": "1",
        "saldo": "124.5",
        "taplajikd": "162",
        "tstamp": "2020-10-27 11:50:29",
        "valuedate": "27/10/2020",
        "vientiselitekd": "0"
    },
    {
        "accountno": "1",
        "amount": "-2.62",
        "bic_receiver": "",
        "bookdate": "26/11/2020",
        "category": "Hyvinvointijakauneus",
        "counterparty_account_id": "127",
        "iban_receiver": "1",
        "paymentdate": "26/11/2020",
        "reference": "1",
        "saldo": "-180.36",
        "taplajikd": "162",
        "tstamp": "2020-11-26 6:56:32",
        "valuedate": "26/11/2020",
        "vientiselitekd": "0"
    },
    {
        "accountno": "2",
        "amount": "-22.25",
        "bic_receiver": "",
        "bookdate": "20/02/2019",
        "category": "Hyvinvointijakauneus",
        "counterparty_account_id": "83",
        "iban_receiver": "1",
        "paymentdate": "19/02/2019",
        "reference": "1",
        "saldo": "2036.88",
        "taplajikd": "162",
        "tstamp": "2019-02-19 16:00:00",
        "valuedate": "19/02/2019",
        "vientiselitekd": "0"
    },
    {
        "accountno": "2",
        "amount": "-14.59",
        "bic_receiver": "OKOYFIHH",
        "bookdate": "07/05/2019",
        "category": "Hyvinvointijakauneus",
        "counterparty_account_id": "192",
        "iban_receiver": "0",
        "paymentdate": "07/05/2019",
        "reference": "0",
        "saldo": "1610.44",
        "taplajikd": "106",
        "tstamp": "2019-05-07 20:34:17",
        "valuedate": "07/05/2019",
        "vientiselitekd": "706"
    },
    {
        "accountno": "2",
        "amount": "-15.27",
        "bic_receiver": "",
        "bookdate": "11/06/2019",
        "category": "Hyvinvointijakauneus",
        "counterparty_account_id": "65",
        "iban_receiver": "1",
        "paymentdate": "11/06/2019",
        "reference": "1",
        "saldo": "252.27",
        "taplajikd": "162",
        "tstamp": "2019-06-11 21:49:05",
        "valuedate": "11/06/2019",
        "vientiselitekd": "0"
    },
    {
        "accountno": "2",
        "amount": "-128.79",
        "bic_receiver": "",
        "bookdate": "08/07/2019",
        "category": "Hyvinvointijakauneus",
        "counterparty_account_id": "60",
        "iban_receiver": "1",
        "paymentdate": "08/07/2019",
        "reference": "1",
        "saldo": "1685.16",
        "taplajikd": "162",
        "tstamp": "2019-07-08 6:28:19",
        "valuedate": "08/07/2019",
        "vientiselitekd": "0"
    },
    {
        "accountno": "2",
        "amount": "-20.42",
        "bic_receiver": "",
        "bookdate": "07/11/2019",
        "category": "Hyvinvointijakauneus",
        "counterparty_account_id": "71",
        "iban_receiver": "1",
        "paymentdate": "07/11/2019",
        "reference": "1",
        "saldo": "3871",
        "taplajikd": "162",
        "tstamp": "2019-11-07 6:51:26",
        "valuedate": "07/11/2019",
        "vientiselitekd": "0"
    },
    {
        "accountno": "2",
        "amount": "-3.66",
        "bic_receiver": "",
        "bookdate": "10/01/2020",
        "category": "Hyvinvointijakauneus",
        "counterparty_account_id": "126",
        "iban_receiver": "1",
        "paymentdate": "10/01/2020",
        "reference": "1",
        "saldo": "-14.01",
        "taplajikd": "162",
        "tstamp": "2020-01-10 5:57:01",
        "valuedate": "10/01/2020",
        "vientiselitekd": "0"
    },
    {
        "accountno": "2",
        "amount": "-6.26",
        "bic_receiver": "OKOYFIHH",
        "bookdate": "03/08/2020",
        "category": "Hyvinvointijakauneus",
        "counterparty_account_id": "207",
        "iban_receiver": "0",
        "paymentdate": "03/08/2020",
        "reference": "0",
        "saldo": "767.53",
        "taplajikd": "147",
        "tstamp": "2020-08-03 15:35:23",
        "valuedate": "03/08/2020",
        "vientiselitekd": "706"
    },
    {
        "accountno": "2",
        "amount": "-16.74",
        "bic_receiver": "",
        "bookdate": "04/08/2020",
        "category": "Hyvinvointijakauneus",
        "counterparty_account_id": "37",
        "iban_receiver": "1",
        "paymentdate": "04/08/2020",
        "reference": "1",
        "saldo": "731.78",
        "taplajikd": "162",
        "tstamp": "2020-08-04 17:01:32",
        "valuedate": "04/08/2020",
        "vientiselitekd": "0"
    },
    {
        "accountno": "2",
        "amount": "-20.31",
        "bic_receiver": "",
        "bookdate": "07/08/2020",
        "category": "Hyvinvointijakauneus",
        "counterparty_account_id": "95",
        "iban_receiver": "1",
        "paymentdate": "07/08/2020",
        "reference": "1",
        "saldo": "890.56",
        "taplajikd": "162",
        "tstamp": "2020-08-07 22:46:09",
        "valuedate": "07/08/2020",
        "vientiselitekd": "0"
    },
    {
        "accountno": "2",
        "amount": "-23.65",
        "bic_receiver": "OKOYFIHH",
        "bookdate": "15/11/2020",
        "category": "Hyvinvointijakauneus",
        "counterparty_account_id": "3",
        "iban_receiver": "0",
        "paymentdate": "15/11/2020",
        "reference": "0",
        "saldo": "5349.08",
        "taplajikd": "106",
        "tstamp": "2020-11-15 2:10:55",
        "valuedate": "15/11/2020",
        "vientiselitekd": "0"
    },
    {
        "accountno": "2",
        "amount": "-8.82",
        "bic_receiver": "",
        "bookdate": "30/11/2020",
        "category": "Hyvinvointijakauneus",
        "counterparty_account_id": "84",
        "iban_receiver": "1",
        "paymentdate": "27/11/2020",
        "reference": "1",
        "saldo": "6458.25",
        "taplajikd": "162",
        "tstamp": "2020-11-27 4:21:49",
        "valuedate": "27/11/2020",
        "vientiselitekd": "0"
    },
    {
        "accountno": "3",
        "amount": "-48.52",
        "bic_receiver": "",
        "bookdate": "20/06/2019",
        "category": "Hyvinvointijakauneus",
        "counterparty_account_id": "99",
        "iban_receiver": "1",
        "paymentdate": "20/06/2019",
        "reference": "1",
        "saldo": "68809.07",
        "taplajikd": "162",
        "tstamp": "2019-06-20 16:33:06",
        "valuedate": "20/06/2019",
        "vientiselitekd": "0"
    },
    {
        "accountno": "3",
        "amount": "-218.41",
        "bic_receiver": "HANDFIHH",
        "bookdate": "04/09/2019",
        "category": "Hyvinvointijakauneus",
        "counterparty_account_id": "25",
        "iban_receiver": "0",
        "paymentdate": "04/09/2019",
        "reference": "0",
        "saldo": "71307.53",
        "taplajikd": "106",
        "tstamp": "2019-09-04 22:25:34",
        "valuedate": "04/09/2019",
        "vientiselitekd": "0"
    },
    {
        "accountno": "3",
        "amount": "-187.17",
        "bic_receiver": "",
        "bookdate": "05/11/2019",
        "category": "Hyvinvointijakauneus",
        "counterparty_account_id": "86",
        "iban_receiver": "1",
        "paymentdate": "05/11/2019",
        "reference": "1",
        "saldo": "76132.14",
        "taplajikd": "162",
        "tstamp": "2019-11-05 12:23:14",
        "valuedate": "05/11/2019",
        "vientiselitekd": "0"
    },
    {
        "accountno": "3",
        "amount": "-6.46",
        "bic_receiver": "",
        "bookdate": "12/11/2019",
        "category": "Hyvinvointijakauneus",
        "counterparty_account_id": "163",
        "iban_receiver": "1",
        "paymentdate": "12/11/2019",
        "reference": "1",
        "saldo": "52450",
        "taplajikd": "162",
        "tstamp": "2019-11-12 14:42:35",
        "valuedate": "12/11/2019",
        "vientiselitekd": "0"
    },
    {
        "accountno": "3",
        "amount": "-26.08",
        "bic_receiver": "",
        "bookdate": "29/11/2019",
        "category": "Hyvinvointijakauneus",
        "counterparty_account_id": "63",
        "iban_receiver": "1",
        "paymentdate": "29/11/2019",
        "reference": "1",
        "saldo": "26690.77",
        "taplajikd": "162",
        "tstamp": "2019-11-29 0:46:27",
        "valuedate": "29/11/2019",
        "vientiselitekd": "0"
    },
    {
        "accountno": "3",
        "amount": "-46.65",
        "bic_receiver": "OKOYFIHH",
        "bookdate": "25/05/2020",
        "category": "Hyvinvointijakauneus",
        "counterparty_account_id": "204",
        "iban_receiver": "0",
        "paymentdate": "25/05/2020",
        "reference": "0",
        "saldo": "26936.93",
        "taplajikd": "106",
        "tstamp": "2020-05-25 0:58:47",
        "valuedate": "25/05/2020",
        "vientiselitekd": "706"
    },
    {
        "accountno": "3",
        "amount": "-84.81",
        "bic_receiver": "OKOYFIHH",
        "bookdate": "05/06/2020",
        "category": "Hyvinvointijakauneus",
        "counterparty_account_id": "208",
        "iban_receiver": "0",
        "paymentdate": "05/06/2020",
        "reference": "0",
        "saldo": "25696.36",
        "taplajikd": "106",
        "tstamp": "2020-06-05 17:05:20",
        "valuedate": "05/06/2020",
        "vientiselitekd": "706"
    },
    {
        "accountno": "3",
        "amount": "-40.55",
        "bic_receiver": "",
        "bookdate": "09/07/2020",
        "category": "Hyvinvointijakauneus",
        "counterparty_account_id": "119",
        "iban_receiver": "1",
        "paymentdate": "09/07/2020",
        "reference": "1",
        "saldo": "20201.15",
        "taplajikd": "162",
        "tstamp": "2020-07-09 7:03:32",
        "valuedate": "09/07/2020",
        "vientiselitekd": "0"
    },
    {
        "accountno": "3",
        "amount": "-38.91",
        "bic_receiver": "",
        "bookdate": "23/07/2020",
        "category": "Hyvinvointijakauneus",
        "counterparty_account_id": "68",
        "iban_receiver": "1",
        "paymentdate": "23/07/2020",
        "reference": "1",
        "saldo": "19796.83",
        "taplajikd": "162",
        "tstamp": "2020-07-23 13:05:27",
        "valuedate": "23/07/2020",
        "vientiselitekd": "0"
    },
    {
        "accountno": "3",
        "amount": "-106.43",
        "bic_receiver": "HANDFIHH",
        "bookdate": "25/08/2020",
        "category": "Hyvinvointijakauneus",
        "counterparty_account_id": "41",
        "iban_receiver": "0",
        "paymentdate": "25/08/2020",
        "reference": "0",
        "saldo": "35894.31",
        "taplajikd": "129",
        "tstamp": "2020-08-25 1:40:28",
        "valuedate": "25/08/2020",
        "vientiselitekd": "0"
    },
    {
        "accountno": "3",
        "amount": "-9.29",
        "bic_receiver": "",
        "bookdate": "26/08/2020",
        "category": "Hyvinvointijakauneus",
        "counterparty_account_id": "44",
        "iban_receiver": "1",
        "paymentdate": "26/08/2020",
        "reference": "1",
        "saldo": "40777.22",
        "taplajikd": "162",
        "tstamp": "2020-08-26 11:20:56",
        "valuedate": "26/08/2020",
        "vientiselitekd": "0"
    },
    {
        "accountno": "3",
        "amount": "-24.51",
        "bic_receiver": "",
        "bookdate": "09/11/2020",
        "category": "Hyvinvointijakauneus",
        "counterparty_account_id": "150",
        "iban_receiver": "1",
        "paymentdate": "09/11/2020",
        "reference": "1",
        "saldo": "21518.21",
        "taplajikd": "162",
        "tstamp": "2020-11-09 5:06:53",
        "valuedate": "09/11/2020",
        "vientiselitekd": "0"
    },
    {
        "accountno": "3",
        "amount": "-19.95",
        "bic_receiver": "",
        "bookdate": "16/11/2020",
        "category": "Hyvinvointijakauneus",
        "counterparty_account_id": "71",
        "iban_receiver": "1",
        "paymentdate": "16/11/2020",
        "reference": "1",
        "saldo": "25402.9",
        "taplajikd": "162",
        "tstamp": "2020-11-16 17:18:41",
        "valuedate": "16/11/2020",
        "vientiselitekd": "0"
    },
    {
        "accountno": "3",
        "amount": "-17.87",
        "bic_receiver": "",
        "bookdate": "19/11/2020",
        "category": "Hyvinvointijakauneus",
        "counterparty_account_id": "125",
        "iban_receiver": "1",
        "paymentdate": "19/11/2020",
        "reference": "1",
        "saldo": "25266.71",
        "taplajikd": "162",
        "tstamp": "2020-11-19 0:47:13",
        "valuedate": "19/11/2020",
        "vientiselitekd": "0"
    },
    {
        "accountno": "3",
        "amount": "-13.81",
        "bic_receiver": "",
        "bookdate": "04/12/2020",
        "category": "Hyvinvointijakauneus",
        "counterparty_account_id": "152",
        "iban_receiver": "1",
        "paymentdate": "04/12/2020",
        "reference": "1",
        "saldo": "25093.39",
        "taplajikd": "162",
        "tstamp": "2020-12-04 20:25:20",
        "valuedate": "04/12/2020",
        "vientiselitekd": "0"
    },
    {
        "accountno": "3",
        "amount": "-50.26",
        "bic_receiver": "",
        "bookdate": "10/12/2020",
        "category": "Hyvinvointijakauneus",
        "counterparty_account_id": "117",
        "iban_receiver": "1",
        "paymentdate": "10/12/2020",
        "reference": "1",
        "saldo": "24386.74",
        "taplajikd": "162",
        "tstamp": "2020-12-10 15:03:21",
        "valuedate": "10/12/2020",
        "vientiselitekd": "0"
    },
    {
        "accountno": "1",
        "amount": "-3.65",
        "bic_receiver": "",
        "bookdate": "04/01/2019",
        "category": "Kulttuuri_viihde",
        "counterparty_account_id": "38",
        "iban_receiver": "1",
        "paymentdate": "04/01/2019",
        "reference": "1",
        "saldo": "297.7",
        "taplajikd": "162",
        "tstamp": "2019-01-04 15:15:08",
        "valuedate": "04/01/2019",
        "vientiselitekd": "0"
    },
    {
        "accountno": "1",
        "amount": "-2.83",
        "bic_receiver": "",
        "bookdate": "28/01/2019",
        "category": "Kulttuuri_viihde",
        "counterparty_account_id": "128",
        "iban_receiver": "1",
        "paymentdate": "28/01/2019",
        "reference": "1",
        "saldo": "-75.71",
        "taplajikd": "162",
        "tstamp": "2019-01-28 1:47:40",
        "valuedate": "28/01/2019",
        "vientiselitekd": "0"
    },
    {
        "accountno": "1",
        "amount": "-4.46",
        "bic_receiver": "",
        "bookdate": "08/02/2019",
        "category": "Kulttuuri_viihde",
        "counterparty_account_id": "79",
        "iban_receiver": "1",
        "paymentdate": "08/02/2019",
        "reference": "1",
        "saldo": "-369.35",
        "taplajikd": "162",
        "tstamp": "2019-02-08 3:25:43",
        "valuedate": "08/02/2019",
        "vientiselitekd": "0"
    },
    {
        "accountno": "1",
        "amount": "-17.44",
        "bic_receiver": "",
        "bookdate": "26/03/2019",
        "category": "Kulttuuri_viihde",
        "counterparty_account_id": "80",
        "iban_receiver": "1",
        "paymentdate": "26/03/2019",
        "reference": "1",
        "saldo": "-117.07",
        "taplajikd": "162",
        "tstamp": "2019-03-26 0:25:16",
        "valuedate": "26/03/2019",
        "vientiselitekd": "0"
    },
    {
        "accountno": "1",
        "amount": "-6.09",
        "bic_receiver": "OKOYFIHH",
        "bookdate": "24/04/2019",
        "category": "Kulttuuri_viihde",
        "counterparty_account_id": "8",
        "iban_receiver": "0",
        "paymentdate": "24/04/2019",
        "reference": "0",
        "saldo": "-122.45",
        "taplajikd": "106",
        "tstamp": "2019-04-24 11:11:04",
        "valuedate": "24/04/2019",
        "vientiselitekd": "0"
    },
    {
        "accountno": "1",
        "amount": "-2.22",
        "bic_receiver": "",
        "bookdate": "07/05/2019",
        "category": "Kulttuuri_viihde",
        "counterparty_account_id": "65",
        "iban_receiver": "1",
        "paymentdate": "07/05/2019",
        "reference": "1",
        "saldo": "-80.86",
        "taplajikd": "162",
        "tstamp": "2019-05-07 6:41:01",
        "valuedate": "07/05/2019",
        "vientiselitekd": "0"
    },
    {
        "accountno": "1",
        "amount": "-2.41",
        "bic_receiver": "",
        "bookdate": "20/05/2019",
        "category": "Kulttuuri_viihde",
        "counterparty_account_id": "151",
        "iban_receiver": "1",
        "paymentdate": "20/05/2019",
        "reference": "1",
        "saldo": "-224.63",
        "taplajikd": "162",
        "tstamp": "2019-05-20 1:12:55",
        "valuedate": "20/05/2019",
        "vientiselitekd": "0"
    },
    {
        "accountno": "1",
        "amount": "-6.24",
        "bic_receiver": "",
        "bookdate": "20/05/2019",
        "category": "Kulttuuri_viihde",
        "counterparty_account_id": "141",
        "iban_receiver": "1",
        "paymentdate": "20/05/2019",
        "reference": "1",
        "saldo": "-233.21",
        "taplajikd": "162",
        "tstamp": "2019-05-20 14:53:10",
        "valuedate": "20/05/2019",
        "vientiselitekd": "0"
    },
    {
        "accountno": "1",
        "amount": "-14.23",
        "bic_receiver": "OKOYFIHH",
        "bookdate": "23/05/2019",
        "category": "Kulttuuri_viihde",
        "counterparty_account_id": "16",
        "iban_receiver": "0",
        "paymentdate": "23/05/2019",
        "reference": "0",
        "saldo": "-303.07",
        "taplajikd": "106",
        "tstamp": "2019-05-23 4:33:25",
        "valuedate": "23/05/2019",
        "vientiselitekd": "0"
    },
    {
        "accountno": "1",
        "amount": "-15.03",
        "bic_receiver": "DABAFIHH",
        "bookdate": "05/11/2019",
        "category": "Kulttuuri_viihde",
        "counterparty_account_id": "25",
        "iban_receiver": "0",
        "paymentdate": "05/11/2019",
        "reference": "0",
        "saldo": "-528.45",
        "taplajikd": "106",
        "tstamp": "2019-11-05 22:53:57",
        "valuedate": "05/11/2019",
        "vientiselitekd": "0"
    },
    {
        "accountno": "1",
        "amount": "-16.45",
        "bic_receiver": "",
        "bookdate": "16/01/2020",
        "category": "Kulttuuri_viihde",
        "counterparty_account_id": "109",
        "iban_receiver": "1",
        "paymentdate": "16/01/2020",
        "reference": "1",
        "saldo": "-80.83",
        "taplajikd": "162",
        "tstamp": "2020-01-16 21:52:24",
        "valuedate": "16/01/2020",
        "vientiselitekd": "0"
    },
    {
        "accountno": "1",
        "amount": "-11.34",
        "bic_receiver": "",
        "bookdate": "20/01/2020",
        "category": "Kulttuuri_viihde",
        "counterparty_account_id": "64",
        "iban_receiver": "1",
        "paymentdate": "20/01/2020",
        "reference": "1",
        "saldo": "-96.27",
        "taplajikd": "162",
        "tstamp": "2020-01-20 1:12:55",
        "valuedate": "20/01/2020",
        "vientiselitekd": "0"
    },
    {
        "accountno": "1",
        "amount": "-71.82",
        "bic_receiver": "OKOYFIHH",
        "bookdate": "29/01/2020",
        "category": "Kulttuuri_viihde",
        "counterparty_account_id": "31",
        "iban_receiver": "0",
        "paymentdate": "29/01/2020",
        "reference": "0",
        "saldo": "-236.39",
        "taplajikd": "106",
        "tstamp": "2020-01-29 0:54:41",
        "valuedate": "29/01/2020",
        "vientiselitekd": "0"
    },
    {
        "accountno": "1",
        "amount": "-7.68",
        "bic_receiver": "",
        "bookdate": "24/02/2020",
        "category": "Kulttuuri_viihde",
        "counterparty_account_id": "51",
        "iban_receiver": "1",
        "paymentdate": "24/02/2020",
        "reference": "1",
        "saldo": "-455.03",
        "taplajikd": "162",
        "tstamp": "2020-02-24 1:48:41",
        "valuedate": "24/02/2020",
        "vientiselitekd": "0"
    },
    {
        "accountno": "1",
        "amount": "-0.74",
        "bic_receiver": "",
        "bookdate": "27/02/2020",
        "category": "Kulttuuri_viihde",
        "counterparty_account_id": "91",
        "iban_receiver": "1",
        "paymentdate": "27/02/2020",
        "reference": "1",
        "saldo": "287.69",
        "taplajikd": "162",
        "tstamp": "2020-02-27 6:20:23",
        "valuedate": "27/02/2020",
        "vientiselitekd": "0"
    },
    {
        "accountno": "1",
        "amount": "-2.24",
        "bic_receiver": "",
        "bookdate": "04/05/2020",
        "category": "Kulttuuri_viihde",
        "counterparty_account_id": "84",
        "iban_receiver": "1",
        "paymentdate": "04/05/2020",
        "reference": "1",
        "saldo": "-22.15",
        "taplajikd": "162",
        "tstamp": "2020-05-04 18:08:00",
        "valuedate": "04/05/2020",
        "vientiselitekd": "0"
    },
    {
        "accountno": "1",
        "amount": "-1.97",
        "bic_receiver": "",
        "bookdate": "07/08/2020",
        "category": "Kulttuuri_viihde",
        "counterparty_account_id": "72",
        "iban_receiver": "1",
        "paymentdate": "07/08/2020",
        "reference": "1",
        "saldo": "-10.98",
        "taplajikd": "162",
        "tstamp": "2020-08-07 20:21:16",
        "valuedate": "07/08/2020",
        "vientiselitekd": "0"
    },
    {
        "accountno": "1",
        "amount": "-15.34",
        "bic_receiver": "",
        "bookdate": "18/09/2020",
        "category": "Kulttuuri_viihde",
        "counterparty_account_id": "72",
        "iban_receiver": "1",
        "paymentdate": "18/09/2020",
        "reference": "1",
        "saldo": "-126.13",
        "taplajikd": "162",
        "tstamp": "2020-09-18 14:46:09",
        "valuedate": "18/09/2020",
        "vientiselitekd": "0"
    },
    {
        "accountno": "1",
        "amount": "-33.08",
        "bic_receiver": "",
        "bookdate": "29/09/2020",
        "category": "Kulttuuri_viihde",
        "counterparty_account_id": "33",
        "iban_receiver": "1",
        "paymentdate": "29/09/2020",
        "reference": "1",
        "saldo": "-136.37",
        "taplajikd": "162",
        "tstamp": "2020-09-29 12:55:23",
        "valuedate": "29/09/2020",
        "vientiselitekd": "0"
    },
    {
        "accountno": "1",
        "amount": "-2.94",
        "bic_receiver": "",
        "bookdate": "05/10/2020",
        "category": "Kulttuuri_viihde",
        "counterparty_account_id": "35",
        "iban_receiver": "1",
        "paymentdate": "05/10/2020",
        "reference": "1",
        "saldo": "-293",
        "taplajikd": "162",
        "tstamp": "2020-10-05 11:06:05",
        "valuedate": "05/10/2020",
        "vientiselitekd": "0"
    },
    {
        "accountno": "1",
        "amount": "-5.4",
        "bic_receiver": "",
        "bookdate": "05/10/2020",
        "category": "Kulttuuri_viihde",
        "counterparty_account_id": "162",
        "iban_receiver": "1",
        "paymentdate": "05/10/2020",
        "reference": "1",
        "saldo": "-358.66",
        "taplajikd": "162",
        "tstamp": "2020-10-05 21:59:28",
        "valuedate": "05/10/2020",
        "vientiselitekd": "0"
    },
    {
        "accountno": "1",
        "amount": "-17.23",
        "bic_receiver": "",
        "bookdate": "16/10/2020",
        "category": "Kulttuuri_viihde",
        "counterparty_account_id": "76",
        "iban_receiver": "1",
        "paymentdate": "16/10/2020",
        "reference": "1",
        "saldo": "-728.49",
        "taplajikd": "162",
        "tstamp": "2020-10-16 15:51:33",
        "valuedate": "16/10/2020",
        "vientiselitekd": "0"
    },
    {
        "accountno": "1",
        "amount": "-6.97",
        "bic_receiver": "",
        "bookdate": "26/10/2020",
        "category": "Kulttuuri_viihde",
        "counterparty_account_id": "33",
        "iban_receiver": "1",
        "paymentdate": "26/10/2020",
        "reference": "1",
        "saldo": "271.7",
        "taplajikd": "162",
        "tstamp": "2020-10-26 0:50:45",
        "valuedate": "26/10/2020",
        "vientiselitekd": "0"
    },
    {
        "accountno": "2",
        "amount": "-27.64",
        "bic_receiver": "",
        "bookdate": "07/02/2019",
        "category": "Kulttuuri_viihde",
        "counterparty_account_id": "116",
        "iban_receiver": "1",
        "paymentdate": "07/02/2019",
        "reference": "1",
        "saldo": "2048.76",
        "taplajikd": "162",
        "tstamp": "2019-02-07 8:00:00",
        "valuedate": "07/02/2019",
        "vientiselitekd": "0"
    },
    {
        "accountno": "2",
        "amount": "-66.07",
        "bic_receiver": "",
        "bookdate": "18/07/2019",
        "category": "Kulttuuri_viihde",
        "counterparty_account_id": "73",
        "iban_receiver": "1",
        "paymentdate": "18/07/2019",
        "reference": "1",
        "saldo": "3046.35",
        "taplajikd": "162",
        "tstamp": "2019-07-18 9:58:39",
        "valuedate": "18/07/2019",
        "vientiselitekd": "0"
    },
    {
        "accountno": "2",
        "amount": "-114.84",
        "bic_receiver": "",
        "bookdate": "19/07/2019",
        "category": "Kulttuuri_viihde",
        "counterparty_account_id": "45",
        "iban_receiver": "1",
        "paymentdate": "19/07/2019",
        "reference": "1",
        "saldo": "2922.78",
        "taplajikd": "162",
        "tstamp": "2019-07-19 19:24:57",
        "valuedate": "19/07/2019",
        "vientiselitekd": "0"
    },
    {
        "accountno": "2",
        "amount": "-49.18",
        "bic_receiver": "",
        "bookdate": "09/08/2019",
        "category": "Kulttuuri_viihde",
        "counterparty_account_id": "88",
        "iban_receiver": "1",
        "paymentdate": "09/08/2019",
        "reference": "1",
        "saldo": "2575.12",
        "taplajikd": "162",
        "tstamp": "2019-08-09 9:04:52",
        "valuedate": "09/08/2019",
        "vientiselitekd": "0"
    },
    {
        "accountno": "2",
        "amount": "-54.5",
        "bic_receiver": "",
        "bookdate": "13/08/2019",
        "category": "Kulttuuri_viihde",
        "counterparty_account_id": "94",
        "iban_receiver": "1",
        "paymentdate": "13/08/2019",
        "reference": "1",
        "saldo": "3348.18",
        "taplajikd": "162",
        "tstamp": "2019-08-13 14:42:10",
        "valuedate": "13/08/2019",
        "vientiselitekd": "0"
    },
    {
        "accountno": "2",
        "amount": "-31.38",
        "bic_receiver": "OKOYFIHH",
        "bookdate": "04/11/2019",
        "category": "Kulttuuri_viihde",
        "counterparty_account_id": "25",
        "iban_receiver": "0",
        "paymentdate": "04/11/2019",
        "reference": "0",
        "saldo": "3828.56",
        "taplajikd": "129",
        "tstamp": "2019-11-04 10:17:09",
        "valuedate": "04/11/2019",
        "vientiselitekd": "0"
    },
    {
        "accountno": "2",
        "amount": "-11.44",
        "bic_receiver": "",
        "bookdate": "17/01/2020",
        "category": "Kulttuuri_viihde",
        "counterparty_account_id": "136",
        "iban_receiver": "1",
        "paymentdate": "17/01/2020",
        "reference": "1",
        "saldo": "274.88",
        "taplajikd": "162",
        "tstamp": "2020-01-17 21:13:23",
        "valuedate": "17/01/2020",
        "vientiselitekd": "0"
    },
    {
        "accountno": "2",
        "amount": "-7.92",
        "bic_receiver": "",
        "bookdate": "29/05/2020",
        "category": "Kulttuuri_viihde",
        "counterparty_account_id": "101",
        "iban_receiver": "1",
        "paymentdate": "29/05/2020",
        "reference": "1",
        "saldo": "-1438.21",
        "taplajikd": "162",
        "tstamp": "2020-05-29 13:31:16",
        "valuedate": "29/05/2020",
        "vientiselitekd": "0"
    },
    {
        "accountno": "2",
        "amount": "-5.64",
        "bic_receiver": "",
        "bookdate": "16/06/2020",
        "category": "Kulttuuri_viihde",
        "counterparty_account_id": "28",
        "iban_receiver": "1",
        "paymentdate": "16/06/2020",
        "reference": "1",
        "saldo": "1279.23",
        "taplajikd": "162",
        "tstamp": "2020-06-16 21:41:12",
        "valuedate": "16/06/2020",
        "vientiselitekd": "0"
    },
    {
        "accountno": "2",
        "amount": "-2.92",
        "bic_receiver": "",
        "bookdate": "18/06/2020",
        "category": "Kulttuuri_viihde",
        "counterparty_account_id": "73",
        "iban_receiver": "1",
        "paymentdate": "18/06/2020",
        "reference": "1",
        "saldo": "1257.49",
        "taplajikd": "162",
        "tstamp": "2020-06-18 8:23:08",
        "valuedate": "18/06/2020",
        "vientiselitekd": "0"
    },
    {
        "accountno": "2",
        "amount": "-96.65",
        "bic_receiver": "",
        "bookdate": "19/06/2020",
        "category": "Kulttuuri_viihde",
        "counterparty_account_id": "119",
        "iban_receiver": "1",
        "paymentdate": "19/06/2020",
        "reference": "1",
        "saldo": "1160.84",
        "taplajikd": "162",
        "tstamp": "2020-06-19 1:44:06",
        "valuedate": "19/06/2020",
        "vientiselitekd": "0"
    },
    {
        "accountno": "2",
        "amount": "-21.28",
        "bic_receiver": "",
        "bookdate": "29/06/2020",
        "category": "Kulttuuri_viihde",
        "counterparty_account_id": "70",
        "iban_receiver": "1",
        "paymentdate": "29/06/2020",
        "reference": "1",
        "saldo": "563.37",
        "taplajikd": "162",
        "tstamp": "2020-06-29 17:55:40",
        "valuedate": "29/06/2020",
        "vientiselitekd": "0"
    },
    {
        "accountno": "2",
        "amount": "-1.33",
        "bic_receiver": "",
        "bookdate": "20/07/2020",
        "category": "Kulttuuri_viihde",
        "counterparty_account_id": "67",
        "iban_receiver": "1",
        "paymentdate": "20/07/2020",
        "reference": "1",
        "saldo": "-42.12",
        "taplajikd": "162",
        "tstamp": "2020-07-20 16:00:00",
        "valuedate": "20/07/2020",
        "vientiselitekd": "0"
    },
    {
        "accountno": "2",
        "amount": "-4.8",
        "bic_receiver": "",
        "bookdate": "31/07/2020",
        "category": "Kulttuuri_viihde",
        "counterparty_account_id": "83",
        "iban_receiver": "1",
        "paymentdate": "31/07/2020",
        "reference": "1",
        "saldo": "-74.81",
        "taplajikd": "162",
        "tstamp": "2020-07-31 7:28:00",
        "valuedate": "31/07/2020",
        "vientiselitekd": "0"
    },
    {
        "accountno": "2",
        "amount": "-3.55",
        "bic_receiver": "",
        "bookdate": "31/08/2020",
        "category": "Kulttuuri_viihde",
        "counterparty_account_id": "87",
        "iban_receiver": "1",
        "paymentdate": "31/08/2020",
        "reference": "1",
        "saldo": "-20.02",
        "taplajikd": "162",
        "tstamp": "2020-08-31 16:12:18",
        "valuedate": "31/08/2020",
        "vientiselitekd": "0"
    },
    {
        "accountno": "2",
        "amount": "-7.35",
        "bic_receiver": "OKOYFIHH",
        "bookdate": "21/09/2020",
        "category": "Kulttuuri_viihde",
        "counterparty_account_id": "10",
        "iban_receiver": "0",
        "paymentdate": "21/09/2020",
        "reference": "0",
        "saldo": "4092.98",
        "taplajikd": "106",
        "tstamp": "2020-09-21 6:13:20",
        "valuedate": "21/09/2020",
        "vientiselitekd": "0"
    },
    {
        "accountno": "2",
        "amount": "-79.75",
        "bic_receiver": "OKOYFIHH",
        "bookdate": "28/09/2020",
        "category": "Kulttuuri_viihde",
        "counterparty_account_id": "13",
        "iban_receiver": "0",
        "paymentdate": "28/09/2020",
        "reference": "0",
        "saldo": "2642.28",
        "taplajikd": "106",
        "tstamp": "2020-09-28 9:46:40",
        "valuedate": "28/09/2020",
        "vientiselitekd": "0"
    },
    {
        "accountno": "3",
        "amount": "-45.69",
        "bic_receiver": "",
        "bookdate": "22/05/2019",
        "category": "Kulttuuri_viihde",
        "counterparty_account_id": "109",
        "iban_receiver": "1",
        "paymentdate": "22/05/2019",
        "reference": "1",
        "saldo": "66587.74",
        "taplajikd": "162",
        "tstamp": "2019-05-22 16:00:00",
        "valuedate": "22/05/2019",
        "vientiselitekd": "0"
    },
    {
        "accountno": "3",
        "amount": "-148.25",
        "bic_receiver": "",
        "bookdate": "10/06/2019",
        "category": "Kulttuuri_viihde",
        "counterparty_account_id": "88",
        "iban_receiver": "1",
        "paymentdate": "10/06/2019",
        "reference": "1",
        "saldo": "64467.21",
        "taplajikd": "162",
        "tstamp": "2019-06-10 6:37:14",
        "valuedate": "10/06/2019",
        "vientiselitekd": "0"
    },
    {
        "accountno": "3",
        "amount": "-44.6",
        "bic_receiver": "",
        "bookdate": "08/07/2019",
        "category": "Kulttuuri_viihde",
        "counterparty_account_id": "96",
        "iban_receiver": "1",
        "paymentdate": "08/07/2019",
        "reference": "1",
        "saldo": "68163.39",
        "taplajikd": "162",
        "tstamp": "2019-07-08 3:02:04",
        "valuedate": "08/07/2019",
        "vientiselitekd": "0"
    },
    {
        "accountno": "3",
        "amount": "-13.99",
        "bic_receiver": "",
        "bookdate": "08/07/2019",
        "category": "Kulttuuri_viihde",
        "counterparty_account_id": "108",
        "iban_receiver": "1",
        "paymentdate": "08/07/2019",
        "reference": "1",
        "saldo": "68149.4",
        "taplajikd": "162",
        "tstamp": "2019-07-08 9:55:52",
        "valuedate": "08/07/2019",
        "vientiselitekd": "0"
    },
    {
        "accountno": "3",
        "amount": "-27.35",
        "bic_receiver": "OKOYFIHH",
        "bookdate": "02/08/2019",
        "category": "Kulttuuri_viihde",
        "counterparty_account_id": "39",
        "iban_receiver": "0",
        "paymentdate": "02/08/2019",
        "reference": "0",
        "saldo": "72626.03",
        "taplajikd": "106",
        "tstamp": "2019-08-02 5:10:35",
        "valuedate": "02/08/2019",
        "vientiselitekd": "0"
    },
    {
        "accountno": "3",
        "amount": "-13.23",
        "bic_receiver": "",
        "bookdate": "06/08/2019",
        "category": "Kulttuuri_viihde",
        "counterparty_account_id": "88",
        "iban_receiver": "1",
        "paymentdate": "05/08/2019",
        "reference": "1",
        "saldo": "72612.8",
        "taplajikd": "162",
        "tstamp": "2019-08-05 10:21:11",
        "valuedate": "05/08/2019",
        "vientiselitekd": "0"
    },
    {
        "accountno": "3",
        "amount": "-25.55",
        "bic_receiver": "",
        "bookdate": "25/11/2019",
        "category": "Kulttuuri_viihde",
        "counterparty_account_id": "136",
        "iban_receiver": "1",
        "paymentdate": "25/11/2019",
        "reference": "1",
        "saldo": "24887.79",
        "taplajikd": "162",
        "tstamp": "2019-11-25 12:23:14",
        "valuedate": "25/11/2019",
        "vientiselitekd": "0"
    },
    {
        "accountno": "3",
        "amount": "-9.44",
        "bic_receiver": "",
        "bookdate": "23/12/2019",
        "category": "Kulttuuri_viihde",
        "counterparty_account_id": "135",
        "iban_receiver": "1",
        "paymentdate": "23/12/2019",
        "reference": "1",
        "saldo": "29136.97",
        "taplajikd": "162",
        "tstamp": "2019-12-23 13:33:55",
        "valuedate": "23/12/2019",
        "vientiselitekd": "0"
    },
    {
        "accountno": "3",
        "amount": "-32.23",
        "bic_receiver": "",
        "bookdate": "27/04/2020",
        "category": "Kulttuuri_viihde",
        "counterparty_account_id": "143",
        "iban_receiver": "1",
        "paymentdate": "27/04/2020",
        "reference": "1",
        "saldo": "32396.26",
        "taplajikd": "162",
        "tstamp": "2020-04-27 12:16:45",
        "valuedate": "27/04/2020",
        "vientiselitekd": "0"
    },
    {
        "accountno": "3",
        "amount": "-30.47",
        "bic_receiver": "",
        "bookdate": "14/05/2020",
        "category": "Kulttuuri_viihde",
        "counterparty_account_id": "128",
        "iban_receiver": "1",
        "paymentdate": "14/05/2020",
        "reference": "1",
        "saldo": "27264.48",
        "taplajikd": "162",
        "tstamp": "2020-05-14 15:40:24",
        "valuedate": "14/05/2020",
        "vientiselitekd": "0"
    },
    {
        "accountno": "3",
        "amount": "-27.61",
        "bic_receiver": "OKOYFIHH",
        "bookdate": "18/05/2020",
        "category": "Kulttuuri_viihde",
        "counterparty_account_id": "209",
        "iban_receiver": "0",
        "paymentdate": "18/05/2020",
        "reference": "0",
        "saldo": "27085.49",
        "taplajikd": "106",
        "tstamp": "2020-05-18 10:46:32",
        "valuedate": "18/05/2020",
        "vientiselitekd": "706"
    },
    {
        "accountno": "3",
        "amount": "-22.34",
        "bic_receiver": "",
        "bookdate": "20/07/2020",
        "category": "Kulttuuri_viihde",
        "counterparty_account_id": "86",
        "iban_receiver": "1",
        "paymentdate": "20/07/2020",
        "reference": "1",
        "saldo": "19956.27",
        "taplajikd": "162",
        "tstamp": "2020-07-20 21:25:59",
        "valuedate": "20/07/2020",
        "vientiselitekd": "0"
    },
    {
        "accountno": "3",
        "amount": "-42.99",
        "bic_receiver": "OKOYFIHH",
        "bookdate": "05/09/2020",
        "category": "Kulttuuri_viihde",
        "counterparty_account_id": "13",
        "iban_receiver": "0",
        "paymentdate": "05/09/2020",
        "reference": "0",
        "saldo": "41345.98",
        "taplajikd": "106",
        "tstamp": "2020-09-05 9:06:34",
        "valuedate": "05/09/2020",
        "vientiselitekd": "0"
    },
    {
        "accountno": "3",
        "amount": "-13.28",
        "bic_receiver": "",
        "bookdate": "19/11/2020",
        "category": "Kulttuuri_viihde",
        "counterparty_account_id": "127",
        "iban_receiver": "1",
        "paymentdate": "19/11/2020",
        "reference": "1",
        "saldo": "25171.3",
        "taplajikd": "162",
        "tstamp": "2020-11-19 16:31:29",
        "valuedate": "19/11/2020",
        "vientiselitekd": "0"
    },
    {
        "accountno": "3",
        "amount": "-12.39",
        "bic_receiver": "",
        "bookdate": "24/12/2020",
        "category": "Kulttuuri_viihde",
        "counterparty_account_id": "72",
        "iban_receiver": "1",
        "paymentdate": "24/12/2020",
        "reference": "1",
        "saldo": "23311.98",
        "taplajikd": "162",
        "tstamp": "2020-12-24 11:46:35",
        "valuedate": "24/12/2020",
        "vientiselitekd": "0"
    },
    {
        "accountno": "3",
        "amount": "-31.65",
        "bic_receiver": "",
        "bookdate": "29/12/2020",
        "category": "Kulttuuri_viihde",
        "counterparty_account_id": "148",
        "iban_receiver": "1",
        "paymentdate": "29/12/2020",
        "reference": "1",
        "saldo": "22690.8",
        "taplajikd": "162",
        "tstamp": "2020-12-29 6:24:36",
        "valuedate": "29/12/2020",
        "vientiselitekd": "0"
    },
    {
        "accountno": "1",
        "amount": "-2.14",
        "bic_receiver": "",
        "bookdate": "06/06/2019",
        "category": "Lapset",
        "counterparty_account_id": "116",
        "iban_receiver": "1",
        "paymentdate": "06/06/2019",
        "reference": "1",
        "saldo": "-299.61",
        "taplajikd": "162",
        "tstamp": "2019-06-06 21:10:35",
        "valuedate": "06/06/2019",
        "vientiselitekd": "0"
    },
    {
        "accountno": "1",
        "amount": "-3.13",
        "bic_receiver": "",
        "bookdate": "10/06/2019",
        "category": "Lapset",
        "counterparty_account_id": "95",
        "iban_receiver": "1",
        "paymentdate": "10/06/2019",
        "reference": "1",
        "saldo": "-336.54",
        "taplajikd": "162",
        "tstamp": "2019-06-10 9:52:56",
        "valuedate": "10/06/2019",
        "vientiselitekd": "0"
    },
    {
        "accountno": "1",
        "amount": "-6.14",
        "bic_receiver": "",
        "bookdate": "10/10/2019",
        "category": "Lapset",
        "counterparty_account_id": "69",
        "iban_receiver": "1",
        "paymentdate": "10/10/2019",
        "reference": "1",
        "saldo": "-64.38",
        "taplajikd": "162",
        "tstamp": "2019-10-10 14:01:51",
        "valuedate": "10/10/2019",
        "vientiselitekd": "0"
    },
    {
        "accountno": "1",
        "amount": "-9.91",
        "bic_receiver": "OKOYFIHH",
        "bookdate": "19/11/2019",
        "category": "Lapset",
        "counterparty_account_id": "22",
        "iban_receiver": "0",
        "paymentdate": "19/11/2019",
        "reference": "0",
        "saldo": "-218.15",
        "taplajikd": "106",
        "tstamp": "2019-11-19 3:57:48",
        "valuedate": "19/11/2019",
        "vientiselitekd": "0"
    },
    {
        "accountno": "1",
        "amount": "-4.84",
        "bic_receiver": "",
        "bookdate": "29/11/2019",
        "category": "Lapset",
        "counterparty_account_id": "122",
        "iban_receiver": "1",
        "paymentdate": "29/11/2019",
        "reference": "1",
        "saldo": "-380.17",
        "taplajikd": "162",
        "tstamp": "2019-11-29 4:11:01",
        "valuedate": "29/11/2019",
        "vientiselitekd": "0"
    },
    {
        "accountno": "1",
        "amount": "-27.64",
        "bic_receiver": "OKOYFIHH",
        "bookdate": "13/12/2019",
        "category": "Lapset",
        "counterparty_account_id": "10",
        "iban_receiver": "0",
        "paymentdate": "13/12/2019",
        "reference": "1",
        "saldo": "-888.33",
        "taplajikd": "106",
        "tstamp": "2019-12-13 0:17:47",
        "valuedate": "13/12/2019",
        "vientiselitekd": "0"
    },
    {
        "accountno": "1",
        "amount": "-3.67",
        "bic_receiver": "",
        "bookdate": "29/06/2020",
        "category": "Lapset",
        "counterparty_account_id": "80",
        "iban_receiver": "1",
        "paymentdate": "29/06/2020",
        "reference": "1",
        "saldo": "-152.6",
        "taplajikd": "162",
        "tstamp": "2020-06-29 11:23:23",
        "valuedate": "29/06/2020",
        "vientiselitekd": "0"
    },
    {
        "accountno": "1",
        "amount": "-2.96",
        "bic_receiver": "",
        "bookdate": "12/08/2020",
        "category": "Lapset",
        "counterparty_account_id": "105",
        "iban_receiver": "1",
        "paymentdate": "12/08/2020",
        "reference": "1",
        "saldo": "-72.1",
        "taplajikd": "162",
        "tstamp": "2020-08-12 13:22:02",
        "valuedate": "12/08/2020",
        "vientiselitekd": "0"
    },
    {
        "accountno": "1",
        "amount": "-8.73",
        "bic_receiver": "",
        "bookdate": "03/09/2020",
        "category": "Lapset",
        "counterparty_account_id": "117",
        "iban_receiver": "1",
        "paymentdate": "03/09/2020",
        "reference": "1",
        "saldo": "-14.3",
        "taplajikd": "162",
        "tstamp": "2020-09-03 18:27:42",
        "valuedate": "03/09/2020",
        "vientiselitekd": "0"
    },
    {
        "accountno": "1",
        "amount": "-2.87",
        "bic_receiver": "",
        "bookdate": "04/09/2020",
        "category": "Lapset",
        "counterparty_account_id": "54",
        "iban_receiver": "1",
        "paymentdate": "04/09/2020",
        "reference": "1",
        "saldo": "-28.07",
        "taplajikd": "162",
        "tstamp": "2020-09-04 14:46:09",
        "valuedate": "04/09/2020",
        "vientiselitekd": "0"
    },
    {
        "accountno": "1",
        "amount": "-30.96",
        "bic_receiver": "",
        "bookdate": "05/10/2020",
        "category": "Lapset",
        "counterparty_account_id": "144",
        "iban_receiver": "1",
        "paymentdate": "05/10/2020",
        "reference": "1",
        "saldo": "-323.96",
        "taplajikd": "162",
        "tstamp": "2020-10-05 13:12:57",
        "valuedate": "05/10/2020",
        "vientiselitekd": "0"
    },
    {
        "accountno": "1",
        "amount": "-1.62",
        "bic_receiver": "",
        "bookdate": "04/11/2020",
        "category": "Lapset",
        "counterparty_account_id": "59",
        "iban_receiver": "1",
        "paymentdate": "04/11/2020",
        "reference": "1",
        "saldo": "-131.25",
        "taplajikd": "162",
        "tstamp": "2020-11-04 23:12:24",
        "valuedate": "04/11/2020",
        "vientiselitekd": "0"
    },
    {
        "accountno": "1",
        "amount": "-4.51",
        "bic_receiver": "",
        "bookdate": "01/12/2020",
        "category": "Lapset",
        "counterparty_account_id": "137",
        "iban_receiver": "1",
        "paymentdate": "30/11/2020",
        "reference": "1",
        "saldo": "-262.75",
        "taplajikd": "162",
        "tstamp": "2020-11-30 6:20:50",
        "valuedate": "30/11/2020",
        "vientiselitekd": "0"
    },
    {
        "accountno": "1",
        "amount": "-4.34",
        "bic_receiver": "",
        "bookdate": "11/12/2020",
        "category": "Lapset",
        "counterparty_account_id": "59",
        "iban_receiver": "1",
        "paymentdate": "11/12/2020",
        "reference": "1",
        "saldo": "3.15",
        "taplajikd": "162",
        "tstamp": "2020-12-11 11:29:35",
        "valuedate": "11/12/2020",
        "vientiselitekd": "0"
    },
    {
        "accountno": "1",
        "amount": "-0.62",
        "bic_receiver": "",
        "bookdate": "28/12/2020",
        "category": "Lapset",
        "counterparty_account_id": "148",
        "iban_receiver": "1",
        "paymentdate": "28/12/2020",
        "reference": "1",
        "saldo": "191.48",
        "taplajikd": "162",
        "tstamp": "2020-12-28 1:41:25",
        "valuedate": "28/12/2020",
        "vientiselitekd": "0"
    },
    {
        "accountno": "2",
        "amount": "-9.03",
        "bic_receiver": "",
        "bookdate": "28/01/2019",
        "category": "Lapset",
        "counterparty_account_id": "101",
        "iban_receiver": "1",
        "paymentdate": "28/01/2019",
        "reference": "1",
        "saldo": "2120.28",
        "taplajikd": "162",
        "tstamp": "2019-01-28 13:20:00",
        "valuedate": "28/01/2019",
        "vientiselitekd": "0"
    },
    {
        "accountno": "2",
        "amount": "-10.87",
        "bic_receiver": "OKOYFIHH",
        "bookdate": "25/03/2019",
        "category": "Lapset",
        "counterparty_account_id": "22",
        "iban_receiver": "0",
        "paymentdate": "25/03/2019",
        "reference": "0",
        "saldo": "2985.84",
        "taplajikd": "106",
        "tstamp": "2019-03-25 0:58:47",
        "valuedate": "25/03/2019",
        "vientiselitekd": "0"
    },
    {
        "accountno": "2",
        "amount": "-105.47",
        "bic_receiver": "DABAFIHH",
        "bookdate": "28/03/2019",
        "category": "Lapset",
        "counterparty_account_id": "186",
        "iban_receiver": "0",
        "paymentdate": "28/03/2019",
        "reference": "0",
        "saldo": "2715.61",
        "taplajikd": "106",
        "tstamp": "2019-03-28 2:26:56",
        "valuedate": "28/03/2019",
        "vientiselitekd": "706"
    },
    {
        "accountno": "2",
        "amount": "-878.3",
        "bic_receiver": "ITELFIHH",
        "bookdate": "15/04/2019",
        "category": "Lapset",
        "counterparty_account_id": "190",
        "iban_receiver": "0",
        "paymentdate": "15/04/2019",
        "reference": "0",
        "saldo": "1554.45",
        "taplajikd": "106",
        "tstamp": "2019-04-15 9:36:00",
        "valuedate": "15/04/2019",
        "vientiselitekd": "706"
    },
    {
        "accountno": "2",
        "amount": "-49.74",
        "bic_receiver": "",
        "bookdate": "29/07/2019",
        "category": "Lapset",
        "counterparty_account_id": "81",
        "iban_receiver": "1",
        "paymentdate": "29/07/2019",
        "reference": "1",
        "saldo": "3447.13",
        "taplajikd": "162",
        "tstamp": "2019-07-29 20:45:51",
        "valuedate": "29/07/2019",
        "vientiselitekd": "0"
    },
    {
        "accountno": "2",
        "amount": "-23.61",
        "bic_receiver": "",
        "bookdate": "05/08/2019",
        "category": "Lapset",
        "counterparty_account_id": "78",
        "iban_receiver": "1",
        "paymentdate": "05/08/2019",
        "reference": "1",
        "saldo": "3156.25",
        "taplajikd": "162",
        "tstamp": "2019-08-05 21:50:16",
        "valuedate": "05/08/2019",
        "vientiselitekd": "0"
    },
    {
        "accountno": "2",
        "amount": "-48.69",
        "bic_receiver": "",
        "bookdate": "19/09/2019",
        "category": "Lapset",
        "counterparty_account_id": "37",
        "iban_receiver": "1",
        "paymentdate": "19/09/2019",
        "reference": "1",
        "saldo": "4885.28",
        "taplajikd": "162",
        "tstamp": "2019-09-19 1:58:21",
        "valuedate": "19/09/2019",
        "vientiselitekd": "0"
    },
    {
        "accountno": "2",
        "amount": "-62.21",
        "bic_receiver": "OKOYFIHH",
        "bookdate": "03/11/2019",
        "category": "Lapset",
        "counterparty_account_id": "20",
        "iban_receiver": "0",
        "paymentdate": "03/11/2019",
        "reference": "0",
        "saldo": "3896.05",
        "taplajikd": "106",
        "tstamp": "2019-11-03 6:51:26",
        "valuedate": "03/11/2019",
        "vientiselitekd": "0"
    },
    {
        "accountno": "2",
        "amount": "-10.18",
        "bic_receiver": "",
        "bookdate": "20/11/2019",
        "category": "Lapset",
        "counterparty_account_id": "73",
        "iban_receiver": "1",
        "paymentdate": "20/11/2019",
        "reference": "1",
        "saldo": "-13.11",
        "taplajikd": "162",
        "tstamp": "2019-11-20 10:17:09",
        "valuedate": "20/11/2019",
        "vientiselitekd": "0"
    },
    {
        "accountno": "2",
        "amount": "-127.37",
        "bic_receiver": "DABAFIHH",
        "bookdate": "23/12/2019",
        "category": "Lapset",
        "counterparty_account_id": "200",
        "iban_receiver": "0",
        "paymentdate": "23/12/2019",
        "reference": "0",
        "saldo": "1948.37",
        "taplajikd": "129",
        "tstamp": "2019-12-23 9:06:12",
        "valuedate": "23/12/2019",
        "vientiselitekd": "706"
    },
    {
        "accountno": "2",
        "amount": "-16.62",
        "bic_receiver": "OKOYFIHH",
        "bookdate": "01/01/2020",
        "category": "Lapset",
        "counterparty_account_id": "190",
        "iban_receiver": "0",
        "paymentdate": "01/01/2020",
        "reference": "0",
        "saldo": "1560.8",
        "taplajikd": "106",
        "tstamp": "2020-01-01 12:17:51",
        "valuedate": "01/01/2020",
        "vientiselitekd": "706"
    },
    {
        "accountno": "2",
        "amount": "-1.11",
        "bic_receiver": "",
        "bookdate": "27/01/2020",
        "category": "Lapset",
        "counterparty_account_id": "113",
        "iban_receiver": "1",
        "paymentdate": "27/01/2020",
        "reference": "1",
        "saldo": "-30.2",
        "taplajikd": "162",
        "tstamp": "2020-01-27 1:59:00",
        "valuedate": "27/01/2020",
        "vientiselitekd": "0"
    },
    {
        "accountno": "2",
        "amount": "-41.12",
        "bic_receiver": "",
        "bookdate": "27/01/2020",
        "category": "Lapset",
        "counterparty_account_id": "103",
        "iban_receiver": "1",
        "paymentdate": "27/01/2020",
        "reference": "1",
        "saldo": "-75.75",
        "taplajikd": "162",
        "tstamp": "2020-01-27 4:21:49",
        "valuedate": "27/01/2020",
        "vientiselitekd": "0"
    },
    {
        "accountno": "2",
        "amount": "-0.94",
        "bic_receiver": "",
        "bookdate": "19/02/2020",
        "category": "Lapset",
        "counterparty_account_id": "60",
        "iban_receiver": "1",
        "paymentdate": "19/02/2020",
        "reference": "1",
        "saldo": "-360.1",
        "taplajikd": "162",
        "tstamp": "2020-02-19 8:50:32",
        "valuedate": "19/02/2020",
        "vientiselitekd": "0"
    },
    {
        "accountno": "2",
        "amount": "-9.73",
        "bic_receiver": "",
        "bookdate": "27/02/2020",
        "category": "Lapset",
        "counterparty_account_id": "50",
        "iban_receiver": "1",
        "paymentdate": "27/02/2020",
        "reference": "1",
        "saldo": "-459.54",
        "taplajikd": "162",
        "tstamp": "2020-02-27 10:56:51",
        "valuedate": "27/02/2020",
        "vientiselitekd": "0"
    },
    {
        "accountno": "2",
        "amount": "-10.73",
        "bic_receiver": "",
        "bookdate": "20/04/2020",
        "category": "Lapset",
        "counterparty_account_id": "28",
        "iban_receiver": "1",
        "paymentdate": "20/04/2020",
        "reference": "1",
        "saldo": "-157.32",
        "taplajikd": "162",
        "tstamp": "2020-04-20 5:28:06",
        "valuedate": "20/04/2020",
        "vientiselitekd": "0"
    },
    {
        "accountno": "2",
        "amount": "-1.83",
        "bic_receiver": "",
        "bookdate": "23/04/2020",
        "category": "Lapset",
        "counterparty_account_id": "38",
        "iban_receiver": "1",
        "paymentdate": "23/04/2020",
        "reference": "1",
        "saldo": "-177.83",
        "taplajikd": "162",
        "tstamp": "2020-04-23 18:50:08",
        "valuedate": "23/04/2020",
        "vientiselitekd": "0"
    },
    {
        "accountno": "2",
        "amount": "-8.06",
        "bic_receiver": "",
        "bookdate": "27/04/2020",
        "category": "Lapset",
        "counterparty_account_id": "45",
        "iban_receiver": "1",
        "paymentdate": "27/04/2020",
        "reference": "1",
        "saldo": "-237.69",
        "taplajikd": "162",
        "tstamp": "2020-04-27 8:12:09",
        "valuedate": "27/04/2020",
        "vientiselitekd": "0"
    },
    {
        "accountno": "2",
        "amount": "-4.25",
        "bic_receiver": "",
        "bookdate": "18/05/2020",
        "category": "Lapset",
        "counterparty_account_id": "80",
        "iban_receiver": "1",
        "paymentdate": "18/05/2020",
        "reference": "1",
        "saldo": "-378.68",
        "taplajikd": "162",
        "tstamp": "2020-05-18 11:09:18",
        "valuedate": "18/05/2020",
        "vientiselitekd": "0"
    },
    {
        "accountno": "2",
        "amount": "-16.88",
        "bic_receiver": "OKOYFIHH",
        "bookdate": "20/07/2020",
        "category": "Lapset",
        "counterparty_account_id": "18",
        "iban_receiver": "0",
        "paymentdate": "20/07/2020",
        "reference": "0",
        "saldo": "-59",
        "taplajikd": "106",
        "tstamp": "2020-07-20 17:57:20",
        "valuedate": "16/07/2020",
        "vientiselitekd": "0"
    },
    {
        "accountno": "2",
        "amount": "-5.45",
        "bic_receiver": "",
        "bookdate": "27/07/2020",
        "category": "Lapset",
        "counterparty_account_id": "145",
        "iban_receiver": "1",
        "paymentdate": "27/07/2020",
        "reference": "1",
        "saldo": "17.18",
        "taplajikd": "162",
        "tstamp": "2020-07-27 13:20:00",
        "valuedate": "27/07/2020",
        "vientiselitekd": "0"
    },
    {
        "accountno": "2",
        "amount": "-12.83",
        "bic_receiver": "",
        "bookdate": "28/08/2020",
        "category": "Lapset",
        "counterparty_account_id": "136",
        "iban_receiver": "1",
        "paymentdate": "28/08/2020",
        "reference": "1",
        "saldo": "-10.4",
        "taplajikd": "162",
        "tstamp": "2020-08-28 13:20:00",
        "valuedate": "28/08/2020",
        "vientiselitekd": "0"
    },
    {
        "accountno": "2",
        "amount": "-30.16",
        "bic_receiver": "OKOYFIHH",
        "bookdate": "23/11/2020",
        "category": "Lapset",
        "counterparty_account_id": "8",
        "iban_receiver": "0",
        "paymentdate": "23/11/2020",
        "reference": "0",
        "saldo": "6616.2",
        "taplajikd": "106",
        "tstamp": "2020-11-23 21:49:05",
        "valuedate": "23/11/2020",
        "vientiselitekd": "0"
    },
    {
        "accountno": "3",
        "amount": "-51.68",
        "bic_receiver": "",
        "bookdate": "28/06/2019",
        "category": "Lapset",
        "counterparty_account_id": "90",
        "iban_receiver": "1",
        "paymentdate": "28/06/2019",
        "reference": "1",
        "saldo": "68948.19",
        "taplajikd": "162",
        "tstamp": "2019-06-28 9:06:12",
        "valuedate": "28/06/2019",
        "vientiselitekd": "0"
    },
    {
        "accountno": "3",
        "amount": "-24.78",
        "bic_receiver": "",
        "bookdate": "23/07/2019",
        "category": "Lapset",
        "counterparty_account_id": "135",
        "iban_receiver": "1",
        "paymentdate": "23/07/2019",
        "reference": "1",
        "saldo": "69049.22",
        "taplajikd": "162",
        "tstamp": "2019-07-23 16:00:00",
        "valuedate": "23/07/2019",
        "vientiselitekd": "0"
    },
    {
        "accountno": "3",
        "amount": "-45.03",
        "bic_receiver": "",
        "bookdate": "02/06/2020",
        "category": "Lapset",
        "counterparty_account_id": "86",
        "iban_receiver": "1",
        "paymentdate": "01/06/2020",
        "reference": "1",
        "saldo": "26063.79",
        "taplajikd": "162",
        "tstamp": "2020-06-02 21:14:08",
        "valuedate": "02/06/2020",
        "vientiselitekd": "0"
    },
    {
        "accountno": "3",
        "amount": "-11.91",
        "bic_receiver": "",
        "bookdate": "08/06/2020",
        "category": "Lapset",
        "counterparty_account_id": "116",
        "iban_receiver": "1",
        "paymentdate": "08/06/2020",
        "reference": "1",
        "saldo": "25184.21",
        "taplajikd": "162",
        "tstamp": "2020-06-08 21:51:50",
        "valuedate": "08/06/2020",
        "vientiselitekd": "0"
    },
    {
        "accountno": "3",
        "amount": "-174.76",
        "bic_receiver": "",
        "bookdate": "29/06/2020",
        "category": "Lapset",
        "counterparty_account_id": "124",
        "iban_receiver": "1",
        "paymentdate": "29/06/2020",
        "reference": "1",
        "saldo": "21342.59",
        "taplajikd": "162",
        "tstamp": "2020-06-29 12:41:28",
        "valuedate": "29/06/2020",
        "vientiselitekd": "0"
    },
    {
        "accountno": "3",
        "amount": "-14.03",
        "bic_receiver": "",
        "bookdate": "27/07/2020",
        "category": "Lapset",
        "counterparty_account_id": "92",
        "iban_receiver": "1",
        "paymentdate": "27/07/2020",
        "reference": "1",
        "saldo": "25805.26",
        "taplajikd": "162",
        "tstamp": "2020-07-27 12:42:21",
        "valuedate": "27/07/2020",
        "vientiselitekd": "0"
    },
    {
        "accountno": "3",
        "amount": "-4.26",
        "bic_receiver": "",
        "bookdate": "27/07/2020",
        "category": "Lapset",
        "counterparty_account_id": "119",
        "iban_receiver": "1",
        "paymentdate": "27/07/2020",
        "reference": "1",
        "saldo": "25772",
        "taplajikd": "162",
        "tstamp": "2020-07-27 20:39:47",
        "valuedate": "27/07/2020",
        "vientiselitekd": "0"
    },
    {
        "accountno": "3",
        "amount": "-303.57",
        "bic_receiver": "",
        "bookdate": "07/09/2020",
        "category": "Lapset",
        "counterparty_account_id": "92",
        "iban_receiver": "1",
        "paymentdate": "07/09/2020",
        "reference": "1",
        "saldo": "44518.86",
        "taplajikd": "162",
        "tstamp": "2020-09-07 13:39:51",
        "valuedate": "07/09/2020",
        "vientiselitekd": "0"
    },
    {
        "accountno": "3",
        "amount": "-56.36",
        "bic_receiver": "OKOYFIHH",
        "bookdate": "12/10/2020",
        "category": "Lapset",
        "counterparty_account_id": "213",
        "iban_receiver": "0",
        "paymentdate": "12/10/2020",
        "reference": "0",
        "saldo": "17617.05",
        "taplajikd": "129",
        "tstamp": "2020-10-12 3:08:14",
        "valuedate": "12/10/2020",
        "vientiselitekd": "706"
    },
    {
        "accountno": "3",
        "amount": "-39.21",
        "bic_receiver": "",
        "bookdate": "09/11/2020",
        "category": "Lapset",
        "counterparty_account_id": "102",
        "iban_receiver": "1",
        "paymentdate": "09/11/2020",
        "reference": "1",
        "saldo": "21467.89",
        "taplajikd": "162",
        "tstamp": "2020-11-09 12:59:01",
        "valuedate": "09/11/2020",
        "vientiselitekd": "0"
    },
    {
        "accountno": "1",
        "amount": "-10.51",
        "bic_receiver": "",
        "bookdate": "31/01/2019",
        "category": "Lemmikit",
        "counterparty_account_id": "80",
        "iban_receiver": "1",
        "paymentdate": "31/01/2019",
        "reference": "1",
        "saldo": "-518.94",
        "taplajikd": "162",
        "tstamp": "2019-01-31 17:02:48",
        "valuedate": "31/01/2019",
        "vientiselitekd": "0"
    },
    {
        "accountno": "1",
        "amount": "-3.64",
        "bic_receiver": "",
        "bookdate": "12/03/2019",
        "category": "Lemmikit",
        "counterparty_account_id": "80",
        "iban_receiver": "1",
        "paymentdate": "12/03/2019",
        "reference": "1",
        "saldo": "24.35",
        "taplajikd": "162",
        "tstamp": "2019-03-12 23:09:28",
        "valuedate": "12/03/2019",
        "vientiselitekd": "0"
    },
    {
        "accountno": "1",
        "amount": "-8.59",
        "bic_receiver": "OKOYFIHH",
        "bookdate": "14/03/2019",
        "category": "Lemmikit",
        "counterparty_account_id": "13",
        "iban_receiver": "0",
        "paymentdate": "14/03/2019",
        "reference": "1",
        "saldo": "15.76",
        "taplajikd": "106",
        "tstamp": "2019-03-14 1:15:47",
        "valuedate": "14/03/2019",
        "vientiselitekd": "0"
    },
    {
        "accountno": "1",
        "amount": "-29.06",
        "bic_receiver": "",
        "bookdate": "08/04/2019",
        "category": "Lemmikit",
        "counterparty_account_id": "95",
        "iban_receiver": "1",
        "paymentdate": "08/04/2019",
        "reference": "1",
        "saldo": "-53.57",
        "taplajikd": "162",
        "tstamp": "2019-04-08 13:44:51",
        "valuedate": "08/04/2019",
        "vientiselitekd": "0"
    },
    {
        "accountno": "1",
        "amount": "-14.23",
        "bic_receiver": "",
        "bookdate": "06/05/2019",
        "category": "Lemmikit",
        "counterparty_account_id": "142",
        "iban_receiver": "1",
        "paymentdate": "06/05/2019",
        "reference": "1",
        "saldo": "-65.42",
        "taplajikd": "162",
        "tstamp": "2019-05-06 11:50:53",
        "valuedate": "06/05/2019",
        "vientiselitekd": "0"
    },
    {
        "accountno": "1",
        "amount": "-5.56",
        "bic_receiver": "",
        "bookdate": "13/05/2019",
        "category": "Lemmikit",
        "counterparty_account_id": "65",
        "iban_receiver": "1",
        "paymentdate": "13/05/2019",
        "reference": "1",
        "saldo": "-152.95",
        "taplajikd": "162",
        "tstamp": "2019-05-13 13:22:02",
        "valuedate": "13/05/2019",
        "vientiselitekd": "0"
    },
    {
        "accountno": "1",
        "amount": "-2.34",
        "bic_receiver": "",
        "bookdate": "20/05/2019",
        "category": "Lemmikit",
        "counterparty_account_id": "118",
        "iban_receiver": "1",
        "paymentdate": "20/05/2019",
        "reference": "1",
        "saldo": "-226.97",
        "taplajikd": "162",
        "tstamp": "2019-05-20 9:43:17",
        "valuedate": "20/05/2019",
        "vientiselitekd": "0"
    },
    {
        "accountno": "1",
        "amount": "-2.1",
        "bic_receiver": "",
        "bookdate": "27/05/2019",
        "category": "Lemmikit",
        "counterparty_account_id": "100",
        "iban_receiver": "1",
        "paymentdate": "27/05/2019",
        "reference": "1",
        "saldo": "-362.44",
        "taplajikd": "162",
        "tstamp": "2019-05-27 11:14:26",
        "valuedate": "27/05/2019",
        "vientiselitekd": "0"
    },
    {
        "accountno": "1",
        "amount": "-1.65",
        "bic_receiver": "",
        "bookdate": "14/06/2019",
        "category": "Lemmikit",
        "counterparty_account_id": "65",
        "iban_receiver": "1",
        "paymentdate": "14/06/2019",
        "reference": "1",
        "saldo": "-375.72",
        "taplajikd": "162",
        "tstamp": "2019-06-14 22:35:18",
        "valuedate": "14/06/2019",
        "vientiselitekd": "0"
    },
    {
        "accountno": "1",
        "amount": "-21.94",
        "bic_receiver": "",
        "bookdate": "19/08/2019",
        "category": "Lemmikit",
        "counterparty_account_id": "122",
        "iban_receiver": "1",
        "paymentdate": "19/08/2019",
        "reference": "1",
        "saldo": "364.33",
        "taplajikd": "162",
        "tstamp": "2019-08-19 9:41:03",
        "valuedate": "19/08/2019",
        "vientiselitekd": "0"
    },
    {
        "accountno": "1",
        "amount": "-1.44",
        "bic_receiver": "",
        "bookdate": "20/09/2019",
        "category": "Lemmikit",
        "counterparty_account_id": "68",
        "iban_receiver": "1",
        "paymentdate": "20/09/2019",
        "reference": "1",
        "saldo": "-117.27",
        "taplajikd": "162",
        "tstamp": "2019-09-20 11:42:26",
        "valuedate": "20/09/2019",
        "vientiselitekd": "0"
    },
    {
        "accountno": "1",
        "amount": "-4.7",
        "bic_receiver": "",
        "bookdate": "08/10/2019",
        "category": "Lemmikit",
        "counterparty_account_id": "148",
        "iban_receiver": "1",
        "paymentdate": "08/10/2019",
        "reference": "1",
        "saldo": "-57.69",
        "taplajikd": "162",
        "tstamp": "2019-10-08 15:08:18",
        "valuedate": "08/10/2019",
        "vientiselitekd": "0"
    },
    {
        "accountno": "1",
        "amount": "-27.92",
        "bic_receiver": "OKOYFIHH",
        "bookdate": "05/11/2019",
        "category": "Lemmikit",
        "counterparty_account_id": "9",
        "iban_receiver": "0",
        "paymentdate": "05/11/2019",
        "reference": "0",
        "saldo": "-475.72",
        "taplajikd": "106",
        "tstamp": "2019-11-05 9:41:17",
        "valuedate": "05/11/2019",
        "vientiselitekd": "0"
    },
    {
        "accountno": "1",
        "amount": "-6.07",
        "bic_receiver": "",
        "bookdate": "29/11/2019",
        "category": "Lemmikit",
        "counterparty_account_id": "119",
        "iban_receiver": "1",
        "paymentdate": "29/11/2019",
        "reference": "1",
        "saldo": "-387.61",
        "taplajikd": "162",
        "tstamp": "2019-11-29 14:58:21",
        "valuedate": "29/11/2019",
        "vientiselitekd": "0"
    },
    {
        "accountno": "1",
        "amount": "-52.35",
        "bic_receiver": "",
        "bookdate": "10/12/2019",
        "category": "Lemmikit",
        "counterparty_account_id": "98",
        "iban_receiver": "1",
        "paymentdate": "10/12/2019",
        "reference": "1",
        "saldo": "-854.1",
        "taplajikd": "162",
        "tstamp": "2019-12-10 4:26:40",
        "valuedate": "10/12/2019",
        "vientiselitekd": "0"
    },
    {
        "accountno": "1",
        "amount": "-5.85",
        "bic_receiver": "",
        "bookdate": "13/04/2020",
        "category": "Lemmikit",
        "counterparty_account_id": "159",
        "iban_receiver": "1",
        "paymentdate": "13/04/2020",
        "reference": "1",
        "saldo": "100.37",
        "taplajikd": "162",
        "tstamp": "2020-04-13 13:09:41",
        "valuedate": "13/04/2020",
        "vientiselitekd": "0"
    },
    {
        "accountno": "1",
        "amount": "-27.06",
        "bic_receiver": "",
        "bookdate": "24/04/2020",
        "category": "Lemmikit",
        "counterparty_account_id": "84",
        "iban_receiver": "1",
        "paymentdate": "24/04/2020",
        "reference": "1",
        "saldo": "17.06",
        "taplajikd": "162",
        "tstamp": "2020-04-24 5:25:10",
        "valuedate": "24/04/2020",
        "vientiselitekd": "0"
    },
    {
        "accountno": "1",
        "amount": "-14.42",
        "bic_receiver": "",
        "bookdate": "11/06/2020",
        "category": "Lemmikit",
        "counterparty_account_id": "57",
        "iban_receiver": "1",
        "paymentdate": "11/06/2020",
        "reference": "1",
        "saldo": "-263.7",
        "taplajikd": "162",
        "tstamp": "2020-06-11 4:04:04",
        "valuedate": "11/06/2020",
        "vientiselitekd": "0"
    },
    {
        "accountno": "1",
        "amount": "-4.2",
        "bic_receiver": "",
        "bookdate": "31/08/2020",
        "category": "Lemmikit",
        "counterparty_account_id": "58",
        "iban_receiver": "1",
        "paymentdate": "31/08/2020",
        "reference": "1",
        "saldo": "-0.34",
        "taplajikd": "162",
        "tstamp": "2020-08-31 14:34:56",
        "valuedate": "31/08/2020",
        "vientiselitekd": "0"
    },
    {
        "accountno": "1",
        "amount": "-7.39",
        "bic_receiver": "",
        "bookdate": "13/10/2020",
        "category": "Lemmikit",
        "counterparty_account_id": "74",
        "iban_receiver": "1",
        "paymentdate": "13/10/2020",
        "reference": "1",
        "saldo": "-641.63",
        "taplajikd": "162",
        "tstamp": "2020-10-13 22:18:30",
        "valuedate": "13/10/2020",
        "vientiselitekd": "0"
    },
    {
        "accountno": "1",
        "amount": "-11.14",
        "bic_receiver": "",
        "bookdate": "03/11/2020",
        "category": "Lemmikit",
        "counterparty_account_id": "95",
        "iban_receiver": "1",
        "paymentdate": "03/11/2020",
        "reference": "1",
        "saldo": "-96.51",
        "taplajikd": "162",
        "tstamp": "2020-11-03 23:24:18",
        "valuedate": "03/11/2020",
        "vientiselitekd": "0"
    },
    {
        "accountno": "1",
        "amount": "-2.97",
        "bic_receiver": "",
        "bookdate": "23/11/2020",
        "category": "Lemmikit",
        "counterparty_account_id": "50",
        "iban_receiver": "1",
        "paymentdate": "23/11/2020",
        "reference": "1",
        "saldo": "-252.51",
        "taplajikd": "162",
        "tstamp": "2020-11-23 19:26:17",
        "valuedate": "23/11/2020",
        "vientiselitekd": "0"
    },
    {
        "accountno": "1",
        "amount": "-27.26",
        "bic_receiver": "",
        "bookdate": "21/12/2020",
        "category": "Lemmikit",
        "counterparty_account_id": "55",
        "iban_receiver": "1",
        "paymentdate": "21/12/2020",
        "reference": "1",
        "saldo": "258.76",
        "taplajikd": "162",
        "tstamp": "2020-12-21 22:59:09",
        "valuedate": "21/12/2020",
        "vientiselitekd": "0"
    },
    {
        "accountno": "1",
        "amount": "-37.13",
        "bic_receiver": "NDEAFIHH",
        "bookdate": "30/12/2020",
        "category": "Lemmikit",
        "counterparty_account_id": "201",
        "iban_receiver": "0",
        "paymentdate": "30/12/2020",
        "reference": "0",
        "saldo": "435.68",
        "taplajikd": "129",
        "tstamp": "2020-12-30 16:33:48",
        "valuedate": "30/12/2020",
        "vientiselitekd": "706"
    },
    {
        "accountno": "2",
        "amount": "-166.97",
        "bic_receiver": "NDEAFIHH",
        "bookdate": "21/03/2019",
        "category": "Lemmikit",
        "counterparty_account_id": "188",
        "iban_receiver": "0",
        "paymentdate": "21/03/2019",
        "reference": "0",
        "saldo": "1805.62",
        "taplajikd": "106",
        "tstamp": "2019-03-21 5:52:39",
        "valuedate": "21/03/2019",
        "vientiselitekd": "706"
    },
    {
        "accountno": "2",
        "amount": "-12.15",
        "bic_receiver": "",
        "bookdate": "13/05/2019",
        "category": "Lemmikit",
        "counterparty_account_id": "90",
        "iban_receiver": "1",
        "paymentdate": "13/05/2019",
        "reference": "1",
        "saldo": "1405.09",
        "taplajikd": "162",
        "tstamp": "2019-05-13 22:02:27",
        "valuedate": "13/05/2019",
        "vientiselitekd": "0"
    },
    {
        "accountno": "2",
        "amount": "-26.75",
        "bic_receiver": "OKOYFIHH",
        "bookdate": "20/06/2019",
        "category": "Lemmikit",
        "counterparty_account_id": "195",
        "iban_receiver": "0",
        "paymentdate": "20/06/2019",
        "reference": "0",
        "saldo": "653.02",
        "taplajikd": "106",
        "tstamp": "2019-06-20 15:16:22",
        "valuedate": "20/06/2019",
        "vientiselitekd": "706"
    },
    {
        "accountno": "2",
        "amount": "-38.63",
        "bic_receiver": "",
        "bookdate": "08/07/2019",
        "category": "Lemmikit",
        "counterparty_account_id": "45",
        "iban_receiver": "1",
        "paymentdate": "08/07/2019",
        "reference": "1",
        "saldo": "3334",
        "taplajikd": "162",
        "tstamp": "2019-07-08 23:11:28",
        "valuedate": "08/07/2019",
        "vientiselitekd": "0"
    },
    {
        "accountno": "2",
        "amount": "-253.2",
        "bic_receiver": "OKOYFIHH",
        "bookdate": "30/07/2019",
        "category": "Lemmikit",
        "counterparty_account_id": "203",
        "iban_receiver": "0",
        "paymentdate": "30/07/2019",
        "reference": "0",
        "saldo": "3193.93",
        "taplajikd": "129",
        "tstamp": "2019-07-30 6:12:08",
        "valuedate": "30/07/2019",
        "vientiselitekd": "706"
    },
    {
        "accountno": "2",
        "amount": "-5.3",
        "bic_receiver": "",
        "bookdate": "14/10/2019",
        "category": "Lemmikit",
        "counterparty_account_id": "112",
        "iban_receiver": "1",
        "paymentdate": "14/10/2019",
        "reference": "1",
        "saldo": "3789.58",
        "taplajikd": "162",
        "tstamp": "2019-10-14 9:36:00",
        "valuedate": "14/10/2019",
        "vientiselitekd": "0"
    },
    {
        "accountno": "2",
        "amount": "-15.22",
        "bic_receiver": "",
        "bookdate": "18/10/2019",
        "category": "Lemmikit",
        "counterparty_account_id": "89",
        "iban_receiver": "1",
        "paymentdate": "18/10/2019",
        "reference": "1",
        "saldo": "3539.01",
        "taplajikd": "162",
        "tstamp": "2019-10-18 2:57:14",
        "valuedate": "18/10/2019",
        "vientiselitekd": "0"
    },
    {
        "accountno": "2",
        "amount": "-40.67",
        "bic_receiver": "",
        "bookdate": "09/12/2019",
        "category": "Lemmikit",
        "counterparty_account_id": "134",
        "iban_receiver": "1",
        "paymentdate": "09/12/2019",
        "reference": "1",
        "saldo": "5138.43",
        "taplajikd": "162",
        "tstamp": "2019-12-09 13:14:29",
        "valuedate": "09/12/2019",
        "vientiselitekd": "0"
    },
    {
        "accountno": "2",
        "amount": "-10.98",
        "bic_receiver": "",
        "bookdate": "13/01/2020",
        "category": "Lemmikit",
        "counterparty_account_id": "99",
        "iban_receiver": "1",
        "paymentdate": "13/01/2020",
        "reference": "1",
        "saldo": "-80.19",
        "taplajikd": "162",
        "tstamp": "2020-01-13 6:32:44",
        "valuedate": "13/01/2020",
        "vientiselitekd": "0"
    },
    {
        "accountno": "2",
        "amount": "-27.35",
        "bic_receiver": "",
        "bookdate": "04/02/2020",
        "category": "Lemmikit",
        "counterparty_account_id": "126",
        "iban_receiver": "1",
        "paymentdate": "04/02/2020",
        "reference": "1",
        "saldo": "135.98",
        "taplajikd": "162",
        "tstamp": "2020-02-04 1:15:47",
        "valuedate": "04/02/2020",
        "vientiselitekd": "0"
    },
    {
        "accountno": "2",
        "amount": "-3.54",
        "bic_receiver": "",
        "bookdate": "25/03/2020",
        "category": "Lemmikit",
        "counterparty_account_id": "54",
        "iban_receiver": "1",
        "paymentdate": "25/03/2020",
        "reference": "1",
        "saldo": "-17.4",
        "taplajikd": "162",
        "tstamp": "2020-03-25 12:42:21",
        "valuedate": "25/03/2020",
        "vientiselitekd": "0"
    },
    {
        "accountno": "2",
        "amount": "-16.61",
        "bic_receiver": "",
        "bookdate": "17/04/2020",
        "category": "Lemmikit",
        "counterparty_account_id": "129",
        "iban_receiver": "1",
        "paymentdate": "17/04/2020",
        "reference": "1",
        "saldo": "-140.35",
        "taplajikd": "162",
        "tstamp": "2020-04-17 17:00:46",
        "valuedate": "17/04/2020",
        "vientiselitekd": "0"
    },
    {
        "accountno": "2",
        "amount": "-8.52",
        "bic_receiver": "",
        "bookdate": "01/05/2020",
        "category": "Lemmikit",
        "counterparty_account_id": "127",
        "iban_receiver": "1",
        "paymentdate": "01/05/2020",
        "reference": "1",
        "saldo": "-309.94",
        "taplajikd": "162",
        "tstamp": "2020-05-01 14:52:24",
        "valuedate": "01/05/2020",
        "vientiselitekd": "0"
    },
    {
        "accountno": "2",
        "amount": "-38.67",
        "bic_receiver": "",
        "bookdate": "15/05/2020",
        "category": "Lemmikit",
        "counterparty_account_id": "78",
        "iban_receiver": "1",
        "paymentdate": "15/05/2020",
        "reference": "1",
        "saldo": "-357.7",
        "taplajikd": "162",
        "tstamp": "2020-05-15 2:21:58",
        "valuedate": "15/05/2020",
        "vientiselitekd": "0"
    },
    {
        "accountno": "2",
        "amount": "-18.35",
        "bic_receiver": "",
        "bookdate": "09/06/2020",
        "category": "Lemmikit",
        "counterparty_account_id": "65",
        "iban_receiver": "1",
        "paymentdate": "09/06/2020",
        "reference": "1",
        "saldo": "1755.05",
        "taplajikd": "162",
        "tstamp": "2020-06-09 16:11:34",
        "valuedate": "09/06/2020",
        "vientiselitekd": "0"
    },
    {
        "accountno": "2",
        "amount": "-15.97",
        "bic_receiver": "",
        "bookdate": "03/07/2020",
        "category": "Lemmikit",
        "counterparty_account_id": "130",
        "iban_receiver": "1",
        "paymentdate": "03/07/2020",
        "reference": "1",
        "saldo": "1148.44",
        "taplajikd": "162",
        "tstamp": "2020-07-03 7:06:40",
        "valuedate": "03/07/2020",
        "vientiselitekd": "0"
    },
    {
        "accountno": "2",
        "amount": "-14.31",
        "bic_receiver": "",
        "bookdate": "16/07/2020",
        "category": "Lemmikit",
        "counterparty_account_id": "79",
        "iban_receiver": "1",
        "paymentdate": "16/07/2020",
        "reference": "1",
        "saldo": "165.77",
        "taplajikd": "162",
        "tstamp": "2020-07-16 1:46:40",
        "valuedate": "16/07/2020",
        "vientiselitekd": "0"
    },
    {
        "accountno": "2",
        "amount": "-4.24",
        "bic_receiver": "",
        "bookdate": "10/08/2020",
        "category": "Lemmikit",
        "counterparty_account_id": "27",
        "iban_receiver": "1",
        "paymentdate": "10/08/2020",
        "reference": "1",
        "saldo": "689.51",
        "taplajikd": "162",
        "tstamp": "2020-08-10 11:29:14",
        "valuedate": "10/08/2020",
        "vientiselitekd": "0"
    },
    {
        "accountno": "2",
        "amount": "-1.4",
        "bic_receiver": "",
        "bookdate": "27/08/2020",
        "category": "Lemmikit",
        "counterparty_account_id": "90",
        "iban_receiver": "1",
        "paymentdate": "27/08/2020",
        "reference": "1",
        "saldo": "5.07",
        "taplajikd": "162",
        "tstamp": "2020-08-27 21:44:37",
        "valuedate": "27/08/2020",
        "vientiselitekd": "0"
    },
    {
        "accountno": "2",
        "amount": "-10.18",
        "bic_receiver": "",
        "bookdate": "08/09/2020",
        "category": "Lemmikit",
        "counterparty_account_id": "26",
        "iban_receiver": "1",
        "paymentdate": "08/09/2020",
        "reference": "1",
        "saldo": "4593.25",
        "taplajikd": "162",
        "tstamp": "2020-09-08 9:46:40",
        "valuedate": "08/09/2020",
        "vientiselitekd": "0"
    },
    {
        "accountno": "2",
        "amount": "-32.35",
        "bic_receiver": "",
        "bookdate": "10/09/2020",
        "category": "Lemmikit",
        "counterparty_account_id": "57",
        "iban_receiver": "1",
        "paymentdate": "10/09/2020",
        "reference": "1",
        "saldo": "4458.31",
        "taplajikd": "162",
        "tstamp": "2020-09-10 20:26:40",
        "valuedate": "10/09/2020",
        "vientiselitekd": "0"
    },
    {
        "accountno": "2",
        "amount": "-3.07",
        "bic_receiver": "",
        "bookdate": "25/09/2020",
        "category": "Lemmikit",
        "counterparty_account_id": "67",
        "iban_receiver": "1",
        "paymentdate": "25/09/2020",
        "reference": "1",
        "saldo": "2763.61",
        "taplajikd": "162",
        "tstamp": "2020-09-25 10:40:00",
        "valuedate": "25/09/2020",
        "vientiselitekd": "0"
    },
    {
        "accountno": "3",
        "amount": "-6.69",
        "bic_receiver": "",
        "bookdate": "16/04/2019",
        "category": "Lemmikit",
        "counterparty_account_id": "102",
        "iban_receiver": "1",
        "paymentdate": "16/04/2019",
        "reference": "1",
        "saldo": "61010.26",
        "taplajikd": "162",
        "tstamp": "2019-04-16 14:47:40",
        "valuedate": "16/04/2019",
        "vientiselitekd": "0"
    },
    {
        "accountno": "3",
        "amount": "-45.54",
        "bic_receiver": "",
        "bookdate": "02/05/2019",
        "category": "Lemmikit",
        "counterparty_account_id": "106",
        "iban_receiver": "1",
        "paymentdate": "02/05/2019",
        "reference": "1",
        "saldo": "66306.49",
        "taplajikd": "162",
        "tstamp": "2019-05-02 15:40:48",
        "valuedate": "02/05/2019",
        "vientiselitekd": "0"
    },
    {
        "accountno": "3",
        "amount": "-53.64",
        "bic_receiver": "",
        "bookdate": "16/05/2019",
        "category": "Lemmikit",
        "counterparty_account_id": "50",
        "iban_receiver": "1",
        "paymentdate": "16/05/2019",
        "reference": "1",
        "saldo": "66207.94",
        "taplajikd": "162",
        "tstamp": "2019-05-16 12:48:00",
        "valuedate": "16/05/2019",
        "vientiselitekd": "0"
    },
    {
        "accountno": "3",
        "amount": "-24.6",
        "bic_receiver": "",
        "bookdate": "03/06/2019",
        "category": "Lemmikit",
        "counterparty_account_id": "113",
        "iban_receiver": "1",
        "paymentdate": "03/06/2019",
        "reference": "1",
        "saldo": "63044.77",
        "taplajikd": "162",
        "tstamp": "2019-06-03 13:14:29",
        "valuedate": "03/06/2019",
        "vientiselitekd": "0"
    },
    {
        "accountno": "3",
        "amount": "-18.3",
        "bic_receiver": "",
        "bookdate": "17/06/2019",
        "category": "Lemmikit",
        "counterparty_account_id": "142",
        "iban_receiver": "1",
        "paymentdate": "17/06/2019",
        "reference": "1",
        "saldo": "69192.64",
        "taplajikd": "162",
        "tstamp": "2019-06-17 7:26:54",
        "valuedate": "17/06/2019",
        "vientiselitekd": "0"
    },
    {
        "accountno": "3",
        "amount": "-94.31",
        "bic_receiver": "",
        "bookdate": "17/07/2019",
        "category": "Lemmikit",
        "counterparty_account_id": "87",
        "iban_receiver": "1",
        "paymentdate": "17/07/2019",
        "reference": "1",
        "saldo": "69025.48",
        "taplajikd": "162",
        "tstamp": "2019-07-17 9:22:46",
        "valuedate": "17/07/2019",
        "vientiselitekd": "0"
    },
    {
        "accountno": "3",
        "amount": "-25.24",
        "bic_receiver": "",
        "bookdate": "27/09/2019",
        "category": "Lemmikit",
        "counterparty_account_id": "80",
        "iban_receiver": "1",
        "paymentdate": "27/09/2019",
        "reference": "1",
        "saldo": "71905.91",
        "taplajikd": "162",
        "tstamp": "2019-09-27 13:22:37",
        "valuedate": "27/09/2019",
        "vientiselitekd": "0"
    },
    {
        "accountno": "3",
        "amount": "-25.98",
        "bic_receiver": "OKOYFIHH",
        "bookdate": "27/11/2019",
        "category": "Lemmikit",
        "counterparty_account_id": "34",
        "iban_receiver": "0",
        "paymentdate": "27/11/2019",
        "reference": "0",
        "saldo": "24552.14",
        "taplajikd": "106",
        "tstamp": "2019-11-27 3:52:15",
        "valuedate": "27/11/2019",
        "vientiselitekd": "0"
    },
    {
        "accountno": "3",
        "amount": "-37.74",
        "bic_receiver": "",
        "bookdate": "13/01/2020",
        "category": "Lemmikit",
        "counterparty_account_id": "95",
        "iban_receiver": "1",
        "paymentdate": "13/01/2020",
        "reference": "1",
        "saldo": "28696.12",
        "taplajikd": "162",
        "tstamp": "2020-01-13 8:56:28",
        "valuedate": "13/01/2020",
        "vientiselitekd": "0"
    },
    {
        "accountno": "3",
        "amount": "-46.65",
        "bic_receiver": "",
        "bookdate": "03/04/2020",
        "category": "Lemmikit",
        "counterparty_account_id": "81",
        "iban_receiver": "1",
        "paymentdate": "03/04/2020",
        "reference": "1",
        "saldo": "29755.52",
        "taplajikd": "162",
        "tstamp": "2020-04-03 18:58:36",
        "valuedate": "03/04/2020",
        "vientiselitekd": "0"
    },
    {
        "accountno": "3",
        "amount": "-8.64",
        "bic_receiver": "",
        "bookdate": "03/06/2020",
        "category": "Lemmikit",
        "counterparty_account_id": "105",
        "iban_receiver": "1",
        "paymentdate": "03/06/2020",
        "reference": "1",
        "saldo": "26055.15",
        "taplajikd": "162",
        "tstamp": "2020-06-03 4:46:30",
        "valuedate": "03/06/2020",
        "vientiselitekd": "0"
    },
    {
        "accountno": "3",
        "amount": "-6.95",
        "bic_receiver": "",
        "bookdate": "04/06/2020",
        "category": "Lemmikit",
        "counterparty_account_id": "49",
        "iban_receiver": "1",
        "paymentdate": "04/06/2020",
        "reference": "1",
        "saldo": "26003.03",
        "taplajikd": "162",
        "tstamp": "2020-06-04 3:23:34",
        "valuedate": "04/06/2020",
        "vientiselitekd": "0"
    },
    {
        "accountno": "3",
        "amount": "-14.96",
        "bic_receiver": "",
        "bookdate": "25/06/2020",
        "category": "Lemmikit",
        "counterparty_account_id": "92",
        "iban_receiver": "1",
        "paymentdate": "25/06/2020",
        "reference": "1",
        "saldo": "22158.23",
        "taplajikd": "162",
        "tstamp": "2020-06-25 18:13:12",
        "valuedate": "25/06/2020",
        "vientiselitekd": "0"
    },
    {
        "accountno": "3",
        "amount": "-10.83",
        "bic_receiver": "",
        "bookdate": "23/07/2020",
        "category": "Lemmikit",
        "counterparty_account_id": "110",
        "iban_receiver": "1",
        "paymentdate": "23/07/2020",
        "reference": "1",
        "saldo": "19891.42",
        "taplajikd": "162",
        "tstamp": "2020-07-23 5:00:19",
        "valuedate": "23/07/2020",
        "vientiselitekd": "0"
    },
    {
        "accountno": "3",
        "amount": "-57.38",
        "bic_receiver": "",
        "bookdate": "03/08/2020",
        "category": "Lemmikit",
        "counterparty_account_id": "110",
        "iban_receiver": "1",
        "paymentdate": "03/08/2020",
        "reference": "1",
        "saldo": "23541.61",
        "taplajikd": "162",
        "tstamp": "2020-08-03 10:36:17",
        "valuedate": "03/08/2020",
        "vientiselitekd": "0"
    },
    {
        "accountno": "3",
        "amount": "-33.29",
        "bic_receiver": "",
        "bookdate": "04/09/2020",
        "category": "Lemmikit",
        "counterparty_account_id": "71",
        "iban_receiver": "1",
        "paymentdate": "04/09/2020",
        "reference": "1",
        "saldo": "41388.97",
        "taplajikd": "162",
        "tstamp": "2020-09-04 22:35:55",
        "valuedate": "04/09/2020",
        "vientiselitekd": "0"
    },
    {
        "accountno": "3",
        "amount": "-60.38",
        "bic_receiver": "",
        "bookdate": "09/09/2020",
        "category": "Lemmikit",
        "counterparty_account_id": "98",
        "iban_receiver": "1",
        "paymentdate": "09/09/2020",
        "reference": "1",
        "saldo": "45848.57",
        "taplajikd": "162",
        "tstamp": "2020-09-09 15:14:27",
        "valuedate": "09/09/2020",
        "vientiselitekd": "0"
    },
    {
        "accountno": "3",
        "amount": "-9.63",
        "bic_receiver": "",
        "bookdate": "24/09/2020",
        "category": "Lemmikit",
        "counterparty_account_id": "102",
        "iban_receiver": "1",
        "paymentdate": "24/09/2020",
        "reference": "1",
        "saldo": "43584.72",
        "taplajikd": "162",
        "tstamp": "2020-09-24 2:06:08",
        "valuedate": "24/09/2020",
        "vientiselitekd": "0"
    },
    {
        "accountno": "3",
        "amount": "-30.71",
        "bic_receiver": "OKOYFIHH",
        "bookdate": "05/10/2020",
        "category": "Lemmikit",
        "counterparty_account_id": "25",
        "iban_receiver": "0",
        "paymentdate": "05/10/2020",
        "reference": "1",
        "saldo": "13023.8",
        "taplajikd": "106",
        "tstamp": "2020-10-05 1:15:18",
        "valuedate": "05/10/2020",
        "vientiselitekd": "0"
    },
    {
        "accountno": "3",
        "amount": "-4.37",
        "bic_receiver": "",
        "bookdate": "16/11/2020",
        "category": "Lemmikit",
        "counterparty_account_id": "91",
        "iban_receiver": "1",
        "paymentdate": "16/11/2020",
        "reference": "1",
        "saldo": "25422.85",
        "taplajikd": "162",
        "tstamp": "2020-11-16 10:37:23",
        "valuedate": "16/11/2020",
        "vientiselitekd": "0"
    },
    {
        "accountno": "3",
        "amount": "-47.41",
        "bic_receiver": "",
        "bookdate": "04/12/2020",
        "category": "Lemmikit",
        "counterparty_account_id": "85",
        "iban_receiver": "1",
        "paymentdate": "04/12/2020",
        "reference": "1",
        "saldo": "25189.44",
        "taplajikd": "162",
        "tstamp": "2020-12-04 1:56:16",
        "valuedate": "04/12/2020",
        "vientiselitekd": "0"
    },
    {
        "accountno": "3",
        "amount": "-23.93",
        "bic_receiver": "",
        "bookdate": "04/12/2020",
        "category": "Lemmikit",
        "counterparty_account_id": "135",
        "iban_receiver": "1",
        "paymentdate": "04/12/2020",
        "reference": "1",
        "saldo": "25165.51",
        "taplajikd": "162",
        "tstamp": "2020-12-04 11:10:48",
        "valuedate": "04/12/2020",
        "vientiselitekd": "0"
    },
    {
        "accountno": "1",
        "amount": "-5.62",
        "bic_receiver": "",
        "bookdate": "03/01/2019",
        "category": "Liikkuminen",
        "counterparty_account_id": "50",
        "iban_receiver": "1",
        "paymentdate": "03/01/2019",
        "reference": "1",
        "saldo": "20.87",
        "taplajikd": "162",
        "tstamp": "2019-01-03 21:31:58",
        "valuedate": "03/01/2019",
        "vientiselitekd": "0"
    },
    {
        "accountno": "1",
        "amount": "-2.02",
        "bic_receiver": "",
        "bookdate": "21/01/2019",
        "category": "Liikkuminen",
        "counterparty_account_id": "33",
        "iban_receiver": "1",
        "paymentdate": "21/01/2019",
        "reference": "1",
        "saldo": "-138.12",
        "taplajikd": "162",
        "tstamp": "2019-01-21 20:38:08",
        "valuedate": "21/01/2019",
        "vientiselitekd": "0"
    },
    {
        "accountno": "1",
        "amount": "-8.27",
        "bic_receiver": "OKOYFIHH",
        "bookdate": "31/01/2019",
        "category": "Liikkuminen",
        "counterparty_account_id": "198",
        "iban_receiver": "0",
        "paymentdate": "31/01/2019",
        "reference": "0",
        "saldo": "-508.43",
        "taplajikd": "129",
        "tstamp": "2019-01-31 3:08:25",
        "valuedate": "31/01/2019",
        "vientiselitekd": "706"
    },
    {
        "accountno": "1",
        "amount": "-90.95",
        "bic_receiver": "",
        "bookdate": "18/03/2019",
        "category": "Liikkuminen",
        "counterparty_account_id": "133",
        "iban_receiver": "1",
        "paymentdate": "18/03/2019",
        "reference": "1",
        "saldo": "-22.35",
        "taplajikd": "162",
        "tstamp": "2019-03-18 7:34:44",
        "valuedate": "18/03/2019",
        "vientiselitekd": "0"
    },
    {
        "accountno": "1",
        "amount": "-9.49",
        "bic_receiver": "",
        "bookdate": "02/04/2019",
        "category": "Liikkuminen",
        "counterparty_account_id": "103",
        "iban_receiver": "1",
        "paymentdate": "02/04/2019",
        "reference": "1",
        "saldo": "82.55",
        "taplajikd": "162",
        "tstamp": "2019-04-02 3:57:40",
        "valuedate": "02/04/2019",
        "vientiselitekd": "0"
    },
    {
        "accountno": "1",
        "amount": "-39.31",
        "bic_receiver": "",
        "bookdate": "03/04/2019",
        "category": "Liikkuminen",
        "counterparty_account_id": "112",
        "iban_receiver": "1",
        "paymentdate": "03/04/2019",
        "reference": "1",
        "saldo": "40.07",
        "taplajikd": "162",
        "tstamp": "2019-04-03 7:55:20",
        "valuedate": "03/04/2019",
        "vientiselitekd": "0"
    },
    {
        "accountno": "1",
        "amount": "-5.87",
        "bic_receiver": "",
        "bookdate": "04/04/2019",
        "category": "Liikkuminen",
        "counterparty_account_id": "51",
        "iban_receiver": "1",
        "paymentdate": "04/04/2019",
        "reference": "1",
        "saldo": "16.61",
        "taplajikd": "162",
        "tstamp": "2019-04-04 11:53:01",
        "valuedate": "04/04/2019",
        "vientiselitekd": "0"
    },
    {
        "accountno": "1",
        "amount": "-4.74",
        "bic_receiver": "",
        "bookdate": "12/04/2019",
        "category": "Liikkuminen",
        "counterparty_account_id": "111",
        "iban_receiver": "1",
        "paymentdate": "12/04/2019",
        "reference": "1",
        "saldo": "-89.11",
        "taplajikd": "162",
        "tstamp": "2019-04-12 5:35:32",
        "valuedate": "12/04/2019",
        "vientiselitekd": "0"
    },
    {
        "accountno": "1",
        "amount": "-3.15",
        "bic_receiver": "",
        "bookdate": "15/04/2019",
        "category": "Liikkuminen",
        "counterparty_account_id": "94",
        "iban_receiver": "1",
        "paymentdate": "15/04/2019",
        "reference": "1",
        "saldo": "-93.52",
        "taplajikd": "162",
        "tstamp": "2019-04-15 9:33:12",
        "valuedate": "15/04/2019",
        "vientiselitekd": "0"
    },
    {
        "accountno": "1",
        "amount": "-4.44",
        "bic_receiver": "",
        "bookdate": "15/04/2019",
        "category": "Liikkuminen",
        "counterparty_account_id": "100",
        "iban_receiver": "1",
        "paymentdate": "15/04/2019",
        "reference": "1",
        "saldo": "-102.27",
        "taplajikd": "162",
        "tstamp": "2019-04-15 19:34:22",
        "valuedate": "15/04/2019",
        "vientiselitekd": "0"
    },
    {
        "accountno": "1",
        "amount": "-4.17",
        "bic_receiver": "",
        "bookdate": "26/04/2019",
        "category": "Liikkuminen",
        "counterparty_account_id": "153",
        "iban_receiver": "1",
        "paymentdate": "26/04/2019",
        "reference": "1",
        "saldo": "326.74",
        "taplajikd": "162",
        "tstamp": "2019-04-26 23:04:05",
        "valuedate": "26/04/2019",
        "vientiselitekd": "0"
    },
    {
        "accountno": "1",
        "amount": "-14.16",
        "bic_receiver": "",
        "bookdate": "29/04/2019",
        "category": "Liikkuminen",
        "counterparty_account_id": "101",
        "iban_receiver": "1",
        "paymentdate": "29/04/2019",
        "reference": "1",
        "saldo": "307.4",
        "taplajikd": "162",
        "tstamp": "2019-04-29 13:02:55",
        "valuedate": "29/04/2019",
        "vientiselitekd": "0"
    },
    {
        "accountno": "1",
        "amount": "-56.06",
        "bic_receiver": "",
        "bookdate": "29/04/2019",
        "category": "Liikkuminen",
        "counterparty_account_id": "111",
        "iban_receiver": "1",
        "paymentdate": "29/04/2019",
        "reference": "1",
        "saldo": "251.34",
        "taplajikd": "162",
        "tstamp": "2019-04-29 17:00:35",
        "valuedate": "29/04/2019",
        "vientiselitekd": "0"
    },
    {
        "accountno": "1",
        "amount": "-7.08",
        "bic_receiver": "",
        "bookdate": "10/05/2019",
        "category": "Liikkuminen",
        "counterparty_account_id": "137",
        "iban_receiver": "1",
        "paymentdate": "10/05/2019",
        "reference": "1",
        "saldo": "-142.45",
        "taplajikd": "162",
        "tstamp": "2019-05-10 4:51:39",
        "valuedate": "10/05/2019",
        "vientiselitekd": "0"
    },
    {
        "accountno": "1",
        "amount": "-6.66",
        "bic_receiver": "",
        "bookdate": "17/06/2019",
        "category": "Liikkuminen",
        "counterparty_account_id": "121",
        "iban_receiver": "1",
        "paymentdate": "17/06/2019",
        "reference": "1",
        "saldo": "-382.38",
        "taplajikd": "162",
        "tstamp": "2019-06-17 7:03:32",
        "valuedate": "17/06/2019",
        "vientiselitekd": "0"
    },
    {
        "accountno": "1",
        "amount": "-2.11",
        "bic_receiver": "",
        "bookdate": "19/06/2019",
        "category": "Liikkuminen",
        "counterparty_account_id": "37",
        "iban_receiver": "1",
        "paymentdate": "19/06/2019",
        "reference": "1",
        "saldo": "-388.71",
        "taplajikd": "162",
        "tstamp": "2019-06-19 19:45:53",
        "valuedate": "19/06/2019",
        "vientiselitekd": "0"
    },
    {
        "accountno": "1",
        "amount": "-13.72",
        "bic_receiver": "",
        "bookdate": "25/07/2019",
        "category": "Liikkuminen",
        "counterparty_account_id": "77",
        "iban_receiver": "1",
        "paymentdate": "25/07/2019",
        "reference": "1",
        "saldo": "-293.19",
        "taplajikd": "162",
        "tstamp": "2019-07-25 0:25:16",
        "valuedate": "25/07/2019",
        "vientiselitekd": "0"
    },
    {
        "accountno": "1",
        "amount": "-76.35",
        "bic_receiver": "",
        "bookdate": "09/08/2019",
        "category": "Liikkuminen",
        "counterparty_account_id": "68",
        "iban_receiver": "1",
        "paymentdate": "09/08/2019",
        "reference": "1",
        "saldo": "317.73",
        "taplajikd": "162",
        "tstamp": "2019-08-09 16:50:32",
        "valuedate": "09/08/2019",
        "vientiselitekd": "0"
    },
    {
        "accountno": "1",
        "amount": "-10.37",
        "bic_receiver": "",
        "bookdate": "12/08/2019",
        "category": "Liikkuminen",
        "counterparty_account_id": "86",
        "iban_receiver": "1",
        "paymentdate": "12/08/2019",
        "reference": "1",
        "saldo": "307.36",
        "taplajikd": "162",
        "tstamp": "2019-08-12 21:03:09",
        "valuedate": "12/08/2019",
        "vientiselitekd": "0"
    },
    {
        "accountno": "1",
        "amount": "-12.45",
        "bic_receiver": "",
        "bookdate": "14/10/2019",
        "category": "Liikkuminen",
        "counterparty_account_id": "134",
        "iban_receiver": "1",
        "paymentdate": "14/10/2019",
        "reference": "1",
        "saldo": "-173.69",
        "taplajikd": "162",
        "tstamp": "2019-10-14 10:42:28",
        "valuedate": "14/10/2019",
        "vientiselitekd": "0"
    },
    {
        "accountno": "1",
        "amount": "-25.52",
        "bic_receiver": "",
        "bookdate": "28/10/2019",
        "category": "Liikkuminen",
        "counterparty_account_id": "99",
        "iban_receiver": "1",
        "paymentdate": "28/10/2019",
        "reference": "1",
        "saldo": "-337.64",
        "taplajikd": "162",
        "tstamp": "2019-10-28 15:52:37",
        "valuedate": "28/10/2019",
        "vientiselitekd": "0"
    },
    {
        "accountno": "1",
        "amount": "-7.08",
        "bic_receiver": "",
        "bookdate": "30/10/2019",
        "category": "Liikkuminen",
        "counterparty_account_id": "107",
        "iban_receiver": "1",
        "paymentdate": "29/10/2019",
        "reference": "1",
        "saldo": "-351.12",
        "taplajikd": "162",
        "tstamp": "2019-10-29 14:46:09",
        "valuedate": "29/10/2019",
        "vientiselitekd": "0"
    },
    {
        "accountno": "1",
        "amount": "-3.83",
        "bic_receiver": "",
        "bookdate": "04/11/2019",
        "category": "Liikkuminen",
        "counterparty_account_id": "86",
        "iban_receiver": "1",
        "paymentdate": "04/11/2019",
        "reference": "1",
        "saldo": "-384.29",
        "taplajikd": "162",
        "tstamp": "2019-11-04 4:50:39",
        "valuedate": "04/11/2019",
        "vientiselitekd": "0"
    },
    {
        "accountno": "1",
        "amount": "-26.26",
        "bic_receiver": "OKOYFIHH",
        "bookdate": "06/11/2019",
        "category": "Liikkuminen",
        "counterparty_account_id": "20",
        "iban_receiver": "0",
        "paymentdate": "06/11/2019",
        "reference": "0",
        "saldo": "-554.71",
        "taplajikd": "106",
        "tstamp": "2019-11-06 12:06:36",
        "valuedate": "06/11/2019",
        "vientiselitekd": "0"
    },
    {
        "accountno": "1",
        "amount": "-5.28",
        "bic_receiver": "",
        "bookdate": "08/11/2019",
        "category": "Liikkuminen",
        "counterparty_account_id": "148",
        "iban_receiver": "1",
        "paymentdate": "08/11/2019",
        "reference": "1",
        "saldo": "-605.64",
        "taplajikd": "162",
        "tstamp": "2019-11-08 3:44:35",
        "valuedate": "08/11/2019",
        "vientiselitekd": "0"
    },
    {
        "accountno": "1",
        "amount": "-9.18",
        "bic_receiver": "",
        "bookdate": "12/11/2019",
        "category": "Liikkuminen",
        "counterparty_account_id": "33",
        "iban_receiver": "1",
        "paymentdate": "12/11/2019",
        "reference": "1",
        "saldo": "-754.06",
        "taplajikd": "162",
        "tstamp": "2019-11-12 0:13:13",
        "valuedate": "12/11/2019",
        "vientiselitekd": "0"
    },
    {
        "accountno": "1",
        "amount": "-2.75",
        "bic_receiver": "",
        "bookdate": "12/11/2019",
        "category": "Liikkuminen",
        "counterparty_account_id": "127",
        "iban_receiver": "1",
        "paymentdate": "12/11/2019",
        "reference": "1",
        "saldo": "-756.81",
        "taplajikd": "162",
        "tstamp": "2019-11-12 13:25:52",
        "valuedate": "12/11/2019",
        "vientiselitekd": "0"
    },
    {
        "accountno": "1",
        "amount": "-0.87",
        "bic_receiver": "",
        "bookdate": "18/11/2019",
        "category": "Liikkuminen",
        "counterparty_account_id": "104",
        "iban_receiver": "1",
        "paymentdate": "18/11/2019",
        "reference": "1",
        "saldo": "-186.56",
        "taplajikd": "162",
        "tstamp": "2019-11-18 1:32:29",
        "valuedate": "18/11/2019",
        "vientiselitekd": "0"
    },
    {
        "accountno": "1",
        "amount": "-20.59",
        "bic_receiver": "NDEAFIHH",
        "bookdate": "04/12/2019",
        "category": "Liikkuminen",
        "counterparty_account_id": "12",
        "iban_receiver": "0",
        "paymentdate": "04/12/2019",
        "reference": "0",
        "saldo": "-471.95",
        "taplajikd": "106",
        "tstamp": "2019-12-04 1:28:53",
        "valuedate": "04/12/2019",
        "vientiselitekd": "0"
    },
    {
        "accountno": "1",
        "amount": "-11.47",
        "bic_receiver": "OKOYFIHH",
        "bookdate": "06/12/2019",
        "category": "Liikkuminen",
        "counterparty_account_id": "23",
        "iban_receiver": "0",
        "paymentdate": "06/12/2019",
        "reference": "0",
        "saldo": "-534.88",
        "taplajikd": "106",
        "tstamp": "2019-12-06 21:20:00",
        "valuedate": "06/12/2019",
        "vientiselitekd": "0"
    },
    {
        "accountno": "1",
        "amount": "-221.15",
        "bic_receiver": "",
        "bookdate": "13/01/2020",
        "category": "Liikkuminen",
        "counterparty_account_id": "133",
        "iban_receiver": "1",
        "paymentdate": "13/01/2020",
        "reference": "1",
        "saldo": "22.83",
        "taplajikd": "162",
        "tstamp": "2020-01-13 4:51:39",
        "valuedate": "13/01/2020",
        "vientiselitekd": "0"
    },
    {
        "accountno": "1",
        "amount": "-12.23",
        "bic_receiver": "OKOYFIHH",
        "bookdate": "29/01/2020",
        "category": "Liikkuminen",
        "counterparty_account_id": "7",
        "iban_receiver": "0",
        "paymentdate": "29/01/2020",
        "reference": "1",
        "saldo": "-248.62",
        "taplajikd": "106",
        "tstamp": "2020-01-29 6:04:33",
        "valuedate": "29/01/2020",
        "vientiselitekd": "0"
    },
    {
        "accountno": "1",
        "amount": "-37.18",
        "bic_receiver": "OKOYFIHH",
        "bookdate": "04/02/2020",
        "category": "Liikkuminen",
        "counterparty_account_id": "15",
        "iban_receiver": "0",
        "paymentdate": "04/02/2020",
        "reference": "0",
        "saldo": "-368.75",
        "taplajikd": "106",
        "tstamp": "2020-02-04 6:47:33",
        "valuedate": "04/02/2020",
        "vientiselitekd": "0"
    },
    {
        "accountno": "1",
        "amount": "-3.66",
        "bic_receiver": "",
        "bookdate": "19/02/2020",
        "category": "Liikkuminen",
        "counterparty_account_id": "137",
        "iban_receiver": "1",
        "paymentdate": "19/02/2020",
        "reference": "1",
        "saldo": "-434.47",
        "taplajikd": "162",
        "tstamp": "2020-02-19 14:29:26",
        "valuedate": "19/02/2020",
        "vientiselitekd": "0"
    },
    {
        "accountno": "1",
        "amount": "-6.27",
        "bic_receiver": "",
        "bookdate": "18/03/2020",
        "category": "Liikkuminen",
        "counterparty_account_id": "118",
        "iban_receiver": "1",
        "paymentdate": "18/03/2020",
        "reference": "1",
        "saldo": "131.49",
        "taplajikd": "162",
        "tstamp": "2020-03-18 17:08:34",
        "valuedate": "18/03/2020",
        "vientiselitekd": "0"
    },
    {
        "accountno": "1",
        "amount": "-7.94",
        "bic_receiver": "",
        "bookdate": "20/04/2020",
        "category": "Liikkuminen",
        "counterparty_account_id": "99",
        "iban_receiver": "1",
        "paymentdate": "20/04/2020",
        "reference": "1",
        "saldo": "74.13",
        "taplajikd": "162",
        "tstamp": "2020-04-20 8:30:58",
        "valuedate": "20/04/2020",
        "vientiselitekd": "0"
    },
    {
        "accountno": "1",
        "amount": "-48.47",
        "bic_receiver": "",
        "bookdate": "18/05/2020",
        "category": "Liikkuminen",
        "counterparty_account_id": "122",
        "iban_receiver": "1",
        "paymentdate": "18/05/2020",
        "reference": "1",
        "saldo": "-121.39",
        "taplajikd": "162",
        "tstamp": "2020-05-18 3:44:00",
        "valuedate": "18/05/2020",
        "vientiselitekd": "0"
    },
    {
        "accountno": "1",
        "amount": "-3.84",
        "bic_receiver": "",
        "bookdate": "27/05/2020",
        "category": "Liikkuminen",
        "counterparty_account_id": "81",
        "iban_receiver": "1",
        "paymentdate": "27/05/2020",
        "reference": "1",
        "saldo": "-175.99",
        "taplajikd": "162",
        "tstamp": "2020-05-27 13:20:00",
        "valuedate": "27/05/2020",
        "vientiselitekd": "0"
    },
    {
        "accountno": "1",
        "amount": "-3.33",
        "bic_receiver": "",
        "bookdate": "29/06/2020",
        "category": "Liikkuminen",
        "counterparty_account_id": "68",
        "iban_receiver": "1",
        "paymentdate": "29/06/2020",
        "reference": "1",
        "saldo": "-148.93",
        "taplajikd": "162",
        "tstamp": "2020-06-29 10:58:59",
        "valuedate": "29/06/2020",
        "vientiselitekd": "0"
    },
    {
        "accountno": "1",
        "amount": "-3.7",
        "bic_receiver": "",
        "bookdate": "03/07/2020",
        "category": "Liikkuminen",
        "counterparty_account_id": "147",
        "iban_receiver": "1",
        "paymentdate": "03/07/2020",
        "reference": "1",
        "saldo": "-175.65",
        "taplajikd": "162",
        "tstamp": "2020-07-03 21:12:33",
        "valuedate": "03/07/2020",
        "vientiselitekd": "0"
    },
    {
        "accountno": "1",
        "amount": "-8.03",
        "bic_receiver": "",
        "bookdate": "09/07/2020",
        "category": "Liikkuminen",
        "counterparty_account_id": "129",
        "iban_receiver": "1",
        "paymentdate": "09/07/2020",
        "reference": "1",
        "saldo": "-203.14",
        "taplajikd": "162",
        "tstamp": "2020-07-09 15:37:40",
        "valuedate": "09/07/2020",
        "vientiselitekd": "0"
    },
    {
        "accountno": "1",
        "amount": "-3.61",
        "bic_receiver": "",
        "bookdate": "13/07/2020",
        "category": "Liikkuminen",
        "counterparty_account_id": "70",
        "iban_receiver": "1",
        "paymentdate": "13/07/2020",
        "reference": "1",
        "saldo": "-210.25",
        "taplajikd": "162",
        "tstamp": "2020-07-13 23:26:31",
        "valuedate": "13/07/2020",
        "vientiselitekd": "0"
    },
    {
        "accountno": "1",
        "amount": "-24.39",
        "bic_receiver": "",
        "bookdate": "17/07/2020",
        "category": "Liikkuminen",
        "counterparty_account_id": "100",
        "iban_receiver": "1",
        "paymentdate": "17/07/2020",
        "reference": "1",
        "saldo": "-189.02",
        "taplajikd": "162",
        "tstamp": "2020-07-17 20:39:04",
        "valuedate": "17/07/2020",
        "vientiselitekd": "0"
    },
    {
        "accountno": "1",
        "amount": "-6.16",
        "bic_receiver": "",
        "bookdate": "21/08/2020",
        "category": "Liikkuminen",
        "counterparty_account_id": "99",
        "iban_receiver": "1",
        "paymentdate": "19/08/2020",
        "reference": "1",
        "saldo": "40.81",
        "taplajikd": "162",
        "tstamp": "2020-08-19 1:12:55",
        "valuedate": "19/08/2020",
        "vientiselitekd": "0"
    },
    {
        "accountno": "1",
        "amount": "-23.68",
        "bic_receiver": "",
        "bookdate": "24/08/2020",
        "category": "Liikkuminen",
        "counterparty_account_id": "111",
        "iban_receiver": "1",
        "paymentdate": "24/08/2020",
        "reference": "1",
        "saldo": "51.56",
        "taplajikd": "162",
        "tstamp": "2020-08-24 18:13:40",
        "valuedate": "24/08/2020",
        "vientiselitekd": "0"
    },
    {
        "accountno": "1",
        "amount": "-25.36",
        "bic_receiver": "",
        "bookdate": "11/09/2020",
        "category": "Liikkuminen",
        "counterparty_account_id": "106",
        "iban_receiver": "1",
        "paymentdate": "11/09/2020",
        "reference": "1",
        "saldo": "-102.44",
        "taplajikd": "162",
        "tstamp": "2020-09-11 5:32:18",
        "valuedate": "11/09/2020",
        "vientiselitekd": "0"
    },
    {
        "accountno": "1",
        "amount": "-16.85",
        "bic_receiver": "",
        "bookdate": "18/09/2020",
        "category": "Liikkuminen",
        "counterparty_account_id": "68",
        "iban_receiver": "1",
        "paymentdate": "18/09/2020",
        "reference": "1",
        "saldo": "-110.79",
        "taplajikd": "162",
        "tstamp": "2020-09-18 12:55:23",
        "valuedate": "18/09/2020",
        "vientiselitekd": "0"
    },
    {
        "accountno": "1",
        "amount": "-4.68",
        "bic_receiver": "",
        "bookdate": "02/10/2020",
        "category": "Liikkuminen",
        "counterparty_account_id": "86",
        "iban_receiver": "1",
        "paymentdate": "02/10/2020",
        "reference": "1",
        "saldo": "-167.02",
        "taplajikd": "162",
        "tstamp": "2020-10-02 8:46:31",
        "valuedate": "02/10/2020",
        "vientiselitekd": "0"
    },
    {
        "accountno": "1",
        "amount": "-1.97",
        "bic_receiver": "",
        "bookdate": "06/10/2020",
        "category": "Liikkuminen",
        "counterparty_account_id": "110",
        "iban_receiver": "1",
        "paymentdate": "06/10/2020",
        "reference": "1",
        "saldo": "-360.63",
        "taplajikd": "162",
        "tstamp": "2020-10-06 4:32:47",
        "valuedate": "06/10/2020",
        "vientiselitekd": "0"
    },
    {
        "accountno": "1",
        "amount": "-3.56",
        "bic_receiver": "",
        "bookdate": "12/10/2020",
        "category": "Liikkuminen",
        "counterparty_account_id": "129",
        "iban_receiver": "1",
        "paymentdate": "12/10/2020",
        "reference": "1",
        "saldo": "-603.97",
        "taplajikd": "162",
        "tstamp": "2020-10-12 13:25:38",
        "valuedate": "12/10/2020",
        "vientiselitekd": "0"
    },
    {
        "accountno": "1",
        "amount": "-1.39",
        "bic_receiver": "",
        "bookdate": "12/10/2020",
        "category": "Liikkuminen",
        "counterparty_account_id": "45",
        "iban_receiver": "1",
        "paymentdate": "12/10/2020",
        "reference": "1",
        "saldo": "-607.29",
        "taplajikd": "162",
        "tstamp": "2020-10-12 17:52:04",
        "valuedate": "12/10/2020",
        "vientiselitekd": "0"
    },
    {
        "accountno": "1",
        "amount": "-30.57",
        "bic_receiver": "",
        "bookdate": "15/10/2020",
        "category": "Liikkuminen",
        "counterparty_account_id": "39",
        "iban_receiver": "1",
        "paymentdate": "15/10/2020",
        "reference": "1",
        "saldo": "-707.29",
        "taplajikd": "162",
        "tstamp": "2020-10-15 13:38:20",
        "valuedate": "15/10/2020",
        "vientiselitekd": "0"
    },
    {
        "accountno": "1",
        "amount": "-40.99",
        "bic_receiver": "",
        "bookdate": "23/10/2020",
        "category": "Liikkuminen",
        "counterparty_account_id": "49",
        "iban_receiver": "1",
        "paymentdate": "23/10/2020",
        "reference": "1",
        "saldo": "-863.48",
        "taplajikd": "162",
        "tstamp": "2020-10-23 11:44:08",
        "valuedate": "23/10/2020",
        "vientiselitekd": "0"
    },
    {
        "accountno": "1",
        "amount": "-23.69",
        "bic_receiver": "",
        "bookdate": "27/10/2020",
        "category": "Liikkuminen",
        "counterparty_account_id": "93",
        "iban_receiver": "1",
        "paymentdate": "27/10/2020",
        "reference": "1",
        "saldo": "154.49",
        "taplajikd": "162",
        "tstamp": "2020-10-27 5:17:11",
        "valuedate": "27/10/2020",
        "vientiselitekd": "0"
    },
    {
        "accountno": "1",
        "amount": "-26.75",
        "bic_receiver": "",
        "bookdate": "27/10/2020",
        "category": "Liikkuminen",
        "counterparty_account_id": "120",
        "iban_receiver": "1",
        "paymentdate": "27/10/2020",
        "reference": "1",
        "saldo": "127.74",
        "taplajikd": "162",
        "tstamp": "2020-10-27 7:30:24",
        "valuedate": "27/10/2020",
        "vientiselitekd": "0"
    },
    {
        "accountno": "1",
        "amount": "-34.33",
        "bic_receiver": "",
        "bookdate": "03/11/2020",
        "category": "Liikkuminen",
        "counterparty_account_id": "81",
        "iban_receiver": "1",
        "paymentdate": "03/11/2020",
        "reference": "1",
        "saldo": "-85.37",
        "taplajikd": "162",
        "tstamp": "2020-11-03 11:30:15",
        "valuedate": "03/11/2020",
        "vientiselitekd": "0"
    },
    {
        "accountno": "1",
        "amount": "-24.12",
        "bic_receiver": "",
        "bookdate": "09/11/2020",
        "category": "Liikkuminen",
        "counterparty_account_id": "84",
        "iban_receiver": "1",
        "paymentdate": "09/11/2020",
        "reference": "1",
        "saldo": "-209.4",
        "taplajikd": "162",
        "tstamp": "2020-11-09 22:24:48",
        "valuedate": "09/11/2020",
        "vientiselitekd": "0"
    },
    {
        "accountno": "1",
        "amount": "-2.08",
        "bic_receiver": "",
        "bookdate": "13/11/2020",
        "category": "Liikkuminen",
        "counterparty_account_id": "151",
        "iban_receiver": "1",
        "paymentdate": "12/11/2020",
        "reference": "1",
        "saldo": "-299.26",
        "taplajikd": "162",
        "tstamp": "2020-11-13 21:13:23",
        "valuedate": "13/11/2020",
        "vientiselitekd": "0"
    },
    {
        "accountno": "1",
        "amount": "-5.96",
        "bic_receiver": "",
        "bookdate": "17/11/2020",
        "category": "Liikkuminen",
        "counterparty_account_id": "114",
        "iban_receiver": "1",
        "paymentdate": "17/11/2020",
        "reference": "1",
        "saldo": "-199.56",
        "taplajikd": "162",
        "tstamp": "2020-11-17 8:43:38",
        "valuedate": "17/11/2020",
        "vientiselitekd": "0"
    },
    {
        "accountno": "1",
        "amount": "-14.41",
        "bic_receiver": "SBANFIHH",
        "bookdate": "18/11/2020",
        "category": "Liikkuminen",
        "counterparty_account_id": "19",
        "iban_receiver": "0",
        "paymentdate": "17/11/2020",
        "reference": "1",
        "saldo": "-185.38",
        "taplajikd": "106",
        "tstamp": "2020-11-18 20:25:47",
        "valuedate": "18/11/2020",
        "vientiselitekd": "0"
    },
    {
        "accountno": "1",
        "amount": "-29.68",
        "bic_receiver": "",
        "bookdate": "14/12/2020",
        "category": "Liikkuminen",
        "counterparty_account_id": "100",
        "iban_receiver": "1",
        "paymentdate": "14/12/2020",
        "reference": "1",
        "saldo": "-51.51",
        "taplajikd": "162",
        "tstamp": "2020-12-14 8:27:03",
        "valuedate": "14/12/2020",
        "vientiselitekd": "0"
    },
    {
        "accountno": "1",
        "amount": "-39.74",
        "bic_receiver": "",
        "bookdate": "23/12/2020",
        "category": "Liikkuminen",
        "counterparty_account_id": "127",
        "iban_receiver": "1",
        "paymentdate": "21/12/2020",
        "reference": "1",
        "saldo": "286.02",
        "taplajikd": "162",
        "tstamp": "2020-12-21 5:04:14",
        "valuedate": "21/12/2020",
        "vientiselitekd": "0"
    },
    {
        "accountno": "2",
        "amount": "-3.04",
        "bic_receiver": "",
        "bookdate": "28/03/2019",
        "category": "Liikkuminen",
        "counterparty_account_id": "70",
        "iban_receiver": "1",
        "paymentdate": "28/03/2019",
        "reference": "1",
        "saldo": "2712.57",
        "taplajikd": "162",
        "tstamp": "2019-03-28 8:48:59",
        "valuedate": "28/03/2019",
        "vientiselitekd": "0"
    },
    {
        "accountno": "2",
        "amount": "-8.33",
        "bic_receiver": "",
        "bookdate": "27/05/2019",
        "category": "Liikkuminen",
        "counterparty_account_id": "88",
        "iban_receiver": "1",
        "paymentdate": "27/05/2019",
        "reference": "1",
        "saldo": "1161.86",
        "taplajikd": "162",
        "tstamp": "2019-05-27 7:20:49",
        "valuedate": "27/05/2019",
        "vientiselitekd": "0"
    },
    {
        "accountno": "2",
        "amount": "-746.92",
        "bic_receiver": "POPFFI22",
        "bookdate": "07/06/2019",
        "category": "Liikkuminen",
        "counterparty_account_id": "190",
        "iban_receiver": "0",
        "paymentdate": "06/06/2019",
        "reference": "1",
        "saldo": "836.41",
        "taplajikd": "106",
        "tstamp": "2019-06-06 15:16:22",
        "valuedate": "06/06/2019",
        "vientiselitekd": "706"
    },
    {
        "accountno": "2",
        "amount": "-74.4",
        "bic_receiver": "",
        "bookdate": "24/06/2019",
        "category": "Liikkuminen",
        "counterparty_account_id": "54",
        "iban_receiver": "1",
        "paymentdate": "24/06/2019",
        "reference": "1",
        "saldo": "628.44",
        "taplajikd": "162",
        "tstamp": "2019-06-25 0:00:00",
        "valuedate": "24/06/2019",
        "vientiselitekd": "0"
    },
    {
        "accountno": "2",
        "amount": "-6.66",
        "bic_receiver": "",
        "bookdate": "08/07/2019",
        "category": "Liikkuminen",
        "counterparty_account_id": "74",
        "iban_receiver": "1",
        "paymentdate": "08/07/2019",
        "reference": "1",
        "saldo": "1678.5",
        "taplajikd": "162",
        "tstamp": "2019-07-08 13:45:10",
        "valuedate": "08/07/2019",
        "vientiselitekd": "0"
    },
    {
        "accountno": "2",
        "amount": "-87.83",
        "bic_receiver": "OKOYFIHH",
        "bookdate": "15/07/2019",
        "category": "Liikkuminen",
        "counterparty_account_id": "187",
        "iban_receiver": "0",
        "paymentdate": "15/07/2019",
        "reference": "0",
        "saldo": "3195.09",
        "taplajikd": "106",
        "tstamp": "2019-07-15 15:06:04",
        "valuedate": "15/07/2019",
        "vientiselitekd": "706"
    },
    {
        "accountno": "2",
        "amount": "-8.73",
        "bic_receiver": "",
        "bookdate": "19/07/2019",
        "category": "Liikkuminen",
        "counterparty_account_id": "116",
        "iban_receiver": "1",
        "paymentdate": "19/07/2019",
        "reference": "1",
        "saldo": "3037.62",
        "taplajikd": "162",
        "tstamp": "2019-07-19 2:41:48",
        "valuedate": "19/07/2019",
        "vientiselitekd": "0"
    },
    {
        "accountno": "2",
        "amount": "-86.12",
        "bic_receiver": "",
        "bookdate": "22/07/2019",
        "category": "Liikkuminen",
        "counterparty_account_id": "124",
        "iban_receiver": "1",
        "paymentdate": "22/07/2019",
        "reference": "1",
        "saldo": "2809.15",
        "taplajikd": "162",
        "tstamp": "2019-07-22 12:08:05",
        "valuedate": "22/07/2019",
        "vientiselitekd": "0"
    },
    {
        "accountno": "2",
        "amount": "-123.25",
        "bic_receiver": "",
        "bookdate": "24/07/2019",
        "category": "Liikkuminen",
        "counterparty_account_id": "136",
        "iban_receiver": "1",
        "paymentdate": "24/07/2019",
        "reference": "1",
        "saldo": "3794.47",
        "taplajikd": "162",
        "tstamp": "2019-07-24 16:26:58",
        "valuedate": "24/07/2019",
        "vientiselitekd": "0"
    },
    {
        "accountno": "2",
        "amount": "-69.64",
        "bic_receiver": "",
        "bookdate": "01/08/2019",
        "category": "Liikkuminen",
        "counterparty_account_id": "63",
        "iban_receiver": "1",
        "paymentdate": "01/08/2019",
        "reference": "1",
        "saldo": "3123.11",
        "taplajikd": "162",
        "tstamp": "2019-08-01 19:01:37",
        "valuedate": "01/08/2019",
        "vientiselitekd": "0"
    },
    {
        "accountno": "2",
        "amount": "-10.26",
        "bic_receiver": "",
        "bookdate": "05/08/2019",
        "category": "Liikkuminen",
        "counterparty_account_id": "105",
        "iban_receiver": "1",
        "paymentdate": "05/08/2019",
        "reference": "1",
        "saldo": "3179.86",
        "taplajikd": "162",
        "tstamp": "2019-08-05 16:51:54",
        "valuedate": "05/08/2019",
        "vientiselitekd": "0"
    },
    {
        "accountno": "2",
        "amount": "-18.74",
        "bic_receiver": "",
        "bookdate": "09/08/2019",
        "category": "Liikkuminen",
        "counterparty_account_id": "79",
        "iban_receiver": "1",
        "paymentdate": "09/08/2019",
        "reference": "1",
        "saldo": "2556.38",
        "taplajikd": "162",
        "tstamp": "2019-08-09 22:29:11",
        "valuedate": "09/08/2019",
        "vientiselitekd": "0"
    },
    {
        "accountno": "2",
        "amount": "-16.25",
        "bic_receiver": "",
        "bookdate": "16/08/2019",
        "category": "Liikkuminen",
        "counterparty_account_id": "27",
        "iban_receiver": "1",
        "paymentdate": "16/08/2019",
        "reference": "1",
        "saldo": "3259.16",
        "taplajikd": "162",
        "tstamp": "2019-08-16 1:56:45",
        "valuedate": "16/08/2019",
        "vientiselitekd": "0"
    },
    {
        "accountno": "2",
        "amount": "-37.11",
        "bic_receiver": "",
        "bookdate": "19/08/2019",
        "category": "Liikkuminen",
        "counterparty_account_id": "146",
        "iban_receiver": "1",
        "paymentdate": "19/08/2019",
        "reference": "1",
        "saldo": "3559.93",
        "taplajikd": "162",
        "tstamp": "2019-08-19 10:22:42",
        "valuedate": "19/08/2019",
        "vientiselitekd": "0"
    },
    {
        "accountno": "2",
        "amount": "-19.05",
        "bic_receiver": "",
        "bookdate": "03/09/2019",
        "category": "Liikkuminen",
        "counterparty_account_id": "57",
        "iban_receiver": "1",
        "paymentdate": "03/09/2019",
        "reference": "1",
        "saldo": "4913.25",
        "taplajikd": "162",
        "tstamp": "2019-09-03 11:10:41",
        "valuedate": "03/09/2019",
        "vientiselitekd": "0"
    },
    {
        "accountno": "2",
        "amount": "-52.99",
        "bic_receiver": "",
        "bookdate": "09/09/2019",
        "category": "Liikkuminen",
        "counterparty_account_id": "99",
        "iban_receiver": "1",
        "paymentdate": "09/09/2019",
        "reference": "1",
        "saldo": "4048.9",
        "taplajikd": "162",
        "tstamp": "2019-09-09 5:15:37",
        "valuedate": "09/09/2019",
        "vientiselitekd": "0"
    },
    {
        "accountno": "2",
        "amount": "-98.18",
        "bic_receiver": "",
        "bookdate": "09/09/2019",
        "category": "Liikkuminen",
        "counterparty_account_id": "60",
        "iban_receiver": "1",
        "paymentdate": "09/09/2019",
        "reference": "1",
        "saldo": "3950.72",
        "taplajikd": "162",
        "tstamp": "2019-09-09 9:32:03",
        "valuedate": "09/09/2019",
        "vientiselitekd": "0"
    },
    {
        "accountno": "2",
        "amount": "-18.66",
        "bic_receiver": "",
        "bookdate": "27/09/2019",
        "category": "Liikkuminen",
        "counterparty_account_id": "95",
        "iban_receiver": "1",
        "paymentdate": "27/09/2019",
        "reference": "1",
        "saldo": "4394.81",
        "taplajikd": "162",
        "tstamp": "2019-09-27 18:24:39",
        "valuedate": "27/09/2019",
        "vientiselitekd": "0"
    },
    {
        "accountno": "2",
        "amount": "-8.89",
        "bic_receiver": "",
        "bookdate": "02/10/2019",
        "category": "Liikkuminen",
        "counterparty_account_id": "105",
        "iban_receiver": "1",
        "paymentdate": "02/10/2019",
        "reference": "1",
        "saldo": "4038.35",
        "taplajikd": "162",
        "tstamp": "2019-10-02 21:47:05",
        "valuedate": "02/10/2019",
        "vientiselitekd": "0"
    },
    {
        "accountno": "2",
        "amount": "-7.98",
        "bic_receiver": "",
        "bookdate": "14/10/2019",
        "category": "Liikkuminen",
        "counterparty_account_id": "26",
        "iban_receiver": "1",
        "paymentdate": "14/10/2019",
        "reference": "1",
        "saldo": "3794.88",
        "taplajikd": "162",
        "tstamp": "2019-10-14 8:29:32",
        "valuedate": "14/10/2019",
        "vientiselitekd": "0"
    },
    {
        "accountno": "2",
        "amount": "-90.95",
        "bic_receiver": "",
        "bookdate": "07/11/2019",
        "category": "Liikkuminen",
        "counterparty_account_id": "45",
        "iban_receiver": "1",
        "paymentdate": "07/11/2019",
        "reference": "1",
        "saldo": "3780.05",
        "taplajikd": "162",
        "tstamp": "2019-11-07 10:17:09",
        "valuedate": "07/11/2019",
        "vientiselitekd": "0"
    },
    {
        "accountno": "2",
        "amount": "-3.78",
        "bic_receiver": "",
        "bookdate": "07/11/2019",
        "category": "Liikkuminen",
        "counterparty_account_id": "123",
        "iban_receiver": "1",
        "paymentdate": "07/11/2019",
        "reference": "1",
        "saldo": "3772.64",
        "taplajikd": "162",
        "tstamp": "2019-11-08 0:00:00",
        "valuedate": "07/11/2019",
        "vientiselitekd": "0"
    },
    {
        "accountno": "2",
        "amount": "-84.16",
        "bic_receiver": "",
        "bookdate": "18/11/2019",
        "category": "Liikkuminen",
        "counterparty_account_id": "65",
        "iban_receiver": "1",
        "paymentdate": "18/11/2019",
        "reference": "1",
        "saldo": "24.12",
        "taplajikd": "162",
        "tstamp": "2019-11-18 13:42:51",
        "valuedate": "18/11/2019",
        "vientiselitekd": "0"
    },
    {
        "accountno": "2",
        "amount": "-17.26",
        "bic_receiver": "",
        "bookdate": "19/11/2019",
        "category": "Liikkuminen",
        "counterparty_account_id": "102",
        "iban_receiver": "1",
        "paymentdate": "19/11/2019",
        "reference": "1",
        "saldo": "4.38",
        "taplajikd": "162",
        "tstamp": "2019-11-19 6:51:26",
        "valuedate": "19/11/2019",
        "vientiselitekd": "0"
    },
    {
        "accountno": "2",
        "amount": "-17.85",
        "bic_receiver": "",
        "bookdate": "28/11/2019",
        "category": "Liikkuminen",
        "counterparty_account_id": "112",
        "iban_receiver": "1",
        "paymentdate": "28/11/2019",
        "reference": "1",
        "saldo": "240.6",
        "taplajikd": "162",
        "tstamp": "2019-11-29 0:00:00",
        "valuedate": "28/11/2019",
        "vientiselitekd": "0"
    },
    {
        "accountno": "2",
        "amount": "-55.07",
        "bic_receiver": "",
        "bookdate": "09/12/2019",
        "category": "Liikkuminen",
        "counterparty_account_id": "57",
        "iban_receiver": "1",
        "paymentdate": "09/12/2019",
        "reference": "1",
        "saldo": "5187.86",
        "taplajikd": "162",
        "tstamp": "2019-12-09 3:02:04",
        "valuedate": "09/12/2019",
        "vientiselitekd": "0"
    },
    {
        "accountno": "2",
        "amount": "-20.05",
        "bic_receiver": "",
        "bookdate": "10/12/2019",
        "category": "Liikkuminen",
        "counterparty_account_id": "94",
        "iban_receiver": "1",
        "paymentdate": "10/12/2019",
        "reference": "1",
        "saldo": "5116.96",
        "taplajikd": "162",
        "tstamp": "2019-12-10 23:26:54",
        "valuedate": "10/12/2019",
        "vientiselitekd": "0"
    },
    {
        "accountno": "2",
        "amount": "-8.93",
        "bic_receiver": "",
        "bookdate": "12/12/2019",
        "category": "Liikkuminen",
        "counterparty_account_id": "128",
        "iban_receiver": "1",
        "paymentdate": "12/12/2019",
        "reference": "1",
        "saldo": "5078.9",
        "taplajikd": "162",
        "tstamp": "2019-12-12 19:51:43",
        "valuedate": "12/12/2019",
        "vientiselitekd": "0"
    },
    {
        "accountno": "2",
        "amount": "-18.18",
        "bic_receiver": "",
        "bookdate": "20/12/2019",
        "category": "Liikkuminen",
        "counterparty_account_id": "88",
        "iban_receiver": "1",
        "paymentdate": "16/12/2019",
        "reference": "1",
        "saldo": "2480.8",
        "taplajikd": "162",
        "tstamp": "2019-12-20 16:00:00",
        "valuedate": "20/12/2019",
        "vientiselitekd": "0"
    },
    {
        "accountno": "2",
        "amount": "-37.07",
        "bic_receiver": "",
        "bookdate": "30/12/2019",
        "category": "Liikkuminen",
        "counterparty_account_id": "139",
        "iban_receiver": "1",
        "paymentdate": "30/12/2019",
        "reference": "1",
        "saldo": "1750.22",
        "taplajikd": "162",
        "tstamp": "2019-12-30 5:14:29",
        "valuedate": "30/12/2019",
        "vientiselitekd": "0"
    },
    {
        "accountno": "2",
        "amount": "-23.96",
        "bic_receiver": "",
        "bookdate": "03/01/2020",
        "category": "Liikkuminen",
        "counterparty_account_id": "116",
        "iban_receiver": "1",
        "paymentdate": "03/01/2020",
        "reference": "1",
        "saldo": "1455.2",
        "taplajikd": "162",
        "tstamp": "2020-01-03 1:11:24",
        "valuedate": "03/01/2020",
        "vientiselitekd": "0"
    },
    {
        "accountno": "2",
        "amount": "-20.85",
        "bic_receiver": "",
        "bookdate": "06/01/2020",
        "category": "Liikkuminen",
        "counterparty_account_id": "83",
        "iban_receiver": "1",
        "paymentdate": "06/01/2020",
        "reference": "1",
        "saldo": "1120.29",
        "taplajikd": "162",
        "tstamp": "2020-01-06 14:40:40",
        "valuedate": "06/01/2020",
        "vientiselitekd": "0"
    },
    {
        "accountno": "2",
        "amount": "-66.71",
        "bic_receiver": "NDEAFIHH",
        "bookdate": "13/01/2020",
        "category": "Liikkuminen",
        "counterparty_account_id": "18",
        "iban_receiver": "0",
        "paymentdate": "13/01/2020",
        "reference": "0",
        "saldo": "-158.87",
        "taplajikd": "106",
        "tstamp": "2020-01-13 19:26:17",
        "valuedate": "13/01/2020",
        "vientiselitekd": "0"
    },
    {
        "accountno": "2",
        "amount": "-4.3",
        "bic_receiver": "",
        "bookdate": "16/01/2020",
        "category": "Liikkuminen",
        "counterparty_account_id": "99",
        "iban_receiver": "1",
        "paymentdate": "16/01/2020",
        "reference": "1",
        "saldo": "-268.49",
        "taplajikd": "162",
        "tstamp": "2020-01-16 21:49:05",
        "valuedate": "16/01/2020",
        "vientiselitekd": "0"
    },
    {
        "accountno": "2",
        "amount": "-8.03",
        "bic_receiver": "",
        "bookdate": "20/01/2020",
        "category": "Liikkuminen",
        "counterparty_account_id": "114",
        "iban_receiver": "1",
        "paymentdate": "20/01/2020",
        "reference": "1",
        "saldo": "126.48",
        "taplajikd": "162",
        "tstamp": "2020-01-20 23:00:30",
        "valuedate": "20/01/2020",
        "vientiselitekd": "0"
    },
    {
        "accountno": "2",
        "amount": "-35.52",
        "bic_receiver": "",
        "bookdate": "22/01/2020",
        "category": "Liikkuminen",
        "counterparty_account_id": "84",
        "iban_receiver": "1",
        "paymentdate": "22/01/2020",
        "reference": "1",
        "saldo": "78.06",
        "taplajikd": "162",
        "tstamp": "2020-01-22 0:11:54",
        "valuedate": "22/01/2020",
        "vientiselitekd": "0"
    },
    {
        "accountno": "2",
        "amount": "-73.61",
        "bic_receiver": "",
        "bookdate": "29/01/2020",
        "category": "Liikkuminen",
        "counterparty_account_id": "37",
        "iban_receiver": "1",
        "paymentdate": "29/01/2020",
        "reference": "1",
        "saldo": "29.77",
        "taplajikd": "162",
        "tstamp": "2020-01-29 17:15:22",
        "valuedate": "29/01/2020",
        "vientiselitekd": "0"
    },
    {
        "accountno": "2",
        "amount": "-21.68",
        "bic_receiver": "",
        "bookdate": "17/02/2020",
        "category": "Liikkuminen",
        "counterparty_account_id": "77",
        "iban_receiver": "1",
        "paymentdate": "17/02/2020",
        "reference": "1",
        "saldo": "-195.93",
        "taplajikd": "162",
        "tstamp": "2020-02-17 6:18:57",
        "valuedate": "17/02/2020",
        "vientiselitekd": "0"
    },
    {
        "accountno": "2",
        "amount": "-8.23",
        "bic_receiver": "",
        "bookdate": "27/03/2020",
        "category": "Liikkuminen",
        "counterparty_account_id": "126",
        "iban_receiver": "1",
        "paymentdate": "26/03/2020",
        "reference": "1",
        "saldo": "-25.63",
        "taplajikd": "162",
        "tstamp": "2020-03-27 17:52:56",
        "valuedate": "27/03/2020",
        "vientiselitekd": "0"
    },
    {
        "accountno": "2",
        "amount": "-15.23",
        "bic_receiver": "",
        "bookdate": "02/04/2020",
        "category": "Liikkuminen",
        "counterparty_account_id": "26",
        "iban_receiver": "1",
        "paymentdate": "02/04/2020",
        "reference": "1",
        "saldo": "850.9",
        "taplajikd": "162",
        "tstamp": "2020-04-02 12:27:21",
        "valuedate": "02/04/2020",
        "vientiselitekd": "0"
    },
    {
        "accountno": "2",
        "amount": "-4.8",
        "bic_receiver": "",
        "bookdate": "07/04/2020",
        "category": "Liikkuminen",
        "counterparty_account_id": "125",
        "iban_receiver": "1",
        "paymentdate": "07/04/2020",
        "reference": "1",
        "saldo": "441.95",
        "taplajikd": "162",
        "tstamp": "2020-04-07 14:16:43",
        "valuedate": "07/04/2020",
        "vientiselitekd": "0"
    },
    {
        "accountno": "2",
        "amount": "-4",
        "bic_receiver": "",
        "bookdate": "09/04/2020",
        "category": "Liikkuminen",
        "counterparty_account_id": "50",
        "iban_receiver": "1",
        "paymentdate": "09/04/2020",
        "reference": "1",
        "saldo": "374.11",
        "taplajikd": "162",
        "tstamp": "2020-04-09 8:30:23",
        "valuedate": "09/04/2020",
        "vientiselitekd": "0"
    },
    {
        "accountno": "2",
        "amount": "-9.03",
        "bic_receiver": "OKOYFIHH",
        "bookdate": "30/04/2020",
        "category": "Liikkuminen",
        "counterparty_account_id": "20",
        "iban_receiver": "0",
        "paymentdate": "30/04/2020",
        "reference": "1",
        "saldo": "-301.42",
        "taplajikd": "106",
        "tstamp": "2020-04-30 14:53:10",
        "valuedate": "30/04/2020",
        "vientiselitekd": "0"
    },
    {
        "accountno": "2",
        "amount": "-1.7",
        "bic_receiver": "",
        "bookdate": "01/05/2020",
        "category": "Liikkuminen",
        "counterparty_account_id": "84",
        "iban_receiver": "1",
        "paymentdate": "01/05/2020",
        "reference": "1",
        "saldo": "-311.64",
        "taplajikd": "162",
        "tstamp": "2020-05-01 17:54:56",
        "valuedate": "01/05/2020",
        "vientiselitekd": "0"
    },
    {
        "accountno": "2",
        "amount": "-7.44",
        "bic_receiver": "",
        "bookdate": "07/05/2020",
        "category": "Liikkuminen",
        "counterparty_account_id": "126",
        "iban_receiver": "1",
        "paymentdate": "07/05/2020",
        "reference": "1",
        "saldo": "-264.15",
        "taplajikd": "162",
        "tstamp": "2020-05-07 20:37:11",
        "valuedate": "07/05/2020",
        "vientiselitekd": "0"
    },
    {
        "accountno": "2",
        "amount": "-4.35",
        "bic_receiver": "",
        "bookdate": "27/05/2020",
        "category": "Liikkuminen",
        "counterparty_account_id": "135",
        "iban_receiver": "1",
        "paymentdate": "27/05/2020",
        "reference": "1",
        "saldo": "-1378.14",
        "taplajikd": "162",
        "tstamp": "2020-05-27 4:43:57",
        "valuedate": "27/05/2020",
        "vientiselitekd": "0"
    },
    {
        "accountno": "2",
        "amount": "-79.22",
        "bic_receiver": "OKOYFIHH",
        "bookdate": "15/06/2020",
        "category": "Liikkuminen",
        "counterparty_account_id": "196",
        "iban_receiver": "0",
        "paymentdate": "15/06/2020",
        "reference": "0",
        "saldo": "1572.4",
        "taplajikd": "129",
        "tstamp": "2020-06-15 0:17:21",
        "valuedate": "15/06/2020",
        "vientiselitekd": "706"
    },
    {
        "accountno": "2",
        "amount": "-37.92",
        "bic_receiver": "",
        "bookdate": "16/06/2020",
        "category": "Liikkuminen",
        "counterparty_account_id": "113",
        "iban_receiver": "1",
        "paymentdate": "16/06/2020",
        "reference": "1",
        "saldo": "1451.35",
        "taplajikd": "162",
        "tstamp": "2020-06-16 4:20:14",
        "valuedate": "16/06/2020",
        "vientiselitekd": "0"
    },
    {
        "accountno": "2",
        "amount": "-35.66",
        "bic_receiver": "",
        "bookdate": "29/06/2020",
        "category": "Liikkuminen",
        "counterparty_account_id": "44",
        "iban_receiver": "1",
        "paymentdate": "29/06/2020",
        "reference": "1",
        "saldo": "584.65",
        "taplajikd": "162",
        "tstamp": "2020-06-29 11:16:38",
        "valuedate": "29/06/2020",
        "vientiselitekd": "0"
    },
    {
        "accountno": "2",
        "amount": "-1.36",
        "bic_receiver": "",
        "bookdate": "30/06/2020",
        "category": "Liikkuminen",
        "counterparty_account_id": "95",
        "iban_receiver": "1",
        "paymentdate": "30/06/2020",
        "reference": "1",
        "saldo": "418.53",
        "taplajikd": "162",
        "tstamp": "2020-06-30 15:19:31",
        "valuedate": "30/06/2020",
        "vientiselitekd": "0"
    },
    {
        "accountno": "2",
        "amount": "-50.77",
        "bic_receiver": "",
        "bookdate": "06/07/2020",
        "category": "Liikkuminen",
        "counterparty_account_id": "28",
        "iban_receiver": "1",
        "paymentdate": "06/07/2020",
        "reference": "1",
        "saldo": "701.17",
        "taplajikd": "162",
        "tstamp": "2020-07-06 5:09:20",
        "valuedate": "06/07/2020",
        "vientiselitekd": "0"
    },
    {
        "accountno": "2",
        "amount": "-12.51",
        "bic_receiver": "",
        "bookdate": "06/07/2020",
        "category": "Liikkuminen",
        "counterparty_account_id": "67",
        "iban_receiver": "1",
        "paymentdate": "06/07/2020",
        "reference": "1",
        "saldo": "688.66",
        "taplajikd": "162",
        "tstamp": "2020-07-06 8:21:20",
        "valuedate": "06/07/2020",
        "vientiselitekd": "0"
    },
    {
        "accountno": "2",
        "amount": "-62.82",
        "bic_receiver": "OKOYFIHH",
        "bookdate": "08/07/2020",
        "category": "Liikkuminen",
        "counterparty_account_id": "198",
        "iban_receiver": "0",
        "paymentdate": "08/07/2020",
        "reference": "0",
        "saldo": "563.28",
        "taplajikd": "129",
        "tstamp": "2020-07-08 17:25:20",
        "valuedate": "08/07/2020",
        "vientiselitekd": "706"
    },
    {
        "accountno": "2",
        "amount": "-64.35",
        "bic_receiver": "",
        "bookdate": "15/07/2020",
        "category": "Liikkuminen",
        "counterparty_account_id": "37",
        "iban_receiver": "1",
        "paymentdate": "15/07/2020",
        "reference": "1",
        "saldo": "180.08",
        "taplajikd": "162",
        "tstamp": "2020-07-15 16:42:40",
        "valuedate": "15/07/2020",
        "vientiselitekd": "0"
    },
    {
        "accountno": "2",
        "amount": "-7.68",
        "bic_receiver": "",
        "bookdate": "20/07/2020",
        "category": "Liikkuminen",
        "counterparty_account_id": "136",
        "iban_receiver": "1",
        "paymentdate": "20/07/2020",
        "reference": "1",
        "saldo": "-40.79",
        "taplajikd": "162",
        "tstamp": "2020-07-20 6:56:00",
        "valuedate": "20/07/2020",
        "vientiselitekd": "0"
    },
    {
        "accountno": "2",
        "amount": "-5.33",
        "bic_receiver": "",
        "bookdate": "23/07/2020",
        "category": "Liikkuminen",
        "counterparty_account_id": "77",
        "iban_receiver": "1",
        "paymentdate": "23/07/2020",
        "reference": "1",
        "saldo": "62.75",
        "taplajikd": "162",
        "tstamp": "2020-07-23 19:12:00",
        "valuedate": "23/07/2020",
        "vientiselitekd": "0"
    },
    {
        "accountno": "2",
        "amount": "-1.75",
        "bic_receiver": "",
        "bookdate": "27/07/2020",
        "category": "Liikkuminen",
        "counterparty_account_id": "104",
        "iban_receiver": "1",
        "paymentdate": "27/07/2020",
        "reference": "1",
        "saldo": "26.87",
        "taplajikd": "162",
        "tstamp": "2020-07-27 6:13:20",
        "valuedate": "27/07/2020",
        "vientiselitekd": "0"
    },
    {
        "accountno": "2",
        "amount": "-4.81",
        "bic_receiver": "",
        "bookdate": "27/07/2020",
        "category": "Liikkuminen",
        "counterparty_account_id": "70",
        "iban_receiver": "1",
        "paymentdate": "27/07/2020",
        "reference": "1",
        "saldo": "-9.57",
        "taplajikd": "162",
        "tstamp": "2020-07-27 17:14:40",
        "valuedate": "27/07/2020",
        "vientiselitekd": "0"
    },
    {
        "accountno": "2",
        "amount": "-2.89",
        "bic_receiver": "",
        "bookdate": "29/07/2020",
        "category": "Liikkuminen",
        "counterparty_account_id": "111",
        "iban_receiver": "1",
        "paymentdate": "29/07/2020",
        "reference": "1",
        "saldo": "-25.57",
        "taplajikd": "162",
        "tstamp": "2020-07-29 20:26:40",
        "valuedate": "29/07/2020",
        "vientiselitekd": "0"
    },
    {
        "accountno": "2",
        "amount": "-206.43",
        "bic_receiver": "",
        "bookdate": "04/08/2020",
        "category": "Liikkuminen",
        "counterparty_account_id": "140",
        "iban_receiver": "1",
        "paymentdate": "03/08/2020",
        "reference": "1",
        "saldo": "773.79",
        "taplajikd": "162",
        "tstamp": "2020-08-03 14:09:14",
        "valuedate": "03/08/2020",
        "vientiselitekd": "0"
    },
    {
        "accountno": "2",
        "amount": "-13.84",
        "bic_receiver": "",
        "bookdate": "13/08/2020",
        "category": "Liikkuminen",
        "counterparty_account_id": "26",
        "iban_receiver": "1",
        "paymentdate": "13/08/2020",
        "reference": "1",
        "saldo": "412.44",
        "taplajikd": "162",
        "tstamp": "2020-08-13 17:13:51",
        "valuedate": "13/08/2020",
        "vientiselitekd": "0"
    },
    {
        "accountno": "2",
        "amount": "-14.45",
        "bic_receiver": "",
        "bookdate": "20/08/2020",
        "category": "Liikkuminen",
        "counterparty_account_id": "57",
        "iban_receiver": "1",
        "paymentdate": "20/08/2020",
        "reference": "1",
        "saldo": "106.33",
        "taplajikd": "162",
        "tstamp": "2020-08-20 16:00:00",
        "valuedate": "20/08/2020",
        "vientiselitekd": "0"
    },
    {
        "accountno": "2",
        "amount": "-4.18",
        "bic_receiver": "",
        "bookdate": "11/09/2020",
        "category": "Liikkuminen",
        "counterparty_account_id": "94",
        "iban_receiver": "1",
        "paymentdate": "11/09/2020",
        "reference": "1",
        "saldo": "4360.95",
        "taplajikd": "162",
        "tstamp": "2020-09-11 15:06:40",
        "valuedate": "11/09/2020",
        "vientiselitekd": "0"
    },
    {
        "accountno": "2",
        "amount": "-40.94",
        "bic_receiver": "",
        "bookdate": "17/09/2020",
        "category": "Liikkuminen",
        "counterparty_account_id": "74",
        "iban_receiver": "1",
        "paymentdate": "17/09/2020",
        "reference": "1",
        "saldo": "4198.7",
        "taplajikd": "162",
        "tstamp": "2020-09-17 13:20:00",
        "valuedate": "17/09/2020",
        "vientiselitekd": "0"
    },
    {
        "accountno": "2",
        "amount": "-24.14",
        "bic_receiver": "",
        "bookdate": "23/09/2020",
        "category": "Liikkuminen",
        "counterparty_account_id": "94",
        "iban_receiver": "1",
        "paymentdate": "23/09/2020",
        "reference": "1",
        "saldo": "2822.2",
        "taplajikd": "162",
        "tstamp": "2020-09-23 5:20:00",
        "valuedate": "23/09/2020",
        "vientiselitekd": "0"
    },
    {
        "accountno": "2",
        "amount": "-12.28",
        "bic_receiver": "",
        "bookdate": "12/10/2020",
        "category": "Liikkuminen",
        "counterparty_account_id": "109",
        "iban_receiver": "1",
        "paymentdate": "12/10/2020",
        "reference": "1",
        "saldo": "3864.31",
        "taplajikd": "162",
        "tstamp": "2020-10-12 10:58:59",
        "valuedate": "12/10/2020",
        "vientiselitekd": "0"
    },
    {
        "accountno": "2",
        "amount": "-90.56",
        "bic_receiver": "",
        "bookdate": "23/10/2020",
        "category": "Liikkuminen",
        "counterparty_account_id": "65",
        "iban_receiver": "1",
        "paymentdate": "23/10/2020",
        "reference": "1",
        "saldo": "3609.12",
        "taplajikd": "162",
        "tstamp": "2020-10-23 2:50:51",
        "valuedate": "23/10/2020",
        "vientiselitekd": "0"
    },
    {
        "accountno": "2",
        "amount": "-2.77",
        "bic_receiver": "",
        "bookdate": "27/10/2020",
        "category": "Liikkuminen",
        "counterparty_account_id": "87",
        "iban_receiver": "1",
        "paymentdate": "27/10/2020",
        "reference": "1",
        "saldo": "3581.97",
        "taplajikd": "162",
        "tstamp": "2020-10-27 6:30:31",
        "valuedate": "27/10/2020",
        "vientiselitekd": "0"
    },
    {
        "accountno": "2",
        "amount": "-28.29",
        "bic_receiver": "",
        "bookdate": "23/11/2020",
        "category": "Liikkuminen",
        "counterparty_account_id": "95",
        "iban_receiver": "1",
        "paymentdate": "23/11/2020",
        "reference": "1",
        "saldo": "6659.38",
        "taplajikd": "162",
        "tstamp": "2020-11-23 17:27:16",
        "valuedate": "23/11/2020",
        "vientiselitekd": "0"
    },
    {
        "accountno": "2",
        "amount": "-13.02",
        "bic_receiver": "",
        "bookdate": "23/11/2020",
        "category": "Liikkuminen",
        "counterparty_account_id": "99",
        "iban_receiver": "1",
        "paymentdate": "23/11/2020",
        "reference": "1",
        "saldo": "6646.36",
        "taplajikd": "162",
        "tstamp": "2020-11-23 19:38:11",
        "valuedate": "23/11/2020",
        "vientiselitekd": "0"
    },
    {
        "accountno": "2",
        "amount": "-43.65",
        "bic_receiver": "",
        "bookdate": "09/12/2020",
        "category": "Liikkuminen",
        "counterparty_account_id": "50",
        "iban_receiver": "1",
        "paymentdate": "09/12/2020",
        "reference": "1",
        "saldo": "7580.53",
        "taplajikd": "162",
        "tstamp": "2020-12-09 7:01:55",
        "valuedate": "09/12/2020",
        "vientiselitekd": "0"
    },
    {
        "accountno": "2",
        "amount": "-30.31",
        "bic_receiver": "",
        "bookdate": "14/12/2020",
        "category": "Liikkuminen",
        "counterparty_account_id": "70",
        "iban_receiver": "1",
        "paymentdate": "14/12/2020",
        "reference": "1",
        "saldo": "6628.06",
        "taplajikd": "162",
        "tstamp": "2020-12-14 1:22:33",
        "valuedate": "14/12/2020",
        "vientiselitekd": "0"
    },
    {
        "accountno": "2",
        "amount": "-8.5",
        "bic_receiver": "",
        "bookdate": "18/12/2020",
        "category": "Liikkuminen",
        "counterparty_account_id": "136",
        "iban_receiver": "1",
        "paymentdate": "17/12/2020",
        "reference": "1",
        "saldo": "4541.56",
        "taplajikd": "162",
        "tstamp": "2020-12-18 9:01:09",
        "valuedate": "18/12/2020",
        "vientiselitekd": "0"
    },
    {
        "accountno": "2",
        "amount": "-21.45",
        "bic_receiver": "",
        "bookdate": "31/12/2020",
        "category": "Liikkuminen",
        "counterparty_account_id": "45",
        "iban_receiver": "1",
        "paymentdate": "31/12/2020",
        "reference": "1",
        "saldo": "4667.19",
        "taplajikd": "162",
        "tstamp": "2020-12-31 5:21:01",
        "valuedate": "31/12/2020",
        "vientiselitekd": "0"
    },
    {
        "accountno": "3",
        "amount": "-4.98",
        "bic_receiver": "",
        "bookdate": "08/02/2019",
        "category": "Liikkuminen",
        "counterparty_account_id": "81",
        "iban_receiver": "1",
        "paymentdate": "08/02/2019",
        "reference": "1",
        "saldo": "44130.76",
        "taplajikd": "162",
        "tstamp": "2019-02-08 17:22:46",
        "valuedate": "08/02/2019",
        "vientiselitekd": "0"
    },
    {
        "accountno": "3",
        "amount": "-93.56",
        "bic_receiver": "",
        "bookdate": "03/05/2019",
        "category": "Liikkuminen",
        "counterparty_account_id": "111",
        "iban_receiver": "1",
        "paymentdate": "03/05/2019",
        "reference": "1",
        "saldo": "66562.68",
        "taplajikd": "162",
        "tstamp": "2019-05-03 23:02:24",
        "valuedate": "03/05/2019",
        "vientiselitekd": "0"
    },
    {
        "accountno": "3",
        "amount": "-23.16",
        "bic_receiver": "OKOYFIHH",
        "bookdate": "13/05/2019",
        "category": "Liikkuminen",
        "counterparty_account_id": "211",
        "iban_receiver": "0",
        "paymentdate": "13/05/2019",
        "reference": "0",
        "saldo": "66417.68",
        "taplajikd": "129",
        "tstamp": "2019-05-13 9:36:00",
        "valuedate": "13/05/2019",
        "vientiselitekd": "706"
    },
    {
        "accountno": "3",
        "amount": "-124.62",
        "bic_receiver": "",
        "bookdate": "14/05/2019",
        "category": "Liikkuminen",
        "counterparty_account_id": "165",
        "iban_receiver": "1",
        "paymentdate": "14/05/2019",
        "reference": "1",
        "saldo": "66293.06",
        "taplajikd": "162",
        "tstamp": "2019-05-14 1:16:48",
        "valuedate": "14/05/2019",
        "vientiselitekd": "0"
    },
    {
        "accountno": "3",
        "amount": "-618.12",
        "bic_receiver": "OKOYFIHH",
        "bookdate": "24/05/2019",
        "category": "Liikkuminen",
        "counterparty_account_id": "208",
        "iban_receiver": "0",
        "paymentdate": "23/05/2019",
        "reference": "0",
        "saldo": "66070.73",
        "taplajikd": "106",
        "tstamp": "2019-05-24 23:21:36",
        "valuedate": "24/05/2019",
        "vientiselitekd": "706"
    },
    {
        "accountno": "3",
        "amount": "-85.51",
        "bic_receiver": "",
        "bookdate": "07/06/2019",
        "category": "Liikkuminen",
        "counterparty_account_id": "124",
        "iban_receiver": "1",
        "paymentdate": "07/06/2019",
        "reference": "1",
        "saldo": "64691.53",
        "taplajikd": "162",
        "tstamp": "2019-06-07 14:53:48",
        "valuedate": "07/06/2019",
        "vientiselitekd": "0"
    },
    {
        "accountno": "3",
        "amount": "-9.37",
        "bic_receiver": "",
        "bookdate": "11/06/2019",
        "category": "Liikkuminen",
        "counterparty_account_id": "85",
        "iban_receiver": "1",
        "paymentdate": "11/06/2019",
        "reference": "1",
        "saldo": "70512.28",
        "taplajikd": "162",
        "tstamp": "2019-06-11 14:04:08",
        "valuedate": "11/06/2019",
        "vientiselitekd": "0"
    },
    {
        "accountno": "3",
        "amount": "-64.04",
        "bic_receiver": "",
        "bookdate": "17/06/2019",
        "category": "Liikkuminen",
        "counterparty_account_id": "86",
        "iban_receiver": "1",
        "paymentdate": "17/06/2019",
        "reference": "1",
        "saldo": "69128.6",
        "taplajikd": "162",
        "tstamp": "2019-06-17 11:35:10",
        "valuedate": "17/06/2019",
        "vientiselitekd": "0"
    },
    {
        "accountno": "3",
        "amount": "-71.73",
        "bic_receiver": "",
        "bookdate": "20/06/2019",
        "category": "Liikkuminen",
        "counterparty_account_id": "104",
        "iban_receiver": "1",
        "paymentdate": "19/06/2019",
        "reference": "1",
        "saldo": "68726.31",
        "taplajikd": "162",
        "tstamp": "2019-06-20 22:20:41",
        "valuedate": "20/06/2019",
        "vientiselitekd": "0"
    },
    {
        "accountno": "3",
        "amount": "-29.21",
        "bic_receiver": "",
        "bookdate": "25/06/2019",
        "category": "Liikkuminen",
        "counterparty_account_id": "158",
        "iban_receiver": "1",
        "paymentdate": "24/06/2019",
        "reference": "1",
        "saldo": "69345.27",
        "taplajikd": "162",
        "tstamp": "2019-06-25 0:00:00",
        "valuedate": "24/06/2019",
        "vientiselitekd": "0"
    },
    {
        "accountno": "3",
        "amount": "-30.59",
        "bic_receiver": "",
        "bookdate": "27/06/2019",
        "category": "Liikkuminen",
        "counterparty_account_id": "86",
        "iban_receiver": "1",
        "paymentdate": "27/06/2019",
        "reference": "1",
        "saldo": "69016.81",
        "taplajikd": "162",
        "tstamp": "2019-06-27 15:43:27",
        "valuedate": "27/06/2019",
        "vientiselitekd": "0"
    },
    {
        "accountno": "3",
        "amount": "-105.95",
        "bic_receiver": "",
        "bookdate": "27/06/2019",
        "category": "Liikkuminen",
        "counterparty_account_id": "90",
        "iban_receiver": "1",
        "paymentdate": "27/06/2019",
        "reference": "1",
        "saldo": "68910.86",
        "taplajikd": "162",
        "tstamp": "2019-06-27 17:22:46",
        "valuedate": "27/06/2019",
        "vientiselitekd": "0"
    },
    {
        "accountno": "3",
        "amount": "-57.28",
        "bic_receiver": "",
        "bookdate": "05/07/2019",
        "category": "Liikkuminen",
        "counterparty_account_id": "81",
        "iban_receiver": "1",
        "paymentdate": "05/07/2019",
        "reference": "1",
        "saldo": "68317.96",
        "taplajikd": "162",
        "tstamp": "2019-07-05 16:49:39",
        "valuedate": "05/07/2019",
        "vientiselitekd": "0"
    },
    {
        "accountno": "3",
        "amount": "-33.71",
        "bic_receiver": "",
        "bookdate": "09/07/2019",
        "category": "Liikkuminen",
        "counterparty_account_id": "90",
        "iban_receiver": "1",
        "paymentdate": "09/07/2019",
        "reference": "1",
        "saldo": "68107.95",
        "taplajikd": "162",
        "tstamp": "2019-07-09 13:14:29",
        "valuedate": "09/07/2019",
        "vientiselitekd": "0"
    },
    {
        "accountno": "3",
        "amount": "-148.48",
        "bic_receiver": "",
        "bookdate": "26/07/2019",
        "category": "Liikkuminen",
        "counterparty_account_id": "110",
        "iban_receiver": "1",
        "paymentdate": "23/07/2019",
        "reference": "1",
        "saldo": "69781.72",
        "taplajikd": "162",
        "tstamp": "2019-07-26 5:31:02",
        "valuedate": "26/07/2019",
        "vientiselitekd": "0"
    },
    {
        "accountno": "3",
        "amount": "-68.86",
        "bic_receiver": "",
        "bookdate": "29/07/2019",
        "category": "Liikkuminen",
        "counterparty_account_id": "156",
        "iban_receiver": "1",
        "paymentdate": "29/07/2019",
        "reference": "1",
        "saldo": "72984.82",
        "taplajikd": "162",
        "tstamp": "2019-07-29 1:55:52",
        "valuedate": "29/07/2019",
        "vientiselitekd": "0"
    },
    {
        "accountno": "3",
        "amount": "-242.28",
        "bic_receiver": "",
        "bookdate": "19/08/2019",
        "category": "Liikkuminen",
        "counterparty_account_id": "101",
        "iban_receiver": "1",
        "paymentdate": "19/08/2019",
        "reference": "1",
        "saldo": "72380.68",
        "taplajikd": "162",
        "tstamp": "2019-08-19 5:38:49",
        "valuedate": "19/08/2019",
        "vientiselitekd": "0"
    },
    {
        "accountno": "3",
        "amount": "-12.27",
        "bic_receiver": "",
        "bookdate": "20/08/2019",
        "category": "Liikkuminen",
        "counterparty_account_id": "60",
        "iban_receiver": "1",
        "paymentdate": "20/08/2019",
        "reference": "1",
        "saldo": "72360.69",
        "taplajikd": "162",
        "tstamp": "2019-08-20 21:10:35",
        "valuedate": "20/08/2019",
        "vientiselitekd": "0"
    },
    {
        "accountno": "3",
        "amount": "-21.05",
        "bic_receiver": "",
        "bookdate": "23/08/2019",
        "category": "Liikkuminen",
        "counterparty_account_id": "103",
        "iban_receiver": "1",
        "paymentdate": "23/08/2019",
        "reference": "1",
        "saldo": "71121.37",
        "taplajikd": "162",
        "tstamp": "2019-08-23 2:21:11",
        "valuedate": "23/08/2019",
        "vientiselitekd": "0"
    },
    {
        "accountno": "3",
        "amount": "-26.02",
        "bic_receiver": "",
        "bookdate": "29/08/2019",
        "category": "Liikkuminen",
        "counterparty_account_id": "86",
        "iban_receiver": "1",
        "paymentdate": "27/08/2019",
        "reference": "1",
        "saldo": "71080.97",
        "taplajikd": "162",
        "tstamp": "2019-08-27 17:52:56",
        "valuedate": "27/08/2019",
        "vientiselitekd": "0"
    },
    {
        "accountno": "3",
        "amount": "-59.85",
        "bic_receiver": "",
        "bookdate": "09/09/2019",
        "category": "Liikkuminen",
        "counterparty_account_id": "87",
        "iban_receiver": "1",
        "paymentdate": "09/09/2019",
        "reference": "1",
        "saldo": "70853.46",
        "taplajikd": "162",
        "tstamp": "2019-09-09 20:27:32",
        "valuedate": "09/09/2019",
        "vientiselitekd": "0"
    },
    {
        "accountno": "3",
        "amount": "-7.21",
        "bic_receiver": "",
        "bookdate": "25/09/2019",
        "category": "Liikkuminen",
        "counterparty_account_id": "53",
        "iban_receiver": "1",
        "paymentdate": "25/09/2019",
        "reference": "1",
        "saldo": "71521.63",
        "taplajikd": "162",
        "tstamp": "2019-09-25 13:46:14",
        "valuedate": "25/09/2019",
        "vientiselitekd": "0"
    },
    {
        "accountno": "3",
        "amount": "-27.07",
        "bic_receiver": "",
        "bookdate": "18/10/2019",
        "category": "Liikkuminen",
        "counterparty_account_id": "158",
        "iban_receiver": "1",
        "paymentdate": "18/10/2019",
        "reference": "1",
        "saldo": "72850.25",
        "taplajikd": "162",
        "tstamp": "2019-10-18 20:09:36",
        "valuedate": "18/10/2019",
        "vientiselitekd": "0"
    },
    {
        "accountno": "3",
        "amount": "-31.95",
        "bic_receiver": "",
        "bookdate": "07/11/2019",
        "category": "Liikkuminen",
        "counterparty_account_id": "64",
        "iban_receiver": "1",
        "paymentdate": "07/11/2019",
        "reference": "1",
        "saldo": "76069.52",
        "taplajikd": "162",
        "tstamp": "2019-11-07 10:50:19",
        "valuedate": "07/11/2019",
        "vientiselitekd": "0"
    },
    {
        "accountno": "3",
        "amount": "-14.73",
        "bic_receiver": "",
        "bookdate": "11/11/2019",
        "category": "Liikkuminen",
        "counterparty_account_id": "138",
        "iban_receiver": "1",
        "paymentdate": "11/11/2019",
        "reference": "1",
        "saldo": "75812.3",
        "taplajikd": "162",
        "tstamp": "2019-11-11 0:46:27",
        "valuedate": "11/11/2019",
        "vientiselitekd": "0"
    },
    {
        "accountno": "3",
        "amount": "-26.29",
        "bic_receiver": "",
        "bookdate": "19/11/2019",
        "category": "Liikkuminen",
        "counterparty_account_id": "100",
        "iban_receiver": "1",
        "paymentdate": "19/11/2019",
        "reference": "1",
        "saldo": "25533.83",
        "taplajikd": "162",
        "tstamp": "2019-11-20 0:00:00",
        "valuedate": "19/11/2019",
        "vientiselitekd": "0"
    },
    {
        "accountno": "3",
        "amount": "-117.68",
        "bic_receiver": "",
        "bookdate": "20/11/2019",
        "category": "Liikkuminen",
        "counterparty_account_id": "57",
        "iban_receiver": "1",
        "paymentdate": "20/11/2019",
        "reference": "1",
        "saldo": "25416.15",
        "taplajikd": "162",
        "tstamp": "2019-11-20 15:29:02",
        "valuedate": "20/11/2019",
        "vientiselitekd": "0"
    },
    {
        "accountno": "3",
        "amount": "-288.42",
        "bic_receiver": "OKOYFIHH",
        "bookdate": "25/11/2019",
        "category": "Liikkuminen",
        "counterparty_account_id": "212",
        "iban_receiver": "0",
        "paymentdate": "25/11/2019",
        "reference": "0",
        "saldo": "24599.37",
        "taplajikd": "129",
        "tstamp": "2019-11-25 20:54:12",
        "valuedate": "25/11/2019",
        "vientiselitekd": "706"
    },
    {
        "accountno": "3",
        "amount": "-21.25",
        "bic_receiver": "",
        "bookdate": "26/11/2019",
        "category": "Liikkuminen",
        "counterparty_account_id": "70",
        "iban_receiver": "1",
        "paymentdate": "26/11/2019",
        "reference": "1",
        "saldo": "24578.12",
        "taplajikd": "162",
        "tstamp": "2019-11-26 19:21:17",
        "valuedate": "26/11/2019",
        "vientiselitekd": "0"
    },
    {
        "accountno": "3",
        "amount": "-298.68",
        "bic_receiver": "",
        "bookdate": "09/12/2019",
        "category": "Liikkuminen",
        "counterparty_account_id": "53",
        "iban_receiver": "1",
        "paymentdate": "09/12/2019",
        "reference": "1",
        "saldo": "26848.87",
        "taplajikd": "162",
        "tstamp": "2019-12-09 2:05:13",
        "valuedate": "09/12/2019",
        "vientiselitekd": "0"
    },
    {
        "accountno": "3",
        "amount": "-15.91",
        "bic_receiver": "",
        "bookdate": "27/12/2019",
        "category": "Liikkuminen",
        "counterparty_account_id": "96",
        "iban_receiver": "1",
        "paymentdate": "27/12/2019",
        "reference": "1",
        "saldo": "28971.68",
        "taplajikd": "162",
        "tstamp": "2019-12-27 3:49:34",
        "valuedate": "27/12/2019",
        "vientiselitekd": "0"
    },
    {
        "accountno": "3",
        "amount": "-647.67",
        "bic_receiver": "OKOYFIHH",
        "bookdate": "10/01/2020",
        "category": "Liikkuminen",
        "counterparty_account_id": "204",
        "iban_receiver": "0",
        "paymentdate": "10/01/2020",
        "reference": "0",
        "saldo": "28988.25",
        "taplajikd": "106",
        "tstamp": "2020-01-10 12:14:07",
        "valuedate": "10/01/2020",
        "vientiselitekd": "706"
    },
    {
        "accountno": "3",
        "amount": "-49.39",
        "bic_receiver": "",
        "bookdate": "10/01/2020",
        "category": "Liikkuminen",
        "counterparty_account_id": "164",
        "iban_receiver": "1",
        "paymentdate": "10/01/2020",
        "reference": "1",
        "saldo": "28794.81",
        "taplajikd": "162",
        "tstamp": "2020-01-10 22:35:18",
        "valuedate": "10/01/2020",
        "vientiselitekd": "0"
    },
    {
        "accountno": "3",
        "amount": "-64.64",
        "bic_receiver": "",
        "bookdate": "15/01/2020",
        "category": "Liikkuminen",
        "counterparty_account_id": "96",
        "iban_receiver": "1",
        "paymentdate": "15/01/2020",
        "reference": "1",
        "saldo": "28631.48",
        "taplajikd": "162",
        "tstamp": "2020-01-15 14:07:04",
        "valuedate": "15/01/2020",
        "vientiselitekd": "0"
    },
    {
        "accountno": "3",
        "amount": "-43.18",
        "bic_receiver": "",
        "bookdate": "27/01/2020",
        "category": "Liikkuminen",
        "counterparty_account_id": "136",
        "iban_receiver": "1",
        "paymentdate": "27/01/2020",
        "reference": "1",
        "saldo": "27868.62",
        "taplajikd": "162",
        "tstamp": "2020-01-27 23:03:32",
        "valuedate": "27/01/2020",
        "vientiselitekd": "0"
    },
    {
        "accountno": "3",
        "amount": "-114.11",
        "bic_receiver": "",
        "bookdate": "17/02/2020",
        "category": "Liikkuminen",
        "counterparty_account_id": "163",
        "iban_receiver": "1",
        "paymentdate": "17/02/2020",
        "reference": "1",
        "saldo": "27390.02",
        "taplajikd": "162",
        "tstamp": "2020-02-17 13:42:51",
        "valuedate": "17/02/2020",
        "vientiselitekd": "0"
    },
    {
        "accountno": "3",
        "amount": "-4.06",
        "bic_receiver": "",
        "bookdate": "17/02/2020",
        "category": "Liikkuminen",
        "counterparty_account_id": "165",
        "iban_receiver": "1",
        "paymentdate": "17/02/2020",
        "reference": "1",
        "saldo": "27385.96",
        "taplajikd": "162",
        "tstamp": "2020-02-17 21:56:34",
        "valuedate": "17/02/2020",
        "vientiselitekd": "0"
    },
    {
        "accountno": "3",
        "amount": "-40.02",
        "bic_receiver": "",
        "bookdate": "05/03/2020",
        "category": "Liikkuminen",
        "counterparty_account_id": "82",
        "iban_receiver": "1",
        "paymentdate": "05/03/2020",
        "reference": "1",
        "saldo": "30504.07",
        "taplajikd": "162",
        "tstamp": "2020-03-05 12:16:00",
        "valuedate": "05/03/2020",
        "vientiselitekd": "0"
    },
    {
        "accountno": "3",
        "amount": "-23.47",
        "bic_receiver": "",
        "bookdate": "09/03/2020",
        "category": "Liikkuminen",
        "counterparty_account_id": "66",
        "iban_receiver": "1",
        "paymentdate": "09/03/2020",
        "reference": "1",
        "saldo": "30480.6",
        "taplajikd": "162",
        "tstamp": "2020-03-09 6:24:00",
        "valuedate": "09/03/2020",
        "vientiselitekd": "0"
    },
    {
        "accountno": "3",
        "amount": "-31.26",
        "bic_receiver": "",
        "bookdate": "23/03/2020",
        "category": "Liikkuminen",
        "counterparty_account_id": "166",
        "iban_receiver": "1",
        "paymentdate": "23/03/2020",
        "reference": "1",
        "saldo": "29745.07",
        "taplajikd": "162",
        "tstamp": "2020-03-23 10:08:00",
        "valuedate": "23/03/2020",
        "vientiselitekd": "0"
    },
    {
        "accountno": "3",
        "amount": "-55.79",
        "bic_receiver": "",
        "bookdate": "07/04/2020",
        "category": "Liikkuminen",
        "counterparty_account_id": "149",
        "iban_receiver": "1",
        "paymentdate": "07/04/2020",
        "reference": "1",
        "saldo": "29827.1",
        "taplajikd": "162",
        "tstamp": "2020-04-07 23:26:31",
        "valuedate": "07/04/2020",
        "vientiselitekd": "0"
    },
    {
        "accountno": "3",
        "amount": "-158.7",
        "bic_receiver": "",
        "bookdate": "07/05/2020",
        "category": "Liikkuminen",
        "counterparty_account_id": "170",
        "iban_receiver": "1",
        "paymentdate": "07/05/2020",
        "reference": "1",
        "saldo": "32304.08",
        "taplajikd": "162",
        "tstamp": "2020-05-07 7:50:12",
        "valuedate": "07/05/2020",
        "vientiselitekd": "0"
    },
    {
        "accountno": "3",
        "amount": "-4.82",
        "bic_receiver": "",
        "bookdate": "13/05/2020",
        "category": "Liikkuminen",
        "counterparty_account_id": "47",
        "iban_receiver": "1",
        "paymentdate": "13/05/2020",
        "reference": "1",
        "saldo": "27294.95",
        "taplajikd": "162",
        "tstamp": "2020-05-13 22:02:27",
        "valuedate": "13/05/2020",
        "vientiselitekd": "0"
    },
    {
        "accountno": "3",
        "amount": "-18.47",
        "bic_receiver": "",
        "bookdate": "18/05/2020",
        "category": "Liikkuminen",
        "counterparty_account_id": "148",
        "iban_receiver": "1",
        "paymentdate": "18/05/2020",
        "reference": "1",
        "saldo": "27067.02",
        "taplajikd": "162",
        "tstamp": "2020-05-18 17:08:34",
        "valuedate": "18/05/2020",
        "vientiselitekd": "0"
    },
    {
        "accountno": "3",
        "amount": "-48.92",
        "bic_receiver": "",
        "bookdate": "08/06/2020",
        "category": "Liikkuminen",
        "counterparty_account_id": "135",
        "iban_receiver": "1",
        "paymentdate": "08/06/2020",
        "reference": "1",
        "saldo": "25598.31",
        "taplajikd": "162",
        "tstamp": "2020-06-08 8:10:03",
        "valuedate": "08/06/2020",
        "vientiselitekd": "0"
    },
    {
        "accountno": "3",
        "amount": "-38.13",
        "bic_receiver": "",
        "bookdate": "09/06/2020",
        "category": "Liikkuminen",
        "counterparty_account_id": "88",
        "iban_receiver": "1",
        "paymentdate": "09/06/2020",
        "reference": "1",
        "saldo": "25146.08",
        "taplajikd": "162",
        "tstamp": "2020-06-09 2:38:19",
        "valuedate": "09/06/2020",
        "vientiselitekd": "0"
    },
    {
        "accountno": "3",
        "amount": "-60.29",
        "bic_receiver": "",
        "bookdate": "10/06/2020",
        "category": "Liikkuminen",
        "counterparty_account_id": "139",
        "iban_receiver": "1",
        "paymentdate": "09/06/2020",
        "reference": "1",
        "saldo": "25085.79",
        "taplajikd": "162",
        "tstamp": "2020-06-09 4:01:15",
        "valuedate": "09/06/2020",
        "vientiselitekd": "0"
    },
    {
        "accountno": "3",
        "amount": "-28.08",
        "bic_receiver": "",
        "bookdate": "10/06/2020",
        "category": "Liikkuminen",
        "counterparty_account_id": "55",
        "iban_receiver": "1",
        "paymentdate": "09/06/2020",
        "reference": "1",
        "saldo": "25057.71",
        "taplajikd": "162",
        "tstamp": "2020-06-09 10:10:41",
        "valuedate": "09/06/2020",
        "vientiselitekd": "0"
    },
    {
        "accountno": "3",
        "amount": "-40.21",
        "bic_receiver": "",
        "bookdate": "11/06/2020",
        "category": "Liikkuminen",
        "counterparty_account_id": "87",
        "iban_receiver": "1",
        "paymentdate": "11/06/2020",
        "reference": "1",
        "saldo": "24807.65",
        "taplajikd": "162",
        "tstamp": "2020-06-11 8:47:45",
        "valuedate": "11/06/2020",
        "vientiselitekd": "0"
    },
    {
        "accountno": "3",
        "amount": "-135.24",
        "bic_receiver": "",
        "bookdate": "11/06/2020",
        "category": "Liikkuminen",
        "counterparty_account_id": "111",
        "iban_receiver": "1",
        "paymentdate": "11/06/2020",
        "reference": "1",
        "saldo": "24651.87",
        "taplajikd": "162",
        "tstamp": "2020-06-11 23:52:28",
        "valuedate": "11/06/2020",
        "vientiselitekd": "0"
    },
    {
        "accountno": "3",
        "amount": "-75.95",
        "bic_receiver": "",
        "bookdate": "12/06/2020",
        "category": "Liikkuminen",
        "counterparty_account_id": "165",
        "iban_receiver": "1",
        "paymentdate": "12/06/2020",
        "reference": "1",
        "saldo": "24524.68",
        "taplajikd": "162",
        "tstamp": "2020-06-12 22:29:32",
        "valuedate": "12/06/2020",
        "vientiselitekd": "0"
    },
    {
        "accountno": "3",
        "amount": "-16.22",
        "bic_receiver": "",
        "bookdate": "15/06/2020",
        "category": "Liikkuminen",
        "counterparty_account_id": "47",
        "iban_receiver": "1",
        "paymentdate": "15/06/2020",
        "reference": "1",
        "saldo": "24128.05",
        "taplajikd": "162",
        "tstamp": "2020-06-15 12:11:19",
        "valuedate": "15/06/2020",
        "vientiselitekd": "0"
    },
    {
        "accountno": "3",
        "amount": "-45.31",
        "bic_receiver": "",
        "bookdate": "16/06/2020",
        "category": "Liikkuminen",
        "counterparty_account_id": "113",
        "iban_receiver": "1",
        "paymentdate": "16/06/2020",
        "reference": "1",
        "saldo": "23949.94",
        "taplajikd": "162",
        "tstamp": "2020-06-16 8:02:31",
        "valuedate": "16/06/2020",
        "vientiselitekd": "0"
    },
    {
        "accountno": "3",
        "amount": "-757.79",
        "bic_receiver": "DABAFIHH",
        "bookdate": "21/06/2020",
        "category": "Liikkuminen",
        "counterparty_account_id": "36",
        "iban_receiver": "0",
        "paymentdate": "21/06/2020",
        "reference": "0",
        "saldo": "22582.71",
        "taplajikd": "106",
        "tstamp": "2020-06-21 10:03:08",
        "valuedate": "21/06/2020",
        "vientiselitekd": "0"
    },
    {
        "accountno": "3",
        "amount": "-4.69",
        "bic_receiver": "",
        "bookdate": "22/06/2020",
        "category": "Liikkuminen",
        "counterparty_account_id": "146",
        "iban_receiver": "1",
        "paymentdate": "22/06/2020",
        "reference": "1",
        "saldo": "22564.68",
        "taplajikd": "162",
        "tstamp": "2020-06-22 16:12:34",
        "valuedate": "22/06/2020",
        "vientiselitekd": "0"
    },
    {
        "accountno": "3",
        "amount": "-7.83",
        "bic_receiver": "",
        "bookdate": "22/06/2020",
        "category": "Liikkuminen",
        "counterparty_account_id": "147",
        "iban_receiver": "1",
        "paymentdate": "22/06/2020",
        "reference": "1",
        "saldo": "22528.23",
        "taplajikd": "162",
        "tstamp": "2020-06-22 23:44:55",
        "valuedate": "22/06/2020",
        "vientiselitekd": "0"
    },
    {
        "accountno": "3",
        "amount": "-11.17",
        "bic_receiver": "",
        "bookdate": "23/06/2020",
        "category": "Liikkuminen",
        "counterparty_account_id": "156",
        "iban_receiver": "1",
        "paymentdate": "23/06/2020",
        "reference": "1",
        "saldo": "22517.06",
        "taplajikd": "162",
        "tstamp": "2020-06-23 5:54:21",
        "valuedate": "23/06/2020",
        "vientiselitekd": "0"
    },
    {
        "accountno": "3",
        "amount": "-48.28",
        "bic_receiver": "",
        "bookdate": "24/06/2020",
        "category": "Liikkuminen",
        "counterparty_account_id": "113",
        "iban_receiver": "1",
        "paymentdate": "24/06/2020",
        "reference": "1",
        "saldo": "22337.12",
        "taplajikd": "162",
        "tstamp": "2020-06-24 13:26:42",
        "valuedate": "24/06/2020",
        "vientiselitekd": "0"
    },
    {
        "accountno": "3",
        "amount": "-139.88",
        "bic_receiver": "",
        "bookdate": "24/06/2020",
        "category": "Liikkuminen",
        "counterparty_account_id": "108",
        "iban_receiver": "1",
        "paymentdate": "24/06/2020",
        "reference": "1",
        "saldo": "22194.91",
        "taplajikd": "162",
        "tstamp": "2020-06-24 20:59:03",
        "valuedate": "24/06/2020",
        "vientiselitekd": "0"
    },
    {
        "accountno": "3",
        "amount": "-203.51",
        "bic_receiver": "",
        "bookdate": "26/06/2020",
        "category": "Liikkuminen",
        "counterparty_account_id": "117",
        "iban_receiver": "1",
        "paymentdate": "26/06/2020",
        "reference": "1",
        "saldo": "21907.55",
        "taplajikd": "162",
        "tstamp": "2020-06-26 4:31:25",
        "valuedate": "26/06/2020",
        "vientiselitekd": "0"
    },
    {
        "accountno": "3",
        "amount": "-10.73",
        "bic_receiver": "",
        "bookdate": "29/06/2020",
        "category": "Liikkuminen",
        "counterparty_account_id": "124",
        "iban_receiver": "1",
        "paymentdate": "29/06/2020",
        "reference": "1",
        "saldo": "21517.35",
        "taplajikd": "162",
        "tstamp": "2020-06-29 7:54:58",
        "valuedate": "29/06/2020",
        "vientiselitekd": "0"
    },
    {
        "accountno": "3",
        "amount": "-6.91",
        "bic_receiver": "",
        "bookdate": "29/06/2020",
        "category": "Liikkuminen",
        "counterparty_account_id": "140",
        "iban_receiver": "1",
        "paymentdate": "29/06/2020",
        "reference": "1",
        "saldo": "21335.68",
        "taplajikd": "162",
        "tstamp": "2020-06-29 14:04:24",
        "valuedate": "29/06/2020",
        "vientiselitekd": "0"
    },
    {
        "accountno": "3",
        "amount": "-87.63",
        "bic_receiver": "",
        "bookdate": "03/07/2020",
        "category": "Liikkuminen",
        "counterparty_account_id": "59",
        "iban_receiver": "1",
        "paymentdate": "02/07/2020",
        "reference": "1",
        "saldo": "21143.39",
        "taplajikd": "162",
        "tstamp": "2020-07-02 7:49:44",
        "valuedate": "02/07/2020",
        "vientiselitekd": "0"
    },
    {
        "accountno": "3",
        "amount": "-6.65",
        "bic_receiver": "",
        "bookdate": "02/07/2020",
        "category": "Liikkuminen",
        "counterparty_account_id": "158",
        "iban_receiver": "1",
        "paymentdate": "02/07/2020",
        "reference": "1",
        "saldo": "21136.74",
        "taplajikd": "162",
        "tstamp": "2020-07-02 7:57:26",
        "valuedate": "02/07/2020",
        "vientiselitekd": "0"
    },
    {
        "accountno": "3",
        "amount": "-18.31",
        "bic_receiver": "",
        "bookdate": "06/07/2020",
        "category": "Liikkuminen",
        "counterparty_account_id": "81",
        "iban_receiver": "1",
        "paymentdate": "06/07/2020",
        "reference": "1",
        "saldo": "20770.38",
        "taplajikd": "162",
        "tstamp": "2020-07-06 15:24:04",
        "valuedate": "06/07/2020",
        "vientiselitekd": "0"
    },
    {
        "accountno": "3",
        "amount": "-14.29",
        "bic_receiver": "",
        "bookdate": "08/07/2020",
        "category": "Liikkuminen",
        "counterparty_account_id": "143",
        "iban_receiver": "1",
        "paymentdate": "06/07/2020",
        "reference": "1",
        "saldo": "20756.09",
        "taplajikd": "162",
        "tstamp": "2020-07-06 23:13:48",
        "valuedate": "06/07/2020",
        "vientiselitekd": "0"
    },
    {
        "accountno": "3",
        "amount": "-182.47",
        "bic_receiver": "",
        "bookdate": "07/07/2020",
        "category": "Liikkuminen",
        "counterparty_account_id": "142",
        "iban_receiver": "1",
        "paymentdate": "07/07/2020",
        "reference": "1",
        "saldo": "20498.1",
        "taplajikd": "162",
        "tstamp": "2020-07-07 7:11:14",
        "valuedate": "07/07/2020",
        "vientiselitekd": "0"
    },
    {
        "accountno": "3",
        "amount": "-47.57",
        "bic_receiver": "",
        "bookdate": "07/07/2020",
        "category": "Liikkuminen",
        "counterparty_account_id": "156",
        "iban_receiver": "1",
        "paymentdate": "07/07/2020",
        "reference": "1",
        "saldo": "20445.38",
        "taplajikd": "162",
        "tstamp": "2020-07-07 15:08:40",
        "valuedate": "07/07/2020",
        "vientiselitekd": "0"
    },
    {
        "accountno": "3",
        "amount": "-2.54",
        "bic_receiver": "",
        "bookdate": "09/07/2020",
        "category": "Liikkuminen",
        "counterparty_account_id": "134",
        "iban_receiver": "1",
        "paymentdate": "09/07/2020",
        "reference": "1",
        "saldo": "20158.94",
        "taplajikd": "162",
        "tstamp": "2020-07-09 22:58:24",
        "valuedate": "09/07/2020",
        "vientiselitekd": "0"
    },
    {
        "accountno": "3",
        "amount": "-32.41",
        "bic_receiver": "",
        "bookdate": "10/07/2020",
        "category": "Liikkuminen",
        "counterparty_account_id": "87",
        "iban_receiver": "1",
        "paymentdate": "10/07/2020",
        "reference": "1",
        "saldo": "22253.78",
        "taplajikd": "162",
        "tstamp": "2020-07-10 22:35:18",
        "valuedate": "10/07/2020",
        "vientiselitekd": "0"
    },
    {
        "accountno": "3",
        "amount": "-57.43",
        "bic_receiver": "",
        "bookdate": "13/07/2020",
        "category": "Liikkuminen",
        "counterparty_account_id": "65",
        "iban_receiver": "1",
        "paymentdate": "13/07/2020",
        "reference": "1",
        "saldo": "22177.31",
        "taplajikd": "162",
        "tstamp": "2020-07-13 6:25:02",
        "valuedate": "13/07/2020",
        "vientiselitekd": "0"
    },
    {
        "accountno": "3",
        "amount": "-43.95",
        "bic_receiver": "",
        "bookdate": "13/07/2020",
        "category": "Liikkuminen",
        "counterparty_account_id": "87",
        "iban_receiver": "1",
        "paymentdate": "13/07/2020",
        "reference": "1",
        "saldo": "21689.69",
        "taplajikd": "162",
        "tstamp": "2020-07-13 14:22:28",
        "valuedate": "13/07/2020",
        "vientiselitekd": "0"
    },
    {
        "accountno": "3",
        "amount": "-17.72",
        "bic_receiver": "",
        "bookdate": "15/07/2020",
        "category": "Liikkuminen",
        "counterparty_account_id": "103",
        "iban_receiver": "1",
        "paymentdate": "15/07/2020",
        "reference": "1",
        "saldo": "21904.23",
        "taplajikd": "162",
        "tstamp": "2020-07-15 21:56:47",
        "valuedate": "15/07/2020",
        "vientiselitekd": "0"
    },
    {
        "accountno": "3",
        "amount": "-5.63",
        "bic_receiver": "",
        "bookdate": "16/07/2020",
        "category": "Liikkuminen",
        "counterparty_account_id": "115",
        "iban_receiver": "1",
        "paymentdate": "16/07/2020",
        "reference": "1",
        "saldo": "21884.29",
        "taplajikd": "162",
        "tstamp": "2020-07-16 13:43:57",
        "valuedate": "16/07/2020",
        "vientiselitekd": "0"
    },
    {
        "accountno": "3",
        "amount": "-21.87",
        "bic_receiver": "",
        "bookdate": "20/07/2020",
        "category": "Liikkuminen",
        "counterparty_account_id": "129",
        "iban_receiver": "1",
        "paymentdate": "20/07/2020",
        "reference": "1",
        "saldo": "20031.79",
        "taplajikd": "162",
        "tstamp": "2020-07-20 5:46:31",
        "valuedate": "20/07/2020",
        "vientiselitekd": "0"
    },
    {
        "accountno": "3",
        "amount": "-27.34",
        "bic_receiver": "",
        "bookdate": "20/07/2020",
        "category": "Liikkuminen",
        "counterparty_account_id": "135",
        "iban_receiver": "1",
        "paymentdate": "20/07/2020",
        "reference": "1",
        "saldo": "19981.71",
        "taplajikd": "162",
        "tstamp": "2020-07-20 13:28:33",
        "valuedate": "20/07/2020",
        "vientiselitekd": "0"
    },
    {
        "accountno": "3",
        "amount": "-32.41",
        "bic_receiver": "",
        "bookdate": "22/07/2020",
        "category": "Liikkuminen",
        "counterparty_account_id": "134",
        "iban_receiver": "1",
        "paymentdate": "22/07/2020",
        "reference": "1",
        "saldo": "19914.18",
        "taplajikd": "162",
        "tstamp": "2020-07-22 5:15:43",
        "valuedate": "22/07/2020",
        "vientiselitekd": "0"
    },
    {
        "accountno": "3",
        "amount": "-11.93",
        "bic_receiver": "",
        "bookdate": "22/07/2020",
        "category": "Liikkuminen",
        "counterparty_account_id": "73",
        "iban_receiver": "1",
        "paymentdate": "22/07/2020",
        "reference": "1",
        "saldo": "19902.25",
        "taplajikd": "162",
        "tstamp": "2020-07-22 5:23:25",
        "valuedate": "22/07/2020",
        "vientiselitekd": "0"
    },
    {
        "accountno": "3",
        "amount": "-19.72",
        "bic_receiver": "",
        "bookdate": "30/07/2020",
        "category": "Liikkuminen",
        "counterparty_account_id": "134",
        "iban_receiver": "1",
        "paymentdate": "30/07/2020",
        "reference": "1",
        "saldo": "24798.95",
        "taplajikd": "162",
        "tstamp": "2020-07-30 20:16:41",
        "valuedate": "30/07/2020",
        "vientiselitekd": "0"
    },
    {
        "accountno": "3",
        "amount": "-78.49",
        "bic_receiver": "",
        "bookdate": "31/07/2020",
        "category": "Liikkuminen",
        "counterparty_account_id": "94",
        "iban_receiver": "1",
        "paymentdate": "31/07/2020",
        "reference": "1",
        "saldo": "24720.46",
        "taplajikd": "162",
        "tstamp": "2020-07-31 4:14:07",
        "valuedate": "31/07/2020",
        "vientiselitekd": "0"
    },
    {
        "accountno": "3",
        "amount": "-22.63",
        "bic_receiver": "",
        "bookdate": "12/08/2020",
        "category": "Liikkuminen",
        "counterparty_account_id": "143",
        "iban_receiver": "1",
        "paymentdate": "12/08/2020",
        "reference": "1",
        "saldo": "24485.1",
        "taplajikd": "162",
        "tstamp": "2020-08-12 12:50:14",
        "valuedate": "12/08/2020",
        "vientiselitekd": "0"
    },
    {
        "accountno": "3",
        "amount": "-28.36",
        "bic_receiver": "",
        "bookdate": "18/09/2020",
        "category": "Liikkuminen",
        "counterparty_account_id": "99",
        "iban_receiver": "1",
        "paymentdate": "18/09/2020",
        "reference": "1",
        "saldo": "43861.38",
        "taplajikd": "162",
        "tstamp": "2020-09-18 22:56:56",
        "valuedate": "18/09/2020",
        "vientiselitekd": "0"
    },
    {
        "accountno": "3",
        "amount": "-7.36",
        "bic_receiver": "",
        "bookdate": "25/09/2020",
        "category": "Liikkuminen",
        "counterparty_account_id": "71",
        "iban_receiver": "1",
        "paymentdate": "25/09/2020",
        "reference": "1",
        "saldo": "43503.32",
        "taplajikd": "162",
        "tstamp": "2020-09-25 9:38:06",
        "valuedate": "25/09/2020",
        "vientiselitekd": "0"
    },
    {
        "accountno": "3",
        "amount": "-27.82",
        "bic_receiver": "",
        "bookdate": "09/10/2020",
        "category": "Liikkuminen",
        "counterparty_account_id": "86",
        "iban_receiver": "1",
        "paymentdate": "09/10/2020",
        "reference": "1",
        "saldo": "12465.87",
        "taplajikd": "162",
        "tstamp": "2020-10-09 21:20:00",
        "valuedate": "09/10/2020",
        "vientiselitekd": "0"
    },
    {
        "accountno": "3",
        "amount": "-46.92",
        "bic_receiver": "",
        "bookdate": "12/10/2020",
        "category": "Liikkuminen",
        "counterparty_account_id": "117",
        "iban_receiver": "1",
        "paymentdate": "12/10/2020",
        "reference": "1",
        "saldo": "17558.66",
        "taplajikd": "162",
        "tstamp": "2020-10-12 8:18:49",
        "valuedate": "12/10/2020",
        "vientiselitekd": "0"
    },
    {
        "accountno": "3",
        "amount": "-63.65",
        "bic_receiver": "",
        "bookdate": "13/10/2020",
        "category": "Liikkuminen",
        "counterparty_account_id": "88",
        "iban_receiver": "1",
        "paymentdate": "13/10/2020",
        "reference": "1",
        "saldo": "17400.06",
        "taplajikd": "162",
        "tstamp": "2020-10-13 18:40:00",
        "valuedate": "13/10/2020",
        "vientiselitekd": "0"
    },
    {
        "accountno": "3",
        "amount": "-48.01",
        "bic_receiver": "",
        "bookdate": "15/10/2020",
        "category": "Liikkuminen",
        "counterparty_account_id": "146",
        "iban_receiver": "1",
        "paymentdate": "15/10/2020",
        "reference": "1",
        "saldo": "17352.05",
        "taplajikd": "162",
        "tstamp": "2020-10-15 4:23:32",
        "valuedate": "15/10/2020",
        "vientiselitekd": "0"
    },
    {
        "accountno": "3",
        "amount": "-12.64",
        "bic_receiver": "",
        "bookdate": "20/10/2020",
        "category": "Liikkuminen",
        "counterparty_account_id": "53",
        "iban_receiver": "1",
        "paymentdate": "20/10/2020",
        "reference": "1",
        "saldo": "18371.63",
        "taplajikd": "162",
        "tstamp": "2020-10-20 1:05:53",
        "valuedate": "20/10/2020",
        "vientiselitekd": "0"
    },
    {
        "accountno": "3",
        "amount": "-10.51",
        "bic_receiver": "",
        "bookdate": "21/10/2020",
        "category": "Liikkuminen",
        "counterparty_account_id": "167",
        "iban_receiver": "1",
        "paymentdate": "21/10/2020",
        "reference": "1",
        "saldo": "17795.01",
        "taplajikd": "162",
        "tstamp": "2020-10-21 16:37:39",
        "valuedate": "21/10/2020",
        "vientiselitekd": "0"
    },
    {
        "accountno": "3",
        "amount": "-33.78",
        "bic_receiver": "",
        "bookdate": "26/10/2020",
        "category": "Liikkuminen",
        "counterparty_account_id": "65",
        "iban_receiver": "1",
        "paymentdate": "26/10/2020",
        "reference": "1",
        "saldo": "16375.58",
        "taplajikd": "162",
        "tstamp": "2020-10-26 2:58:49",
        "valuedate": "26/10/2020",
        "vientiselitekd": "0"
    },
    {
        "accountno": "3",
        "amount": "-4.48",
        "bic_receiver": "",
        "bookdate": "29/10/2020",
        "category": "Liikkuminen",
        "counterparty_account_id": "156",
        "iban_receiver": "1",
        "paymentdate": "29/10/2020",
        "reference": "1",
        "saldo": "15807.63",
        "taplajikd": "162",
        "tstamp": "2020-10-29 13:57:39",
        "valuedate": "29/10/2020",
        "vientiselitekd": "0"
    },
    {
        "accountno": "3",
        "amount": "-106.4",
        "bic_receiver": "",
        "bookdate": "30/10/2020",
        "category": "Liikkuminen",
        "counterparty_account_id": "151",
        "iban_receiver": "1",
        "paymentdate": "30/10/2020",
        "reference": "1",
        "saldo": "15701.23",
        "taplajikd": "162",
        "tstamp": "2020-10-30 9:24:42",
        "valuedate": "30/10/2020",
        "vientiselitekd": "0"
    },
    {
        "accountno": "3",
        "amount": "-25.67",
        "bic_receiver": "",
        "bookdate": "30/10/2020",
        "category": "Liikkuminen",
        "counterparty_account_id": "105",
        "iban_receiver": "1",
        "paymentdate": "30/10/2020",
        "reference": "1",
        "saldo": "15497.55",
        "taplajikd": "162",
        "tstamp": "2020-10-30 23:41:11",
        "valuedate": "30/10/2020",
        "vientiselitekd": "0"
    },
    {
        "accountno": "3",
        "amount": "-117.05",
        "bic_receiver": "",
        "bookdate": "04/11/2020",
        "category": "Liikkuminen",
        "counterparty_account_id": "110",
        "iban_receiver": "1",
        "paymentdate": "04/11/2020",
        "reference": "1",
        "saldo": "20928.89",
        "taplajikd": "162",
        "tstamp": "2020-11-04 14:09:50",
        "valuedate": "04/11/2020",
        "vientiselitekd": "0"
    },
    {
        "accountno": "3",
        "amount": "-205.27",
        "bic_receiver": "OKOYFIHH",
        "bookdate": "06/11/2020",
        "category": "Liikkuminen",
        "counterparty_account_id": "8",
        "iban_receiver": "0",
        "paymentdate": "06/11/2020",
        "reference": "0",
        "saldo": "21390.08",
        "taplajikd": "106",
        "tstamp": "2020-11-06 5:54:06",
        "valuedate": "06/11/2020",
        "vientiselitekd": "0"
    },
    {
        "accountno": "3",
        "amount": "-28.6",
        "bic_receiver": "OKOYFIHH",
        "bookdate": "06/11/2020",
        "category": "Liikkuminen",
        "counterparty_account_id": "30",
        "iban_receiver": "0",
        "paymentdate": "06/11/2020",
        "reference": "0",
        "saldo": "21347.69",
        "taplajikd": "106",
        "tstamp": "2020-11-06 21:38:22",
        "valuedate": "06/11/2020",
        "vientiselitekd": "0"
    },
    {
        "accountno": "3",
        "amount": "-4.96",
        "bic_receiver": "",
        "bookdate": "09/11/2020",
        "category": "Liikkuminen",
        "counterparty_account_id": "171",
        "iban_receiver": "1",
        "paymentdate": "09/11/2020",
        "reference": "1",
        "saldo": "21456.52",
        "taplajikd": "162",
        "tstamp": "2020-11-09 20:51:09",
        "valuedate": "09/11/2020",
        "vientiselitekd": "0"
    },
    {
        "accountno": "3",
        "amount": "-37.1",
        "bic_receiver": "OKOYFIHH",
        "bookdate": "10/11/2020",
        "category": "Liikkuminen",
        "counterparty_account_id": "211",
        "iban_receiver": "0",
        "paymentdate": "10/11/2020",
        "reference": "0",
        "saldo": "21411.36",
        "taplajikd": "129",
        "tstamp": "2020-11-10 11:48:12",
        "valuedate": "10/11/2020",
        "vientiselitekd": "706"
    },
    {
        "accountno": "3",
        "amount": "-74",
        "bic_receiver": "",
        "bookdate": "12/11/2020",
        "category": "Liikkuminen",
        "counterparty_account_id": "123",
        "iban_receiver": "1",
        "paymentdate": "12/11/2020",
        "reference": "1",
        "saldo": "22252.71",
        "taplajikd": "162",
        "tstamp": "2020-11-12 11:00:59",
        "valuedate": "12/11/2020",
        "vientiselitekd": "0"
    },
    {
        "accountno": "3",
        "amount": "-108.98",
        "bic_receiver": "",
        "bookdate": "12/11/2020",
        "category": "Liikkuminen",
        "counterparty_account_id": "155",
        "iban_receiver": "1",
        "paymentdate": "12/11/2020",
        "reference": "1",
        "saldo": "22107.63",
        "taplajikd": "162",
        "tstamp": "2020-11-12 18:53:07",
        "valuedate": "12/11/2020",
        "vientiselitekd": "0"
    },
    {
        "accountno": "3",
        "amount": "-56.18",
        "bic_receiver": "",
        "bookdate": "18/11/2020",
        "category": "Liikkuminen",
        "counterparty_account_id": "90",
        "iban_receiver": "1",
        "paymentdate": "18/11/2020",
        "reference": "1",
        "saldo": "25303.44",
        "taplajikd": "162",
        "tstamp": "2020-11-18 1:34:26",
        "valuedate": "18/11/2020",
        "vientiselitekd": "0"
    },
    {
        "accountno": "3",
        "amount": "-4.88",
        "bic_receiver": "",
        "bookdate": "20/11/2020",
        "category": "Liikkuminen",
        "counterparty_account_id": "99",
        "iban_receiver": "1",
        "paymentdate": "20/11/2020",
        "reference": "1",
        "saldo": "25139.07",
        "taplajikd": "162",
        "tstamp": "2020-11-20 7:52:08",
        "valuedate": "20/11/2020",
        "vientiselitekd": "0"
    },
    {
        "accountno": "3",
        "amount": "-13.67",
        "bic_receiver": "",
        "bookdate": "25/11/2020",
        "category": "Liikkuminen",
        "counterparty_account_id": "100",
        "iban_receiver": "1",
        "paymentdate": "25/11/2020",
        "reference": "1",
        "saldo": "24326.19",
        "taplajikd": "162",
        "tstamp": "2020-11-25 13:46:14",
        "valuedate": "25/11/2020",
        "vientiselitekd": "0"
    },
    {
        "accountno": "3",
        "amount": "-66.58",
        "bic_receiver": "",
        "bookdate": "27/11/2020",
        "category": "Liikkuminen",
        "counterparty_account_id": "44",
        "iban_receiver": "1",
        "paymentdate": "27/11/2020",
        "reference": "1",
        "saldo": "23563.26",
        "taplajikd": "162",
        "tstamp": "2020-11-27 5:30:30",
        "valuedate": "27/11/2020",
        "vientiselitekd": "0"
    },
    {
        "accountno": "3",
        "amount": "-53.1",
        "bic_receiver": "",
        "bookdate": "03/12/2020",
        "category": "Liikkuminen",
        "counterparty_account_id": "56",
        "iban_receiver": "1",
        "paymentdate": "03/12/2020",
        "reference": "1",
        "saldo": "25236.85",
        "taplajikd": "162",
        "tstamp": "2020-12-03 16:41:44",
        "valuedate": "03/12/2020",
        "vientiselitekd": "0"
    },
    {
        "accountno": "3",
        "amount": "-58.31",
        "bic_receiver": "",
        "bookdate": "04/12/2020",
        "category": "Liikkuminen",
        "counterparty_account_id": "146",
        "iban_receiver": "1",
        "paymentdate": "04/12/2020",
        "reference": "1",
        "saldo": "25107.2",
        "taplajikd": "162",
        "tstamp": "2020-12-04 14:54:25",
        "valuedate": "04/12/2020",
        "vientiselitekd": "0"
    },
    {
        "accountno": "3",
        "amount": "-25.48",
        "bic_receiver": "",
        "bookdate": "07/12/2020",
        "category": "Liikkuminen",
        "counterparty_account_id": "76",
        "iban_receiver": "1",
        "paymentdate": "07/12/2020",
        "reference": "1",
        "saldo": "24933.2",
        "taplajikd": "162",
        "tstamp": "2020-12-07 18:38:01",
        "valuedate": "07/12/2020",
        "vientiselitekd": "0"
    },
    {
        "accountno": "3",
        "amount": "-10.3",
        "bic_receiver": "",
        "bookdate": "14/12/2020",
        "category": "Liikkuminen",
        "counterparty_account_id": "117",
        "iban_receiver": "1",
        "paymentdate": "14/12/2020",
        "reference": "1",
        "saldo": "24022.21",
        "taplajikd": "162",
        "tstamp": "2020-12-14 20:43:14",
        "valuedate": "14/12/2020",
        "vientiselitekd": "0"
    },
    {
        "accountno": "3",
        "amount": "-13.4",
        "bic_receiver": "",
        "bookdate": "24/12/2020",
        "category": "Liikkuminen",
        "counterparty_account_id": "165",
        "iban_receiver": "1",
        "paymentdate": "24/12/2020",
        "reference": "1",
        "saldo": "23298.58",
        "taplajikd": "162",
        "tstamp": "2020-12-24 15:30:11",
        "valuedate": "24/12/2020",
        "vientiselitekd": "0"
    },
    {
        "accountno": "3",
        "amount": "-35.66",
        "bic_receiver": "",
        "bookdate": "24/12/2020",
        "category": "Liikkuminen",
        "counterparty_account_id": "68",
        "iban_receiver": "1",
        "paymentdate": "24/12/2020",
        "reference": "1",
        "saldo": "23262.92",
        "taplajikd": "162",
        "tstamp": "2020-12-24 17:17:31",
        "valuedate": "24/12/2020",
        "vientiselitekd": "0"
    },
    {
        "accountno": "3",
        "amount": "-6.81",
        "bic_receiver": "",
        "bookdate": "28/12/2020",
        "category": "Liikkuminen",
        "counterparty_account_id": "44",
        "iban_receiver": "1",
        "paymentdate": "28/12/2020",
        "reference": "1",
        "saldo": "23020.57",
        "taplajikd": "162",
        "tstamp": "2020-12-28 4:28:19",
        "valuedate": "28/12/2020",
        "vientiselitekd": "0"
    },
    {
        "accountno": "3",
        "amount": "-28.94",
        "bic_receiver": "",
        "bookdate": "30/12/2020",
        "category": "Liikkuminen",
        "counterparty_account_id": "68",
        "iban_receiver": "1",
        "paymentdate": "30/12/2020",
        "reference": "1",
        "saldo": "22602.87",
        "taplajikd": "162",
        "tstamp": "2020-12-30 10:08:12",
        "valuedate": "30/12/2020",
        "vientiselitekd": "0"
    },
    {
        "accountno": "3",
        "amount": "-108.75",
        "bic_receiver": "",
        "bookdate": "30/12/2020",
        "category": "Liikkuminen",
        "counterparty_account_id": "124",
        "iban_receiver": "1",
        "paymentdate": "30/12/2020",
        "reference": "1",
        "saldo": "22494.12",
        "taplajikd": "162",
        "tstamp": "2020-12-30 19:22:44",
        "valuedate": "30/12/2020",
        "vientiselitekd": "0"
    },
    {
        "accountno": "1",
        "amount": "-58.44",
        "bic_receiver": "",
        "bookdate": "11/01/2019",
        "category": "Luokittelemattomat",
        "counterparty_account_id": "74",
        "iban_receiver": "1",
        "paymentdate": "11/01/2019",
        "reference": "1",
        "saldo": "100.75",
        "taplajikd": "162",
        "tstamp": "2019-01-11 6:30:17",
        "valuedate": "11/01/2019",
        "vientiselitekd": "0"
    },
    {
        "accountno": "1",
        "amount": "-12.83",
        "bic_receiver": "OKOYFIHH",
        "bookdate": "15/01/2019",
        "category": "Luokittelemattomat",
        "counterparty_account_id": "201",
        "iban_receiver": "0",
        "paymentdate": "15/01/2019",
        "reference": "0",
        "saldo": "-133.35",
        "taplajikd": "129",
        "tstamp": "2019-01-15 11:39:49",
        "valuedate": "15/01/2019",
        "vientiselitekd": "706"
    },
    {
        "accountno": "1",
        "amount": "-122.42",
        "bic_receiver": "OKOYFIHH",
        "bookdate": "22/01/2019",
        "category": "Luokittelemattomat",
        "counterparty_account_id": "29",
        "iban_receiver": "0",
        "paymentdate": "22/01/2019",
        "reference": "1",
        "saldo": "-277.78",
        "taplajikd": "106",
        "tstamp": "2019-01-22 10:32:31",
        "valuedate": "22/01/2019",
        "vientiselitekd": "0"
    },
    {
        "accountno": "1",
        "amount": "-38.82",
        "bic_receiver": "NDEAFIHH",
        "bookdate": "12/02/2019",
        "category": "Luokittelemattomat",
        "counterparty_account_id": "193",
        "iban_receiver": "0",
        "paymentdate": "12/02/2019",
        "reference": "1",
        "saldo": "-408.17",
        "taplajikd": "106",
        "tstamp": "2019-02-12 10:17:09",
        "valuedate": "12/02/2019",
        "vientiselitekd": "706"
    },
    {
        "accountno": "1",
        "amount": "-6.41",
        "bic_receiver": "",
        "bookdate": "18/02/2019",
        "category": "Luokittelemattomat",
        "counterparty_account_id": "85",
        "iban_receiver": "1",
        "paymentdate": "18/02/2019",
        "reference": "1",
        "saldo": "-385.5",
        "taplajikd": "162",
        "tstamp": "2019-02-18 3:25:43",
        "valuedate": "18/02/2019",
        "vientiselitekd": "0"
    },
    {
        "accountno": "1",
        "amount": "-2.94",
        "bic_receiver": "",
        "bookdate": "04/03/2019",
        "category": "Luokittelemattomat",
        "counterparty_account_id": "118",
        "iban_receiver": "1",
        "paymentdate": "04/03/2019",
        "reference": "1",
        "saldo": "358.66",
        "taplajikd": "162",
        "tstamp": "2019-03-04 4:12:38",
        "valuedate": "04/03/2019",
        "vientiselitekd": "0"
    },
    {
        "accountno": "1",
        "amount": "-55.94",
        "bic_receiver": "OKOYFIHH",
        "bookdate": "04/03/2019",
        "category": "Luokittelemattomat",
        "counterparty_account_id": "190",
        "iban_receiver": "0",
        "paymentdate": "04/03/2019",
        "reference": "1",
        "saldo": "302.72",
        "taplajikd": "106",
        "tstamp": "2019-03-04 6:18:57",
        "valuedate": "04/03/2019",
        "vientiselitekd": "706"
    },
    {
        "accountno": "1",
        "amount": "-17.59",
        "bic_receiver": "OKOYFIHH",
        "bookdate": "03/04/2019",
        "category": "Luokittelemattomat",
        "counterparty_account_id": "197",
        "iban_receiver": "0",
        "paymentdate": "03/04/2019",
        "reference": "0",
        "saldo": "22.48",
        "taplajikd": "106",
        "tstamp": "2019-04-03 21:54:10",
        "valuedate": "03/04/2019",
        "vientiselitekd": "706"
    },
    {
        "accountno": "1",
        "amount": "-5.92",
        "bic_receiver": "",
        "bookdate": "11/04/2019",
        "category": "Luokittelemattomat",
        "counterparty_account_id": "79",
        "iban_receiver": "1",
        "paymentdate": "11/04/2019",
        "reference": "1",
        "saldo": "-70.21",
        "taplajikd": "162",
        "tstamp": "2019-04-11 11:39:02",
        "valuedate": "11/04/2019",
        "vientiselitekd": "0"
    },
    {
        "accountno": "1",
        "amount": "-26.51",
        "bic_receiver": "OKOYFIHH",
        "bookdate": "01/05/2019",
        "category": "Luokittelemattomat",
        "counterparty_account_id": "191",
        "iban_receiver": "0",
        "paymentdate": "01/05/2019",
        "reference": "1",
        "saldo": "198.36",
        "taplajikd": "106",
        "tstamp": "2019-05-01 18:50:08",
        "valuedate": "01/05/2019",
        "vientiselitekd": "706"
    },
    {
        "accountno": "1",
        "amount": "-6.04",
        "bic_receiver": "NDEAFIHH",
        "bookdate": "03/05/2019",
        "category": "Luokittelemattomat",
        "counterparty_account_id": "195",
        "iban_receiver": "0",
        "paymentdate": "02/05/2019",
        "reference": "0",
        "saldo": "192.32",
        "taplajikd": "106",
        "tstamp": "2019-05-02 13:40:15",
        "valuedate": "02/05/2019",
        "vientiselitekd": "706"
    },
    {
        "accountno": "1",
        "amount": "-2.5",
        "bic_receiver": "",
        "bookdate": "21/05/2019",
        "category": "Luokittelemattomat",
        "counterparty_account_id": "79",
        "iban_receiver": "1",
        "paymentdate": "21/05/2019",
        "reference": "1",
        "saldo": "-235.71",
        "taplajikd": "162",
        "tstamp": "2019-05-21 20:03:02",
        "valuedate": "21/05/2019",
        "vientiselitekd": "0"
    },
    {
        "accountno": "1",
        "amount": "-77.66",
        "bic_receiver": "OKOYFIHH",
        "bookdate": "24/05/2019",
        "category": "Luokittelemattomat",
        "counterparty_account_id": "189",
        "iban_receiver": "0",
        "paymentdate": "24/05/2019",
        "reference": "1",
        "saldo": "-426.96",
        "taplajikd": "106",
        "tstamp": "2019-05-24 13:03:48",
        "valuedate": "24/05/2019",
        "vientiselitekd": "706"
    },
    {
        "accountno": "1",
        "amount": "-6.82",
        "bic_receiver": "",
        "bookdate": "27/05/2019",
        "category": "Luokittelemattomat",
        "counterparty_account_id": "117",
        "iban_receiver": "1",
        "paymentdate": "27/05/2019",
        "reference": "1",
        "saldo": "-360.34",
        "taplajikd": "162",
        "tstamp": "2019-05-27 2:44:03",
        "valuedate": "27/05/2019",
        "vientiselitekd": "0"
    },
    {
        "accountno": "1",
        "amount": "-10.49",
        "bic_receiver": "OKOYFIHH",
        "bookdate": "10/07/2019",
        "category": "Luokittelemattomat",
        "counterparty_account_id": "194",
        "iban_receiver": "0",
        "paymentdate": "10/07/2019",
        "reference": "1",
        "saldo": "32.46",
        "taplajikd": "106",
        "tstamp": "2019-07-10 12:37:54",
        "valuedate": "10/07/2019",
        "vientiselitekd": "706"
    },
    {
        "accountno": "1",
        "amount": "-19.87",
        "bic_receiver": "",
        "bookdate": "15/07/2019",
        "category": "Luokittelemattomat",
        "counterparty_account_id": "65",
        "iban_receiver": "1",
        "paymentdate": "15/07/2019",
        "reference": "1",
        "saldo": "-18.68",
        "taplajikd": "162",
        "tstamp": "2019-07-15 1:15:47",
        "valuedate": "15/07/2019",
        "vientiselitekd": "0"
    },
    {
        "accountno": "1",
        "amount": "-40.63",
        "bic_receiver": "NDEAFIHH",
        "bookdate": "22/07/2019",
        "category": "Luokittelemattomat",
        "counterparty_account_id": "194",
        "iban_receiver": "0",
        "paymentdate": "22/07/2019",
        "reference": "1",
        "saldo": "-251.52",
        "taplajikd": "106",
        "tstamp": "2019-07-22 18:06:19",
        "valuedate": "22/07/2019",
        "vientiselitekd": "706"
    },
    {
        "accountno": "1",
        "amount": "-4.11",
        "bic_receiver": "NDEAFIHH",
        "bookdate": "26/07/2019",
        "category": "Luokittelemattomat",
        "counterparty_account_id": "190",
        "iban_receiver": "0",
        "paymentdate": "26/07/2019",
        "reference": "1",
        "saldo": "-297.3",
        "taplajikd": "106",
        "tstamp": "2019-07-26 2:31:35",
        "valuedate": "26/07/2019",
        "vientiselitekd": "706"
    },
    {
        "accountno": "1",
        "amount": "-6.73",
        "bic_receiver": "",
        "bookdate": "25/10/2019",
        "category": "Luokittelemattomat",
        "counterparty_account_id": "127",
        "iban_receiver": "1",
        "paymentdate": "25/10/2019",
        "reference": "1",
        "saldo": "-286.02",
        "taplajikd": "162",
        "tstamp": "2019-10-25 18:05:32",
        "valuedate": "25/10/2019",
        "vientiselitekd": "0"
    },
    {
        "accountno": "1",
        "amount": "-35.51",
        "bic_receiver": "OKOYFIHH",
        "bookdate": "11/11/2019",
        "category": "Luokittelemattomat",
        "counterparty_account_id": "201",
        "iban_receiver": "0",
        "paymentdate": "11/11/2019",
        "reference": "0",
        "saldo": "-744.88",
        "taplajikd": "129",
        "tstamp": "2019-11-11 11:00:33",
        "valuedate": "11/11/2019",
        "vientiselitekd": "706"
    },
    {
        "accountno": "1",
        "amount": "-5.87",
        "bic_receiver": "",
        "bookdate": "13/11/2019",
        "category": "Luokittelemattomat",
        "counterparty_account_id": "87",
        "iban_receiver": "1",
        "paymentdate": "13/11/2019",
        "reference": "1",
        "saldo": "-778.81",
        "taplajikd": "162",
        "tstamp": "2019-11-13 18:16:31",
        "valuedate": "13/11/2019",
        "vientiselitekd": "0"
    },
    {
        "accountno": "1",
        "amount": "-8.84",
        "bic_receiver": "NDEAFIHH",
        "bookdate": "22/11/2019",
        "category": "Luokittelemattomat",
        "counterparty_account_id": "14",
        "iban_receiver": "0",
        "paymentdate": "22/11/2019",
        "reference": "1",
        "saldo": "-255.86",
        "taplajikd": "106",
        "tstamp": "2019-11-22 11:13:46",
        "valuedate": "22/11/2019",
        "vientiselitekd": "0"
    },
    {
        "accountno": "1",
        "amount": "-2.66",
        "bic_receiver": "",
        "bookdate": "27/11/2019",
        "category": "Luokittelemattomat",
        "counterparty_account_id": "81",
        "iban_receiver": "1",
        "paymentdate": "27/11/2019",
        "reference": "1",
        "saldo": "-369.81",
        "taplajikd": "162",
        "tstamp": "2019-11-27 10:07:42",
        "valuedate": "27/11/2019",
        "vientiselitekd": "0"
    },
    {
        "accountno": "1",
        "amount": "-5.32",
        "bic_receiver": "",
        "bookdate": "27/11/2019",
        "category": "Luokittelemattomat",
        "counterparty_account_id": "127",
        "iban_receiver": "1",
        "paymentdate": "27/11/2019",
        "reference": "1",
        "saldo": "-375.13",
        "taplajikd": "162",
        "tstamp": "2019-11-27 23:20:22",
        "valuedate": "27/11/2019",
        "vientiselitekd": "0"
    },
    {
        "accountno": "1",
        "amount": "-13.52",
        "bic_receiver": "OKOYFIHH",
        "bookdate": "06/12/2019",
        "category": "Luokittelemattomat",
        "counterparty_account_id": "8",
        "iban_receiver": "0",
        "paymentdate": "06/12/2019",
        "reference": "0",
        "saldo": "-523.41",
        "taplajikd": "106",
        "tstamp": "2019-12-06 8:35:33",
        "valuedate": "06/12/2019",
        "vientiselitekd": "0"
    },
    {
        "accountno": "1",
        "amount": "-11.48",
        "bic_receiver": "NDEAFIHH",
        "bookdate": "09/12/2019",
        "category": "Luokittelemattomat",
        "counterparty_account_id": "28",
        "iban_receiver": "0",
        "paymentdate": "09/12/2019",
        "reference": "0",
        "saldo": "-801.75",
        "taplajikd": "106",
        "tstamp": "2019-12-09 15:42:13",
        "valuedate": "09/12/2019",
        "vientiselitekd": "0"
    },
    {
        "accountno": "1",
        "amount": "-1.69",
        "bic_receiver": "",
        "bookdate": "11/12/2019",
        "category": "Luokittelemattomat",
        "counterparty_account_id": "130",
        "iban_receiver": "1",
        "paymentdate": "11/12/2019",
        "reference": "1",
        "saldo": "-860.69",
        "taplajikd": "162",
        "tstamp": "2019-12-11 17:11:07",
        "valuedate": "11/12/2019",
        "vientiselitekd": "0"
    },
    {
        "accountno": "1",
        "amount": "-8.83",
        "bic_receiver": "",
        "bookdate": "06/01/2020",
        "category": "Luokittelemattomat",
        "counterparty_account_id": "125",
        "iban_receiver": "1",
        "paymentdate": "06/01/2020",
        "reference": "1",
        "saldo": "11.12",
        "taplajikd": "162",
        "tstamp": "2020-01-06 22:10:38",
        "valuedate": "06/01/2020",
        "vientiselitekd": "0"
    },
    {
        "accountno": "1",
        "amount": "-14.1",
        "bic_receiver": "",
        "bookdate": "14/01/2020",
        "category": "Luokittelemattomat",
        "counterparty_account_id": "93",
        "iban_receiver": "1",
        "paymentdate": "14/01/2020",
        "reference": "1",
        "saldo": "-2.92",
        "taplajikd": "162",
        "tstamp": "2020-01-14 3:02:17",
        "valuedate": "14/01/2020",
        "vientiselitekd": "0"
    },
    {
        "accountno": "1",
        "amount": "-30.01",
        "bic_receiver": "",
        "bookdate": "20/04/2020",
        "category": "Luokittelemattomat",
        "counterparty_account_id": "128",
        "iban_receiver": "1",
        "paymentdate": "20/04/2020",
        "reference": "1",
        "saldo": "44.12",
        "taplajikd": "162",
        "tstamp": "2020-04-20 10:03:52",
        "valuedate": "20/04/2020",
        "vientiselitekd": "0"
    },
    {
        "accountno": "1",
        "amount": "-6.04",
        "bic_receiver": "",
        "bookdate": "29/05/2020",
        "category": "Luokittelemattomat",
        "counterparty_account_id": "117",
        "iban_receiver": "1",
        "paymentdate": "29/05/2020",
        "reference": "1",
        "saldo": "-182.03",
        "taplajikd": "162",
        "tstamp": "2020-05-29 7:28:00",
        "valuedate": "29/05/2020",
        "vientiselitekd": "0"
    },
    {
        "accountno": "1",
        "amount": "-1.87",
        "bic_receiver": "",
        "bookdate": "10/07/2020",
        "category": "Luokittelemattomat",
        "counterparty_account_id": "104",
        "iban_receiver": "1",
        "paymentdate": "10/07/2020",
        "reference": "1",
        "saldo": "-205.01",
        "taplajikd": "162",
        "tstamp": "2020-07-10 2:13:57",
        "valuedate": "10/07/2020",
        "vientiselitekd": "0"
    },
    {
        "accountno": "1",
        "amount": "-5.6",
        "bic_receiver": "",
        "bookdate": "26/08/2020",
        "category": "Luokittelemattomat",
        "counterparty_account_id": "131",
        "iban_receiver": "1",
        "paymentdate": "26/08/2020",
        "reference": "1",
        "saldo": "45.96",
        "taplajikd": "162",
        "tstamp": "2020-08-26 2:44:03",
        "valuedate": "26/08/2020",
        "vientiselitekd": "0"
    },
    {
        "accountno": "1",
        "amount": "-1.51",
        "bic_receiver": "",
        "bookdate": "28/08/2020",
        "category": "Luokittelemattomat",
        "counterparty_account_id": "115",
        "iban_receiver": "1",
        "paymentdate": "28/08/2020",
        "reference": "1",
        "saldo": "9.52",
        "taplajikd": "162",
        "tstamp": "2020-08-28 11:14:26",
        "valuedate": "28/08/2020",
        "vientiselitekd": "0"
    },
    {
        "accountno": "1",
        "amount": "-2.02",
        "bic_receiver": "",
        "bookdate": "29/09/2020",
        "category": "Luokittelemattomat",
        "counterparty_account_id": "87",
        "iban_receiver": "1",
        "paymentdate": "29/09/2020",
        "reference": "1",
        "saldo": "-138.39",
        "taplajikd": "162",
        "tstamp": "2020-09-29 14:46:09",
        "valuedate": "29/09/2020",
        "vientiselitekd": "0"
    },
    {
        "accountno": "1",
        "amount": "-4.32",
        "bic_receiver": "",
        "bookdate": "12/10/2020",
        "category": "Luokittelemattomat",
        "counterparty_account_id": "41",
        "iban_receiver": "1",
        "paymentdate": "12/10/2020",
        "reference": "1",
        "saldo": "-623.37",
        "taplajikd": "162",
        "tstamp": "2020-10-12 22:12:10",
        "valuedate": "12/10/2020",
        "vientiselitekd": "0"
    },
    {
        "accountno": "1",
        "amount": "-1.25",
        "bic_receiver": "",
        "bookdate": "21/10/2020",
        "category": "Luokittelemattomat",
        "counterparty_account_id": "55",
        "iban_receiver": "1",
        "paymentdate": "21/10/2020",
        "reference": "1",
        "saldo": "-797.43",
        "taplajikd": "162",
        "tstamp": "2020-10-21 5:04:30",
        "valuedate": "21/10/2020",
        "vientiselitekd": "0"
    },
    {
        "accountno": "1",
        "amount": "-7.48",
        "bic_receiver": "",
        "bookdate": "26/10/2020",
        "category": "Luokittelemattomat",
        "counterparty_account_id": "42",
        "iban_receiver": "1",
        "paymentdate": "26/10/2020",
        "reference": "1",
        "saldo": "264.22",
        "taplajikd": "162",
        "tstamp": "2020-10-26 3:03:58",
        "valuedate": "26/10/2020",
        "vientiselitekd": "0"
    },
    {
        "accountno": "1",
        "amount": "-96.09",
        "bic_receiver": "",
        "bookdate": "30/10/2020",
        "category": "Luokittelemattomat",
        "counterparty_account_id": "188",
        "iban_receiver": "1",
        "paymentdate": "30/10/2020",
        "reference": "1",
        "saldo": "-50.46",
        "taplajikd": "106",
        "tstamp": "2020-10-30 20:43:21",
        "valuedate": "30/10/2020",
        "vientiselitekd": "702"
    },
    {
        "accountno": "1",
        "amount": "-2.38",
        "bic_receiver": "",
        "bookdate": "05/11/2020",
        "category": "Luokittelemattomat",
        "counterparty_account_id": "72",
        "iban_receiver": "1",
        "paymentdate": "05/11/2020",
        "reference": "1",
        "saldo": "-136.59",
        "taplajikd": "162",
        "tstamp": "2020-11-05 23:00:30",
        "valuedate": "05/11/2020",
        "vientiselitekd": "0"
    },
    {
        "accountno": "2",
        "amount": "-136.78",
        "bic_receiver": "OKOYFIHH",
        "bookdate": "25/02/2019",
        "category": "Luokittelemattomat",
        "counterparty_account_id": "191",
        "iban_receiver": "0",
        "paymentdate": "25/02/2019",
        "reference": "1",
        "saldo": "1844.6",
        "taplajikd": "106",
        "tstamp": "2019-02-25 0:00:00",
        "valuedate": "25/02/2019",
        "vientiselitekd": "706"
    },
    {
        "accountno": "2",
        "amount": "-214.38",
        "bic_receiver": "OKOYFIHH",
        "bookdate": "11/03/2019",
        "category": "Luokittelemattomat",
        "counterparty_account_id": "186",
        "iban_receiver": "0",
        "paymentdate": "11/03/2019",
        "reference": "0",
        "saldo": "2138.38",
        "taplajikd": "106",
        "tstamp": "2019-03-11 9:18:22",
        "valuedate": "11/03/2019",
        "vientiselitekd": "706"
    },
    {
        "accountno": "2",
        "amount": "-52.7",
        "bic_receiver": "NDEAFIHH",
        "bookdate": "14/03/2019",
        "category": "Luokittelemattomat",
        "counterparty_account_id": "186",
        "iban_receiver": "0",
        "paymentdate": "14/03/2019",
        "reference": "1",
        "saldo": "2035.89",
        "taplajikd": "106",
        "tstamp": "2019-03-14 22:02:27",
        "valuedate": "14/03/2019",
        "vientiselitekd": "706"
    },
    {
        "accountno": "2",
        "amount": "-23.14",
        "bic_receiver": "",
        "bookdate": "26/03/2019",
        "category": "Luokittelemattomat",
        "counterparty_account_id": "71",
        "iban_receiver": "1",
        "paymentdate": "26/03/2019",
        "reference": "1",
        "saldo": "2962.7",
        "taplajikd": "162",
        "tstamp": "2019-03-26 7:20:49",
        "valuedate": "26/03/2019",
        "vientiselitekd": "0"
    },
    {
        "accountno": "2",
        "amount": "-141.62",
        "bic_receiver": "OKOYFIHH",
        "bookdate": "27/03/2019",
        "category": "Luokittelemattomat",
        "counterparty_account_id": "193",
        "iban_receiver": "0",
        "paymentdate": "27/03/2019",
        "reference": "1",
        "saldo": "2821.08",
        "taplajikd": "106",
        "tstamp": "2019-03-27 13:42:51",
        "valuedate": "27/03/2019",
        "vientiselitekd": "706"
    },
    {
        "accountno": "2",
        "amount": "-32.5",
        "bic_receiver": "OKOYFIHH",
        "bookdate": "28/03/2019",
        "category": "Luokittelemattomat",
        "counterparty_account_id": "188",
        "iban_receiver": "0",
        "paymentdate": "28/03/2019",
        "reference": "0",
        "saldo": "2680.07",
        "taplajikd": "106",
        "tstamp": "2019-03-28 20:04:54",
        "valuedate": "28/03/2019",
        "vientiselitekd": "706"
    },
    {
        "accountno": "2",
        "amount": "-124.39",
        "bic_receiver": "OKOYFIHH",
        "bookdate": "12/04/2019",
        "category": "Luokittelemattomat",
        "counterparty_account_id": "189",
        "iban_receiver": "0",
        "paymentdate": "12/04/2019",
        "reference": "1",
        "saldo": "2432.75",
        "taplajikd": "106",
        "tstamp": "2019-04-12 14:24:00",
        "valuedate": "12/04/2019",
        "vientiselitekd": "706"
    },
    {
        "accountno": "2",
        "amount": "-6.94",
        "bic_receiver": "",
        "bookdate": "06/05/2019",
        "category": "Luokittelemattomat",
        "counterparty_account_id": "40",
        "iban_receiver": "1",
        "paymentdate": "06/05/2019",
        "reference": "1",
        "saldo": "1658.76",
        "taplajikd": "162",
        "tstamp": "2019-05-06 1:28:10",
        "valuedate": "06/05/2019",
        "vientiselitekd": "0"
    },
    {
        "accountno": "2",
        "amount": "-33.73",
        "bic_receiver": "",
        "bookdate": "07/05/2019",
        "category": "Luokittelemattomat",
        "counterparty_account_id": "35",
        "iban_receiver": "1",
        "paymentdate": "07/05/2019",
        "reference": "1",
        "saldo": "1625.03",
        "taplajikd": "162",
        "tstamp": "2019-05-07 7:50:12",
        "valuedate": "07/05/2019",
        "vientiselitekd": "0"
    },
    {
        "accountno": "2",
        "amount": "-14.02",
        "bic_receiver": "",
        "bookdate": "20/05/2019",
        "category": "Luokittelemattomat",
        "counterparty_account_id": "90",
        "iban_receiver": "1",
        "paymentdate": "20/05/2019",
        "reference": "1",
        "saldo": "1268.65",
        "taplajikd": "162",
        "tstamp": "2019-05-20 17:08:34",
        "valuedate": "20/05/2019",
        "vientiselitekd": "0"
    },
    {
        "accountno": "2",
        "amount": "-54.58",
        "bic_receiver": "OKOYFIHH",
        "bookdate": "06/08/2019",
        "category": "Luokittelemattomat",
        "counterparty_account_id": "195",
        "iban_receiver": "0",
        "paymentdate": "06/08/2019",
        "reference": "1",
        "saldo": "3101.67",
        "taplajikd": "106",
        "tstamp": "2019-08-06 14:03:15",
        "valuedate": "06/08/2019",
        "vientiselitekd": "706"
    },
    {
        "accountno": "2",
        "amount": "-12.15",
        "bic_receiver": "",
        "bookdate": "19/08/2019",
        "category": "Luokittelemattomat",
        "counterparty_account_id": "79",
        "iban_receiver": "1",
        "paymentdate": "16/08/2019",
        "reference": "1",
        "saldo": "3545.49",
        "taplajikd": "162",
        "tstamp": "2019-08-19 23:47:02",
        "valuedate": "19/08/2019",
        "vientiselitekd": "0"
    },
    {
        "accountno": "2",
        "amount": "-3.6",
        "bic_receiver": "",
        "bookdate": "21/08/2019",
        "category": "Luokittelemattomat",
        "counterparty_account_id": "85",
        "iban_receiver": "1",
        "paymentdate": "21/08/2019",
        "reference": "1",
        "saldo": "3904.86",
        "taplajikd": "162",
        "tstamp": "2019-08-21 2:35:41",
        "valuedate": "21/08/2019",
        "vientiselitekd": "0"
    },
    {
        "accountno": "2",
        "amount": "-21.15",
        "bic_receiver": "",
        "bookdate": "21/08/2019",
        "category": "Luokittelemattomat",
        "counterparty_account_id": "150",
        "iban_receiver": "1",
        "paymentdate": "21/08/2019",
        "reference": "1",
        "saldo": "3850.55",
        "taplajikd": "162",
        "tstamp": "2019-08-21 18:48:39",
        "valuedate": "21/08/2019",
        "vientiselitekd": "0"
    },
    {
        "accountno": "2",
        "amount": "-39.44",
        "bic_receiver": "OKOYFIHH",
        "bookdate": "15/11/2019",
        "category": "Luokittelemattomat",
        "counterparty_account_id": "197",
        "iban_receiver": "0",
        "paymentdate": "15/11/2019",
        "reference": "0",
        "saldo": "273.51",
        "taplajikd": "129",
        "tstamp": "2019-11-15 6:51:26",
        "valuedate": "15/11/2019",
        "vientiselitekd": "706"
    },
    {
        "accountno": "2",
        "amount": "-57.93",
        "bic_receiver": "NDEAFIHH",
        "bookdate": "15/11/2019",
        "category": "Luokittelemattomat",
        "counterparty_account_id": "191",
        "iban_receiver": "0",
        "paymentdate": "15/11/2019",
        "reference": "1",
        "saldo": "215.58",
        "taplajikd": "106",
        "tstamp": "2019-11-15 10:17:09",
        "valuedate": "15/11/2019",
        "vientiselitekd": "706"
    },
    {
        "accountno": "2",
        "amount": "-29.13",
        "bic_receiver": "NDEAFIHH",
        "bookdate": "12/12/2019",
        "category": "Luokittelemattomat",
        "counterparty_account_id": "196",
        "iban_receiver": "0",
        "paymentdate": "12/12/2019",
        "reference": "0",
        "saldo": "5087.83",
        "taplajikd": "129",
        "tstamp": "2019-12-12 9:39:19",
        "valuedate": "12/12/2019",
        "vientiselitekd": "706"
    },
    {
        "accountno": "2",
        "amount": "-25.1",
        "bic_receiver": "",
        "bookdate": "25/12/2019",
        "category": "Luokittelemattomat",
        "counterparty_account_id": "72",
        "iban_receiver": "1",
        "paymentdate": "25/12/2019",
        "reference": "1",
        "saldo": "1901.38",
        "taplajikd": "162",
        "tstamp": "2019-12-25 12:24:50",
        "valuedate": "25/12/2019",
        "vientiselitekd": "0"
    },
    {
        "accountno": "2",
        "amount": "-89.35",
        "bic_receiver": "NDEAFIHH",
        "bookdate": "30/12/2019",
        "category": "Luokittelemattomat",
        "counterparty_account_id": "11",
        "iban_receiver": "0",
        "paymentdate": "30/12/2019",
        "reference": "0",
        "saldo": "1660.87",
        "taplajikd": "106",
        "tstamp": "2019-12-30 12:08:17",
        "valuedate": "30/12/2019",
        "vientiselitekd": "0"
    },
    {
        "accountno": "2",
        "amount": "-4.74",
        "bic_receiver": "",
        "bookdate": "30/12/2019",
        "category": "Luokittelemattomat",
        "counterparty_account_id": "102",
        "iban_receiver": "1",
        "paymentdate": "30/12/2019",
        "reference": "1",
        "saldo": "1652.87",
        "taplajikd": "162",
        "tstamp": "2019-12-30 22:20:41",
        "valuedate": "30/12/2019",
        "vientiselitekd": "0"
    },
    {
        "accountno": "2",
        "amount": "-17.13",
        "bic_receiver": "OKOYFIHH",
        "bookdate": "03/01/2020",
        "category": "Luokittelemattomat",
        "counterparty_account_id": "196",
        "iban_receiver": "0",
        "paymentdate": "03/01/2020",
        "reference": "0",
        "saldo": "1229.71",
        "taplajikd": "129",
        "tstamp": "2020-01-03 14:04:58",
        "valuedate": "03/01/2020",
        "vientiselitekd": "706"
    },
    {
        "accountno": "2",
        "amount": "-29.07",
        "bic_receiver": "OKOYFIHH",
        "bookdate": "08/01/2020",
        "category": "Luokittelemattomat",
        "counterparty_account_id": "8",
        "iban_receiver": "0",
        "paymentdate": "06/01/2020",
        "reference": "0",
        "saldo": "1141.14",
        "taplajikd": "106",
        "tstamp": "2020-01-06 2:58:31",
        "valuedate": "06/01/2020",
        "vientiselitekd": "0"
    },
    {
        "accountno": "2",
        "amount": "-898.62",
        "bic_receiver": "DABAFIHH",
        "bookdate": "06/01/2020",
        "category": "Luokittelemattomat",
        "counterparty_account_id": "8",
        "iban_receiver": "0",
        "paymentdate": "06/01/2020",
        "reference": "1",
        "saldo": "221.67",
        "taplajikd": "106",
        "tstamp": "2020-01-06 15:16:22",
        "valuedate": "06/01/2020",
        "vientiselitekd": "0"
    },
    {
        "accountno": "2",
        "amount": "-4.55",
        "bic_receiver": "",
        "bookdate": "16/01/2020",
        "category": "Luokittelemattomat",
        "counterparty_account_id": "136",
        "iban_receiver": "1",
        "paymentdate": "16/01/2020",
        "reference": "1",
        "saldo": "-264.19",
        "taplajikd": "162",
        "tstamp": "2020-01-16 9:31:14",
        "valuedate": "16/01/2020",
        "vientiselitekd": "0"
    },
    {
        "accountno": "2",
        "amount": "-18.63",
        "bic_receiver": "NDEAFIHH",
        "bookdate": "22/01/2020",
        "category": "Luokittelemattomat",
        "counterparty_account_id": "4",
        "iban_receiver": "0",
        "paymentdate": "22/01/2020",
        "reference": "0",
        "saldo": "59.43",
        "taplajikd": "106",
        "tstamp": "2020-01-22 11:54:03",
        "valuedate": "22/01/2020",
        "vientiselitekd": "0"
    },
    {
        "accountno": "2",
        "amount": "-2.36",
        "bic_receiver": "",
        "bookdate": "22/01/2020",
        "category": "Luokittelemattomat",
        "counterparty_account_id": "85",
        "iban_receiver": "1",
        "paymentdate": "22/01/2020",
        "reference": "1",
        "saldo": "57.07",
        "taplajikd": "162",
        "tstamp": "2020-01-22 12:29:45",
        "valuedate": "22/01/2020",
        "vientiselitekd": "0"
    },
    {
        "accountno": "2",
        "amount": "-156.13",
        "bic_receiver": "OKOYFIHH",
        "bookdate": "10/02/2020",
        "category": "Luokittelemattomat",
        "counterparty_account_id": "2",
        "iban_receiver": "0",
        "paymentdate": "10/02/2020",
        "reference": "1",
        "saldo": "-25.05",
        "taplajikd": "106",
        "tstamp": "2020-02-10 3:47:22",
        "valuedate": "10/02/2020",
        "vientiselitekd": "0"
    },
    {
        "accountno": "2",
        "amount": "-17.06",
        "bic_receiver": "OKOYFIHH",
        "bookdate": "11/02/2020",
        "category": "Luokittelemattomat",
        "counterparty_account_id": "14",
        "iban_receiver": "0",
        "paymentdate": "11/02/2020",
        "reference": "1",
        "saldo": "-42.11",
        "taplajikd": "106",
        "tstamp": "2020-02-11 4:12:38",
        "valuedate": "11/02/2020",
        "vientiselitekd": "0"
    },
    {
        "accountno": "2",
        "amount": "-0.67",
        "bic_receiver": "",
        "bookdate": "28/02/2020",
        "category": "Luokittelemattomat",
        "counterparty_account_id": "27",
        "iban_receiver": "1",
        "paymentdate": "28/02/2020",
        "reference": "1",
        "saldo": "-496.36",
        "taplajikd": "162",
        "tstamp": "2020-02-28 11:47:22",
        "valuedate": "28/02/2020",
        "vientiselitekd": "0"
    },
    {
        "accountno": "2",
        "amount": "-67.8",
        "bic_receiver": "NDEAFIHH",
        "bookdate": "09/03/2020",
        "category": "Luokittelemattomat",
        "counterparty_account_id": "189",
        "iban_receiver": "0",
        "paymentdate": "09/03/2020",
        "reference": "0",
        "saldo": "-15.2",
        "taplajikd": "106",
        "tstamp": "2020-03-09 17:24:42",
        "valuedate": "09/03/2020",
        "vientiselitekd": "706"
    },
    {
        "accountno": "2",
        "amount": "-48.91",
        "bic_receiver": "OKOYFIHH",
        "bookdate": "03/04/2020",
        "category": "Luokittelemattomat",
        "counterparty_account_id": "13",
        "iban_receiver": "0",
        "paymentdate": "03/04/2020",
        "reference": "0",
        "saldo": "801.99",
        "taplajikd": "106",
        "tstamp": "2020-04-03 6:41:01",
        "valuedate": "03/04/2020",
        "vientiselitekd": "0"
    },
    {
        "accountno": "2",
        "amount": "-9.88",
        "bic_receiver": "",
        "bookdate": "15/04/2020",
        "category": "Luokittelemattomat",
        "counterparty_account_id": "99",
        "iban_receiver": "1",
        "paymentdate": "14/04/2020",
        "reference": "1",
        "saldo": "-66.19",
        "taplajikd": "162",
        "tstamp": "2020-04-14 4:33:25",
        "valuedate": "14/04/2020",
        "vientiselitekd": "0"
    },
    {
        "accountno": "2",
        "amount": "-4.88",
        "bic_receiver": "",
        "bookdate": "22/04/2020",
        "category": "Luokittelemattomat",
        "counterparty_account_id": "116",
        "iban_receiver": "1",
        "paymentdate": "22/04/2020",
        "reference": "1",
        "saldo": "-166.66",
        "taplajikd": "162",
        "tstamp": "2020-04-22 12:09:07",
        "valuedate": "22/04/2020",
        "vientiselitekd": "0"
    },
    {
        "accountno": "2",
        "amount": "-166.48",
        "bic_receiver": "OKOYFIHH",
        "bookdate": "16/06/2020",
        "category": "Luokittelemattomat",
        "counterparty_account_id": "20",
        "iban_receiver": "0",
        "paymentdate": "16/06/2020",
        "reference": "1",
        "saldo": "1284.87",
        "taplajikd": "106",
        "tstamp": "2020-06-16 15:02:10",
        "valuedate": "16/06/2020",
        "vientiselitekd": "0"
    },
    {
        "accountno": "2",
        "amount": "-418.49",
        "bic_receiver": "OKOYFIHH",
        "bookdate": "26/06/2020",
        "category": "Luokittelemattomat",
        "counterparty_account_id": "5",
        "iban_receiver": "0",
        "paymentdate": "26/06/2020",
        "reference": "0",
        "saldo": "745.43",
        "taplajikd": "106",
        "tstamp": "2020-06-26 7:13:44",
        "valuedate": "26/06/2020",
        "vientiselitekd": "0"
    },
    {
        "accountno": "2",
        "amount": "-355.61",
        "bic_receiver": "OKOYFIHH",
        "bookdate": "03/07/2020",
        "category": "Luokittelemattomat",
        "counterparty_account_id": "200",
        "iban_receiver": "0",
        "paymentdate": "03/07/2020",
        "reference": "0",
        "saldo": "776.36",
        "taplajikd": "129",
        "tstamp": "2020-07-03 18:08:00",
        "valuedate": "03/07/2020",
        "vientiselitekd": "706"
    },
    {
        "accountno": "2",
        "amount": "-35.01",
        "bic_receiver": "",
        "bookdate": "10/07/2020",
        "category": "Luokittelemattomat",
        "counterparty_account_id": "77",
        "iban_receiver": "1",
        "paymentdate": "10/07/2020",
        "reference": "1",
        "saldo": "479.51",
        "taplajikd": "162",
        "tstamp": "2020-07-10 2:29:20",
        "valuedate": "10/07/2020",
        "vientiselitekd": "0"
    },
    {
        "accountno": "2",
        "amount": "-157.09",
        "bic_receiver": "ITELFIHH",
        "bookdate": "24/07/2020",
        "category": "Luokittelemattomat",
        "counterparty_account_id": "12",
        "iban_receiver": "0",
        "paymentdate": "23/07/2020",
        "reference": "0",
        "saldo": "169.46",
        "taplajikd": "106",
        "tstamp": "2020-07-23 10:08:00",
        "valuedate": "23/07/2020",
        "vientiselitekd": "0"
    },
    {
        "accountno": "2",
        "amount": "-21.01",
        "bic_receiver": "",
        "bookdate": "13/08/2020",
        "category": "Luokittelemattomat",
        "counterparty_account_id": "136",
        "iban_receiver": "1",
        "paymentdate": "13/08/2020",
        "reference": "1",
        "saldo": "426.28",
        "taplajikd": "162",
        "tstamp": "2020-08-13 15:47:42",
        "valuedate": "13/08/2020",
        "vientiselitekd": "0"
    },
    {
        "accountno": "2",
        "amount": "-6.59",
        "bic_receiver": "",
        "bookdate": "24/08/2020",
        "category": "Luokittelemattomat",
        "counterparty_account_id": "33",
        "iban_receiver": "1",
        "paymentdate": "24/08/2020",
        "reference": "1",
        "saldo": "99.74",
        "taplajikd": "162",
        "tstamp": "2020-08-24 4:43:05",
        "valuedate": "24/08/2020",
        "vientiselitekd": "0"
    },
    {
        "accountno": "2",
        "amount": "-45.73",
        "bic_receiver": "",
        "bookdate": "15/09/2020",
        "category": "Luokittelemattomat",
        "counterparty_account_id": "146",
        "iban_receiver": "1",
        "paymentdate": "15/09/2020",
        "reference": "1",
        "saldo": "4239.64",
        "taplajikd": "162",
        "tstamp": "2020-09-15 19:33:20",
        "valuedate": "15/09/2020",
        "vientiselitekd": "0"
    },
    {
        "accountno": "2",
        "amount": "-217.71",
        "bic_receiver": "OKOYFIHH",
        "bookdate": "28/10/2020",
        "category": "Luokittelemattomat",
        "counterparty_account_id": "4",
        "iban_receiver": "0",
        "paymentdate": "28/10/2020",
        "reference": "1",
        "saldo": "3364.26",
        "taplajikd": "106",
        "tstamp": "2020-10-28 7:43:44",
        "valuedate": "28/10/2020",
        "vientiselitekd": "0"
    },
    {
        "accountno": "2",
        "amount": "-369.92",
        "bic_receiver": "OKOYFIHH",
        "bookdate": "29/10/2020",
        "category": "Luokittelemattomat",
        "counterparty_account_id": "7",
        "iban_receiver": "0",
        "paymentdate": "29/10/2020",
        "reference": "1",
        "saldo": "2994.34",
        "taplajikd": "106",
        "tstamp": "2020-10-29 8:56:57",
        "valuedate": "29/10/2020",
        "vientiselitekd": "0"
    },
    {
        "accountno": "2",
        "amount": "-88.6",
        "bic_receiver": "OKOYFIHH",
        "bookdate": "24/11/2020",
        "category": "Luokittelemattomat",
        "counterparty_account_id": "2",
        "iban_receiver": "0",
        "paymentdate": "24/11/2020",
        "reference": "1",
        "saldo": "6527.6",
        "taplajikd": "106",
        "tstamp": "2020-11-25 0:00:00",
        "valuedate": "24/11/2020",
        "vientiselitekd": "0"
    },
    {
        "accountno": "2",
        "amount": "-24.18",
        "bic_receiver": "",
        "bookdate": "21/12/2020",
        "category": "Luokittelemattomat",
        "counterparty_account_id": "146",
        "iban_receiver": "1",
        "paymentdate": "21/12/2020",
        "reference": "1",
        "saldo": "4073.27",
        "taplajikd": "162",
        "tstamp": "2020-12-21 17:53:07",
        "valuedate": "21/12/2020",
        "vientiselitekd": "0"
    },
    {
        "accountno": "2",
        "amount": "-3.92",
        "bic_receiver": "",
        "bookdate": "24/12/2020",
        "category": "Luokittelemattomat",
        "counterparty_account_id": "98",
        "iban_receiver": "1",
        "paymentdate": "24/12/2020",
        "reference": "1",
        "saldo": "3904.65",
        "taplajikd": "162",
        "tstamp": "2020-12-24 2:45:06",
        "valuedate": "24/12/2020",
        "vientiselitekd": "0"
    },
    {
        "accountno": "2",
        "amount": "-16.53",
        "bic_receiver": "",
        "bookdate": "30/12/2020",
        "category": "Luokittelemattomat",
        "counterparty_account_id": "128",
        "iban_receiver": "1",
        "paymentdate": "30/12/2020",
        "reference": "1",
        "saldo": "4688.64",
        "taplajikd": "162",
        "tstamp": "2020-12-30 19:52:21",
        "valuedate": "30/12/2020",
        "vientiselitekd": "0"
    },
    {
        "accountno": "3",
        "amount": "-16.43",
        "bic_receiver": "",
        "bookdate": "22/04/2019",
        "category": "Luokittelemattomat",
        "counterparty_account_id": "146",
        "iban_receiver": "1",
        "paymentdate": "22/04/2019",
        "reference": "1",
        "saldo": "61313.65",
        "taplajikd": "162",
        "tstamp": "2019-04-22 13:09:02",
        "valuedate": "22/04/2019",
        "vientiselitekd": "0"
    },
    {
        "accountno": "3",
        "amount": "-30.98",
        "bic_receiver": "",
        "bookdate": "26/04/2019",
        "category": "Luokittelemattomat",
        "counterparty_account_id": "48",
        "iban_receiver": "1",
        "paymentdate": "26/04/2019",
        "reference": "1",
        "saldo": "65593.63",
        "taplajikd": "162",
        "tstamp": "2019-04-26 11:30:25",
        "valuedate": "26/04/2019",
        "vientiselitekd": "0"
    },
    {
        "accountno": "3",
        "amount": "-16.58",
        "bic_receiver": "",
        "bookdate": "01/07/2019",
        "category": "Luokittelemattomat",
        "counterparty_account_id": "43",
        "iban_receiver": "1",
        "paymentdate": "28/06/2019",
        "reference": "1",
        "saldo": "68902.17",
        "taplajikd": "162",
        "tstamp": "2019-06-28 19:02:04",
        "valuedate": "28/06/2019",
        "vientiselitekd": "0"
    },
    {
        "accountno": "3",
        "amount": "-688.04",
        "bic_receiver": "OKOYFIHH",
        "bookdate": "03/07/2019",
        "category": "Luokittelemattomat",
        "counterparty_account_id": "7",
        "iban_receiver": "0",
        "paymentdate": "03/07/2019",
        "reference": "1",
        "saldo": "68488.36",
        "taplajikd": "106",
        "tstamp": "2019-07-03 3:18:37",
        "valuedate": "03/07/2019",
        "vientiselitekd": "0"
    },
    {
        "accountno": "3",
        "amount": "-89.03",
        "bic_receiver": "",
        "bookdate": "11/07/2019",
        "category": "Luokittelemattomat",
        "counterparty_account_id": "127",
        "iban_receiver": "1",
        "paymentdate": "11/07/2019",
        "reference": "1",
        "saldo": "67988.82",
        "taplajikd": "162",
        "tstamp": "2019-07-11 6:20:41",
        "valuedate": "11/07/2019",
        "vientiselitekd": "0"
    },
    {
        "accountno": "3",
        "amount": "-111.31",
        "bic_receiver": "",
        "bookdate": "12/08/2019",
        "category": "Luokittelemattomat",
        "counterparty_account_id": "94",
        "iban_receiver": "1",
        "paymentdate": "12/08/2019",
        "reference": "1",
        "saldo": "72690.54",
        "taplajikd": "162",
        "tstamp": "2019-08-12 17:24:42",
        "valuedate": "12/08/2019",
        "vientiselitekd": "0"
    },
    {
        "accountno": "3",
        "amount": "-32.47",
        "bic_receiver": "",
        "bookdate": "16/08/2019",
        "category": "Luokittelemattomat",
        "counterparty_account_id": "111",
        "iban_receiver": "1",
        "paymentdate": "16/08/2019",
        "reference": "1",
        "saldo": "72629.65",
        "taplajikd": "162",
        "tstamp": "2019-08-16 19:17:39",
        "valuedate": "16/08/2019",
        "vientiselitekd": "0"
    },
    {
        "accountno": "3",
        "amount": "-126.92",
        "bic_receiver": "OKOYFIHH",
        "bookdate": "14/10/2019",
        "category": "Luokittelemattomat",
        "counterparty_account_id": "21",
        "iban_receiver": "0",
        "paymentdate": "14/10/2019",
        "reference": "0",
        "saldo": "72964.3",
        "taplajikd": "106",
        "tstamp": "2019-10-14 5:26:24",
        "valuedate": "14/10/2019",
        "vientiselitekd": "0"
    },
    {
        "accountno": "3",
        "amount": "-178.8",
        "bic_receiver": "",
        "bookdate": "14/10/2019",
        "category": "Luokittelemattomat",
        "counterparty_account_id": "90",
        "iban_receiver": "1",
        "paymentdate": "14/10/2019",
        "reference": "1",
        "saldo": "73039.51",
        "taplajikd": "162",
        "tstamp": "2019-10-14 16:57:36",
        "valuedate": "14/10/2019",
        "vientiselitekd": "0"
    },
    {
        "accountno": "3",
        "amount": "-618.45",
        "bic_receiver": "OKOYFIHH",
        "bookdate": "19/10/2019",
        "category": "Luokittelemattomat",
        "counterparty_account_id": "8",
        "iban_receiver": "0",
        "paymentdate": "19/10/2019",
        "reference": "0",
        "saldo": "72231.8",
        "taplajikd": "106",
        "tstamp": "2019-10-19 0:19:12",
        "valuedate": "19/10/2019",
        "vientiselitekd": "0"
    },
    {
        "accountno": "3",
        "amount": "-21.54",
        "bic_receiver": "",
        "bookdate": "15/11/2019",
        "category": "Luokittelemattomat",
        "counterparty_account_id": "86",
        "iban_receiver": "1",
        "paymentdate": "15/11/2019",
        "reference": "1",
        "saldo": "52350.19",
        "taplajikd": "162",
        "tstamp": "2019-11-15 13:09:41",
        "valuedate": "15/11/2019",
        "vientiselitekd": "0"
    },
    {
        "accountno": "3",
        "amount": "-831.99",
        "bic_receiver": "SBANFIHH",
        "bookdate": "18/11/2019",
        "category": "Luokittelemattomat",
        "counterparty_account_id": "9",
        "iban_receiver": "0",
        "paymentdate": "18/11/2019",
        "reference": "1",
        "saldo": "26435.93",
        "taplajikd": "106",
        "tstamp": "2019-11-18 18:34:50",
        "valuedate": "18/11/2019",
        "vientiselitekd": "0"
    },
    {
        "accountno": "3",
        "amount": "-273.84",
        "bic_receiver": "",
        "bookdate": "19/11/2019",
        "category": "Luokittelemattomat",
        "counterparty_account_id": "112",
        "iban_receiver": "1",
        "paymentdate": "19/11/2019",
        "reference": "1",
        "saldo": "26143.22",
        "taplajikd": "162",
        "tstamp": "2019-11-19 1:32:54",
        "valuedate": "19/11/2019",
        "vientiselitekd": "0"
    },
    {
        "accountno": "3",
        "amount": "-11.67",
        "bic_receiver": "",
        "bookdate": "19/11/2019",
        "category": "Luokittelemattomat",
        "counterparty_account_id": "76",
        "iban_receiver": "1",
        "paymentdate": "19/11/2019",
        "reference": "1",
        "saldo": "25560.12",
        "taplajikd": "162",
        "tstamp": "2019-11-19 17:01:56",
        "valuedate": "19/11/2019",
        "vientiselitekd": "0"
    },
    {
        "accountno": "3",
        "amount": "-57.9",
        "bic_receiver": "",
        "bookdate": "27/11/2019",
        "category": "Luokittelemattomat",
        "counterparty_account_id": "162",
        "iban_receiver": "1",
        "paymentdate": "27/11/2019",
        "reference": "1",
        "saldo": "24494.24",
        "taplajikd": "162",
        "tstamp": "2019-11-27 10:50:19",
        "valuedate": "27/11/2019",
        "vientiselitekd": "0"
    },
    {
        "accountno": "3",
        "amount": "-133.32",
        "bic_receiver": "DABAFIHH",
        "bookdate": "05/12/2019",
        "category": "Luokittelemattomat",
        "counterparty_account_id": "28",
        "iban_receiver": "0",
        "paymentdate": "05/12/2019",
        "reference": "1",
        "saldo": "27292.64",
        "taplajikd": "106",
        "tstamp": "2019-12-05 6:57:23",
        "valuedate": "05/12/2019",
        "vientiselitekd": "0"
    },
    {
        "accountno": "3",
        "amount": "-145.09",
        "bic_receiver": "OKOYFIHH",
        "bookdate": "05/12/2019",
        "category": "Luokittelemattomat",
        "counterparty_account_id": "212",
        "iban_receiver": "0",
        "paymentdate": "05/12/2019",
        "reference": "0",
        "saldo": "27147.55",
        "taplajikd": "129",
        "tstamp": "2019-12-05 11:49:34",
        "valuedate": "05/12/2019",
        "vientiselitekd": "706"
    },
    {
        "accountno": "3",
        "amount": "-324.21",
        "bic_receiver": "DABAFIHH",
        "bookdate": "10/12/2019",
        "category": "Luokittelemattomat",
        "counterparty_account_id": "205",
        "iban_receiver": "0",
        "paymentdate": "10/12/2019",
        "reference": "1",
        "saldo": "26629.22",
        "taplajikd": "106",
        "tstamp": "2019-12-10 21:13:03",
        "valuedate": "10/12/2019",
        "vientiselitekd": "706"
    },
    {
        "accountno": "3",
        "amount": "-1345.73",
        "bic_receiver": "OKOYFIHH",
        "bookdate": "27/12/2019",
        "category": "Luokittelemattomat",
        "counterparty_account_id": "204",
        "iban_receiver": "0",
        "paymentdate": "27/12/2019",
        "reference": "1",
        "saldo": "27615.92",
        "taplajikd": "106",
        "tstamp": "2019-12-27 22:57:23",
        "valuedate": "27/12/2019",
        "vientiselitekd": "706"
    },
    {
        "accountno": "3",
        "amount": "-144.05",
        "bic_receiver": "ITELFIHH",
        "bookdate": "10/01/2020",
        "category": "Luokittelemattomat",
        "counterparty_account_id": "207",
        "iban_receiver": "0",
        "paymentdate": "10/01/2020",
        "reference": "0",
        "saldo": "28844.2",
        "taplajikd": "106",
        "tstamp": "2020-01-10 17:24:42",
        "valuedate": "10/01/2020",
        "vientiselitekd": "706"
    },
    {
        "accountno": "3",
        "amount": "-6.66",
        "bic_receiver": "",
        "bookdate": "24/01/2020",
        "category": "Luokittelemattomat",
        "counterparty_account_id": "45",
        "iban_receiver": "1",
        "paymentdate": "24/01/2020",
        "reference": "1",
        "saldo": "27992.67",
        "taplajikd": "162",
        "tstamp": "2020-01-24 7:31:46",
        "valuedate": "24/01/2020",
        "vientiselitekd": "0"
    },
    {
        "accountno": "3",
        "amount": "-30.8",
        "bic_receiver": "",
        "bookdate": "24/01/2020",
        "category": "Luokittelemattomat",
        "counterparty_account_id": "171",
        "iban_receiver": "1",
        "paymentdate": "24/01/2020",
        "reference": "1",
        "saldo": "27961.87",
        "taplajikd": "162",
        "tstamp": "2020-01-24 21:10:35",
        "valuedate": "24/01/2020",
        "vientiselitekd": "0"
    },
    {
        "accountno": "3",
        "amount": "-167.02",
        "bic_receiver": "OKOYFIHH",
        "bookdate": "12/02/2020",
        "category": "Luokittelemattomat",
        "counterparty_account_id": "38",
        "iban_receiver": "0",
        "paymentdate": "12/02/2020",
        "reference": "1",
        "saldo": "27740.38",
        "taplajikd": "106",
        "tstamp": "2020-02-12 14:24:00",
        "valuedate": "12/02/2020",
        "vientiselitekd": "0"
    },
    {
        "accountno": "3",
        "amount": "-9.45",
        "bic_receiver": "",
        "bookdate": "06/04/2020",
        "category": "Luokittelemattomat",
        "counterparty_account_id": "124",
        "iban_receiver": "1",
        "paymentdate": "06/04/2020",
        "reference": "1",
        "saldo": "29738.44",
        "taplajikd": "162",
        "tstamp": "2020-04-06 13:57:13",
        "valuedate": "06/04/2020",
        "vientiselitekd": "0"
    },
    {
        "accountno": "3",
        "amount": "-17.85",
        "bic_receiver": "",
        "bookdate": "23/04/2020",
        "category": "Luokittelemattomat",
        "counterparty_account_id": "126",
        "iban_receiver": "1",
        "paymentdate": "23/04/2020",
        "reference": "1",
        "saldo": "32443.93",
        "taplajikd": "162",
        "tstamp": "2020-04-23 7:48:50",
        "valuedate": "23/04/2020",
        "vientiselitekd": "0"
    },
    {
        "accountno": "3",
        "amount": "-26.33",
        "bic_receiver": "",
        "bookdate": "27/05/2020",
        "category": "Luokittelemattomat",
        "counterparty_account_id": "146",
        "iban_receiver": "1",
        "paymentdate": "27/05/2020",
        "reference": "1",
        "saldo": "26863.66",
        "taplajikd": "162",
        "tstamp": "2020-05-27 13:42:51",
        "valuedate": "27/05/2020",
        "vientiselitekd": "0"
    },
    {
        "accountno": "3",
        "amount": "-308.85",
        "bic_receiver": "OKOYFIHH",
        "bookdate": "02/06/2020",
        "category": "Luokittelemattomat",
        "counterparty_account_id": "205",
        "iban_receiver": "0",
        "paymentdate": "02/06/2020",
        "reference": "0",
        "saldo": "26132.57",
        "taplajikd": "106",
        "tstamp": "2020-06-02 6:09:25",
        "valuedate": "02/06/2020",
        "vientiselitekd": "706"
    },
    {
        "accountno": "3",
        "amount": "-9.99",
        "bic_receiver": "",
        "bookdate": "15/06/2020",
        "category": "Luokittelemattomat",
        "counterparty_account_id": "124",
        "iban_receiver": "1",
        "paymentdate": "15/06/2020",
        "reference": "1",
        "saldo": "24144.27",
        "taplajikd": "162",
        "tstamp": "2020-06-15 10:48:23",
        "valuedate": "15/06/2020",
        "vientiselitekd": "0"
    },
    {
        "accountno": "3",
        "amount": "-12.08",
        "bic_receiver": "",
        "bookdate": "19/06/2020",
        "category": "Luokittelemattomat",
        "counterparty_account_id": "104",
        "iban_receiver": "1",
        "paymentdate": "19/06/2020",
        "reference": "1",
        "saldo": "23464.61",
        "taplajikd": "162",
        "tstamp": "2020-06-19 12:49:00",
        "valuedate": "19/06/2020",
        "vientiselitekd": "0"
    },
    {
        "accountno": "3",
        "amount": "-116.98",
        "bic_receiver": "",
        "bookdate": "29/06/2020",
        "category": "Luokittelemattomat",
        "counterparty_account_id": "87",
        "iban_receiver": "1",
        "paymentdate": "29/06/2020",
        "reference": "1",
        "saldo": "21528.08",
        "taplajikd": "162",
        "tstamp": "2020-06-29 6:32:03",
        "valuedate": "29/06/2020",
        "vientiselitekd": "0"
    },
    {
        "accountno": "3",
        "amount": "-2.44",
        "bic_receiver": "",
        "bookdate": "02/07/2020",
        "category": "Luokittelemattomat",
        "counterparty_account_id": "43",
        "iban_receiver": "1",
        "paymentdate": "02/07/2020",
        "reference": "1",
        "saldo": "21134.3",
        "taplajikd": "162",
        "tstamp": "2020-07-02 15:47:10",
        "valuedate": "02/07/2020",
        "vientiselitekd": "0"
    },
    {
        "accountno": "3",
        "amount": "-8.16",
        "bic_receiver": "",
        "bookdate": "03/07/2020",
        "category": "Luokittelemattomat",
        "counterparty_account_id": "43",
        "iban_receiver": "1",
        "paymentdate": "03/07/2020",
        "reference": "1",
        "saldo": "21056.67",
        "taplajikd": "162",
        "tstamp": "2020-07-03 15:31:46",
        "valuedate": "03/07/2020",
        "vientiselitekd": "0"
    },
    {
        "accountno": "3",
        "amount": "-27.05",
        "bic_receiver": "",
        "bookdate": "10/07/2020",
        "category": "Luokittelemattomat",
        "counterparty_account_id": "107",
        "iban_receiver": "1",
        "paymentdate": "10/07/2020",
        "reference": "1",
        "saldo": "20131.89",
        "taplajikd": "162",
        "tstamp": "2020-07-10 6:40:26",
        "valuedate": "10/07/2020",
        "vientiselitekd": "0"
    },
    {
        "accountno": "3",
        "amount": "-196.26",
        "bic_receiver": "HELSFIHH",
        "bookdate": "28/07/2020",
        "category": "Luokittelemattomat",
        "counterparty_account_id": "7",
        "iban_receiver": "0",
        "paymentdate": "28/07/2020",
        "reference": "1",
        "saldo": "25245",
        "taplajikd": "106",
        "tstamp": "2020-07-28 20:24:23",
        "valuedate": "28/07/2020",
        "vientiselitekd": "0"
    },
    {
        "accountno": "3",
        "amount": "-35.89",
        "bic_receiver": "OKOYFIHH",
        "bookdate": "20/08/2020",
        "category": "Luokittelemattomat",
        "counterparty_account_id": "218",
        "iban_receiver": "0",
        "paymentdate": "20/08/2020",
        "reference": "0",
        "saldo": "35324.53",
        "taplajikd": "129",
        "tstamp": "2020-08-20 16:55:49",
        "valuedate": "20/08/2020",
        "vientiselitekd": "706"
    },
    {
        "accountno": "3",
        "amount": "-109.66",
        "bic_receiver": "OKOYFIHH",
        "bookdate": "22/08/2020",
        "category": "Luokittelemattomat",
        "counterparty_account_id": "42",
        "iban_receiver": "0",
        "paymentdate": "22/08/2020",
        "reference": "0",
        "saldo": "35936.64",
        "taplajikd": "129",
        "tstamp": "2020-08-22 14:08:22",
        "valuedate": "22/08/2020",
        "vientiselitekd": "0"
    },
    {
        "accountno": "3",
        "amount": "-41.76",
        "bic_receiver": "OKOYFIHH",
        "bookdate": "25/08/2020",
        "category": "Luokittelemattomat",
        "counterparty_account_id": "32",
        "iban_receiver": "0",
        "paymentdate": "25/08/2020",
        "reference": "1",
        "saldo": "35852.55",
        "taplajikd": "106",
        "tstamp": "2020-08-25 12:16:45",
        "valuedate": "25/08/2020",
        "vientiselitekd": "0"
    },
    {
        "accountno": "3",
        "amount": "-73.49",
        "bic_receiver": "OKOYFIHH",
        "bookdate": "30/08/2020",
        "category": "Luokittelemattomat",
        "counterparty_account_id": "11",
        "iban_receiver": "0",
        "paymentdate": "30/08/2020",
        "reference": "0",
        "saldo": "41214.85",
        "taplajikd": "106",
        "tstamp": "2020-08-30 19:09:46",
        "valuedate": "30/08/2020",
        "vientiselitekd": "0"
    },
    {
        "accountno": "3",
        "amount": "-138.7",
        "bic_receiver": "",
        "bookdate": "14/09/2020",
        "category": "Luokittelemattomat",
        "counterparty_account_id": "86",
        "iban_receiver": "1",
        "paymentdate": "14/09/2020",
        "reference": "1",
        "saldo": "45077.12",
        "taplajikd": "162",
        "tstamp": "2020-09-14 3:19:42",
        "valuedate": "14/09/2020",
        "vientiselitekd": "0"
    },
    {
        "accountno": "3",
        "amount": "-84.52",
        "bic_receiver": "",
        "bookdate": "17/09/2020",
        "category": "Luokittelemattomat",
        "counterparty_account_id": "45",
        "iban_receiver": "1",
        "paymentdate": "16/09/2020",
        "reference": "1",
        "saldo": "44166.88",
        "taplajikd": "162",
        "tstamp": "2020-09-16 0:21:01",
        "valuedate": "16/09/2020",
        "vientiselitekd": "0"
    },
    {
        "accountno": "3",
        "amount": "-102.21",
        "bic_receiver": "NDEAFIHH",
        "bookdate": "21/09/2020",
        "category": "Luokittelemattomat",
        "counterparty_account_id": "29",
        "iban_receiver": "0",
        "paymentdate": "21/09/2020",
        "reference": "1",
        "saldo": "43734.58",
        "taplajikd": "106",
        "tstamp": "2020-09-21 11:02:11",
        "valuedate": "21/09/2020",
        "vientiselitekd": "0"
    },
    {
        "accountno": "3",
        "amount": "-2.93",
        "bic_receiver": "",
        "bookdate": "05/10/2020",
        "category": "Luokittelemattomat",
        "counterparty_account_id": "113",
        "iban_receiver": "1",
        "paymentdate": "05/10/2020",
        "reference": "1",
        "saldo": "13020.87",
        "taplajikd": "162",
        "tstamp": "2020-10-05 1:52:56",
        "valuedate": "05/10/2020",
        "vientiselitekd": "0"
    },
    {
        "accountno": "3",
        "amount": "-8.5",
        "bic_receiver": "",
        "bookdate": "19/10/2020",
        "category": "Luokittelemattomat",
        "counterparty_account_id": "68",
        "iban_receiver": "1",
        "paymentdate": "19/10/2020",
        "reference": "1",
        "saldo": "18644.31",
        "taplajikd": "162",
        "tstamp": "2020-10-19 10:11:46",
        "valuedate": "19/10/2020",
        "vientiselitekd": "0"
    },
    {
        "accountno": "3",
        "amount": "-539.54",
        "bic_receiver": "NDEAFIHH",
        "bookdate": "22/10/2020",
        "category": "Luokittelemattomat",
        "counterparty_account_id": "36",
        "iban_receiver": "0",
        "paymentdate": "21/10/2020",
        "reference": "1",
        "saldo": "17805.52",
        "taplajikd": "106",
        "tstamp": "2020-10-21 6:16:28",
        "valuedate": "21/10/2020",
        "vientiselitekd": "0"
    },
    {
        "accountno": "3",
        "amount": "-110.75",
        "bic_receiver": "",
        "bookdate": "28/10/2020",
        "category": "Luokittelemattomat",
        "counterparty_account_id": "94",
        "iban_receiver": "1",
        "paymentdate": "28/10/2020",
        "reference": "1",
        "saldo": "15992.87",
        "taplajikd": "162",
        "tstamp": "2020-10-28 4:14:07",
        "valuedate": "28/10/2020",
        "vientiselitekd": "0"
    },
    {
        "accountno": "3",
        "amount": "-61.31",
        "bic_receiver": "",
        "bookdate": "29/10/2020",
        "category": "Luokittelemattomat",
        "counterparty_account_id": "203",
        "iban_receiver": "1",
        "paymentdate": "29/10/2020",
        "reference": "1",
        "saldo": "15812.11",
        "taplajikd": "106",
        "tstamp": "2020-10-29 8:47:04",
        "valuedate": "29/10/2020",
        "vientiselitekd": "702"
    },
    {
        "accountno": "3",
        "amount": "-47",
        "bic_receiver": "",
        "bookdate": "04/11/2020",
        "category": "Luokittelemattomat",
        "counterparty_account_id": "120",
        "iban_receiver": "1",
        "paymentdate": "04/11/2020",
        "reference": "1",
        "saldo": "21057.73",
        "taplajikd": "162",
        "tstamp": "2020-11-04 6:17:42",
        "valuedate": "04/11/2020",
        "vientiselitekd": "0"
    },
    {
        "accountno": "3",
        "amount": "-6.79",
        "bic_receiver": "OKOYFIHH",
        "bookdate": "13/11/2020",
        "category": "Luokittelemattomat",
        "counterparty_account_id": "30",
        "iban_receiver": "0",
        "paymentdate": "13/11/2020",
        "reference": "1",
        "saldo": "21975.48",
        "taplajikd": "106",
        "tstamp": "2020-11-13 18:05:54",
        "valuedate": "13/11/2020",
        "vientiselitekd": "0"
    },
    {
        "accountno": "3",
        "amount": "-93.07",
        "bic_receiver": "DABAFIHH",
        "bookdate": "23/11/2020",
        "category": "Luokittelemattomat",
        "counterparty_account_id": "204",
        "iban_receiver": "0",
        "paymentdate": "23/11/2020",
        "reference": "1",
        "saldo": "25135.09",
        "taplajikd": "106",
        "tstamp": "2020-11-23 14:33:27",
        "valuedate": "23/11/2020",
        "vientiselitekd": "706"
    },
    {
        "accountno": "3",
        "amount": "-19.85",
        "bic_receiver": "",
        "bookdate": "24/11/2020",
        "category": "Luokittelemattomat",
        "counterparty_account_id": "104",
        "iban_receiver": "1",
        "paymentdate": "23/11/2020",
        "reference": "1",
        "saldo": "25115.24",
        "taplajikd": "162",
        "tstamp": "2020-11-23 14:57:03",
        "valuedate": "23/11/2020",
        "vientiselitekd": "0"
    },
    {
        "accountno": "3",
        "amount": "-8.32",
        "bic_receiver": "",
        "bookdate": "27/11/2020",
        "category": "Luokittelemattomat",
        "counterparty_account_id": "81",
        "iban_receiver": "1",
        "paymentdate": "27/11/2020",
        "reference": "1",
        "saldo": "23554.94",
        "taplajikd": "162",
        "tstamp": "2020-11-27 6:17:42",
        "valuedate": "27/11/2020",
        "vientiselitekd": "0"
    },
    {
        "accountno": "3",
        "amount": "-13.34",
        "bic_receiver": "",
        "bookdate": "30/11/2020",
        "category": "Luokittelemattomat",
        "counterparty_account_id": "53",
        "iban_receiver": "1",
        "paymentdate": "30/11/2020",
        "reference": "1",
        "saldo": "23077.83",
        "taplajikd": "162",
        "tstamp": "2020-11-30 12:35:25",
        "valuedate": "30/11/2020",
        "vientiselitekd": "0"
    },
    {
        "accountno": "3",
        "amount": "-66.65",
        "bic_receiver": "OKOYFIHH",
        "bookdate": "12/12/2020",
        "category": "Luokittelemattomat",
        "counterparty_account_id": "35",
        "iban_receiver": "0",
        "paymentdate": "12/12/2020",
        "reference": "1",
        "saldo": "25185.68",
        "taplajikd": "106",
        "tstamp": "2020-12-12 22:30:34",
        "valuedate": "12/12/2020",
        "vientiselitekd": "0"
    },
    {
        "accountno": "3",
        "amount": "-1125.57",
        "bic_receiver": "OKOYFIHH",
        "bookdate": "13/12/2020",
        "category": "Luokittelemattomat",
        "counterparty_account_id": "25",
        "iban_receiver": "0",
        "paymentdate": "13/12/2020",
        "reference": "1",
        "saldo": "24060.11",
        "taplajikd": "106",
        "tstamp": "2020-12-13 4:01:29",
        "valuedate": "13/12/2020",
        "vientiselitekd": "0"
    },
    {
        "accountno": "3",
        "amount": "-166.13",
        "bic_receiver": "NDEAFIHH",
        "bookdate": "24/12/2020",
        "category": "Luokittelemattomat",
        "counterparty_account_id": "212",
        "iban_receiver": "0",
        "paymentdate": "24/12/2020",
        "reference": "0",
        "saldo": "23096.79",
        "taplajikd": "129",
        "tstamp": "2020-12-24 21:01:07",
        "valuedate": "24/12/2020",
        "vientiselitekd": "706"
    },
    {
        "accountno": "3",
        "amount": "-16.5",
        "bic_receiver": "",
        "bookdate": "31/12/2020",
        "category": "Luokittelemattomat",
        "counterparty_account_id": "108",
        "iban_receiver": "1",
        "paymentdate": "31/12/2020",
        "reference": "1",
        "saldo": "22477.62",
        "taplajikd": "162",
        "tstamp": "2020-12-31 0:53:40",
        "valuedate": "31/12/2020",
        "vientiselitekd": "0"
    },
    {
        "accountno": "1",
        "amount": "-105.08",
        "bic_receiver": "OKOYFIHH",
        "bookdate": "11/01/2019",
        "category": "Luottojen_maksut",
        "counterparty_account_id": "205",
        "iban_receiver": "0",
        "paymentdate": "11/01/2019",
        "reference": "0",
        "saldo": "-28.06",
        "taplajikd": "129",
        "tstamp": "2019-01-11 20:24:40",
        "valuedate": "11/01/2019",
        "vientiselitekd": "706"
    },
    {
        "accountno": "1",
        "amount": "-8.17",
        "bic_receiver": "OKOYFIHH",
        "bookdate": "07/02/2019",
        "category": "Luottojen_maksut",
        "counterparty_account_id": "24",
        "iban_receiver": "0",
        "paymentdate": "07/02/2019",
        "reference": "0",
        "saldo": "-364.89",
        "taplajikd": "106",
        "tstamp": "2019-02-08 0:00:00",
        "valuedate": "07/02/2019",
        "vientiselitekd": "0"
    },
    {
        "accountno": "1",
        "amount": "-23.33",
        "bic_receiver": "NDEAFIHH",
        "bookdate": "15/02/2019",
        "category": "Luottojen_maksut",
        "counterparty_account_id": "200",
        "iban_receiver": "0",
        "paymentdate": "15/02/2019",
        "reference": "0",
        "saldo": "-379.09",
        "taplajikd": "129",
        "tstamp": "2019-02-15 20:34:17",
        "valuedate": "15/02/2019",
        "vientiselitekd": "706"
    },
    {
        "accountno": "1",
        "amount": "-53.13",
        "bic_receiver": "OKOYFIHH",
        "bookdate": "22/05/2019",
        "category": "Luottojen_maksut",
        "counterparty_account_id": "189",
        "iban_receiver": "0",
        "paymentdate": "22/05/2019",
        "reference": "0",
        "saldo": "-288.84",
        "taplajikd": "106",
        "tstamp": "2019-05-22 23:23:33",
        "valuedate": "22/05/2019",
        "vientiselitekd": "706"
    },
    {
        "accountno": "1",
        "amount": "-5.11",
        "bic_receiver": "",
        "bookdate": "04/06/2019",
        "category": "Luottojen_maksut",
        "counterparty_account_id": "116",
        "iban_receiver": "1",
        "paymentdate": "04/06/2019",
        "reference": "1",
        "saldo": "-257.24",
        "taplajikd": "162",
        "tstamp": "2019-06-04 12:42:21",
        "valuedate": "04/06/2019",
        "vientiselitekd": "0"
    },
    {
        "accountno": "1",
        "amount": "-5.44",
        "bic_receiver": "",
        "bookdate": "29/11/2019",
        "category": "Luottojen_maksut",
        "counterparty_account_id": "73",
        "iban_receiver": "1",
        "paymentdate": "29/11/2019",
        "reference": "1",
        "saldo": "-393.05",
        "taplajikd": "162",
        "tstamp": "2019-11-29 17:23:40",
        "valuedate": "29/11/2019",
        "vientiselitekd": "0"
    },
    {
        "accountno": "1",
        "amount": "-25.16",
        "bic_receiver": "",
        "bookdate": "27/12/2019",
        "category": "Luottojen_maksut",
        "counterparty_account_id": "100",
        "iban_receiver": "1",
        "paymentdate": "27/12/2019",
        "reference": "1",
        "saldo": "-225.29",
        "taplajikd": "162",
        "tstamp": "2019-12-27 18:57:47",
        "valuedate": "27/12/2019",
        "vientiselitekd": "0"
    },
    {
        "accountno": "1",
        "amount": "-19.36",
        "bic_receiver": "NDEAFIHH",
        "bookdate": "05/02/2020",
        "category": "Luottojen_maksut",
        "counterparty_account_id": "31",
        "iban_receiver": "0",
        "paymentdate": "05/02/2020",
        "reference": "0",
        "saldo": "-388.11",
        "taplajikd": "106",
        "tstamp": "2020-02-05 9:03:24",
        "valuedate": "05/02/2020",
        "vientiselitekd": "0"
    },
    {
        "accountno": "1",
        "amount": "-8.54",
        "bic_receiver": "",
        "bookdate": "15/06/2020",
        "category": "Luottojen_maksut",
        "counterparty_account_id": "86",
        "iban_receiver": "1",
        "paymentdate": "15/06/2020",
        "reference": "1",
        "saldo": "-62.1",
        "taplajikd": "162",
        "tstamp": "2020-06-15 5:41:42",
        "valuedate": "15/06/2020",
        "vientiselitekd": "0"
    },
    {
        "accountno": "1",
        "amount": "-191.22",
        "bic_receiver": "",
        "bookdate": "08/10/2020",
        "category": "Luottojen_maksut",
        "counterparty_account_id": "0",
        "iban_receiver": "1",
        "paymentdate": "08/10/2020",
        "reference": "1",
        "saldo": "-618.47",
        "taplajikd": "100",
        "tstamp": "2020-10-08 22:05:49",
        "valuedate": "08/10/2020",
        "vientiselitekd": "0"
    },
    {
        "accountno": "1",
        "amount": "-19.22",
        "bic_receiver": "OKOYFIHH",
        "bookdate": "20/11/2020",
        "category": "Luottojen_maksut",
        "counterparty_account_id": "201",
        "iban_receiver": "0",
        "paymentdate": "20/11/2020",
        "reference": "0",
        "saldo": "-235.89",
        "taplajikd": "129",
        "tstamp": "2020-11-20 8:07:56",
        "valuedate": "20/11/2020",
        "vientiselitekd": "706"
    },
    {
        "accountno": "2",
        "amount": "-11.9",
        "bic_receiver": "OKOYFIHH",
        "bookdate": "08/03/2019",
        "category": "Luottojen_maksut",
        "counterparty_account_id": "194",
        "iban_receiver": "0",
        "paymentdate": "07/03/2019",
        "reference": "0",
        "saldo": "2402.46",
        "taplajikd": "106",
        "tstamp": "2019-03-08 20:34:17",
        "valuedate": "08/03/2019",
        "vientiselitekd": "706"
    },
    {
        "accountno": "2",
        "amount": "-660.38",
        "bic_receiver": "OKOYFIHH",
        "bookdate": "03/04/2019",
        "category": "Luottojen_maksut",
        "counterparty_account_id": "186",
        "iban_receiver": "0",
        "paymentdate": "03/04/2019",
        "reference": "0",
        "saldo": "2019.69",
        "taplajikd": "106",
        "tstamp": "2019-04-03 9:36:00",
        "valuedate": "03/04/2019",
        "vientiselitekd": "706"
    },
    {
        "accountno": "2",
        "amount": "-43.51",
        "bic_receiver": "OKOYFIHH",
        "bookdate": "29/04/2019",
        "category": "Luottojen_maksut",
        "counterparty_account_id": "186",
        "iban_receiver": "0",
        "paymentdate": "29/04/2019",
        "reference": "0",
        "saldo": "1453.44",
        "taplajikd": "106",
        "tstamp": "2019-04-29 19:12:00",
        "valuedate": "29/04/2019",
        "vientiselitekd": "706"
    },
    {
        "accountno": "2",
        "amount": "-61.61",
        "bic_receiver": "OKOYFIHH",
        "bookdate": "03/06/2019",
        "category": "Luottojen_maksut",
        "counterparty_account_id": "188",
        "iban_receiver": "0",
        "paymentdate": "03/06/2019",
        "reference": "1",
        "saldo": "1393.19",
        "taplajikd": "106",
        "tstamp": "2019-06-03 4:21:49",
        "valuedate": "03/06/2019",
        "vientiselitekd": "706"
    },
    {
        "accountno": "2",
        "amount": "-9.4",
        "bic_receiver": "",
        "bookdate": "02/08/2019",
        "category": "Luottojen_maksut",
        "counterparty_account_id": "126",
        "iban_receiver": "1",
        "paymentdate": "02/08/2019",
        "reference": "1",
        "saldo": "4011.67",
        "taplajikd": "162",
        "tstamp": "2019-08-02 16:12:58",
        "valuedate": "02/08/2019",
        "vientiselitekd": "0"
    },
    {
        "accountno": "2",
        "amount": "-821.55",
        "bic_receiver": "OKOYFIHH",
        "bookdate": "05/08/2019",
        "category": "Luottojen_maksut",
        "counterparty_account_id": "19",
        "iban_receiver": "0",
        "paymentdate": "05/08/2019",
        "reference": "0",
        "saldo": "3190.12",
        "taplajikd": "106",
        "tstamp": "2019-08-05 11:14:36",
        "valuedate": "05/08/2019",
        "vientiselitekd": "0"
    },
    {
        "accountno": "2",
        "amount": "-188.6",
        "bic_receiver": "OKOYFIHH",
        "bookdate": "30/08/2019",
        "category": "Luottojen_maksut",
        "counterparty_account_id": "210",
        "iban_receiver": "0",
        "paymentdate": "30/08/2019",
        "reference": "0",
        "saldo": "3295.43",
        "taplajikd": "147",
        "tstamp": "2019-08-30 17:17:50",
        "valuedate": "30/08/2019",
        "vientiselitekd": "706"
    },
    {
        "accountno": "2",
        "amount": "-681.25",
        "bic_receiver": "OKOYFIHH",
        "bookdate": "04/09/2019",
        "category": "Luottojen_maksut",
        "counterparty_account_id": "18",
        "iban_receiver": "0",
        "paymentdate": "04/09/2019",
        "reference": "0",
        "saldo": "4232",
        "taplajikd": "106",
        "tstamp": "2019-09-04 6:54:15",
        "valuedate": "04/09/2019",
        "vientiselitekd": "0"
    },
    {
        "accountno": "2",
        "amount": "-34.93",
        "bic_receiver": "OKOYFIHH",
        "bookdate": "13/11/2019",
        "category": "Luottojen_maksut",
        "counterparty_account_id": "196",
        "iban_receiver": "0",
        "paymentdate": "13/11/2019",
        "reference": "0",
        "saldo": "3514.89",
        "taplajikd": "129",
        "tstamp": "2019-11-13 17:08:34",
        "valuedate": "13/11/2019",
        "vientiselitekd": "706"
    },
    {
        "accountno": "2",
        "amount": "-21.89",
        "bic_receiver": "",
        "bookdate": "23/12/2019",
        "category": "Luottojen_maksut",
        "counterparty_account_id": "96",
        "iban_receiver": "1",
        "paymentdate": "23/12/2019",
        "reference": "1",
        "saldo": "1926.48",
        "taplajikd": "162",
        "tstamp": "2019-12-23 19:18:37",
        "valuedate": "23/12/2019",
        "vientiselitekd": "0"
    },
    {
        "accountno": "2",
        "amount": "-20.05",
        "bic_receiver": "NDEAFIHH",
        "bookdate": "16/01/2020",
        "category": "Luottojen_maksut",
        "counterparty_account_id": "199",
        "iban_receiver": "0",
        "paymentdate": "16/01/2020",
        "reference": "0",
        "saldo": "-259.64",
        "taplajikd": "129",
        "tstamp": "2020-01-16 8:55:32",
        "valuedate": "16/01/2020",
        "vientiselitekd": "706"
    },
    {
        "accountno": "2",
        "amount": "-18.12",
        "bic_receiver": "",
        "bookdate": "27/01/2020",
        "category": "Luottojen_maksut",
        "counterparty_account_id": "84",
        "iban_receiver": "1",
        "paymentdate": "27/01/2020",
        "reference": "1",
        "saldo": "188.22",
        "taplajikd": "162",
        "tstamp": "2020-01-27 15:28:16",
        "valuedate": "27/01/2020",
        "vientiselitekd": "0"
    },
    {
        "accountno": "2",
        "amount": "-1.35",
        "bic_receiver": "",
        "bookdate": "13/03/2020",
        "category": "Luottojen_maksut",
        "counterparty_account_id": "76",
        "iban_receiver": "1",
        "paymentdate": "13/03/2020",
        "reference": "1",
        "saldo": "-55.72",
        "taplajikd": "162",
        "tstamp": "2020-03-13 8:56:28",
        "valuedate": "13/03/2020",
        "vientiselitekd": "0"
    },
    {
        "accountno": "2",
        "amount": "-3.54",
        "bic_receiver": "",
        "bookdate": "26/03/2020",
        "category": "Luottojen_maksut",
        "counterparty_account_id": "60",
        "iban_receiver": "1",
        "paymentdate": "25/03/2020",
        "reference": "1",
        "saldo": "-13.86",
        "taplajikd": "162",
        "tstamp": "2020-03-25 2:21:11",
        "valuedate": "25/03/2020",
        "vientiselitekd": "0"
    },
    {
        "accountno": "2",
        "amount": "-23.97",
        "bic_receiver": "OKOYFIHH",
        "bookdate": "15/04/2020",
        "category": "Luottojen_maksut",
        "counterparty_account_id": "22",
        "iban_receiver": "0",
        "paymentdate": "15/04/2020",
        "reference": "0",
        "saldo": "-97.13",
        "taplajikd": "106",
        "tstamp": "2020-04-15 10:19:45",
        "valuedate": "15/04/2020",
        "vientiselitekd": "0"
    },
    {
        "accountno": "2",
        "amount": "-832.93",
        "bic_receiver": "OKOYFIHH",
        "bookdate": "22/05/2020",
        "category": "Luottojen_maksut",
        "counterparty_account_id": "197",
        "iban_receiver": "0",
        "paymentdate": "22/05/2020",
        "reference": "0",
        "saldo": "-1253.78",
        "taplajikd": "129",
        "tstamp": "2020-05-22 16:54:05",
        "valuedate": "22/05/2020",
        "vientiselitekd": "706"
    },
    {
        "accountno": "2",
        "amount": "-55.07",
        "bic_receiver": "OKOYFIHH",
        "bookdate": "12/06/2020",
        "category": "Luottojen_maksut",
        "counterparty_account_id": "196",
        "iban_receiver": "0",
        "paymentdate": "11/06/2020",
        "reference": "0",
        "saldo": "1662.22",
        "taplajikd": "129",
        "tstamp": "2020-06-11 13:35:25",
        "valuedate": "11/06/2020",
        "vientiselitekd": "706"
    },
    {
        "accountno": "2",
        "amount": "-11.61",
        "bic_receiver": "",
        "bookdate": "06/07/2020",
        "category": "Luottojen_maksut",
        "counterparty_account_id": "105",
        "iban_receiver": "1",
        "paymentdate": "06/07/2020",
        "reference": "1",
        "saldo": "764.75",
        "taplajikd": "162",
        "tstamp": "2020-07-06 1:14:40",
        "valuedate": "06/07/2020",
        "vientiselitekd": "0"
    },
    {
        "accountno": "2",
        "amount": "-19.28",
        "bic_receiver": "OKOYFIHH",
        "bookdate": "10/07/2020",
        "category": "Luottojen_maksut",
        "counterparty_account_id": "201",
        "iban_receiver": "0",
        "paymentdate": "09/07/2020",
        "reference": "0",
        "saldo": "460.23",
        "taplajikd": "129",
        "tstamp": "2020-07-10 4:26:40",
        "valuedate": "10/07/2020",
        "vientiselitekd": "706"
    },
    {
        "accountno": "2",
        "amount": "-138.6",
        "bic_receiver": "OKOYFIHH",
        "bookdate": "16/07/2020",
        "category": "Luottojen_maksut",
        "counterparty_account_id": "196",
        "iban_receiver": "0",
        "paymentdate": "16/07/2020",
        "reference": "0",
        "saldo": "-22.49",
        "taplajikd": "129",
        "tstamp": "2020-07-16 14:45:20",
        "valuedate": "16/07/2020",
        "vientiselitekd": "706"
    },
    {
        "accountno": "2",
        "amount": "-1.2",
        "bic_receiver": "",
        "bookdate": "16/07/2020",
        "category": "Luottojen_maksut",
        "counterparty_account_id": "29",
        "iban_receiver": "1",
        "paymentdate": "16/07/2020",
        "reference": "1",
        "saldo": "-23.69",
        "taplajikd": "162",
        "tstamp": "2020-07-16 23:49:20",
        "valuedate": "16/07/2020",
        "vientiselitekd": "0"
    },
    {
        "accountno": "2",
        "amount": "-12.14",
        "bic_receiver": "NDEAFIHH",
        "bookdate": "24/07/2020",
        "category": "Luottojen_maksut",
        "counterparty_account_id": "186",
        "iban_receiver": "0",
        "paymentdate": "24/07/2020",
        "reference": "0",
        "saldo": "34.08",
        "taplajikd": "106",
        "tstamp": "2020-07-24 23:06:40",
        "valuedate": "24/07/2020",
        "vientiselitekd": "706"
    },
    {
        "accountno": "2",
        "amount": "-21.94",
        "bic_receiver": "OKOYFIHH",
        "bookdate": "27/07/2020",
        "category": "Luottojen_maksut",
        "counterparty_account_id": "208",
        "iban_receiver": "0",
        "paymentdate": "27/07/2020",
        "reference": "0",
        "saldo": "-4.76",
        "taplajikd": "147",
        "tstamp": "2020-07-27 15:17:20",
        "valuedate": "27/07/2020",
        "vientiselitekd": "706"
    },
    {
        "accountno": "2",
        "amount": "-19.01",
        "bic_receiver": "OKOYFIHH",
        "bookdate": "04/08/2020",
        "category": "Luottojen_maksut",
        "counterparty_account_id": "196",
        "iban_receiver": "0",
        "paymentdate": "04/08/2020",
        "reference": "0",
        "saldo": "748.52",
        "taplajikd": "129",
        "tstamp": "2020-08-04 4:18:28",
        "valuedate": "04/08/2020",
        "vientiselitekd": "706"
    },
    {
        "accountno": "2",
        "amount": "-16.23",
        "bic_receiver": "OKOYFIHH",
        "bookdate": "17/08/2020",
        "category": "Luottojen_maksut",
        "counterparty_account_id": "14",
        "iban_receiver": "0",
        "paymentdate": "17/08/2020",
        "reference": "1",
        "saldo": "331.6",
        "taplajikd": "106",
        "tstamp": "2020-08-17 10:15:23",
        "valuedate": "17/08/2020",
        "vientiselitekd": "0"
    },
    {
        "accountno": "2",
        "amount": "-676.01",
        "bic_receiver": "",
        "bookdate": "03/09/2020",
        "category": "Luottojen_maksut",
        "counterparty_account_id": "158",
        "iban_receiver": "1",
        "paymentdate": "03/09/2020",
        "reference": "1",
        "saldo": "3303.78",
        "taplajikd": "172",
        "tstamp": "2020-09-03 5:20:00",
        "valuedate": "03/09/2020",
        "vientiselitekd": "0"
    },
    {
        "accountno": "2",
        "amount": "-1002.27",
        "bic_receiver": "",
        "bookdate": "03/09/2020",
        "category": "Luottojen_maksut",
        "counterparty_account_id": "157",
        "iban_receiver": "1",
        "paymentdate": "03/09/2020",
        "reference": "1",
        "saldo": "3779.05",
        "taplajikd": "172",
        "tstamp": "2020-09-03 23:06:40",
        "valuedate": "03/09/2020",
        "vientiselitekd": "0"
    },
    {
        "accountno": "2",
        "amount": "-8.66",
        "bic_receiver": "",
        "bookdate": "08/09/2020",
        "category": "Luottojen_maksut",
        "counterparty_account_id": "70",
        "iban_receiver": "1",
        "paymentdate": "08/09/2020",
        "reference": "1",
        "saldo": "4603.43",
        "taplajikd": "162",
        "tstamp": "2020-09-08 4:26:40",
        "valuedate": "08/09/2020",
        "vientiselitekd": "0"
    },
    {
        "accountno": "2",
        "amount": "-274.68",
        "bic_receiver": "",
        "bookdate": "05/10/2020",
        "category": "Luottojen_maksut",
        "counterparty_account_id": "157",
        "iban_receiver": "1",
        "paymentdate": "05/10/2020",
        "reference": "1",
        "saldo": "2640.96",
        "taplajikd": "172",
        "tstamp": "2020-10-05 4:52:53",
        "valuedate": "05/10/2020",
        "vientiselitekd": "0"
    },
    {
        "accountno": "2",
        "amount": "-385.76",
        "bic_receiver": "",
        "bookdate": "07/10/2020",
        "category": "Luottojen_maksut",
        "counterparty_account_id": "157",
        "iban_receiver": "1",
        "paymentdate": "06/10/2020",
        "reference": "1",
        "saldo": "2255.2",
        "taplajikd": "172",
        "tstamp": "2020-10-06 7:19:19",
        "valuedate": "06/10/2020",
        "vientiselitekd": "0"
    },
    {
        "accountno": "2",
        "amount": "-283.18",
        "bic_receiver": "",
        "bookdate": "08/10/2020",
        "category": "Luottojen_maksut",
        "counterparty_account_id": "157",
        "iban_receiver": "1",
        "paymentdate": "08/10/2020",
        "reference": "1",
        "saldo": "3876.59",
        "taplajikd": "172",
        "tstamp": "2020-10-08 8:32:33",
        "valuedate": "08/10/2020",
        "vientiselitekd": "0"
    },
    {
        "accountno": "2",
        "amount": "-825.53",
        "bic_receiver": "",
        "bookdate": "09/11/2020",
        "category": "Luottojen_maksut",
        "counterparty_account_id": "157",
        "iban_receiver": "1",
        "paymentdate": "09/11/2020",
        "reference": "1",
        "saldo": "3331.38",
        "taplajikd": "172",
        "tstamp": "2020-11-09 15:16:22",
        "valuedate": "09/11/2020",
        "vientiselitekd": "0"
    },
    {
        "accountno": "2",
        "amount": "-204.62",
        "bic_receiver": "",
        "bookdate": "09/11/2020",
        "category": "Luottojen_maksut",
        "counterparty_account_id": "158",
        "iban_receiver": "1",
        "paymentdate": "09/11/2020",
        "reference": "1",
        "saldo": "3126.76",
        "taplajikd": "172",
        "tstamp": "2020-11-09 17:27:16",
        "valuedate": "09/11/2020",
        "vientiselitekd": "0"
    },
    {
        "accountno": "2",
        "amount": "-31.54",
        "bic_receiver": "",
        "bookdate": "02/12/2020",
        "category": "Luottojen_maksut",
        "counterparty_account_id": "109",
        "iban_receiver": "1",
        "paymentdate": "02/12/2020",
        "reference": "1",
        "saldo": "7779.64",
        "taplajikd": "162",
        "tstamp": "2020-12-02 23:23:19",
        "valuedate": "02/12/2020",
        "vientiselitekd": "0"
    },
    {
        "accountno": "2",
        "amount": "-32.86",
        "bic_receiver": "",
        "bookdate": "04/12/2020",
        "category": "Luottojen_maksut",
        "counterparty_account_id": "146",
        "iban_receiver": "1",
        "paymentdate": "04/12/2020",
        "reference": "1",
        "saldo": "7319.89",
        "taplajikd": "162",
        "tstamp": "2020-12-04 22:46:37",
        "valuedate": "04/12/2020",
        "vientiselitekd": "0"
    },
    {
        "accountno": "3",
        "amount": "-148.35",
        "bic_receiver": "DABAFIHH",
        "bookdate": "13/02/2019",
        "category": "Luottojen_maksut",
        "counterparty_account_id": "204",
        "iban_receiver": "0",
        "paymentdate": "13/02/2019",
        "reference": "0",
        "saldo": "43851.82",
        "taplajikd": "106",
        "tstamp": "2019-02-13 14:04:08",
        "valuedate": "13/02/2019",
        "vientiselitekd": "706"
    },
    {
        "accountno": "3",
        "amount": "-32.7",
        "bic_receiver": "",
        "bookdate": "23/05/2019",
        "category": "Luottojen_maksut",
        "counterparty_account_id": "118",
        "iban_receiver": "1",
        "paymentdate": "23/05/2019",
        "reference": "1",
        "saldo": "66555.04",
        "taplajikd": "162",
        "tstamp": "2019-05-23 7:40:48",
        "valuedate": "23/05/2019",
        "vientiselitekd": "0"
    },
    {
        "accountno": "3",
        "amount": "-787.37",
        "bic_receiver": "DABAFIHH",
        "bookdate": "14/06/2019",
        "category": "Luottojen_maksut",
        "counterparty_account_id": "212",
        "iban_receiver": "0",
        "paymentdate": "14/06/2019",
        "reference": "0",
        "saldo": "69565.38",
        "taplajikd": "129",
        "tstamp": "2019-06-14 15:43:27",
        "valuedate": "14/06/2019",
        "vientiselitekd": "706"
    },
    {
        "accountno": "3",
        "amount": "-110.36",
        "bic_receiver": "OKOYFIHH",
        "bookdate": "17/06/2019",
        "category": "Luottojen_maksut",
        "counterparty_account_id": "20",
        "iban_receiver": "0",
        "paymentdate": "17/06/2019",
        "reference": "0",
        "saldo": "68976.91",
        "taplajikd": "106",
        "tstamp": "2019-06-17 19:02:04",
        "valuedate": "17/06/2019",
        "vientiselitekd": "0"
    },
    {
        "accountno": "3",
        "amount": "-265.65",
        "bic_receiver": "OKOYFIHH",
        "bookdate": "05/09/2019",
        "category": "Luottojen_maksut",
        "counterparty_account_id": "24",
        "iban_receiver": "0",
        "paymentdate": "05/09/2019",
        "reference": "0",
        "saldo": "71041.88",
        "taplajikd": "106",
        "tstamp": "2019-09-05 21:14:45",
        "valuedate": "05/09/2019",
        "vientiselitekd": "0"
    },
    {
        "accountno": "3",
        "amount": "-58.53",
        "bic_receiver": "OKOYFIHH",
        "bookdate": "22/11/2019",
        "category": "Luottojen_maksut",
        "counterparty_account_id": "17",
        "iban_receiver": "0",
        "paymentdate": "22/11/2019",
        "reference": "0",
        "saldo": "25282.35",
        "taplajikd": "106",
        "tstamp": "2019-11-22 13:56:08",
        "valuedate": "22/11/2019",
        "vientiselitekd": "0"
    },
    {
        "accountno": "3",
        "amount": "-304.43",
        "bic_receiver": "SBANFIHH",
        "bookdate": "25/11/2019",
        "category": "Luottojen_maksut",
        "counterparty_account_id": "216",
        "iban_receiver": "0",
        "paymentdate": "25/11/2019",
        "reference": "0",
        "saldo": "24913.34",
        "taplajikd": "129",
        "tstamp": "2019-11-25 5:25:10",
        "valuedate": "25/11/2019",
        "vientiselitekd": "706"
    },
    {
        "accountno": "3",
        "amount": "-11.69",
        "bic_receiver": "DABAFIHH",
        "bookdate": "24/12/2019",
        "category": "Luottojen_maksut",
        "counterparty_account_id": "213",
        "iban_receiver": "0",
        "paymentdate": "24/12/2019",
        "reference": "0",
        "saldo": "29125.28",
        "taplajikd": "129",
        "tstamp": "2019-12-24 8:41:44",
        "valuedate": "24/12/2019",
        "vientiselitekd": "706"
    },
    {
        "accountno": "3",
        "amount": "-34.77",
        "bic_receiver": "OKOYFIHH",
        "bookdate": "20/01/2020",
        "category": "Luottojen_maksut",
        "counterparty_account_id": "18",
        "iban_receiver": "0",
        "paymentdate": "20/01/2020",
        "reference": "0",
        "saldo": "28190.64",
        "taplajikd": "106",
        "tstamp": "2020-01-20 10:49:25",
        "valuedate": "20/01/2020",
        "vientiselitekd": "0"
    },
    {
        "accountno": "3",
        "amount": "-25.48",
        "bic_receiver": "",
        "bookdate": "08/05/2020",
        "category": "Luottojen_maksut",
        "counterparty_account_id": "113",
        "iban_receiver": "1",
        "paymentdate": "08/05/2020",
        "reference": "1",
        "saldo": "27749.96",
        "taplajikd": "162",
        "tstamp": "2020-05-08 20:34:17",
        "valuedate": "08/05/2020",
        "vientiselitekd": "0"
    },
    {
        "accountno": "3",
        "amount": "-59.25",
        "bic_receiver": "",
        "bookdate": "23/06/2020",
        "category": "Luottojen_maksut",
        "counterparty_account_id": "81",
        "iban_receiver": "1",
        "paymentdate": "23/06/2020",
        "reference": "1",
        "saldo": "22385.4",
        "taplajikd": "162",
        "tstamp": "2020-06-23 22:21:59",
        "valuedate": "23/06/2020",
        "vientiselitekd": "0"
    },
    {
        "accountno": "3",
        "amount": "-42.04",
        "bic_receiver": "OKOYFIHH",
        "bookdate": "28/06/2020",
        "category": "Luottojen_maksut",
        "counterparty_account_id": "37",
        "iban_receiver": "0",
        "paymentdate": "28/06/2020",
        "reference": "0",
        "saldo": "21649.64",
        "taplajikd": "106",
        "tstamp": "2020-06-28 22:59:41",
        "valuedate": "28/06/2020",
        "vientiselitekd": "0"
    },
    {
        "accountno": "3",
        "amount": "-511.96",
        "bic_receiver": "",
        "bookdate": "31/07/2020",
        "category": "Luottojen_maksut",
        "counterparty_account_id": "182",
        "iban_receiver": "1",
        "paymentdate": "31/07/2020",
        "reference": "1",
        "saldo": "24208.5",
        "taplajikd": "172",
        "tstamp": "2020-07-31 12:03:51",
        "valuedate": "31/07/2020",
        "vientiselitekd": "0"
    },
    {
        "accountno": "3",
        "amount": "-583.6",
        "bic_receiver": "",
        "bookdate": "31/07/2020",
        "category": "Luottojen_maksut",
        "counterparty_account_id": "181",
        "iban_receiver": "1",
        "paymentdate": "31/07/2020",
        "reference": "1",
        "saldo": "23624.9",
        "taplajikd": "172",
        "tstamp": "2020-07-31 20:01:17",
        "valuedate": "31/07/2020",
        "vientiselitekd": "0"
    },
    {
        "accountno": "3",
        "amount": "-70.93",
        "bic_receiver": "",
        "bookdate": "17/08/2020",
        "category": "Luottojen_maksut",
        "counterparty_account_id": "181",
        "iban_receiver": "1",
        "paymentdate": "17/08/2020",
        "reference": "1",
        "saldo": "29211.8",
        "taplajikd": "172",
        "tstamp": "2020-08-17 9:06:59",
        "valuedate": "17/08/2020",
        "vientiselitekd": "0"
    },
    {
        "accountno": "3",
        "amount": "-113.19",
        "bic_receiver": "",
        "bookdate": "17/08/2020",
        "category": "Luottojen_maksut",
        "counterparty_account_id": "181",
        "iban_receiver": "1",
        "paymentdate": "17/08/2020",
        "reference": "1",
        "saldo": "32479.45",
        "taplajikd": "172",
        "tstamp": "2020-08-17 21:34:53",
        "valuedate": "17/08/2020",
        "vientiselitekd": "0"
    },
    {
        "accountno": "3",
        "amount": "-534.56",
        "bic_receiver": "",
        "bookdate": "01/09/2020",
        "category": "Luottojen_maksut",
        "counterparty_account_id": "181",
        "iban_receiver": "1",
        "paymentdate": "01/09/2020",
        "reference": "1",
        "saldo": "41072.59",
        "taplajikd": "172",
        "tstamp": "2020-09-01 21:01:19",
        "valuedate": "01/09/2020",
        "vientiselitekd": "0"
    },
    {
        "accountno": "3",
        "amount": "-142.26",
        "bic_receiver": "",
        "bookdate": "04/09/2020",
        "category": "Luottojen_maksut",
        "counterparty_account_id": "181",
        "iban_receiver": "1",
        "paymentdate": "02/09/2020",
        "reference": "1",
        "saldo": "40930.33",
        "taplajikd": "172",
        "tstamp": "2020-09-02 7:31:58",
        "valuedate": "02/09/2020",
        "vientiselitekd": "0"
    },
    {
        "accountno": "3",
        "amount": "-74.21",
        "bic_receiver": "OKOYFIHH",
        "bookdate": "19/10/2020",
        "category": "Luottojen_maksut",
        "counterparty_account_id": "214",
        "iban_receiver": "0",
        "paymentdate": "19/10/2020",
        "reference": "0",
        "saldo": "18384.27",
        "taplajikd": "129",
        "tstamp": "2020-10-19 20:32:56",
        "valuedate": "19/10/2020",
        "vientiselitekd": "706"
    },
    {
        "accountno": "3",
        "amount": "-29.99",
        "bic_receiver": "OKOYFIHH",
        "bookdate": "26/10/2020",
        "category": "Luottojen_maksut",
        "counterparty_account_id": "8",
        "iban_receiver": "0",
        "paymentdate": "26/10/2020",
        "reference": "1",
        "saldo": "16289.61",
        "taplajikd": "106",
        "tstamp": "2020-10-26 22:25:53",
        "valuedate": "26/10/2020",
        "vientiselitekd": "0"
    },
    {
        "accountno": "3",
        "amount": "-13.79",
        "bic_receiver": "OKOYFIHH",
        "bookdate": "06/11/2020",
        "category": "Luottojen_maksut",
        "counterparty_account_id": "8",
        "iban_receiver": "0",
        "paymentdate": "06/11/2020",
        "reference": "0",
        "saldo": "21376.29",
        "taplajikd": "106",
        "tstamp": "2020-11-06 13:46:14",
        "valuedate": "06/11/2020",
        "vientiselitekd": "0"
    },
    {
        "accountno": "3",
        "amount": "-607.85",
        "bic_receiver": "OKOYFIHH",
        "bookdate": "30/11/2020",
        "category": "Luottojen_maksut",
        "counterparty_account_id": "18",
        "iban_receiver": "0",
        "paymentdate": "30/11/2020",
        "reference": "0",
        "saldo": "22401.79",
        "taplajikd": "106",
        "tstamp": "2020-11-30 20:27:32",
        "valuedate": "30/11/2020",
        "vientiselitekd": "0"
    },
    {
        "accountno": "3",
        "amount": "-19.33",
        "bic_receiver": "",
        "bookdate": "11/12/2020",
        "category": "Luottojen_maksut",
        "counterparty_account_id": "71",
        "iban_receiver": "1",
        "paymentdate": "11/12/2020",
        "reference": "1",
        "saldo": "24316.73",
        "taplajikd": "162",
        "tstamp": "2020-12-11 9:32:25",
        "valuedate": "11/12/2020",
        "vientiselitekd": "0"
    },
    {
        "accountno": "3",
        "amount": "-53.44",
        "bic_receiver": "OKOYFIHH",
        "bookdate": "18/12/2020",
        "category": "Luottojen_maksut",
        "counterparty_account_id": "11",
        "iban_receiver": "0",
        "paymentdate": "18/12/2020",
        "reference": "0",
        "saldo": "23717.03",
        "taplajikd": "106",
        "tstamp": "2020-12-18 7:54:02",
        "valuedate": "18/12/2020",
        "vientiselitekd": "0"
    },
    {
        "accountno": "1",
        "amount": "-15.64",
        "bic_receiver": "NDEAFIHH",
        "bookdate": "11/01/2019",
        "category": "Matkailu",
        "counterparty_account_id": "202",
        "iban_receiver": "0",
        "paymentdate": "11/01/2019",
        "reference": "0",
        "saldo": "85.11",
        "taplajikd": "129",
        "tstamp": "2019-01-11 10:19:04",
        "valuedate": "11/01/2019",
        "vientiselitekd": "706"
    },
    {
        "accountno": "1",
        "amount": "-7.57",
        "bic_receiver": "NDEAFIHH",
        "bookdate": "16/01/2019",
        "category": "Matkailu",
        "counterparty_account_id": "200",
        "iban_receiver": "0",
        "paymentdate": "16/01/2019",
        "reference": "0",
        "saldo": "-144.72",
        "taplajikd": "129",
        "tstamp": "2019-01-16 1:34:12",
        "valuedate": "16/01/2019",
        "vientiselitekd": "706"
    },
    {
        "accountno": "1",
        "amount": "-9.84",
        "bic_receiver": "",
        "bookdate": "24/01/2019",
        "category": "Matkailu",
        "counterparty_account_id": "167",
        "iban_receiver": "1",
        "paymentdate": "22/01/2019",
        "reference": "1",
        "saldo": "-147.96",
        "taplajikd": "163",
        "tstamp": "2019-01-22 0:26:55",
        "valuedate": "22/01/2019",
        "vientiselitekd": "0"
    },
    {
        "accountno": "1",
        "amount": "-0.45",
        "bic_receiver": "",
        "bookdate": "28/01/2019",
        "category": "Matkailu",
        "counterparty_account_id": "114",
        "iban_receiver": "1",
        "paymentdate": "28/01/2019",
        "reference": "1",
        "saldo": "-79.41",
        "taplajikd": "162",
        "tstamp": "2019-01-28 19:30:50",
        "valuedate": "28/01/2019",
        "vientiselitekd": "0"
    },
    {
        "accountno": "1",
        "amount": "-2.62",
        "bic_receiver": "",
        "bookdate": "18/04/2019",
        "category": "Matkailu",
        "counterparty_account_id": "4",
        "iban_receiver": "1",
        "paymentdate": "18/04/2019",
        "reference": "0",
        "saldo": "-132.17",
        "taplajikd": "103",
        "tstamp": "2019-04-18 11:25:03",
        "valuedate": "18/04/2019",
        "vientiselitekd": "0"
    },
    {
        "accountno": "1",
        "amount": "-10.5",
        "bic_receiver": "",
        "bookdate": "23/04/2019",
        "category": "Matkailu",
        "counterparty_account_id": "137",
        "iban_receiver": "1",
        "paymentdate": "23/04/2019",
        "reference": "1",
        "saldo": "-111.73",
        "taplajikd": "162",
        "tstamp": "2019-04-23 23:18:03",
        "valuedate": "23/04/2019",
        "vientiselitekd": "0"
    },
    {
        "accountno": "1",
        "amount": "-17.84",
        "bic_receiver": "",
        "bookdate": "17/07/2019",
        "category": "Matkailu",
        "counterparty_account_id": "64",
        "iban_receiver": "1",
        "paymentdate": "17/07/2019",
        "reference": "1",
        "saldo": "-190.32",
        "taplajikd": "162",
        "tstamp": "2019-07-17 7:34:44",
        "valuedate": "17/07/2019",
        "vientiselitekd": "0"
    },
    {
        "accountno": "1",
        "amount": "-15.03",
        "bic_receiver": "",
        "bookdate": "28/10/2019",
        "category": "Matkailu",
        "counterparty_account_id": "101",
        "iban_receiver": "1",
        "paymentdate": "28/10/2019",
        "reference": "1",
        "saldo": "-312.12",
        "taplajikd": "162",
        "tstamp": "2019-10-28 13:39:42",
        "valuedate": "28/10/2019",
        "vientiselitekd": "0"
    },
    {
        "accountno": "1",
        "amount": "-17.37",
        "bic_receiver": "NDEAFIHH",
        "bookdate": "06/11/2019",
        "category": "Matkailu",
        "counterparty_account_id": "12",
        "iban_receiver": "0",
        "paymentdate": "04/11/2019",
        "reference": "0",
        "saldo": "-445",
        "taplajikd": "106",
        "tstamp": "2019-11-04 20:28:37",
        "valuedate": "04/11/2019",
        "vientiselitekd": "0"
    },
    {
        "accountno": "1",
        "amount": "-89.22",
        "bic_receiver": "DABAFIHH",
        "bookdate": "10/11/2019",
        "category": "Matkailu",
        "counterparty_account_id": "15",
        "iban_receiver": "0",
        "paymentdate": "10/11/2019",
        "reference": "0",
        "saldo": "-706.08",
        "taplajikd": "106",
        "tstamp": "2019-11-10 19:22:34",
        "valuedate": "10/11/2019",
        "vientiselitekd": "0"
    },
    {
        "accountno": "1",
        "amount": "-0.2",
        "bic_receiver": "",
        "bookdate": "29/11/2019",
        "category": "Matkailu",
        "counterparty_account_id": "65",
        "iban_receiver": "1",
        "paymentdate": "29/11/2019",
        "reference": "1",
        "saldo": "-375.33",
        "taplajikd": "162",
        "tstamp": "2019-11-29 1:45:41",
        "valuedate": "29/11/2019",
        "vientiselitekd": "0"
    },
    {
        "accountno": "1",
        "amount": "-17.61",
        "bic_receiver": "NDEAFIHH",
        "bookdate": "05/12/2019",
        "category": "Matkailu",
        "counterparty_account_id": "21",
        "iban_receiver": "0",
        "paymentdate": "04/12/2019",
        "reference": "0",
        "saldo": "-509.89",
        "taplajikd": "106",
        "tstamp": "2019-12-05 14:13:20",
        "valuedate": "05/12/2019",
        "vientiselitekd": "0"
    },
    {
        "accountno": "1",
        "amount": "-231.83",
        "bic_receiver": "OKOYFIHH",
        "bookdate": "07/12/2019",
        "category": "Matkailu",
        "counterparty_account_id": "31",
        "iban_receiver": "0",
        "paymentdate": "07/12/2019",
        "reference": "1",
        "saldo": "-766.71",
        "taplajikd": "106",
        "tstamp": "2019-12-07 2:57:47",
        "valuedate": "07/12/2019",
        "vientiselitekd": "0"
    },
    {
        "accountno": "1",
        "amount": "-12.74",
        "bic_receiver": "DABAFIHH",
        "bookdate": "13/12/2019",
        "category": "Matkailu",
        "counterparty_account_id": "201",
        "iban_receiver": "0",
        "paymentdate": "13/12/2019",
        "reference": "0",
        "saldo": "-901.07",
        "taplajikd": "129",
        "tstamp": "2019-12-13 11:33:20",
        "valuedate": "13/12/2019",
        "vientiselitekd": "706"
    },
    {
        "accountno": "1",
        "amount": "-4.8",
        "bic_receiver": "",
        "bookdate": "07/10/2020",
        "category": "Matkailu",
        "counterparty_account_id": "133",
        "iban_receiver": "1",
        "paymentdate": "07/10/2020",
        "reference": "1",
        "saldo": "-388.48",
        "taplajikd": "162",
        "tstamp": "2020-10-07 0:12:41",
        "valuedate": "07/10/2020",
        "vientiselitekd": "0"
    },
    {
        "accountno": "1",
        "amount": "-19.86",
        "bic_receiver": "",
        "bookdate": "07/10/2020",
        "category": "Matkailu",
        "counterparty_account_id": "72",
        "iban_receiver": "1",
        "paymentdate": "07/10/2020",
        "reference": "1",
        "saldo": "-408.34",
        "taplajikd": "162",
        "tstamp": "2020-10-07 2:25:54",
        "valuedate": "07/10/2020",
        "vientiselitekd": "0"
    },
    {
        "accountno": "1",
        "amount": "-14.56",
        "bic_receiver": "",
        "bookdate": "11/10/2020",
        "category": "Matkailu",
        "counterparty_account_id": "167",
        "iban_receiver": "1",
        "paymentdate": "11/10/2020",
        "reference": "1",
        "saldo": "-592.7",
        "taplajikd": "163",
        "tstamp": "2020-10-11 2:32:15",
        "valuedate": "11/10/2020",
        "vientiselitekd": "0"
    },
    {
        "accountno": "2",
        "amount": "-76.55",
        "bic_receiver": "SBANFIHH",
        "bookdate": "22/03/2019",
        "category": "Matkailu",
        "counterparty_account_id": "195",
        "iban_receiver": "0",
        "paymentdate": "22/03/2019",
        "reference": "0",
        "saldo": "1729.07",
        "taplajikd": "106",
        "tstamp": "2019-03-22 12:14:42",
        "valuedate": "22/03/2019",
        "vientiselitekd": "706"
    },
    {
        "accountno": "2",
        "amount": "-68.76",
        "bic_receiver": "NDEAFIHH",
        "bookdate": "23/05/2019",
        "category": "Matkailu",
        "counterparty_account_id": "187",
        "iban_receiver": "0",
        "paymentdate": "23/05/2019",
        "reference": "0",
        "saldo": "1193.53",
        "taplajikd": "106",
        "tstamp": "2019-05-23 18:36:44",
        "valuedate": "23/05/2019",
        "vientiselitekd": "706"
    },
    {
        "accountno": "2",
        "amount": "-19.14",
        "bic_receiver": "OKOYFIHH",
        "bookdate": "02/08/2019",
        "category": "Matkailu",
        "counterparty_account_id": "199",
        "iban_receiver": "0",
        "paymentdate": "02/08/2019",
        "reference": "0",
        "saldo": "3923.92",
        "taplajikd": "129",
        "tstamp": "2019-08-02 5:37:18",
        "valuedate": "02/08/2019",
        "vientiselitekd": "706"
    },
    {
        "accountno": "2",
        "amount": "-204.86",
        "bic_receiver": "OKOYFIHH",
        "bookdate": "30/08/2019",
        "category": "Matkailu",
        "counterparty_account_id": "196",
        "iban_receiver": "0",
        "paymentdate": "30/08/2019",
        "reference": "0",
        "saldo": "3484.03",
        "taplajikd": "129",
        "tstamp": "2019-08-30 3:53:31",
        "valuedate": "30/08/2019",
        "vientiselitekd": "706"
    },
    {
        "accountno": "2",
        "amount": "-6.64",
        "bic_receiver": "",
        "bookdate": "10/09/2019",
        "category": "Matkailu",
        "counterparty_account_id": "108",
        "iban_receiver": "1",
        "paymentdate": "10/09/2019",
        "reference": "1",
        "saldo": "3944.08",
        "taplajikd": "162",
        "tstamp": "2019-09-10 0:59:11",
        "valuedate": "10/09/2019",
        "vientiselitekd": "0"
    },
    {
        "accountno": "2",
        "amount": "-3201.94",
        "bic_receiver": "",
        "bookdate": "14/11/2019",
        "category": "Matkailu",
        "counterparty_account_id": "152",
        "iban_receiver": "1",
        "paymentdate": "14/11/2019",
        "reference": "1",
        "saldo": "312.95",
        "taplajikd": "163",
        "tstamp": "2019-11-14 13:42:51",
        "valuedate": "14/11/2019",
        "vientiselitekd": "0"
    },
    {
        "accountno": "2",
        "amount": "-21.53",
        "bic_receiver": "",
        "bookdate": "25/11/2019",
        "category": "Matkailu",
        "counterparty_account_id": "65",
        "iban_receiver": "1",
        "paymentdate": "25/11/2019",
        "reference": "1",
        "saldo": "385.03",
        "taplajikd": "162",
        "tstamp": "2019-11-25 13:42:51",
        "valuedate": "25/11/2019",
        "vientiselitekd": "0"
    },
    {
        "accountno": "2",
        "amount": "-3.04",
        "bic_receiver": "",
        "bookdate": "23/01/2020",
        "category": "Matkailu",
        "counterparty_account_id": "143",
        "iban_receiver": "1",
        "paymentdate": "23/01/2020",
        "reference": "1",
        "saldo": "37.71",
        "taplajikd": "162",
        "tstamp": "2020-01-23 14:16:52",
        "valuedate": "23/01/2020",
        "vientiselitekd": "0"
    },
    {
        "accountno": "2",
        "amount": "-60.62",
        "bic_receiver": "DABAFIHH",
        "bookdate": "28/01/2020",
        "category": "Matkailu",
        "counterparty_account_id": "187",
        "iban_receiver": "0",
        "paymentdate": "28/01/2020",
        "reference": "1",
        "saldo": "112.78",
        "taplajikd": "106",
        "tstamp": "2020-01-28 16:03:58",
        "valuedate": "28/01/2020",
        "vientiselitekd": "706"
    },
    {
        "accountno": "2",
        "amount": "-1.79",
        "bic_receiver": "",
        "bookdate": "29/01/2020",
        "category": "Matkailu",
        "counterparty_account_id": "129",
        "iban_receiver": "1",
        "paymentdate": "29/01/2020",
        "reference": "1",
        "saldo": "103.38",
        "taplajikd": "162",
        "tstamp": "2020-01-29 16:39:40",
        "valuedate": "29/01/2020",
        "vientiselitekd": "0"
    },
    {
        "accountno": "2",
        "amount": "-47.76",
        "bic_receiver": "DABAFIHH",
        "bookdate": "10/04/2020",
        "category": "Matkailu",
        "counterparty_account_id": "200",
        "iban_receiver": "0",
        "paymentdate": "10/04/2020",
        "reference": "0",
        "saldo": "-18.34",
        "taplajikd": "129",
        "tstamp": "2020-04-10 15:11:24",
        "valuedate": "10/04/2020",
        "vientiselitekd": "706"
    },
    {
        "accountno": "2",
        "amount": "-19.77",
        "bic_receiver": "DABAFIHH",
        "bookdate": "17/04/2020",
        "category": "Matkailu",
        "counterparty_account_id": "188",
        "iban_receiver": "0",
        "paymentdate": "17/04/2020",
        "reference": "0",
        "saldo": "-123.74",
        "taplajikd": "106",
        "tstamp": "2020-04-17 11:14:26",
        "valuedate": "17/04/2020",
        "vientiselitekd": "706"
    },
    {
        "accountno": "2",
        "amount": "-16.65",
        "bic_receiver": "NDEAFIHH",
        "bookdate": "07/05/2020",
        "category": "Matkailu",
        "counterparty_account_id": "199",
        "iban_receiver": "0",
        "paymentdate": "07/05/2020",
        "reference": "0",
        "saldo": "-256.71",
        "taplajikd": "129",
        "tstamp": "2020-05-07 2:42:15",
        "valuedate": "07/05/2020",
        "vientiselitekd": "706"
    },
    {
        "accountno": "2",
        "amount": "-33.53",
        "bic_receiver": "OKOYFIHH",
        "bookdate": "12/08/2020",
        "category": "Matkailu",
        "counterparty_account_id": "209",
        "iban_receiver": "0",
        "paymentdate": "12/08/2020",
        "reference": "0",
        "saldo": "452.44",
        "taplajikd": "147",
        "tstamp": "2020-08-12 3:04:37",
        "valuedate": "12/08/2020",
        "vientiselitekd": "706"
    },
    {
        "accountno": "2",
        "amount": "-17.15",
        "bic_receiver": "OKOYFIHH",
        "bookdate": "14/08/2020",
        "category": "Matkailu",
        "counterparty_account_id": "205",
        "iban_receiver": "0",
        "paymentdate": "14/08/2020",
        "reference": "0",
        "saldo": "395.29",
        "taplajikd": "147",
        "tstamp": "2020-08-14 18:40:00",
        "valuedate": "14/08/2020",
        "vientiselitekd": "706"
    },
    {
        "accountno": "2",
        "amount": "-26.26",
        "bic_receiver": "OKOYFIHH",
        "bookdate": "16/08/2020",
        "category": "Matkailu",
        "counterparty_account_id": "6",
        "iban_receiver": "0",
        "paymentdate": "16/08/2020",
        "reference": "0",
        "saldo": "369.03",
        "taplajikd": "106",
        "tstamp": "2020-08-16 21:32:18",
        "valuedate": "16/08/2020",
        "vientiselitekd": "0"
    },
    {
        "accountno": "2",
        "amount": "-8.77",
        "bic_receiver": "",
        "bookdate": "07/09/2020",
        "category": "Matkailu",
        "counterparty_account_id": "94",
        "iban_receiver": "1",
        "paymentdate": "07/09/2020",
        "reference": "1",
        "saldo": "4643.45",
        "taplajikd": "162",
        "tstamp": "2020-09-07 16:00:00",
        "valuedate": "07/09/2020",
        "vientiselitekd": "0"
    },
    {
        "accountno": "2",
        "amount": "-27.95",
        "bic_receiver": "",
        "bookdate": "04/12/2020",
        "category": "Matkailu",
        "counterparty_account_id": "83",
        "iban_receiver": "1",
        "paymentdate": "04/12/2020",
        "reference": "1",
        "saldo": "7372.97",
        "taplajikd": "162",
        "tstamp": "2020-12-04 13:17:58",
        "valuedate": "04/12/2020",
        "vientiselitekd": "0"
    },
    {
        "accountno": "2",
        "amount": "-16.15",
        "bic_receiver": "OKOYFIHH",
        "bookdate": "15/12/2020",
        "category": "Matkailu",
        "counterparty_account_id": "22",
        "iban_receiver": "0",
        "paymentdate": "15/12/2020",
        "reference": "0",
        "saldo": "4604.75",
        "taplajikd": "106",
        "tstamp": "2020-12-15 14:40:31",
        "valuedate": "15/12/2020",
        "vientiselitekd": "0"
    },
    {
        "accountno": "2",
        "amount": "-197.4",
        "bic_receiver": "",
        "bookdate": "21/12/2020",
        "category": "Matkailu",
        "counterparty_account_id": "154",
        "iban_receiver": "1",
        "paymentdate": "21/12/2020",
        "reference": "1",
        "saldo": "4147.83",
        "taplajikd": "163",
        "tstamp": "2020-12-21 8:24:28",
        "valuedate": "21/12/2020",
        "vientiselitekd": "0"
    },
    {
        "accountno": "2",
        "amount": "-28.02",
        "bic_receiver": "",
        "bookdate": "24/12/2020",
        "category": "Matkailu",
        "counterparty_account_id": "90",
        "iban_receiver": "1",
        "paymentdate": "24/12/2020",
        "reference": "1",
        "saldo": "3886.88",
        "taplajikd": "162",
        "tstamp": "2020-12-24 16:03:03",
        "valuedate": "24/12/2020",
        "vientiselitekd": "0"
    },
    {
        "accountno": "2",
        "amount": "-21.2",
        "bic_receiver": "",
        "bookdate": "28/12/2020",
        "category": "Matkailu",
        "counterparty_account_id": "92",
        "iban_receiver": "1",
        "paymentdate": "28/12/2020",
        "reference": "1",
        "saldo": "4868.99",
        "taplajikd": "162",
        "tstamp": "2020-12-28 15:26:22",
        "valuedate": "28/12/2020",
        "vientiselitekd": "0"
    },
    {
        "accountno": "3",
        "amount": "-73.17",
        "bic_receiver": "",
        "bookdate": "27/02/2019",
        "category": "Matkailu",
        "counterparty_account_id": "173",
        "iban_receiver": "1",
        "paymentdate": "27/02/2019",
        "reference": "1",
        "saldo": "56775.01",
        "taplajikd": "163",
        "tstamp": "2019-02-27 0:49:39",
        "valuedate": "27/02/2019",
        "vientiselitekd": "0"
    },
    {
        "accountno": "3",
        "amount": "-2127.49",
        "bic_receiver": "DABAFIHH",
        "bookdate": "29/05/2019",
        "category": "Matkailu",
        "counterparty_account_id": "213",
        "iban_receiver": "0",
        "paymentdate": "29/05/2019",
        "reference": "0",
        "saldo": "63913.8",
        "taplajikd": "129",
        "tstamp": "2019-05-29 22:24:00",
        "valuedate": "29/05/2019",
        "vientiselitekd": "706"
    },
    {
        "accountno": "3",
        "amount": "-60.54",
        "bic_receiver": "OKOYFIHH",
        "bookdate": "03/06/2019",
        "category": "Matkailu",
        "counterparty_account_id": "211",
        "iban_receiver": "0",
        "paymentdate": "03/06/2019",
        "reference": "1",
        "saldo": "63122.98",
        "taplajikd": "129",
        "tstamp": "2019-06-03 9:55:52",
        "valuedate": "03/06/2019",
        "vientiselitekd": "706"
    },
    {
        "accountno": "3",
        "amount": "-76.38",
        "bic_receiver": "OKOYFIHH",
        "bookdate": "15/06/2019",
        "category": "Matkailu",
        "counterparty_account_id": "16",
        "iban_receiver": "0",
        "paymentdate": "15/06/2019",
        "reference": "0",
        "saldo": "69434.67",
        "taplajikd": "106",
        "tstamp": "2019-06-16 0:00:00",
        "valuedate": "15/06/2019",
        "vientiselitekd": "0"
    },
    {
        "accountno": "3",
        "amount": "-29.44",
        "bic_receiver": "",
        "bookdate": "28/06/2019",
        "category": "Matkailu",
        "counterparty_account_id": "64",
        "iban_receiver": "1",
        "paymentdate": "28/06/2019",
        "reference": "1",
        "saldo": "68918.75",
        "taplajikd": "162",
        "tstamp": "2019-06-28 13:14:29",
        "valuedate": "28/06/2019",
        "vientiselitekd": "0"
    },
    {
        "accountno": "3",
        "amount": "-205.71",
        "bic_receiver": "HANDFIHH",
        "bookdate": "10/09/2019",
        "category": "Matkailu",
        "counterparty_account_id": "8",
        "iban_receiver": "0",
        "paymentdate": "09/09/2019",
        "reference": "0",
        "saldo": "70647.75",
        "taplajikd": "106",
        "tstamp": "2019-09-09 20:51:09",
        "valuedate": "09/09/2019",
        "vientiselitekd": "0"
    },
    {
        "accountno": "3",
        "amount": "-46.36",
        "bic_receiver": "OKOYFIHH",
        "bookdate": "14/09/2019",
        "category": "Matkailu",
        "counterparty_account_id": "15",
        "iban_receiver": "0",
        "paymentdate": "14/09/2019",
        "reference": "0",
        "saldo": "70873.36",
        "taplajikd": "106",
        "tstamp": "2019-09-14 18:05:54",
        "valuedate": "14/09/2019",
        "vientiselitekd": "0"
    },
    {
        "accountno": "3",
        "amount": "-23.23",
        "bic_receiver": "OKOYFIHH",
        "bookdate": "04/11/2019",
        "category": "Matkailu",
        "counterparty_account_id": "211",
        "iban_receiver": "0",
        "paymentdate": "04/11/2019",
        "reference": "0",
        "saldo": "76394.08",
        "taplajikd": "129",
        "tstamp": "2019-11-04 5:25:10",
        "valuedate": "04/11/2019",
        "vientiselitekd": "706"
    },
    {
        "accountno": "3",
        "amount": "-14.75",
        "bic_receiver": "",
        "bookdate": "14/11/2019",
        "category": "Matkailu",
        "counterparty_account_id": "99",
        "iban_receiver": "1",
        "paymentdate": "14/11/2019",
        "reference": "1",
        "saldo": "52406.76",
        "taplajikd": "162",
        "tstamp": "2019-11-14 11:36:46",
        "valuedate": "14/11/2019",
        "vientiselitekd": "0"
    },
    {
        "accountno": "3",
        "amount": "-571.43",
        "bic_receiver": "OKOYFIHH",
        "bookdate": "20/11/2019",
        "category": "Matkailu",
        "counterparty_account_id": "24",
        "iban_receiver": "0",
        "paymentdate": "19/11/2019",
        "reference": "1",
        "saldo": "25571.79",
        "taplajikd": "106",
        "tstamp": "2019-11-19 3:05:48",
        "valuedate": "19/11/2019",
        "vientiselitekd": "0"
    },
    {
        "accountno": "3",
        "amount": "-271.41",
        "bic_receiver": "",
        "bookdate": "20/12/2019",
        "category": "Matkailu",
        "counterparty_account_id": "174",
        "iban_receiver": "1",
        "paymentdate": "19/12/2019",
        "reference": "1",
        "saldo": "29227.05",
        "taplajikd": "163",
        "tstamp": "2019-12-20 18:26:05",
        "valuedate": "20/12/2019",
        "vientiselitekd": "0"
    },
    {
        "accountno": "3",
        "amount": "-38.07",
        "bic_receiver": "",
        "bookdate": "23/12/2019",
        "category": "Matkailu",
        "counterparty_account_id": "135",
        "iban_receiver": "1",
        "paymentdate": "23/12/2019",
        "reference": "1",
        "saldo": "29146.41",
        "taplajikd": "162",
        "tstamp": "2019-12-23 11:07:50",
        "valuedate": "23/12/2019",
        "vientiselitekd": "0"
    },
    {
        "accountno": "3",
        "amount": "-419.1",
        "bic_receiver": "",
        "bookdate": "13/03/2020",
        "category": "Matkailu",
        "counterparty_account_id": "174",
        "iban_receiver": "1",
        "paymentdate": "13/03/2020",
        "reference": "1",
        "saldo": "30306.28",
        "taplajikd": "163",
        "tstamp": "2020-03-13 9:36:00",
        "valuedate": "13/03/2020",
        "vientiselitekd": "0"
    },
    {
        "accountno": "3",
        "amount": "-50.77",
        "bic_receiver": "",
        "bookdate": "29/04/2020",
        "category": "Matkailu",
        "counterparty_account_id": "44",
        "iban_receiver": "1",
        "paymentdate": "29/04/2020",
        "reference": "1",
        "saldo": "32329.46",
        "taplajikd": "162",
        "tstamp": "2020-04-29 7:15:21",
        "valuedate": "29/04/2020",
        "vientiselitekd": "0"
    },
    {
        "accountno": "3",
        "amount": "-16.99",
        "bic_receiver": "",
        "bookdate": "11/05/2020",
        "category": "Matkailu",
        "counterparty_account_id": "146",
        "iban_receiver": "1",
        "paymentdate": "11/05/2020",
        "reference": "1",
        "saldo": "27732.97",
        "taplajikd": "162",
        "tstamp": "2020-05-11 2:56:20",
        "valuedate": "11/05/2020",
        "vientiselitekd": "0"
    },
    {
        "accountno": "3",
        "amount": "-29.59",
        "bic_receiver": "",
        "bookdate": "12/06/2020",
        "category": "Matkailu",
        "counterparty_account_id": "141",
        "iban_receiver": "1",
        "paymentdate": "12/06/2020",
        "reference": "1",
        "saldo": "24622.28",
        "taplajikd": "162",
        "tstamp": "2020-06-12 7:24:49",
        "valuedate": "12/06/2020",
        "vientiselitekd": "0"
    },
    {
        "accountno": "3",
        "amount": "-42.91",
        "bic_receiver": "",
        "bookdate": "06/07/2020",
        "category": "Matkailu",
        "counterparty_account_id": "106",
        "iban_receiver": "1",
        "paymentdate": "06/07/2020",
        "reference": "1",
        "saldo": "20861.78",
        "taplajikd": "162",
        "tstamp": "2020-07-06 7:18:56",
        "valuedate": "06/07/2020",
        "vientiselitekd": "0"
    },
    {
        "accountno": "3",
        "amount": "-19.04",
        "bic_receiver": "",
        "bookdate": "13/07/2020",
        "category": "Matkailu",
        "counterparty_account_id": "43",
        "iban_receiver": "1",
        "paymentdate": "13/07/2020",
        "reference": "1",
        "saldo": "22234.74",
        "taplajikd": "162",
        "tstamp": "2020-07-13 6:17:20",
        "valuedate": "13/07/2020",
        "vientiselitekd": "0"
    },
    {
        "accountno": "3",
        "amount": "-95.9",
        "bic_receiver": "",
        "bookdate": "13/07/2020",
        "category": "Matkailu",
        "counterparty_account_id": "177",
        "iban_receiver": "1",
        "paymentdate": "13/07/2020",
        "reference": "1",
        "saldo": "21591.09",
        "taplajikd": "164",
        "tstamp": "2020-07-13 22:04:30",
        "valuedate": "13/07/2020",
        "vientiselitekd": "0"
    },
    {
        "accountno": "3",
        "amount": "-330.38",
        "bic_receiver": "",
        "bookdate": "14/07/2020",
        "category": "Matkailu",
        "counterparty_account_id": "178",
        "iban_receiver": "1",
        "paymentdate": "14/07/2020",
        "reference": "1",
        "saldo": "21201.13",
        "taplajikd": "164",
        "tstamp": "2020-07-14 22:12:12",
        "valuedate": "14/07/2020",
        "vientiselitekd": "0"
    },
    {
        "accountno": "3",
        "amount": "-219.67",
        "bic_receiver": "",
        "bookdate": "17/07/2020",
        "category": "Matkailu",
        "counterparty_account_id": "178",
        "iban_receiver": "1",
        "paymentdate": "17/07/2020",
        "reference": "1",
        "saldo": "20177.12",
        "taplajikd": "164",
        "tstamp": "2020-07-17 21:49:05",
        "valuedate": "17/07/2020",
        "vientiselitekd": "0"
    },
    {
        "accountno": "3",
        "amount": "-101.94",
        "bic_receiver": "",
        "bookdate": "20/07/2020",
        "category": "Matkailu",
        "counterparty_account_id": "139",
        "iban_receiver": "1",
        "paymentdate": "20/07/2020",
        "reference": "1",
        "saldo": "20075.18",
        "taplajikd": "162",
        "tstamp": "2020-07-20 5:31:07",
        "valuedate": "20/07/2020",
        "vientiselitekd": "0"
    },
    {
        "accountno": "3",
        "amount": "-486.38",
        "bic_receiver": "OKOYFIHH",
        "bookdate": "17/08/2020",
        "category": "Matkailu",
        "counterparty_account_id": "16",
        "iban_receiver": "0",
        "paymentdate": "17/08/2020",
        "reference": "1",
        "saldo": "29282.73",
        "taplajikd": "106",
        "tstamp": "2020-08-17 8:11:10",
        "valuedate": "17/08/2020",
        "vientiselitekd": "0"
    },
    {
        "accountno": "3",
        "amount": "-116.27",
        "bic_receiver": "OKOYFIHH",
        "bookdate": "23/08/2020",
        "category": "Matkailu",
        "counterparty_account_id": "36",
        "iban_receiver": "0",
        "paymentdate": "23/08/2020",
        "reference": "0",
        "saldo": "35718.23",
        "taplajikd": "106",
        "tstamp": "2020-08-23 16:00:00",
        "valuedate": "23/08/2020",
        "vientiselitekd": "0"
    },
    {
        "accountno": "3",
        "amount": "-13.21",
        "bic_receiver": "",
        "bookdate": "27/08/2020",
        "category": "Matkailu",
        "counterparty_account_id": "59",
        "iban_receiver": "1",
        "paymentdate": "27/08/2020",
        "reference": "1",
        "saldo": "40764.01",
        "taplajikd": "162",
        "tstamp": "2020-08-27 9:29:18",
        "valuedate": "27/08/2020",
        "vientiselitekd": "0"
    },
    {
        "accountno": "3",
        "amount": "-549.04",
        "bic_receiver": "OKOYFIHH",
        "bookdate": "31/08/2020",
        "category": "Matkailu",
        "counterparty_account_id": "30",
        "iban_receiver": "0",
        "paymentdate": "30/08/2020",
        "reference": "0",
        "saldo": "41288.34",
        "taplajikd": "106",
        "tstamp": "2020-08-30 7:37:40",
        "valuedate": "30/08/2020",
        "vientiselitekd": "0"
    },
    {
        "accountno": "3",
        "amount": "-225.53",
        "bic_receiver": "OKOYFIHH",
        "bookdate": "08/09/2020",
        "category": "Matkailu",
        "counterparty_account_id": "8",
        "iban_receiver": "0",
        "paymentdate": "06/09/2020",
        "reference": "0",
        "saldo": "41120.45",
        "taplajikd": "106",
        "tstamp": "2020-09-06 6:07:53",
        "valuedate": "06/09/2020",
        "vientiselitekd": "0"
    },
    {
        "accountno": "3",
        "amount": "-49.45",
        "bic_receiver": "",
        "bookdate": "08/09/2020",
        "category": "Matkailu",
        "counterparty_account_id": "117",
        "iban_receiver": "1",
        "paymentdate": "08/09/2020",
        "reference": "1",
        "saldo": "44731.49",
        "taplajikd": "162",
        "tstamp": "2020-09-08 10:41:10",
        "valuedate": "08/09/2020",
        "vientiselitekd": "0"
    },
    {
        "accountno": "3",
        "amount": "-34.87",
        "bic_receiver": "OKOYFIHH",
        "bookdate": "11/09/2020",
        "category": "Matkailu",
        "counterparty_account_id": "11",
        "iban_receiver": "0",
        "paymentdate": "11/09/2020",
        "reference": "0",
        "saldo": "45744.45",
        "taplajikd": "106",
        "tstamp": "2020-09-11 19:47:44",
        "valuedate": "11/09/2020",
        "vientiselitekd": "0"
    },
    {
        "accountno": "3",
        "amount": "-528.63",
        "bic_receiver": "DABAFIHH",
        "bookdate": "12/09/2020",
        "category": "Matkailu",
        "counterparty_account_id": "39",
        "iban_receiver": "0",
        "paymentdate": "12/09/2020",
        "reference": "0",
        "saldo": "45215.82",
        "taplajikd": "106",
        "tstamp": "2020-09-12 9:17:05",
        "valuedate": "12/09/2020",
        "vientiselitekd": "0"
    },
    {
        "accountno": "3",
        "amount": "-433.03",
        "bic_receiver": "OKOYFIHH",
        "bookdate": "15/09/2020",
        "category": "Matkailu",
        "counterparty_account_id": "4",
        "iban_receiver": "0",
        "paymentdate": "15/09/2020",
        "reference": "1",
        "saldo": "44586.8",
        "taplajikd": "105",
        "tstamp": "2020-09-15 10:51:41",
        "valuedate": "15/09/2020",
        "vientiselitekd": "0"
    },
    {
        "accountno": "3",
        "amount": "-335.4",
        "bic_receiver": "OKOYFIHH",
        "bookdate": "15/09/2020",
        "category": "Matkailu",
        "counterparty_account_id": "2",
        "iban_receiver": "0",
        "paymentdate": "15/09/2020",
        "reference": "1",
        "saldo": "44251.4",
        "taplajikd": "105",
        "tstamp": "2020-09-15 21:22:20",
        "valuedate": "15/09/2020",
        "vientiselitekd": "0"
    },
    {
        "accountno": "3",
        "amount": "-20.7",
        "bic_receiver": "OKOYFIHH",
        "bookdate": "09/10/2020",
        "category": "Matkailu",
        "counterparty_account_id": "212",
        "iban_receiver": "0",
        "paymentdate": "09/10/2020",
        "reference": "0",
        "saldo": "12493.69",
        "taplajikd": "129",
        "tstamp": "2020-10-09 17:24:42",
        "valuedate": "09/10/2020",
        "vientiselitekd": "706"
    },
    {
        "accountno": "3",
        "amount": "-69",
        "bic_receiver": "OKOYFIHH",
        "bookdate": "23/10/2020",
        "category": "Matkailu",
        "counterparty_account_id": "8",
        "iban_receiver": "0",
        "paymentdate": "23/10/2020",
        "reference": "0",
        "saldo": "17048.31",
        "taplajikd": "106",
        "tstamp": "2020-10-23 16:00:00",
        "valuedate": "23/10/2020",
        "vientiselitekd": "0"
    },
    {
        "accountno": "3",
        "amount": "-164.84",
        "bic_receiver": "OKOYFIHH",
        "bookdate": "30/10/2020",
        "category": "Matkailu",
        "counterparty_account_id": "12",
        "iban_receiver": "0",
        "paymentdate": "30/10/2020",
        "reference": "0",
        "saldo": "15536.39",
        "taplajikd": "106",
        "tstamp": "2020-10-30 18:30:35",
        "valuedate": "30/10/2020",
        "vientiselitekd": "0"
    },
    {
        "accountno": "3",
        "amount": "-656.7",
        "bic_receiver": "NDEAFIHH",
        "bookdate": "24/11/2020",
        "category": "Matkailu",
        "counterparty_account_id": "215",
        "iban_receiver": "0",
        "paymentdate": "24/11/2020",
        "reference": "0",
        "saldo": "24366.83",
        "taplajikd": "129",
        "tstamp": "2020-11-24 6:41:19",
        "valuedate": "24/11/2020",
        "vientiselitekd": "706"
    },
    {
        "accountno": "3",
        "amount": "-218.82",
        "bic_receiver": "OKOYFIHH",
        "bookdate": "08/12/2020",
        "category": "Matkailu",
        "counterparty_account_id": "33",
        "iban_receiver": "0",
        "paymentdate": "08/12/2020",
        "reference": "1",
        "saldo": "24691.61",
        "taplajikd": "106",
        "tstamp": "2020-12-08 11:19:45",
        "valuedate": "08/12/2020",
        "vientiselitekd": "0"
    },
    {
        "accountno": "3",
        "amount": "-9.33",
        "bic_receiver": "",
        "bookdate": "14/12/2020",
        "category": "Matkailu",
        "counterparty_account_id": "149",
        "iban_receiver": "1",
        "paymentdate": "14/12/2020",
        "reference": "1",
        "saldo": "24044.58",
        "taplajikd": "162",
        "tstamp": "2020-12-14 11:28:42",
        "valuedate": "14/12/2020",
        "vientiselitekd": "0"
    },
    {
        "accountno": "3",
        "amount": "-14.16",
        "bic_receiver": "",
        "bookdate": "21/12/2020",
        "category": "Matkailu",
        "counterparty_account_id": "116",
        "iban_receiver": "1",
        "paymentdate": "21/12/2020",
        "reference": "1",
        "saldo": "23483",
        "taplajikd": "162",
        "tstamp": "2020-12-21 15:21:15",
        "valuedate": "21/12/2020",
        "vientiselitekd": "0"
    },
    {
        "accountno": "1",
        "amount": "-14.77",
        "bic_receiver": "",
        "bookdate": "07/01/2019",
        "category": "Muut",
        "counterparty_account_id": "49",
        "iban_receiver": "1",
        "paymentdate": "07/01/2019",
        "reference": "1",
        "saldo": "254.16",
        "taplajikd": "162",
        "tstamp": "2019-01-07 19:03:56",
        "valuedate": "07/01/2019",
        "vientiselitekd": "0"
    },
    {
        "accountno": "1",
        "amount": "-13.58",
        "bic_receiver": "",
        "bookdate": "08/01/2019",
        "category": "Muut",
        "counterparty_account_id": "134",
        "iban_receiver": "1",
        "paymentdate": "07/01/2019",
        "reference": "1",
        "saldo": "240.58",
        "taplajikd": "162",
        "tstamp": "2019-01-07 22:52:43",
        "valuedate": "07/01/2019",
        "vientiselitekd": "0"
    },
    {
        "accountno": "1",
        "amount": "-17.52",
        "bic_receiver": "",
        "bookdate": "18/01/2019",
        "category": "Muut",
        "counterparty_account_id": "86",
        "iban_receiver": "1",
        "paymentdate": "18/01/2019",
        "reference": "1",
        "saldo": "-122.84",
        "taplajikd": "162",
        "tstamp": "2019-01-18 23:06:10",
        "valuedate": "18/01/2019",
        "vientiselitekd": "0"
    },
    {
        "accountno": "1",
        "amount": "-0.26",
        "bic_receiver": "",
        "bookdate": "05/02/2019",
        "category": "Muut",
        "counterparty_account_id": "158",
        "iban_receiver": "1",
        "paymentdate": "05/02/2019",
        "reference": "1",
        "saldo": "-338.47",
        "taplajikd": "162",
        "tstamp": "2019-02-05 3:25:43",
        "valuedate": "05/02/2019",
        "vientiselitekd": "0"
    },
    {
        "accountno": "1",
        "amount": "-77.9",
        "bic_receiver": "",
        "bookdate": "13/02/2019",
        "category": "Muut",
        "counterparty_account_id": "167",
        "iban_receiver": "1",
        "paymentdate": "13/02/2019",
        "reference": "1",
        "saldo": "-489.86",
        "taplajikd": "163",
        "tstamp": "2019-02-13 6:51:26",
        "valuedate": "13/02/2019",
        "vientiselitekd": "0"
    },
    {
        "accountno": "1",
        "amount": "-19.75",
        "bic_receiver": "",
        "bookdate": "26/02/2019",
        "category": "Muut",
        "counterparty_account_id": "167",
        "iban_receiver": "1",
        "paymentdate": "26/02/2019",
        "reference": "1",
        "saldo": "-450.41",
        "taplajikd": "163",
        "tstamp": "2019-02-26 3:25:43",
        "valuedate": "26/02/2019",
        "vientiselitekd": "0"
    },
    {
        "accountno": "1",
        "amount": "-35.61",
        "bic_receiver": "",
        "bookdate": "05/03/2019",
        "category": "Muut",
        "counterparty_account_id": "167",
        "iban_receiver": "1",
        "paymentdate": "05/03/2019",
        "reference": "1",
        "saldo": "243.93",
        "taplajikd": "163",
        "tstamp": "2019-03-05 8:25:16",
        "valuedate": "05/03/2019",
        "vientiselitekd": "0"
    },
    {
        "accountno": "1",
        "amount": "-10.33",
        "bic_receiver": "",
        "bookdate": "25/03/2019",
        "category": "Muut",
        "counterparty_account_id": "168",
        "iban_receiver": "1",
        "paymentdate": "22/03/2019",
        "reference": "1",
        "saldo": "-72.3",
        "taplajikd": "163",
        "tstamp": "2019-03-22 18:06:19",
        "valuedate": "22/03/2019",
        "vientiselitekd": "0"
    },
    {
        "accountno": "1",
        "amount": "-2.73",
        "bic_receiver": "NDEAFIHH",
        "bookdate": "25/03/2019",
        "category": "Muut",
        "counterparty_account_id": "189",
        "iban_receiver": "0",
        "paymentdate": "25/03/2019",
        "reference": "0",
        "saldo": "-99.63",
        "taplajikd": "106",
        "tstamp": "2019-03-25 22:18:57",
        "valuedate": "25/03/2019",
        "vientiselitekd": "706"
    },
    {
        "accountno": "1",
        "amount": "-0.8",
        "bic_receiver": "",
        "bookdate": "28/03/2019",
        "category": "Muut",
        "counterparty_account_id": "46",
        "iban_receiver": "1",
        "paymentdate": "28/03/2019",
        "reference": "1",
        "saldo": "-150.74",
        "taplajikd": "162",
        "tstamp": "2019-03-28 6:44:13",
        "valuedate": "28/03/2019",
        "vientiselitekd": "0"
    },
    {
        "accountno": "1",
        "amount": "-7.98",
        "bic_receiver": "",
        "bookdate": "31/03/2019",
        "category": "Muut",
        "counterparty_account_id": "167",
        "iban_receiver": "1",
        "paymentdate": "31/03/2019",
        "reference": "1",
        "saldo": "-160.2",
        "taplajikd": "163",
        "tstamp": "2019-03-31 10:56:51",
        "valuedate": "31/03/2019",
        "vientiselitekd": "0"
    },
    {
        "accountno": "1",
        "amount": "-26.47",
        "bic_receiver": "",
        "bookdate": "30/04/2019",
        "category": "Muut",
        "counterparty_account_id": "170",
        "iban_receiver": "1",
        "paymentdate": "30/04/2019",
        "reference": "1",
        "saldo": "224.87",
        "taplajikd": "163",
        "tstamp": "2019-04-30 3:01:45",
        "valuedate": "26/04/2019",
        "vientiselitekd": "0"
    },
    {
        "accountno": "1",
        "amount": "-231.99",
        "bic_receiver": "OKOYFIHH",
        "bookdate": "03/05/2019",
        "category": "Muut",
        "counterparty_account_id": "5",
        "iban_receiver": "0",
        "paymentdate": "03/05/2019",
        "reference": "1",
        "saldo": "-39.67",
        "taplajikd": "105",
        "tstamp": "2019-05-03 3:20:30",
        "valuedate": "03/05/2019",
        "vientiselitekd": "0"
    },
    {
        "accountno": "1",
        "amount": "-19.2",
        "bic_receiver": "",
        "bookdate": "01/06/2019",
        "category": "Muut",
        "counterparty_account_id": "168",
        "iban_receiver": "1",
        "paymentdate": "01/06/2019",
        "reference": "1",
        "saldo": "-491.17",
        "taplajikd": "163",
        "tstamp": "2019-06-01 4:14:07",
        "valuedate": "01/06/2019",
        "vientiselitekd": "0"
    },
    {
        "accountno": "1",
        "amount": "-8.33",
        "bic_receiver": "OKOYFIHH",
        "bookdate": "02/07/2019",
        "category": "Muut",
        "counterparty_account_id": "5",
        "iban_receiver": "0",
        "paymentdate": "02/07/2019",
        "reference": "1",
        "saldo": "-154.71",
        "taplajikd": "105",
        "tstamp": "2019-07-02 2:06:19",
        "valuedate": "02/07/2019",
        "vientiselitekd": "0"
    },
    {
        "accountno": "1",
        "amount": "-8.17",
        "bic_receiver": "",
        "bookdate": "19/07/2019",
        "category": "Muut",
        "counterparty_account_id": "169",
        "iban_receiver": "1",
        "paymentdate": "19/07/2019",
        "reference": "1",
        "saldo": "-198.49",
        "taplajikd": "163",
        "tstamp": "2019-07-19 9:41:03",
        "valuedate": "19/07/2019",
        "vientiselitekd": "0"
    },
    {
        "accountno": "1",
        "amount": "-8.61",
        "bic_receiver": "",
        "bookdate": "24/07/2019",
        "category": "Muut",
        "counterparty_account_id": "167",
        "iban_receiver": "1",
        "paymentdate": "24/07/2019",
        "reference": "1",
        "saldo": "-260.13",
        "taplajikd": "163",
        "tstamp": "2019-07-24 20:12:38",
        "valuedate": "24/07/2019",
        "vientiselitekd": "0"
    },
    {
        "accountno": "1",
        "amount": "-30.05",
        "bic_receiver": "",
        "bookdate": "19/08/2019",
        "category": "Muut",
        "counterparty_account_id": "65",
        "iban_receiver": "1",
        "paymentdate": "19/08/2019",
        "reference": "1",
        "saldo": "334.28",
        "taplajikd": "162",
        "tstamp": "2019-08-19 11:47:22",
        "valuedate": "19/08/2019",
        "vientiselitekd": "0"
    },
    {
        "accountno": "1",
        "amount": "-113.41",
        "bic_receiver": "OKOYFIHH",
        "bookdate": "23/08/2019",
        "category": "Muut",
        "counterparty_account_id": "6",
        "iban_receiver": "0",
        "paymentdate": "23/08/2019",
        "reference": "1",
        "saldo": "16.42",
        "taplajikd": "105",
        "tstamp": "2019-08-23 22:18:57",
        "valuedate": "23/08/2019",
        "vientiselitekd": "0"
    },
    {
        "accountno": "1",
        "amount": "-6.11",
        "bic_receiver": "",
        "bookdate": "30/08/2019",
        "category": "Muut",
        "counterparty_account_id": "168",
        "iban_receiver": "1",
        "paymentdate": "30/08/2019",
        "reference": "1",
        "saldo": "-14.06",
        "taplajikd": "163",
        "tstamp": "2019-08-30 10:56:51",
        "valuedate": "30/08/2019",
        "vientiselitekd": "0"
    },
    {
        "accountno": "1",
        "amount": "-26.02",
        "bic_receiver": "",
        "bookdate": "03/09/2019",
        "category": "Muut",
        "counterparty_account_id": "167",
        "iban_receiver": "1",
        "paymentdate": "03/09/2019",
        "reference": "1",
        "saldo": "263.26",
        "taplajikd": "163",
        "tstamp": "2019-09-03 22:14:38",
        "valuedate": "03/09/2019",
        "vientiselitekd": "0"
    },
    {
        "accountno": "1",
        "amount": "-316.96",
        "bic_receiver": "OKOYFIHH",
        "bookdate": "16/09/2019",
        "category": "Muut",
        "counterparty_account_id": "206",
        "iban_receiver": "0",
        "paymentdate": "16/09/2019",
        "reference": "0",
        "saldo": "-104.83",
        "taplajikd": "147",
        "tstamp": "2019-09-16 4:05:51",
        "valuedate": "16/09/2019",
        "vientiselitekd": "706"
    },
    {
        "accountno": "1",
        "amount": "-32.33",
        "bic_receiver": "",
        "bookdate": "27/09/2019",
        "category": "Muut",
        "counterparty_account_id": "168",
        "iban_receiver": "1",
        "paymentdate": "27/09/2019",
        "reference": "1",
        "saldo": "-187.7",
        "taplajikd": "163",
        "tstamp": "2019-09-27 8:11:42",
        "valuedate": "27/09/2019",
        "vientiselitekd": "0"
    },
    {
        "accountno": "1",
        "amount": "-23.6",
        "bic_receiver": "",
        "bookdate": "30/09/2019",
        "category": "Muut",
        "counterparty_account_id": "92",
        "iban_receiver": "1",
        "paymentdate": "30/09/2019",
        "reference": "1",
        "saldo": "-214.77",
        "taplajikd": "162",
        "tstamp": "2019-09-30 6:26:20",
        "valuedate": "30/09/2019",
        "vientiselitekd": "0"
    },
    {
        "accountno": "1",
        "amount": "-11.6",
        "bic_receiver": "",
        "bookdate": "05/10/2019",
        "category": "Muut",
        "counterparty_account_id": "169",
        "iban_receiver": "1",
        "paymentdate": "04/10/2019",
        "reference": "1",
        "saldo": "-45.32",
        "taplajikd": "163",
        "tstamp": "2019-10-05 18:27:42",
        "valuedate": "05/10/2019",
        "vientiselitekd": "0"
    },
    {
        "accountno": "1",
        "amount": "-5.73",
        "bic_receiver": "",
        "bookdate": "17/10/2019",
        "category": "Muut",
        "counterparty_account_id": "102",
        "iban_receiver": "1",
        "paymentdate": "17/10/2019",
        "reference": "1",
        "saldo": "-200.97",
        "taplajikd": "162",
        "tstamp": "2019-10-17 5:10:09",
        "valuedate": "17/10/2019",
        "vientiselitekd": "0"
    },
    {
        "accountno": "1",
        "amount": "-4.43",
        "bic_receiver": "",
        "bookdate": "18/10/2019",
        "category": "Muut",
        "counterparty_account_id": "161",
        "iban_receiver": "1",
        "paymentdate": "18/10/2019",
        "reference": "1",
        "saldo": "-205.4",
        "taplajikd": "162",
        "tstamp": "2019-10-18 4:03:42",
        "valuedate": "18/10/2019",
        "vientiselitekd": "0"
    },
    {
        "accountno": "1",
        "amount": "-2.79",
        "bic_receiver": "",
        "bookdate": "21/10/2019",
        "category": "Muut",
        "counterparty_account_id": "99",
        "iban_receiver": "1",
        "paymentdate": "21/10/2019",
        "reference": "1",
        "saldo": "-209.26",
        "taplajikd": "162",
        "tstamp": "2019-10-21 1:50:46",
        "valuedate": "21/10/2019",
        "vientiselitekd": "0"
    },
    {
        "accountno": "1",
        "amount": "-11.07",
        "bic_receiver": "",
        "bookdate": "25/10/2019",
        "category": "Muut",
        "counterparty_account_id": "167",
        "iban_receiver": "1",
        "paymentdate": "25/10/2019",
        "reference": "1",
        "saldo": "-297.09",
        "taplajikd": "163",
        "tstamp": "2019-10-25 20:18:28",
        "valuedate": "25/10/2019",
        "vientiselitekd": "0"
    },
    {
        "accountno": "1",
        "amount": "-37.7",
        "bic_receiver": "NDEAFIHH",
        "bookdate": "05/11/2019",
        "category": "Muut",
        "counterparty_account_id": "13",
        "iban_receiver": "0",
        "paymentdate": "05/11/2019",
        "reference": "0",
        "saldo": "-513.42",
        "taplajikd": "106",
        "tstamp": "2019-11-05 14:31:56",
        "valuedate": "05/11/2019",
        "vientiselitekd": "0"
    },
    {
        "accountno": "1",
        "amount": "-11.22",
        "bic_receiver": "",
        "bookdate": "08/11/2019",
        "category": "Muut",
        "counterparty_account_id": "168",
        "iban_receiver": "1",
        "paymentdate": "08/11/2019",
        "reference": "1",
        "saldo": "-616.86",
        "taplajikd": "163",
        "tstamp": "2019-11-08 16:57:15",
        "valuedate": "08/11/2019",
        "vientiselitekd": "0"
    },
    {
        "accountno": "1",
        "amount": "-40.21",
        "bic_receiver": "",
        "bookdate": "15/11/2019",
        "category": "Muut",
        "counterparty_account_id": "167",
        "iban_receiver": "1",
        "paymentdate": "15/11/2019",
        "reference": "1",
        "saldo": "-822.82",
        "taplajikd": "163",
        "tstamp": "2019-11-15 7:29:10",
        "valuedate": "15/11/2019",
        "vientiselitekd": "0"
    },
    {
        "accountno": "1",
        "amount": "-71.79",
        "bic_receiver": "",
        "bookdate": "16/11/2019",
        "category": "Muut",
        "counterparty_account_id": "167",
        "iban_receiver": "1",
        "paymentdate": "16/11/2019",
        "reference": "1",
        "saldo": "-185.69",
        "taplajikd": "163",
        "tstamp": "2019-11-16 23:07:09",
        "valuedate": "16/11/2019",
        "vientiselitekd": "0"
    },
    {
        "accountno": "1",
        "amount": "-8.32",
        "bic_receiver": "",
        "bookdate": "22/11/2019",
        "category": "Muut",
        "counterparty_account_id": "167",
        "iban_receiver": "1",
        "paymentdate": "22/11/2019",
        "reference": "1",
        "saldo": "-247.02",
        "taplajikd": "163",
        "tstamp": "2019-11-22 8:48:26",
        "valuedate": "22/11/2019",
        "vientiselitekd": "0"
    },
    {
        "accountno": "1",
        "amount": "-25.18",
        "bic_receiver": "OKOYFIHH",
        "bookdate": "25/11/2019",
        "category": "Muut",
        "counterparty_account_id": "30",
        "iban_receiver": "0",
        "paymentdate": "22/11/2019",
        "reference": "0",
        "saldo": "-284.69",
        "taplajikd": "106",
        "tstamp": "2019-11-22 22:01:06",
        "valuedate": "22/11/2019",
        "vientiselitekd": "0"
    },
    {
        "accountno": "1",
        "amount": "-24.62",
        "bic_receiver": "",
        "bookdate": "25/11/2019",
        "category": "Muut",
        "counterparty_account_id": "167",
        "iban_receiver": "1",
        "paymentdate": "25/11/2019",
        "reference": "1",
        "saldo": "-374.24",
        "taplajikd": "163",
        "tstamp": "2019-11-25 16:04:24",
        "valuedate": "25/11/2019",
        "vientiselitekd": "0"
    },
    {
        "accountno": "1",
        "amount": "-21.78",
        "bic_receiver": "",
        "bookdate": "02/12/2019",
        "category": "Muut",
        "counterparty_account_id": "167",
        "iban_receiver": "1",
        "paymentdate": "02/12/2019",
        "reference": "1",
        "saldo": "-414.83",
        "taplajikd": "163",
        "tstamp": "2019-12-02 12:44:27",
        "valuedate": "02/12/2019",
        "vientiselitekd": "0"
    },
    {
        "accountno": "1",
        "amount": "-17.52",
        "bic_receiver": "",
        "bookdate": "03/12/2019",
        "category": "Muut",
        "counterparty_account_id": "167",
        "iban_receiver": "1",
        "paymentdate": "03/12/2019",
        "reference": "1",
        "saldo": "-451.36",
        "taplajikd": "163",
        "tstamp": "2019-12-03 7:06:40",
        "valuedate": "03/12/2019",
        "vientiselitekd": "0"
    },
    {
        "accountno": "1",
        "amount": "-0.16",
        "bic_receiver": "",
        "bookdate": "18/12/2019",
        "category": "Muut",
        "counterparty_account_id": "98",
        "iban_receiver": "1",
        "paymentdate": "18/12/2019",
        "reference": "1",
        "saldo": "-77.81",
        "taplajikd": "162",
        "tstamp": "2019-12-18 14:31:07",
        "valuedate": "18/12/2019",
        "vientiselitekd": "0"
    },
    {
        "accountno": "1",
        "amount": "-0.58",
        "bic_receiver": "",
        "bookdate": "19/12/2019",
        "category": "Muut",
        "counterparty_account_id": "3",
        "iban_receiver": "1",
        "paymentdate": "19/12/2019",
        "reference": "0",
        "saldo": "-78.96",
        "taplajikd": "103",
        "tstamp": "2019-12-19 16:00:00",
        "valuedate": "19/12/2019",
        "vientiselitekd": "0"
    },
    {
        "accountno": "1",
        "amount": "-23.38",
        "bic_receiver": "",
        "bookdate": "01/01/2020",
        "category": "Muut",
        "counterparty_account_id": "167",
        "iban_receiver": "1",
        "paymentdate": "01/01/2020",
        "reference": "1",
        "saldo": "95.4",
        "taplajikd": "163",
        "tstamp": "2020-01-01 18:50:08",
        "valuedate": "01/01/2020",
        "vientiselitekd": "0"
    },
    {
        "accountno": "1",
        "amount": "-36.02",
        "bic_receiver": "",
        "bookdate": "02/01/2020",
        "category": "Muut",
        "counterparty_account_id": "168",
        "iban_receiver": "1",
        "paymentdate": "02/01/2020",
        "reference": "1",
        "saldo": "59.38",
        "taplajikd": "163",
        "tstamp": "2020-01-02 13:40:15",
        "valuedate": "02/01/2020",
        "vientiselitekd": "0"
    },
    {
        "accountno": "1",
        "amount": "-16.59",
        "bic_receiver": "",
        "bookdate": "06/01/2020",
        "category": "Muut",
        "counterparty_account_id": "167",
        "iban_receiver": "1",
        "paymentdate": "06/01/2020",
        "reference": "1",
        "saldo": "23.02",
        "taplajikd": "163",
        "tstamp": "2020-01-06 11:50:53",
        "valuedate": "06/01/2020",
        "vientiselitekd": "0"
    },
    {
        "accountno": "1",
        "amount": "-62.68",
        "bic_receiver": "",
        "bookdate": "07/01/2020",
        "category": "Muut",
        "counterparty_account_id": "171",
        "iban_receiver": "1",
        "paymentdate": "07/01/2020",
        "reference": "1",
        "saldo": "-51.56",
        "taplajikd": "163",
        "tstamp": "2020-01-07 6:41:01",
        "valuedate": "07/01/2020",
        "vientiselitekd": "0"
    },
    {
        "accountno": "1",
        "amount": "-48.01",
        "bic_receiver": "",
        "bookdate": "14/01/2020",
        "category": "Muut",
        "counterparty_account_id": "168",
        "iban_receiver": "1",
        "paymentdate": "14/01/2020",
        "reference": "1",
        "saldo": "-50.93",
        "taplajikd": "163",
        "tstamp": "2020-01-14 8:12:09",
        "valuedate": "14/01/2020",
        "vientiselitekd": "0"
    },
    {
        "accountno": "1",
        "amount": "-10.66",
        "bic_receiver": "",
        "bookdate": "16/01/2020",
        "category": "Muut",
        "counterparty_account_id": "168",
        "iban_receiver": "1",
        "paymentdate": "16/01/2020",
        "reference": "1",
        "saldo": "-64.38",
        "taplajikd": "163",
        "tstamp": "2020-01-16 16:42:32",
        "valuedate": "16/01/2020",
        "vientiselitekd": "0"
    },
    {
        "accountno": "1",
        "amount": "-144.15",
        "bic_receiver": "OKOYFIHH",
        "bookdate": "09/03/2020",
        "category": "Muut",
        "counterparty_account_id": "206",
        "iban_receiver": "0",
        "paymentdate": "09/03/2020",
        "reference": "0",
        "saldo": "155.14",
        "taplajikd": "147",
        "tstamp": "2020-03-09 20:34:17",
        "valuedate": "09/03/2020",
        "vientiselitekd": "706"
    },
    {
        "accountno": "1",
        "amount": "-11.34",
        "bic_receiver": "OKOYFIHH",
        "bookdate": "11/03/2020",
        "category": "Muut",
        "counterparty_account_id": "209",
        "iban_receiver": "0",
        "paymentdate": "11/03/2020",
        "reference": "0",
        "saldo": "143.8",
        "taplajikd": "147",
        "tstamp": "2020-03-11 19:25:43",
        "valuedate": "11/03/2020",
        "vientiselitekd": "706"
    },
    {
        "accountno": "1",
        "amount": "-43.09",
        "bic_receiver": "OKOYFIHH",
        "bookdate": "06/04/2020",
        "category": "Muut",
        "counterparty_account_id": "6",
        "iban_receiver": "0",
        "paymentdate": "06/04/2020",
        "reference": "1",
        "saldo": "0.28",
        "taplajikd": "105",
        "tstamp": "2020-04-06 19:21:17",
        "valuedate": "06/04/2020",
        "vientiselitekd": "0"
    },
    {
        "accountno": "1",
        "amount": "-9.47",
        "bic_receiver": "",
        "bookdate": "27/04/2020",
        "category": "Muut",
        "counterparty_account_id": "167",
        "iban_receiver": "1",
        "paymentdate": "27/04/2020",
        "reference": "1",
        "saldo": "-5.62",
        "taplajikd": "163",
        "tstamp": "2020-04-27 3:52:15",
        "valuedate": "27/04/2020",
        "vientiselitekd": "0"
    },
    {
        "accountno": "1",
        "amount": "-6.31",
        "bic_receiver": "",
        "bookdate": "28/04/2020",
        "category": "Muut",
        "counterparty_account_id": "94",
        "iban_receiver": "1",
        "paymentdate": "28/04/2020",
        "reference": "1",
        "saldo": "-11.93",
        "taplajikd": "162",
        "tstamp": "2020-04-28 2:19:21",
        "valuedate": "28/04/2020",
        "vientiselitekd": "0"
    },
    {
        "accountno": "1",
        "amount": "-3.04",
        "bic_receiver": "",
        "bookdate": "20/05/2020",
        "category": "Muut",
        "counterparty_account_id": "127",
        "iban_receiver": "1",
        "paymentdate": "20/05/2020",
        "reference": "1",
        "saldo": "-125.53",
        "taplajikd": "162",
        "tstamp": "2020-05-20 6:56:00",
        "valuedate": "20/05/2020",
        "vientiselitekd": "0"
    },
    {
        "accountno": "1",
        "amount": "-39.21",
        "bic_receiver": "",
        "bookdate": "27/05/2020",
        "category": "Muut",
        "counterparty_account_id": "1",
        "iban_receiver": "1",
        "paymentdate": "27/05/2020",
        "reference": "1",
        "saldo": "-172.15",
        "taplajikd": "101",
        "tstamp": "2020-05-27 4:16:00",
        "valuedate": "27/05/2020",
        "vientiselitekd": "0"
    },
    {
        "accountno": "1",
        "amount": "-3.26",
        "bic_receiver": "OKOYFIHH",
        "bookdate": "10/06/2020",
        "category": "Muut",
        "counterparty_account_id": "6",
        "iban_receiver": "0",
        "paymentdate": "10/06/2020",
        "reference": "1",
        "saldo": "-249.28",
        "taplajikd": "105",
        "tstamp": "2020-06-10 3:39:40",
        "valuedate": "10/06/2020",
        "vientiselitekd": "0"
    },
    {
        "accountno": "1",
        "amount": "-61.05",
        "bic_receiver": "",
        "bookdate": "22/06/2020",
        "category": "Muut",
        "counterparty_account_id": "167",
        "iban_receiver": "1",
        "paymentdate": "22/06/2020",
        "reference": "1",
        "saldo": "-139.57",
        "taplajikd": "163",
        "tstamp": "2020-06-22 8:08:08",
        "valuedate": "22/06/2020",
        "vientiselitekd": "0"
    },
    {
        "accountno": "1",
        "amount": "-5.06",
        "bic_receiver": "",
        "bookdate": "11/08/2020",
        "category": "Muut",
        "counterparty_account_id": "127",
        "iban_receiver": "1",
        "paymentdate": "11/08/2020",
        "reference": "1",
        "saldo": "-64.93",
        "taplajikd": "162",
        "tstamp": "2020-08-11 23:41:46",
        "valuedate": "11/08/2020",
        "vientiselitekd": "0"
    },
    {
        "accountno": "1",
        "amount": "-121.53",
        "bic_receiver": "",
        "bookdate": "12/08/2020",
        "category": "Muut",
        "counterparty_account_id": "2",
        "iban_receiver": "1",
        "paymentdate": "12/08/2020",
        "reference": "1",
        "saldo": "-193.63",
        "taplajikd": "101",
        "tstamp": "2020-08-12 18:31:54",
        "valuedate": "12/08/2020",
        "vientiselitekd": "0"
    },
    {
        "accountno": "1",
        "amount": "-30.7",
        "bic_receiver": "",
        "bookdate": "19/08/2020",
        "category": "Muut",
        "counterparty_account_id": "168",
        "iban_receiver": "1",
        "paymentdate": "19/08/2020",
        "reference": "1",
        "saldo": "10.11",
        "taplajikd": "163",
        "tstamp": "2020-08-19 6:22:47",
        "valuedate": "19/08/2020",
        "vientiselitekd": "0"
    },
    {
        "accountno": "1",
        "amount": "-34.03",
        "bic_receiver": "",
        "bookdate": "14/09/2020",
        "category": "Muut",
        "counterparty_account_id": "123",
        "iban_receiver": "1",
        "paymentdate": "14/09/2020",
        "reference": "1",
        "saldo": "-140.61",
        "taplajikd": "162",
        "tstamp": "2020-09-14 20:18:28",
        "valuedate": "14/09/2020",
        "vientiselitekd": "0"
    },
    {
        "accountno": "1",
        "amount": "-3.21",
        "bic_receiver": "OKOYFIHH",
        "bookdate": "22/09/2020",
        "category": "Muut",
        "counterparty_account_id": "5",
        "iban_receiver": "0",
        "paymentdate": "22/09/2020",
        "reference": "1",
        "saldo": "-139.05",
        "taplajikd": "105",
        "tstamp": "2020-09-22 3:41:32",
        "valuedate": "22/09/2020",
        "vientiselitekd": "0"
    },
    {
        "accountno": "1",
        "amount": "-15.39",
        "bic_receiver": "",
        "bookdate": "22/09/2020",
        "category": "Muut",
        "counterparty_account_id": "168",
        "iban_receiver": "1",
        "paymentdate": "22/09/2020",
        "reference": "1",
        "saldo": "-154.44",
        "taplajikd": "163",
        "tstamp": "2020-09-22 5:32:18",
        "valuedate": "22/09/2020",
        "vientiselitekd": "0"
    },
    {
        "accountno": "1",
        "amount": "-34.23",
        "bic_receiver": "",
        "bookdate": "03/10/2020",
        "category": "Muut",
        "counterparty_account_id": "167",
        "iban_receiver": "1",
        "paymentdate": "03/10/2020",
        "reference": "1",
        "saldo": "-257.53",
        "taplajikd": "163",
        "tstamp": "2020-10-03 4:26:26",
        "valuedate": "03/10/2020",
        "vientiselitekd": "0"
    },
    {
        "accountno": "1",
        "amount": "-2.85",
        "bic_receiver": "",
        "bookdate": "09/10/2020",
        "category": "Muut",
        "counterparty_account_id": "98",
        "iban_receiver": "1",
        "paymentdate": "09/10/2020",
        "reference": "1",
        "saldo": "-578.14",
        "taplajikd": "162",
        "tstamp": "2020-10-09 17:45:44",
        "valuedate": "09/10/2020",
        "vientiselitekd": "0"
    },
    {
        "accountno": "1",
        "amount": "-1.93",
        "bic_receiver": "",
        "bookdate": "12/10/2020",
        "category": "Muut",
        "counterparty_account_id": "101",
        "iban_receiver": "1",
        "paymentdate": "12/10/2020",
        "reference": "1",
        "saldo": "-605.9",
        "taplajikd": "162",
        "tstamp": "2020-10-12 15:38:51",
        "valuedate": "12/10/2020",
        "vientiselitekd": "0"
    },
    {
        "accountno": "1",
        "amount": "-7.48",
        "bic_receiver": "",
        "bookdate": "29/10/2020",
        "category": "Muut",
        "counterparty_account_id": "62",
        "iban_receiver": "1",
        "paymentdate": "28/10/2020",
        "reference": "1",
        "saldo": "96.84",
        "taplajikd": "162",
        "tstamp": "2020-10-28 0:57:06",
        "valuedate": "28/10/2020",
        "vientiselitekd": "0"
    },
    {
        "accountno": "1",
        "amount": "-6.4",
        "bic_receiver": "",
        "bookdate": "12/11/2020",
        "category": "Muut",
        "counterparty_account_id": "37",
        "iban_receiver": "1",
        "paymentdate": "12/11/2020",
        "reference": "1",
        "saldo": "-277.51",
        "taplajikd": "162",
        "tstamp": "2020-11-12 9:43:08",
        "valuedate": "12/11/2020",
        "vientiselitekd": "0"
    },
    {
        "accountno": "1",
        "amount": "-25.24",
        "bic_receiver": "",
        "bookdate": "19/11/2020",
        "category": "Muut",
        "counterparty_account_id": "127",
        "iban_receiver": "1",
        "paymentdate": "19/11/2020",
        "reference": "1",
        "saldo": "-210.62",
        "taplajikd": "162",
        "tstamp": "2020-11-19 8:19:50",
        "valuedate": "19/11/2020",
        "vientiselitekd": "0"
    },
    {
        "accountno": "1",
        "amount": "-24.94",
        "bic_receiver": "",
        "bookdate": "14/12/2020",
        "category": "Muut",
        "counterparty_account_id": "85",
        "iban_receiver": "1",
        "paymentdate": "14/12/2020",
        "reference": "1",
        "saldo": "-76.45",
        "taplajikd": "162",
        "tstamp": "2020-12-14 23:19:26",
        "valuedate": "14/12/2020",
        "vientiselitekd": "0"
    },
    {
        "accountno": "1",
        "amount": "-7.74",
        "bic_receiver": "",
        "bookdate": "24/12/2020",
        "category": "Muut",
        "counterparty_account_id": "92",
        "iban_receiver": "1",
        "paymentdate": "24/12/2020",
        "reference": "1",
        "saldo": "231.94",
        "taplajikd": "162",
        "tstamp": "2020-12-24 7:46:29",
        "valuedate": "24/12/2020",
        "vientiselitekd": "0"
    },
    {
        "accountno": "1",
        "amount": "-205.36",
        "bic_receiver": "",
        "bookdate": "30/12/2020",
        "category": "Muut",
        "counterparty_account_id": "168",
        "iban_receiver": "1",
        "paymentdate": "30/12/2020",
        "reference": "1",
        "saldo": "472.81",
        "taplajikd": "163",
        "tstamp": "2020-12-30 13:31:16",
        "valuedate": "30/12/2020",
        "vientiselitekd": "0"
    },
    {
        "accountno": "2",
        "amount": "-61.97",
        "bic_receiver": "",
        "bookdate": "20/01/2019",
        "category": "Muut",
        "counterparty_account_id": "156",
        "iban_receiver": "1",
        "paymentdate": "20/01/2019",
        "reference": "1",
        "saldo": "2129.31",
        "taplajikd": "163",
        "tstamp": "2019-01-20 16:00:00",
        "valuedate": "20/01/2019",
        "vientiselitekd": "0"
    },
    {
        "accountno": "2",
        "amount": "-43.88",
        "bic_receiver": "",
        "bookdate": "04/02/2019",
        "category": "Muut",
        "counterparty_account_id": "50",
        "iban_receiver": "1",
        "paymentdate": "04/02/2019",
        "reference": "1",
        "saldo": "2076.4",
        "taplajikd": "162",
        "tstamp": "2019-02-04 16:00:00",
        "valuedate": "04/02/2019",
        "vientiselitekd": "0"
    },
    {
        "accountno": "2",
        "amount": "-50.9",
        "bic_receiver": "",
        "bookdate": "11/06/2019",
        "category": "Muut",
        "counterparty_account_id": "63",
        "iban_receiver": "1",
        "paymentdate": "10/06/2019",
        "reference": "1",
        "saldo": "201.37",
        "taplajikd": "162",
        "tstamp": "2019-06-12 0:00:00",
        "valuedate": "11/06/2019",
        "vientiselitekd": "0"
    },
    {
        "accountno": "2",
        "amount": "-8.49",
        "bic_receiver": "",
        "bookdate": "08/07/2019",
        "category": "Muut",
        "counterparty_account_id": "52",
        "iban_receiver": "1",
        "paymentdate": "08/07/2019",
        "reference": "1",
        "saldo": "1813.95",
        "taplajikd": "162",
        "tstamp": "2019-07-08 1:20:54",
        "valuedate": "08/07/2019",
        "vientiselitekd": "0"
    },
    {
        "accountno": "2",
        "amount": "-213.6",
        "bic_receiver": "",
        "bookdate": "10/07/2019",
        "category": "Muut",
        "counterparty_account_id": "153",
        "iban_receiver": "1",
        "paymentdate": "10/07/2019",
        "reference": "1",
        "saldo": "3717.21",
        "taplajikd": "163",
        "tstamp": "2019-07-10 18:04:03",
        "valuedate": "10/07/2019",
        "vientiselitekd": "0"
    },
    {
        "accountno": "2",
        "amount": "-161.08",
        "bic_receiver": "",
        "bookdate": "07/08/2019",
        "category": "Muut",
        "counterparty_account_id": "153",
        "iban_receiver": "1",
        "paymentdate": "07/08/2019",
        "reference": "1",
        "saldo": "2929.74",
        "taplajikd": "163",
        "tstamp": "2019-08-07 0:38:55",
        "valuedate": "07/08/2019",
        "vientiselitekd": "0"
    },
    {
        "accountno": "2",
        "amount": "-288.16",
        "bic_receiver": "",
        "bookdate": "07/08/2019",
        "category": "Muut",
        "counterparty_account_id": "153",
        "iban_receiver": "1",
        "paymentdate": "07/08/2019",
        "reference": "1",
        "saldo": "2641.58",
        "taplajikd": "163",
        "tstamp": "2019-08-07 3:27:34",
        "valuedate": "07/08/2019",
        "vientiselitekd": "0"
    },
    {
        "accountno": "2",
        "amount": "-65.9",
        "bic_receiver": "",
        "bookdate": "14/08/2019",
        "category": "Muut",
        "counterparty_account_id": "152",
        "iban_receiver": "1",
        "paymentdate": "14/08/2019",
        "reference": "1",
        "saldo": "3282.28",
        "taplajikd": "163",
        "tstamp": "2019-08-14 20:19:28",
        "valuedate": "14/08/2019",
        "vientiselitekd": "0"
    },
    {
        "accountno": "2",
        "amount": "-27.56",
        "bic_receiver": "",
        "bookdate": "17/08/2019",
        "category": "Muut",
        "counterparty_account_id": "154",
        "iban_receiver": "1",
        "paymentdate": "17/08/2019",
        "reference": "1",
        "saldo": "3598.17",
        "taplajikd": "163",
        "tstamp": "2019-08-17 18:09:44",
        "valuedate": "17/08/2019",
        "vientiselitekd": "0"
    },
    {
        "accountno": "2",
        "amount": "-77.54",
        "bic_receiver": "",
        "bookdate": "27/08/2019",
        "category": "Muut",
        "counterparty_account_id": "152",
        "iban_receiver": "1",
        "paymentdate": "27/08/2019",
        "reference": "1",
        "saldo": "3304.82",
        "taplajikd": "163",
        "tstamp": "2019-08-27 22:16:13",
        "valuedate": "27/08/2019",
        "vientiselitekd": "0"
    },
    {
        "accountno": "2",
        "amount": "-51.61",
        "bic_receiver": "",
        "bookdate": "29/08/2019",
        "category": "Muut",
        "counterparty_account_id": "152",
        "iban_receiver": "1",
        "paymentdate": "28/08/2019",
        "reference": "1",
        "saldo": "3693.9",
        "taplajikd": "163",
        "tstamp": "2019-08-29 8:51:54",
        "valuedate": "29/08/2019",
        "vientiselitekd": "0"
    },
    {
        "accountno": "2",
        "amount": "-73.87",
        "bic_receiver": "",
        "bookdate": "05/09/2019",
        "category": "Muut",
        "counterparty_account_id": "154",
        "iban_receiver": "1",
        "paymentdate": "05/09/2019",
        "reference": "1",
        "saldo": "4146.44",
        "taplajikd": "163",
        "tstamp": "2019-09-05 2:37:48",
        "valuedate": "05/09/2019",
        "vientiselitekd": "0"
    },
    {
        "accountno": "2",
        "amount": "-94.31",
        "bic_receiver": "",
        "bookdate": "10/09/2019",
        "category": "Muut",
        "counterparty_account_id": "155",
        "iban_receiver": "1",
        "paymentdate": "10/09/2019",
        "reference": "1",
        "saldo": "3849.77",
        "taplajikd": "163",
        "tstamp": "2019-09-10 16:26:18",
        "valuedate": "10/09/2019",
        "vientiselitekd": "0"
    },
    {
        "accountno": "2",
        "amount": "-80.34",
        "bic_receiver": "",
        "bookdate": "20/09/2019",
        "category": "Muut",
        "counterparty_account_id": "153",
        "iban_receiver": "1",
        "paymentdate": "20/09/2019",
        "reference": "1",
        "saldo": "4764.21",
        "taplajikd": "163",
        "tstamp": "2019-09-20 17:25:29",
        "valuedate": "20/09/2019",
        "vientiselitekd": "0"
    },
    {
        "accountno": "2",
        "amount": "-23.55",
        "bic_receiver": "",
        "bookdate": "30/09/2019",
        "category": "Muut",
        "counterparty_account_id": "152",
        "iban_receiver": "1",
        "paymentdate": "30/09/2019",
        "reference": "1",
        "saldo": "4367.78",
        "taplajikd": "163",
        "tstamp": "2019-09-30 14:08:13",
        "valuedate": "30/09/2019",
        "vientiselitekd": "0"
    },
    {
        "accountno": "2",
        "amount": "-93.92",
        "bic_receiver": "",
        "bookdate": "15/10/2019",
        "category": "Muut",
        "counterparty_account_id": "154",
        "iban_receiver": "1",
        "paymentdate": "14/10/2019",
        "reference": "1",
        "saldo": "3695.66",
        "taplajikd": "163",
        "tstamp": "2019-10-14 10:42:28",
        "valuedate": "14/10/2019",
        "vientiselitekd": "0"
    },
    {
        "accountno": "2",
        "amount": "-50.56",
        "bic_receiver": "",
        "bookdate": "15/10/2019",
        "category": "Muut",
        "counterparty_account_id": "112",
        "iban_receiver": "1",
        "paymentdate": "15/10/2019",
        "reference": "1",
        "saldo": "3645.1",
        "taplajikd": "162",
        "tstamp": "2019-10-15 7:23:05",
        "valuedate": "15/10/2019",
        "vientiselitekd": "0"
    },
    {
        "accountno": "2",
        "amount": "-82.71",
        "bic_receiver": "",
        "bookdate": "16/10/2019",
        "category": "Muut",
        "counterparty_account_id": "152",
        "iban_receiver": "1",
        "paymentdate": "16/10/2019",
        "reference": "1",
        "saldo": "3562.39",
        "taplajikd": "163",
        "tstamp": "2019-10-16 6:16:37",
        "valuedate": "16/10/2019",
        "vientiselitekd": "0"
    },
    {
        "accountno": "2",
        "amount": "-53.23",
        "bic_receiver": "",
        "bookdate": "18/10/2019",
        "category": "Muut",
        "counterparty_account_id": "152",
        "iban_receiver": "1",
        "paymentdate": "18/10/2019",
        "reference": "1",
        "saldo": "3485.78",
        "taplajikd": "163",
        "tstamp": "2019-10-18 4:03:42",
        "valuedate": "18/10/2019",
        "vientiselitekd": "0"
    },
    {
        "accountno": "2",
        "amount": "-24.41",
        "bic_receiver": "",
        "bookdate": "31/10/2019",
        "category": "Muut",
        "counterparty_account_id": "152",
        "iban_receiver": "1",
        "paymentdate": "31/10/2019",
        "reference": "1",
        "saldo": "3712.05",
        "taplajikd": "163",
        "tstamp": "2019-10-31 12:33:14",
        "valuedate": "31/10/2019",
        "vientiselitekd": "0"
    },
    {
        "accountno": "2",
        "amount": "-58.75",
        "bic_receiver": "",
        "bookdate": "05/11/2019",
        "category": "Muut",
        "counterparty_account_id": "152",
        "iban_receiver": "1",
        "paymentdate": "05/11/2019",
        "reference": "1",
        "saldo": "3894.55",
        "taplajikd": "163",
        "tstamp": "2019-11-05 13:42:51",
        "valuedate": "05/11/2019",
        "vientiselitekd": "0"
    },
    {
        "accountno": "2",
        "amount": "-16.28",
        "bic_receiver": "",
        "bookdate": "11/11/2019",
        "category": "Muut",
        "counterparty_account_id": "146",
        "iban_receiver": "1",
        "paymentdate": "11/11/2019",
        "reference": "1",
        "saldo": "3731.52",
        "taplajikd": "162",
        "tstamp": "2019-11-11 13:42:51",
        "valuedate": "11/11/2019",
        "vientiselitekd": "0"
    },
    {
        "accountno": "2",
        "amount": "-56.72",
        "bic_receiver": "",
        "bookdate": "15/11/2019",
        "category": "Muut",
        "counterparty_account_id": "153",
        "iban_receiver": "1",
        "paymentdate": "15/11/2019",
        "reference": "1",
        "saldo": "158.86",
        "taplajikd": "163",
        "tstamp": "2019-11-15 20:34:17",
        "valuedate": "15/11/2019",
        "vientiselitekd": "0"
    },
    {
        "accountno": "2",
        "amount": "-124.02",
        "bic_receiver": "",
        "bookdate": "22/11/2019",
        "category": "Muut",
